Location Name,Title,Text,Rating,Year,Month,Day
09,Grand Hotel Courmayeur is definitely Grand!,"We stayed at the the Grand Hotel Courmayeur Mont Blanc for 4 nights while hiking the TMB.  This hotel was a welcome respite after a day on the trail.  It is a beautiful hotel with spacious and comfortable rooms.  The staff were incredibly helpful from making recommendations for restaurants to the shuttle service they provided.  It started with reception personally escorting us to our room.  We appreciated the shuttle service, especially driver Andrea (sp?) who took us wherever we needed to go.  We were particularly impressed with Nando, one of the managers, who took the time to sit and talk with us about the hotel, the area and the culture.  He helped us make some decisions that enhanced our experience.",5,2024,09,19
09,Amazing hotel and tremendous staff!,"Stupendous hotel! Beautiful lobby, restaurant, bar, and rooms. The smell when you walk into the lobby is heavenly! One of the managers, Nando, was so friendly and helpful! He helped us when we were torn about our TMB hike on a rainy day, he gave us wonderful advice and we ended up having a wonderful hike despite the rain. The front desk staff recommended amazing local restaurants and made our reservations and we took the hotel shuttle to and from. The bar staff is fantastic, very friendly and knowledgeable. We did not want to leave this hotel! We hope to get back here someday.",5,2024,09,09
09,Exceptional stay in Courmayeur,"We had an amazing stay at the Hotel Grand Courmayeur in the middle of our Tour du Mont Blanc. Our room was beautiful and we very well attended throughout our stay. The shuttle service offered was invaluable, and their recommendations for dinner were perfect. We enjoyed the restaurant and bar in the hotel as well, and received consistently great service. It was a fantastic place to recharge for the second half of the TMB.",5,2024,08,17
09,"Great stay at Grand Hotel, Courmayeur","We arrived for a 3 nights stay at the hotel, and found what we were expecting, and much more. Hotel location very comfortable, and the shuttle to nearby attractions saved us a lot of time. The rooms with the mountains view were clean, large enough, and modern. The hotel overall is very modern.
Breakfast served every morning in the dining room facing the remarkable Mont Blanc view.
Anything you had in mind, was served in Breakfast.
The Staff is very helpful, for any inquiry or help needed.
Would like to specify front desk reps, 
Ms. Greta and Christian for their service oriented attitude.
BR, Haim.",5,2024,08,17
09,"Highly recommended, excellent hotel","I highly recommend the hotel: the rooms are pleasant and beautifully designed, the location is excellent, the breakfast is indulgent, the view is breathtaking, and the staff is kind and caring, doing everything to make the stay at the hotel and in the city enjoyable, giving precise recommendations—where to eat, sites in the area, etc. I'm sure we'll be back.",5,2024,08,13
09,"Mountain view, excellent service, super facilities and great location","Spent four night on this beautiful hotel, in a room w fantastic Mountain View. Excellent  service in all functions - reception, spa, restaurants, parking etc - very kind and super professional. Great location In  Courmayeur. We’ve been there three times before, summer and winter, and will for sure choose this hotel again.",5,2024,08,13
09,Poor food,"Beautiful views and great location on the edge of Courmayeur. Shuttle service from the hotel in and out of town is really useful. The rooms are a good size and have a good sized balcony. That's the good part. The food is shockingly poor for any hotel let alone 5 star. Breakfast was a minimal choice, and the hot selections were cold. If you asked for fresh hot food they put it through a microwave. Really not acceptable. This is a very expensive hotel and I had hoped for more.",3,2024,07,27
09,A few nights in Courmayeur.,This hotel was the most amazing respite from our TMB hike. The rooms were gorgeous and the beds incredible comfortable. The spa was beautiful and very well appointed. There was nothing I could say negatively about this hotel. The staff was incredibly attentive and the breakfast was A Plus!,5,2024,07,24
09,"One of the best accommodations, if not the best, of our 5 week Italy trip.","We really loved our stay at the Grand Hotel Courmayeur. In our view, although the facility was beautiful, the attentive and helpful staff made our visit very memorable. All of the staff were extremely courteous and I wish I had everyone’s name to mention here, especially those at the front desk. Nando and Alessandro  were especially friendly and helpful. Many of the staff recognized us in town on their off hours and greeted us. As far as other aspects, breakfast was outstanding, served in a room that overlooked the mountains. Pretty much anything you asked for could be had. A beautiful lounge was available to relax, also with a great view. Everything was absolutely spotless including our room and bathroom. I will say that if you prefer a more historic feel, you might be disappointed, but we found the modern decor tasteful and inventive. If available, try and get a room in the B or C buildings, which I think might have better views and be a bit quieter than Bldg A. Be prepared, there is no A/C. It was fairly comfortable in our room while we were there, but only with our balcony door open, which meant the room could be noisy with early morning auto and construction noise. Lastly, the included spa amenities such as the heated pool, steam and sauna, and aromatic showers were a nice touch. We would highly recommend this hotel.",5,2024,07,24
09,Amazing stay,"We spent 3 nights with friends. Place is beautiful. Staff incredible. Rooms are clean, breakfast so good, plenty of food. Nando the manager, Alessandro and Wiam so kind with us. For sure we’ll be back in the winter season with some other friends.",5,2024,07,21
09,Truly a Great Stay,"We booked here last minute after walking the Tour De Mont Blanc. The staff went out of their way to make everyone comfortable, recommended a great local restaurant and welcomed us. The rooms are very comfortable, amazing bath/shower, quiet and decorated in an elevated way to suit this spectacular town.",5,2024,07,21
09,Courmayeur's newest and best hotel!,"I've been to Grand Hotel twice this month to escape Milan's hot summer days. The property is a modern 5 star with beautiful rooms with a spacious balcony. Bathrooms have a giant bathtub, open shower and lots of space. I also had a walk in closet with a coffee machine and complimentary water. The spa area is beautiful and they have Cinq Mondes products which are my favorite. Pool and sauna area are brand new and very well designed. Nando, the Chief of Reception is an absolute rockstar helping guests and really suggesting them ideas to optimise their stay. I also had a beautiful dinner at La Fourchette. Breakfast is unbelievable too: freshly made mountain butter, bread are made in house soo. A collection of fruit jams awaits you... not to forget cakes, pastries, cheese, pancakes with real maple syrup, egg, bacon etc.  An outstanding hotel that deserves not less than a 5 stars rating!",5,2024,07,20
09,An amazing stay from start to finish,"The hotel from start to finish was a great experience, from the front desk staff to the spa team nothing was too much trouble. 

Nando was great in welcoming us almost like we were family and the whole experience was amazing! 

I will definitely look to come here again for ski season and would have no issues recommending this hotel as the place to stay when visiting Courmayeur!",5,2024,07,14
09,Luxury mountain escape,"Wonderfully located hotel in beautiful Courmayeur. Hotel facilities were great, we enjoyed the spa and rooms were specious and well equipped. Nando was a brilliant host and the staff helped us book a lovely restaurant in town for dinner. Will definitely come back in the ski season to check it out!",5,2024,07,14
09,Disappointing,"We travel to Courmayeur monthly and thought to give this 5* beautifully looking hotel a try. 

However, it could hardly pass for a 4*.

First massive let down - air conditioning. I understand that we are in a mountain region and temperatures are cooler for most of the year but summers in Courmayeur are pretty warm and a 5* hotel with no AC is not acceptable. In our instance we had 25 degrees celcius theoughout our trip and room temperature was getting over 26 which is far from a comfortable night’s sleep, especially when you’re travelling with a 1 year old and are unable to close the windows to prevent outdoor noise for day naps and night’s sleep. 

Gym is a sauna for the same reason and totally unusable if you’re looking to do cardio. 

Reception standards definitely don’t stand a chance of a 5* hotel. Having asked some information about the spa I was told to go in the room and call them myself. Also, on the morning of our check-out we were not even asked if we need help with our bags when we came downstairs with full hands + a toddler. 

On the positive note, they offer a great breakfast selection and the breakfast staff are quite attentive. 

Overall quite disappointing as it is a beautiful hotel in an amazing location but the service definitely doesn’t stand a chance of 5*.",2,2024,07,12
09,Excellent!!!!,"The Grand Hotel Courmayeur is truly a gem in Mont Blanc. Located in the most stunning spot with a direct view of the breathtaking Mont Blanc, this hotel offers a warm and welcoming atmosphere from the moment you arrive. The staff goes above and beyond to ensure your comfort, providing complimentary drinks, chocolates, and cookies upon arrival.

The rooms are beautifully decorated in a nature-inspired style and come equipped with all the amenities you could need, including coffee, water, and snacks. The dining room staff are incredibly generous and accommodating, even staying open late to ensure you have a meal.

Nando, the front desk manager, is a true professional who goes out of his way to make sure your stay is unforgettable. The value for money at this hotel is outstanding, making it a highly recommended choice for your next stay in Courmayeur. Thank you to the amazing team at the Grand Hotel Courmayeur for a wonderful experience. #LuxuryTravel #GrandHotelCourmayeur #MontBlancView.",5,2024,07,11
09,"Stunning views, friendly hospitality","This is our second stay at GHCMB. It's a top notch property with clean design and stunning views of the Mont Blanc. Everyone is super nice: reception desk, restaurant staff, drivers of the shuttle, the spa team. We had to leave early in the morning for our kids’ ice skating lessons and the breakfast staff was always helpful and accommodating. If you travel with small kids a fantastic public playground is immediately next to the hotel",5,2024,07,07
09,Best view in the Alps!,"What a lovely hotel!! We loved everything about this place from the ambience to the service. The hotel staff is excellent especially Nadio. The view from our room of Mont Blanc is absolutely stunning!!
We will be back here!!
The town of courmayeur is so charming.
The shops, restaurants and architecture is amazing.",5,2024,07,06
09,What a gem!,"What a gem! I spent a night in that beautiful hotel on the Montblanc. I booked over the phone and received a perfect service. Upon arrival, a valet parked my car, the reception did a quick and efficient check in and brought me to my room. My room was spotless, brand new with a stunning view on the mountain. Their pool area is amazing. Breakfast was very well presented and displayed quality products. Staff was smiling and extremely kind. What to say, this hotel is the gem of Courmayeur. It's modern, brand new and to me the best option one can choose.",5,2024,07,06
09,Perfect place in beautiful venue!,"Excellent hotel,
Very friendly and welcoming staff and manager, will definitely come back in the winter season.
Loved the design, food and neatness of the hotel. View on the mountains is marvellous too.
Walking distance from shops and restaurants, excellent parking facilities.",5,2024,06,16
09,My stay at The Grand Hotel in Courmayeur,"Recently I went to The Grand Hotel in Courmayeur. It was pretty good for a 5 star hotel and I would keep it that way but some of the staff were slightly rude (but some were very kind).
Let’s start with a bit of the positives like the spa. The spa was amazing! There is a big swimming pool but it isn’t cold it is a hot swimming pool. Also there is an Experience Shower behind the pool and sauna aswell. There is a good gym but very cramped.
The room that I stayed in was a beautiful two story room with two beds ,one upstairs and one downstairs. It had a spacious bathroom with a big bathtub in the corner.
Moving on to the food! The breakfast was very nice except there was no toaster so I could not have my usual toast for breakfast. I didn’t have lunch here since I went skiing up in the mountains, but dinner was nice and peaceful. My family and I got served really quickly as not many people were there.
Let’s move onto some of the negatives. The two men that drove us to the ski lift and to a restaurant were really rude and complaining to the hotel about why they had to drive us. As far as I am aware of, if you speak English not Italian you are going to have a tough time as they can’t speak a good amount of English. Also the shuttle is really slow to pick you up.
The ski lift is not far away from the hotel. It is a 5 minute drive away and a 15 minute walk away from it. Lots of nice places in Courmayeur but I would not recommend this place to English people as they cannot understand you very well.",5,2024,02,24
09,Disrespectful Manager could make the trip really memorable,"We paid over 300 dollar/night for a room but we were given a room which had a view of someone's backyard and a playground. The room also had no AC.  The room was hot and humid. The room was also noisy as children were playing all the time next door. Being orbitz platinum we requested a room upgrade or same room with a nicer view. The front desk staff were really nice and wanted to do the upgrade as there were availabilities. Next morning during the breakfast time we also noticed the whole breakfast area was empty. The manager refused the room change without any logic or reason. Certainly the person has issues or has no respect for clients. The hotel group should be aware of this type of managers who brings no good to the business. I have been traveling to italy for last 16 years, and this is the worst hotel management I have ever seen. The manager was so disrespectful, even refused to talk to us personally. The room was so awful and experience was so bad that we decided to leave the hotel and accept the loss before actual check out date.  Also, just want to let the audience know that Mont Blanc tunnel always has issues, and it takes 55 euro to cross the tunnel. Please plan accordingly if you plan to visit french side. Thanks to all excellent staff of the hotel except the manager.",1,2023,09,13
09,disappointed ,"Recently attend a company weekend to which I can only express dissatisfaction with this hotel for creating a memorable experience for everything but a good experience. From rooms with not coffee machine, lacking water pressure in the showers and neighboring rooms being able to hear your every discussion with your partner to broken locks on common toilets. Breakfast lacked enthusiasm with no freshly baked breads and sausages steamed so long that they were good enough to be left on the plate. We hoped for a great dinner with a set menu where meals had to be selected a day before. Unfortunately the dining staff failed the hotel with confusion from the start, this resulted in worst possible experience Courmayeur could offer. For the vegetarians out there... you have fish and potato rosti with ham... mmm??? cannot fault the massage but unfortunately could hear every weight being lifted or splash in the pool... if you are looking for a 5 star experience - LOOK ELSWHERE... if you want to experience 3 star (or at best a 4 star) and pay the prices of a 5 star... then go try. For us, this is the last time ever to visit the Grand Hotel Courmayeur.",3,2023,03,13
09,Excellent stay at Grand Hotel Courmayeur.,"We have just had a fabulous stay at the Grand Hotel. The food, the staff, the hospitality and our shuttle driver were all 5* . Nothing was too much trouble. The rooms were beautiful and clean and towels were changed daily. Could not fault it and endeavour to return. Thank you to all 🥰",5,2023,02,28
09,5 stars on paper - not value for big money,"This hotel is nice at first sight, but during the stay you will see that there a lot of things broken like lamps, ski storage room was out of order, sauna/spa needs renovation, toalett doors broken. When you ask something at reception, sounds like nothing is arrangeable. 
Stay here costed 650 eur/night and compared to other 5 star hotel (like W in Verbier) this is far far lower level. 
When asking something at reception, the receptionist goes always to boss room asking (I never saw this boss) and answer to everything is always no - or yes but this thos extra cost (well…. See the price of stay 650 eur/night). 
If you’re looking for a posh hotel, this is not. Go elsewhere.",2,2023,02,28
09,Very enjoyable experience. Truly 5 star care.,"Good sized rooms. Well provided. Sensible bathroom. Comfortable bed. Very attentive & helpful employees. Only small downside was under whelming breakfast.  Location is a short way out of the centre, but local transfers are quickly available. Dog friendly. 
Covered valet parking.",5,2023,02,10
09,Not even close…,"Our family stayed in a suite for a week and were out of hot water everyday, NO explanation and NO compensation offered. Paid 450 Euro pp for new years eve gala dinner which included wine for adults but only water for kids….Allergies not noted. The food was average

Asked for a compensation but was told the manager would contact me, he never did

The staff at breakfast was unfriendly and very slow. All in all not even close to the service level to be expected from a five star hotel. So not worth the prices charged. There are definitely better options in Courmayeur",1,2023,02,10
09,Meh- much better options available than this - from a Marriott Ambassador,"Tough to say this is a good hotel. It’s adequate- but don’t spend anything extra to stay here. I’m Marriott Ambassador and Hilton Diamond and Hyatt highest level. So I stay in hotels a lot. This hotel to me is labeled as a high end hotel but 2star at best service and facilities. You may want to reconsider your choice of staying here - I’m here now and definitely feel I should have stayed elsewhere. Believe it or not - staff is actually amazing! Bar tenders on 2nd floor are beyond competent and great. But that where it ends. I got USED toiletries from the prior guest - shame on you! - and my room wasn’t clean - previous guest’s long hair everywhere. It was obvious they hadn’t cleaned the room - maybe they swept it (if that!) I asked for new toiletries and the front deck woman who was super nice and pleasant just didn’t get me. 

Overall - overrated for the price, better options if you want good clean rooms! I had to clean my room with Clorox wipes - tells you everything you need to know",2,2022,12,23
09,11 year anniversary,"I just arrived home and was excited to write this review. This hotel is truly special . The price is very good , the staff were excellent ,super friendly and knowledgeable and I didn’t even get to the accommodations yet . The hotel is filled with beautiful antiques , top level fashion and a gorgeous pool, spa , heated outdoor pool, sauna Etc I’m missing being there already .

I am a very busy man and had only 48hrs to enjoy my 11th year anniversary with my wife and being there made us feel as though we were there for 5 days . I highly recommend and will be back very very soon .",5,2022,12,04
09,"Sad, tired, dingy hotel with incredibly rude staff","We arrived in Courmayeur, and we were enchanted by our surroundings. The mountain vistas are breathtakingly beautiful.  Then we got to our hotel. It was well placed, and in it's heyday it must have been a beautiful hotel. Now it's a crumbling old relic, managed by a grumpy cadre of staff. The woman at the reception was dismissive, unhelpful and rude.  Missing bulbs, dusty bedcovers, banged up floors, shutters and windows that don't lock properly from wear and tear. It's a mess! Breakfast was a disaster. It was extremely basic and sad.",1,2022,08,01
09,Great friendly service and spacious modern rooms,"Stayed here as a group and all our needs were met.  Reception staff were efficient, helpful and friendly.  Rooms are spacious modern and very clean.  Breakfasts are fantastic with so much choice and staff always on hand for anything you needed.   The hotel is a short walk from the centre and therefore away from the hustle and bustle.    A wonderful team of staff throughout the hotel.   We had a great stay.   Thank you so much.",5,2022,02,03
09,Excellent Service and Staff and Super flexible management given recent restrictions,"I cannot praise this hotel for making the impossible possible given the uncertainty we have all suffered with the recent and continuing changing regulations on travel and entry requirements. The hotel were prepared to give us maximum flexility for a very large booking coming from different destinations, each with different government advice . Had this not been the case, we would have had to cancel our reservation 2 months before. As a result we all confirmed and had the most fantastic 7 days at this hotel. Thank you .",5,2022,02,01
