Location Name,Title,Text,Rating,Year,Month,Day
09,Soggiorno super!,"Abbiamo prenotato con voyage prive un soggiorno presso questo hotel per il mio compleanno. L'hotel è situato quasi in collina (non vicinissimo al centro ma ci si arriva comodamente a piedi) e permette una doppia visuale spettacolare di courmayeur. 
Appena arrivati il personale ci ha accolto offrendoci un upgrade della camera...la camera era spaziosa, dotata di ogni comfort, anche se l'ho trovata un pò spoglia per essere un deluxe.
La colazione credo che sia uno dei punti forti dell'hotel per la freschezza dei prodotti appena sfornati (dolci e salati); mentre il ristorante non l'ho provato per assenza di menu esposti/sul sito..è un peccato che non venga comunicato al cliente la possibilità di cenare all'interno del ristorante.
A fine giornata, immergetevi nella spa che merita!
Forse per essere un 5 stelle mi sarei aspettata delle attenzioni maggiori e qualche coccola in più, ma tutto sommato mi  sono trovata benissimo!",4,2017,04,18
09,Buona Struttura!Cristina il cuore pulsante dell'hotel ,"Il voto per me sarebbe un 4 pallini e 3/4 ... perchè manca un qualcosina per essere Top ... dico così perchè in alcune strutture a 5 stelle ho trovato quel pizzico in più che forse mancava lì... ( quindi per essere il "" Toppissimo "" manca un pochino ) cmq FANTASTICO... posizione Top... ristorante all'ultimo piano molto bello e anche buono, consiglio... bella la Spa con ottimo personale, Da ricordare la LELLA persona solare che rende tutto ancora più bello... 
l'hotel è comodo per il centro ed anche per raggiungere la famosa funivia del Montebianco ( bellissima ) ... 
vicino alla struttura un bel parco dove fare passeggiate e rilassarsi sulle panchine...
appena arrivati all'hotel l'accoglienza della Cristina è stata Super!! E anche nei giorni successivi era il punto di riferimento dell'hotel ... Gentile & Professionale !!
La struttura ci ha anche offerto una camera superiore rispetto a quella prenotata perchè comunque è un periodo calmo...
Bella esperienza da ripetere...

Grazie di tutto...",5,2017,04,16
09,Excelente,Localizado en un resort de primer nivel como es Courmayer. Acceso cercado a los medios de elevacion que estan en estado impecable recien construidos todos los puntos de visita son muy atractivos sobre todo al tope de la MOntaña.,4,2017,04,13
09,spettacolare,"facilmente raggiungibile e con ampio parcheggio al coperto. Da qui si può partire per le piste da sci o per una ciaspolata. Dotato di centro benesse completo, sauna bagno turco e piscina riscaldata. Ottimi il lounge bar  ed il ristorante.",5,2017,03,31
09,Compleanno da ricordare,"Presenti in struttura per un evento aziendale di mio marito, ho soggiornato a febbraio in concomitanza con il mio compleanno. Due notti splendide. Camera all'altezza delle aspettative, calde ed accoglienti, in stile appropriato al luogo meraviglioso. Un plauso alla sala colazione, vista neve. Una colazione regale, prodotti freschissimi e golosi, con ampia scelta dolce-salato. Personale di sala giovane ma di rara gentilezza ed attenzione. Che bel ricordo.",5,2017,03,26
09,Grazie di tutto.....ritorneremo,"Ho passato 2 gg stupendi, tra sport, SPA, relax buon cibo e ottimo vino. Ho trovato camere e locali molto puliti ed ordinati, come piacciano a me. Personale preparato e professionale. Direttore attento e presente in tutti i momenti di necessità, pronto ad intervenire in caso di necessità in tutte le occasioni_Ritorneremo sicuramente",5,2017,03,25
09,Soggiorno da favola,"Siamo stati diverse volte in questa favolosa struttura.ambiente moderno ,ma ricercato.camere pulitissime e luminose.nuovissima Spa con piscina interna riscaldata.colazione con brioche e torte fresche ogni mattina preparate dal pasticcere.personale gentile e disponibile.trasporto navetta alle piste comodo e veloce.
Ritengo che il grand hotel mont blanc sia  il migliore albergo di Courmayeur.
Davvero unico.",5,2017,03,14
09,Vacanza e relax,"Vorremmo ringraziare tutto lo staff del Mont'Blanc x la stupenda settimana che abbiamo passato presso di voi!!Suite favolose e pulitissime,personale in gamba soprattutto i ragazzi dell'animazione (mio figlio si è divertito tantissimo),la ragazza alla reception sempre molto gentile e disponibile x ogni evenienza e i ragazzi che ogni giorno ci accompagnavano dall'hotel alle piste!!!( SERVIZIO CHE NN TUTTI HANNO)",5,2017,03,02
09,Vacanza,"Hotel nuovo e pulito, servizio navetta buono, servizio noleggio sci 

personale qualificato è molto gentile, purtroppo non abbiamo mai mangiato al ristorante ma siamo andati spesso al bar e abbiamo constatato che il personale e lento e non abituato a uno standard di hotel a 5 stelle.
",3,2017,02,28
09,Scarso,"La colazione era buona, prodotti di pasticceria freschi. Le camere erano belle e pulite
quando sono tornato il pomeriggio dalle piste di sci ho ordinato un Club Sandwich e mi è stato servito con tovagliolo di carta e senza posate, qualità Autogrill. La mia compagnia ha ordinato un toast, servito con tovagliolo di carta e senza posate, per quello che costa deve essere più farcito. La sera dopo io e la mia compagnia ci rechiamo al ristorante e l'ambiente era poco accogliente e freddo, preparazione dei piatti valida ma professionalità del Maitre e dei camerieri molto poco professionale, assolutamente inadeguata per un Hotel 5 Stelle. Non torneremo e lo sconsigliamo.
ps: buon servizio navetta per le piste di sci.",2,2017,02,16
09,Speciale,"Albergo di grande qualità ed eleganza, con ottima colazione camere spaziose e ben pulite e preparate... Direttore dell'albergo molto efficiente e disponible in ogni occasione. Unica pecca forse lo staff al ristorante poco attento e a volte indisponente, ma il giudizio resta molto positivo",4,2017,02,15
09,Evento aziendale,"Hotel molto bello. Abbiamo soggiornato 2 notti a gennaio 2017 per un evento aziendale. Camere belle, trattamento perfetto da parte di tutto lo staff. Direttore presente per tutta la durata dell'evento. Ottimo il ristorante, molto bella la SPA con le vetrate. Direi che sicuramente torneremo.",5,2017,02,14
09,"Struttura splendida, servizio meno","In una  struttura perfetta per il secondo anno non abbiamo riscontrato il servizio  all'altezza, unica menzione positiva nei confronti di  Andrea della reception estremamente disponibile  anche alle 3,00 del mattino.",4,2017,02,05
09,Due giorni alle terme,"Fantastico! Personale, sveglio veloce ed attento ad ogni cosa. Servizio ineccepibile curato ogni dettaglio per clientele anche più esigenti, in una location da sogno calda ed accogliente si può tranquillamente fare a meno di andare alle terme di P. Sant' D. Troppo affollate neo fine settimana, lasciandosi coccolare all'interno della SPA termale dell'albergo che al contrario delle prime questo risulta più elegante, intimo ma soprattutto pulito ed igienico. ",5,2017,01,31
09,...Top!!,Hotel situato in posizione davvero invidiabile (non lontano dal centro cittadino con tanto di vista sul Monte Bianco). Ottime colazioni con prodotti preparati in loco dallo chef (torte squisite!). Camere iper-silenziose. Personale gentile e cordialissimo. Se ricapiterò da quelle parti ci tornerò senz'altro...,5,2017,01,27
09,Eccellente,"Eccellente è la definizione più azzeccata per questo hotel. Struttura molto bella, personale cordiale e location perfetta. A due passi dal centro, con viste meravigliose è un servizio adeguato a una struttura di questo tipo. Promossi a pieni voti!",5,2017,01,21
09,Ritornati ma non contenti,Siamo tornati dopo quasi un anno.e mi dispiace non aver trovato lo stesso clima .mi dispiace molto ..colazione peggiorata  e cucina pure .la spa sempre carina .Courmayeur sempre bella .e la vista del monte bianco toglie il fiato .,1,2017,01,09
09,Grande delusione,"Struttura discreta, mal gestita sia dal punto di vista dell'accoglienza e con scarsa professionalità a partire dal cameriere fino al direttore.Negativo il rapporto prezzo /ospitalità .
Non parliamo poi del ristorante 
Grande delusione!!!",1,2017,01,07
09,Molto bello !!!,"Ci sono stata durante il ponte dell'Immacolata con il mio compagno e mia figlia di 2 anni. La struttura è molto bella e nuova. Lo staff gentile e professionale. Dotata di una spa non grandissima ma ben concepita, soprattutto con personale gentilissimo e disponibilissimo al suo interno. La sala colazione e ristorante è luminosa e offre una vista incantevole sul Monte Bianco. La colazione è continentale e ben assortita. Il bar sempre aperto e con personale top. Le camere spaziose e confortevoli. Prezzo è abbastanza elevato ma coerente.
",4,2017,01,04
09,Delusione....,"Siamo capitati in questo hotel, non per nostra scelta, bensì ""dirottati"" dal sig. Patrick dell'hotel che avevamo prenotato, il QC termemontebianco, che pochi giorni prima della partenza ci ha informati che la nostra ed altre 2 stanze erano inagibili per la rottura di una tubazione (??? mi è sembrata una scusa per far posto a qualche cliente abituale dell'ultima ora..). Sempre il signor Patrick ci ha rassicurati sulla prestigiosa sistemazione che aveva trovato per noi, presso il Grand HotelCourmayeur Mont Blanc, informandoci che avremmo ricevuto i medesimi servizi previsti dall'altro albergo...ma CHE DELUSIONE!
L'hotel, in effetti, si trova molto vicino al centro, ma in zona tranquilla e gode di una bellissima vista è di recente costruzione e stanze e aree comuni sono nuove, ma... non è assolutamente all'altezza di un 5 stelle ! Gli arredi delle stanze, molto piccole, sono a dir poco minimalisti e molesti, richiamano più un moderno hotel cittadino che un Grand hotel montano, nemmeno un bollitore per the e caffè o bottiglia d'acqua, (solo a pagamento nel frigobar), in compenso, biancheria di ottima qualità sia per il letto che in bagno.
Bella la spa ma piccolina , SCANDALOSO il ""Centro fitness "" 25 metri quadrati scarsi, con una colonna al centro,  5 macchinari ed una palla da pilates....3 persone che si allenano  e manca l'aria!!!
Per la colazione poca scelta, buono e rapido ma caro il servizio in camera .
Il  personale è gentile, ma non all'altezza delle stelle dell'hotel: camerieri che chiacchierano tra loro nella sala colazione, le addette alla reception, poco sorridenti, 
il parcheggio antistante può ospitare una decina di auto, altrimenti 30€ al giorno per il garage.
Concludendo, secondo il mio modesto giudizio, da un grand hotel a Courmayeur, considerando il prezzo richiesto per la stanza con prima colazione, mi aspettavo qualcosa in più rispetto agli altri,  ma non l'ho trovato ",3,2017,01,02
09,"Bellissimo,senza parole!","É un bellissimo hotel, forse il più bello che io abbia mai visitato, ma non credo che al mondo ci sia un hotel cosí. Il cibo fantastico, e il personale sempre a tua disposizione. E il panorama é mozzafiato. ",5,2017,01,02
09,Buona soluzione a Courmayeur,"Hotel di recente costruzione, le aree comuni, le camere e la location eccellenti. Si trova a pochi minuti a piedi dal centro di Cormayeur in una zona tranquilla con fantastico panorama. La SPA è a mio parere sottodimensionata ma è comunque accogliente. A causa di qualche piccolo problema con i servizi e il personale non mi sento di confermare le 5 stelle, direi un ottimo 4 stelle.",4,2017,01,02
09,Pranzo al calar del sole..,"Sono stata in questo albergo il 1/1/2017 per pranzare con mio marito e mia figlia. Abbiamo ordinato due club sandwiches alle 1315 h e finalmente alle 1350 sono arrivati giusto in tempo x mangiare in veranda prima del calar del sole alle 1410 h
Ci siamo trasferiti all interno x i caffe' che sono arrivati tiepidi quasi freddi.
Nel bagno delle donne mancava la carta igienica e non erano stati puliti.
Insomma ho trovato che l albergo sia molto bello ed il personale molto gentile ma che il servizio offerto non fosse assolutamente al livello di un cinque stelle. Forse l albergo e' nuovo inaugurato nel 2014 c'e sicuramente molto da migliorare.
",3,2017,01,01
09,Un po' scomodo alle piste,"Albergo  molto confortevole con una cucina di gran livello. Ambienti puliti e in stile valdostano ma con punte di modernità. Peccato che non è sulle piste, ma a Courmayeur gli alloggi comodi alle piste sono pochi. Bello ma preferisco meno stelle e più vicinanza agli impianti di risalita.",4,2016,12,25
09,Si sente ancora l'odore di nuovo,"Ottima location nel mezzo di una collina innevata. Le luminarie rendono l'atmosfera molto natalizia: peculiare il pino illuminato di rosso dinnanzi all'ingresso dell'hotel sullo sfondo bianco candido della neve.
Piatti a base di pesce buoni e ricercati.
Dessert deliziosi in particolare il mont blanc.
Ci ritorneremo per farci coccolare anche dai massaggi rilassanti nella spa, piccola ma elegante.",4,2016,12,19
09,un ottimo 4 stelle,"La posizione è molto bella, quiete assoluta a 200 metri dall'area pedonale, il tutto coronato da una vista magnifica.
Le camere sono calde e accoglienti e molto pulite, ma abbastanza piccole e con un arredamento tutto sommato ordinario. Il personale è abbastanza disponibile e cortese.
La colazione è valida, ma non eccezionale (da buon 4 stelle). Ottimo il lounge bar con caminetto e ottima selezione di vini e distillati. 
In estrema sintesi: se si fosse qualificato come 4 stelle gli avrei dato 5 pallini...ma dal  momento che si qualifica come 5 stelle (e si fa pagare come 5 stelle!!!) il giudizio diventa severo.",3,2016,12,19
09,"Pessimo, scegliete altro!","Prima di dilungarmi nella recensione della mia esperienza, faccio un summa per chi non avesse voglia ne tempo di leggerla tutta: questo non è un 5 stelle nei fatti. Mancano attenzione al cliente, cordialità, charme e tanto altro.
Staff pessimo, ambiente freddo e poco accogliente, cibo scarso e mancanza di personalità.

Premetto che avendo spesso soggiornato in hotel a 5 stelle, ritengo di poter valutare con oggettività la mia esperienza presso il grand hotel mont blanc.

Consiglio anche alla proprietà e la dirigenza di farsi un giro presso hotel della stessa categoria di altri gruppi nazionali ed internazionali. (Bulgari, W, st. Regis, mandarin etc. etc.)

Veniamo alla descrizione dei fatti.

Io e la mia compagna abbiamo appena passato due notti in questo hotel per un week end sulle nevi.

Non sono solito scrivere recensioni ma questa è l'occasione buona per iniziare, con lo scopo di aiutare nella prenotazione le persone che, come me, esigono in proporzione a quello che pagano.

Per maggiore chiarezza organizzo in un elenco puntuale ciò che ritengo non sia accettabile in hotel di questa categoria e con queste tariffe:

- appena arrivato mi hanno chiesto se volessi parcheggiare l'auto in garage al costo di 30€ al giorno, ho detto di si. Appena saliti in camera la mia compagna ha verificato che il costo del parcheggio era invece già incluso nella tariffa. Ho chiesto spiegazioni alla stessa persona che mi aveva domandato se volessi usufruire del parcheggio a pagamento, la quale, dopo aver fatto un giro di parole poco chiaro, ha minimizzato dicendo che si è tratto di un malinteso
- Sempre al mio arrivo ho chiesto che le sacche con gli scarponi da sci venissero scaricate dall'auto e riposte al caldo nella ski-room. Mi hanno informato che avrei pagato 20€ al giorno per l'armadietto, ho risposto che non c'era problema aggiungendo che l'indomani avrei inoltre noleggiato gli sci. Mi hanno detto che se avessi noleggiato gli sci non mi avrebbero addebitato il canone per l'armadietto nella ski room. Risultato: la mattina seguente gli scarponi erano ancora nell'auto parcheggiata in garage... congelati.
- Come detto, l'indomani ho noleggiato gli sci presso il corner all'interno dell'hotel (credo che la gestione sia affidata a terzi, non diretta dell'hotel). Che dire.. sono rimasto allucinato. Il responsabile del noleggio, alle prese con un cliente straniero che mi precede, pronuncia in continuazione turpiloqui contro il sistema informatico che non funziona. Dopo un attesa di 10-15 minuti abbondanti arriva il mio turno: chiedo due paia di sci per un giorno, mi viene fatta compilare una scheda dove scrivo chiaramente la data di inizio e fine del noleggio ( coincidenti visto che intendo noleggiare per un solo giorno). Mi viene presentato un totale di 120€, sembrandomi eccessivo chiedo spiegazioni e anche qui, dopo un giro di parole poco chiare, viene ricalcolato per un totale di 70€. Effettuato il pagamento il noleggiatore dice: ""prendete gli scarponi e seguitemi"". Mi reco nella ski room per prelevare gli scarponi (ovviamente servono a sistemare gli attacchi degli sci noleggiato) e sopraggiunge il noleggiatore che spazientito per i miei tempi pacato, estrae dalla sacca della mia compagna i suoi scarponi.. graffiando sensibilmente la sua maschera da sci nuova. Lo faccio notare subito e non risponde, prende lo scarpone e va dove si trovano gli sci. Ovviamente irritato lo seguo, una volta li prende un paio di sci non di mio gradimento per la mia compagna; gli chiedo se puó darmene un altro paio e mi risponde che bisogna fidarsi si chi fa quel mestiere. Bhè, dico solo che la mia compagna l'indomani ha dovuto racchettare per tutti i falsi piani di Courmayeur perchè gli sci non era preparati o mal sciolinati. Prima di salutare il noleggiatore gli faccio notare ancora gli sfrisi sulla maschera, risponde dicendo che non è stato lui. Tornati dalla sciata si avvicina a noi seccato mentre ci cambiamo, prende uno degli sci usati da me e dice: ""hai rovinato una lama"". Sembrandomi una palese rappresaglia per la kia telefonata di disappunto di poche ore prima per lo stato degli sci della mia compagna rispondo: ""si si"". Mi dice ""si si lo dico io"". Sparisce per qualche minuto e torna nella ski room dove ci stavamo cambiando scusandosi per tutto, la maschera, gli sci non preparati etc.. Mi offre una maschera dal suo negozio a mia scelta per ripagare il danno, rispondo dicendo che le mie critiche non erano mirate ad ottenere qualcosa. Mi dice di prendere almeno un cappellino per la mia compagna, dico di no, si scusa ancora e ci stringiamo la mano. Tuttavia, sebbene abbia apprezzato le scuse finali, non tollero che sin da subito si sia permesso il noleggiatore di darmi del tu, oltre al turpiloquio e la ruvidità dei modi (non adatti a una ambiente con il tono che hanno cercato di impostare nell'hotel).
- Venendo alla camera, trovo di bassa lega e di scarso gusto che tutti i mobili e tutte le porte siano in laminato (finto legno per i profani della materia). Addirittura per fare dei piani da 6 centimetri hanno accoppiato due pannelli da 3 centimetri bordati separatamente. Incredibile che non ci sia nulla in vero legno, il risultato è un ambiente esteticamente freddo e ""plastico"".
- In bagno non c'è nemmeno una crema o una lozione per mani e corpo.
- Il rotolo di carta igienica di scorta è messo li in bella vista sotto il lavello.
- La colazione non è davvero nulla di che, di buono ho trovato solo il bacon. Le torte, le paste e le brioches nulla di straordinario, il caffè pessimo anche se, essendo bevitore accanito, mi è toccato prendere due per essere onesto.

Bhè, direi di finirla qui... credo di aver reso l'idea.

Note positive: posizione tranquilla e comoda, navetta per gli impianti e pulizia. Troppo poco per la categoria e le tariffe di questo hotel.",1,2016,12,14
09,"Ottima struttura ma,.....","Scelgo il Grand Hotel per passare il weekend dell'immacolata, struttura di recente costruzione e valutata con 5 stelle.
La struttura davvero moderna e ben tenuta offre camere veramente all'altezza delle stelle e una piccola piscina con spa inclusa nel prezzo della camera.
Colazione buona, ma non offre nulla in più di un 4 stelle.
Personale alla reception non proprio impeccabile.
Parcheggio interno a pagamento al costo di euro 30.
Camere non sufficentemente riscaldate (ho provato  a modificare la temperatura dal termostato ma senza risultati).
Speravo meglio.",3,2016,12,11
09,"Ottima struttura, ma non vale 5*","L'hotel è nuovo e la struttura molto carina. La vista è bellissima...
Camere nell'ala C non grandissime, ma comunque molto pulite.
La spa è molto buona per essere un hotel.
Colazione abbondante e di qualità.
In conclusione l'hotel nel suo complesso è ottimo, ma forse non vale più di 4*
",4,2016,12,10
09,Non fatevi ingannare,"Struttura ottima, camere top ma qualcuno del personale va sicuramente cambiato in quanto scortese e maleducato. Anche i cibi nulla di particolare, fate attenzione col vino, finita una bottiglia ve ne portano un altra ma in realta e sempre la stessa bottiglia vuota ma con un vino scadente e travasato.",1,2016,12,06
09,Buono ma...,"L'hotel è esteticamente molto bello, gode di una vista magnifica sulle montagne però ho trovato le camere un po' piccole e la Spa, per quanto bella, può ospitare un numero troppo limitato di ospiti. 
Il servizio è buono e il personale cortese..buona la colazione ma pessima la cena.",4,2016,12,03
09,Invitato ad un Test Ferrari,"Pochi giorni fa ho soggiornato una notte al'Hotell Mont Blanc invitato dalla Ferrari, posso dire che e' un Ottimo Hotel e con un personale molto attento e cordiale, unico problema ho trovato le camere gelate...forse si erano dimenticati, dopo un periodo di chiusura o di assenza clientela, di prepararne la temperatura prima degli arrivi degli ospiti. Il sig Claudio e Maurizio alla ricevimento molto Gentili e Disponibili.La sig.ra oksana al concierge non e' all'altezza del Suo lavoro....fredda e non troppo gentile.tutto il resto molto bene specialmente con i camerieri al ristorante e al Bar.Lo consiglio",4,2016,10,27
09,ottima location,"albergo nuovo, molto bello con camere ampie e panorama sulle alpi.
Il servizio è eccellente, personale molto professionale e disponibile.
Non abbiamo utilizzato dei servizi offerti dalla spa molto carina",5,2016,10,25
09,Mirakulöse 5 Sterne,"Gleich zu Beginn: wo sind sie, die 5 Sterne?
Aber lassen Sie mich mit den positiven Eindrücken beginnen:
das Hotel liegt relativ schön, leicht erhöht im Grünen an einer wenig befahrenen Strasse.
Eine Garage - gut zu befahren - ist vorhanden, der Wagen wird auf Wunsch geparkt.
Die Einrichtung des Hotels ist hell und freundlich mit viel Holz, passend in die Berge.
Sehr freundlicher Empfang, man wird auf das Zimmer begleitet.
Unser Zimmer war in Ordnung, nicht sehr gross, aber zweckmässig mit Holzschränken rustikal eingerichtet und mit einem kleinen Balkon, Blick auf die Berge, ausgestattet.
Das Bad ist schön, sehr grosszügige Dusche.
Geräusche aus dem Hotel können in das Zimmer dringen, ein wenig ""ringhörig"" sind die Zimmer schon.
Nun zum weniger Guten: das Essen ist meiner  Meinung nach unterirdisch, ich kann kein Menu nennen, das halbwegs geschmeckt hätte.
Der Fisch (Forelle) wurde in einer Art durchsichtigen, zusammengebundenen Cellophan-Folie serviert, war weich, nicht warm und schmeckte sehr stark nach Fisch - fürchterlich.
Diese mässige Qualität ziehte sich bis zum Dessert fort 
Dazu kam eine nur mittelmässig motivierte Service-Crew, die die Situation auch nicht rettete.
Es ist nun halt einmal so, dass zu einem 5 Sterne Haus auch eine entsprechende Küche gehört.
Ich persönlich werde in diesem Hotel nicht mehr so schnell auftauchen 

",3,2016,10,23
09,Tolles Hotel,"Eine echte Perle am Fuße des Mont blanc. Das Zimmer war toll - das Bad unübertrefflich. Den spa haben wir nicht besucht, daher hier ohne Wertung..das Personal war sehr nett und zuvorkommend. 5 Punkte!",5,2016,10,20
09,Wunderschön...,"Ein sehr schönes Hotel mit tollen zimmern und eigener Tiefgarage.. die Mitarbeiter waren sehr nett und man konnte sich gut in englisch verständigen..
Die speisen waren durchweg lecker und hochklassig... 
Wir würden wieder dort buchen...",5,2016,10,20
09,Einige Kleinigkeiten fehlen zu 5 Sterne,"Die Zimmer und Betten waren fantastisch. Außer dass die Heizung im Bad nicht ging und die Regendusche in alle Richtungen spritzte, nur nicht auf mich. Das Essen war exzellent! Der Zimmerservice grausam. Auf den bestellten Toast warteten wir umsonst und wurden vergessen. Der Ausschank im Hotel ist nicht hinterhergekommen sodass man sich selbst den Wein aus dem Kühler nahm und nachschenken musste. Das Rezeptionspersonal war superfreundlich und hilfsbereit. Die Frühstücksbox zum Mitnehmen früh enthielt lediglich einen Apfel, Mandarine, Nutella, Marmelade, Wasser, Saft und Muffin. Kein Brötchen oder Messer!",3,2016,10,18
09,Monte bianco a 5 stelle,"Veramente bella esperienza da consigliare come soggiorno a chi come noi vuole avvicinarsi al bellissimo monte bianco veramente a pochi minuti dalla struttura.albergo dal bel design in ogni ambiente,camere pulite spaziose e dotate di ogni comfort.servizio impeccabile e bellissima vista sul monte bianco.unico neo se vogliamo trovarlo la colazione non è all altezza di un 5 stelle di questo livello.",5,2016,09,26
09,Carino,"Quest'anno siamo venuti qui per fare una piccola vacanza, pensavo che avrebbero modificato qualcosa, tipo aggiungere qualche tappeto ma invece no.La cena  e il pranzo non si potevano fare lì perché dovevano fare non so che cavolata.la colazione rispetto all anno scorso è peggiorata.",3,2016,09,18
09,anniversario ottimamente festeggiato,"Siamo stati in questo hotel in occasione del 15' anniversario e abbiamo prenotato la specifica offerta disponibile sul sito web dell'hotel.
Abbiamo usufruito del upgrade gratuito alla suite e di un'ottima bottiglia di prosecco per festeggiare.
la struttura è eccellente, il personale cortese e disponibile. 
Unico aspetto con significativi spazi di miglioramento è il ristorante. Anche la colazione potrebbe essere migliorata: frequento abitualmente hotel per lavoro e ci sono hotel di classe inferiore (4*) che offrono una colazione più varia e di qualità superiore. In ogni caso si sta molto bene.",5,2016,09,13
