Location Name,Title,Text,Rating,Year,Month,Day
225,Great Room but big billing incident and obnoxious communication,"The room was great, the housekeeper very sweet, but after check out the manager tried to charge my credit card with 2 breakfasts we had at a nearby café working with the hotel... Only problem is, we paid for those 2 breakfasts cash directly at the café. Now the hotel's manager still states that we didn't pay for those. Obviously poor communication between the hotel and the café and between the manager and the clients, implying we were dishonest people without even listening to our arguments. ",1,2015,12,31
225,Perfect,"Right in the middle of Temple Bar, within easy walking of main shopping centre, its the perfect location.
We were in the Oscar Wilde suite on the third floor and it was beautiful, gorgeous fireplaces, comfortable bed and great facilities.
The staff were very helpful and absolutely lovely, nothing was too much trouble, we will definitely be staying again on our next visit",5,2015,12,11
225,"Great location, Great stay!!!","Absolutely loved our 2 night stay here. This was our second trip to Dublin and last time we stayed a little further out so found the location this year fantastic. The suite (James Joyce) was beautifully decorated and furnished, loved how spacious the room and bathroom was. Very private and quiet, great staff who were so friendly and accommodating. Due to the location there is a lot of bars opposite, we got back at 1am and 2am and never heard a peep!!! If your looking for a lovely relaxing weekend and like to chill out between sites and bards this would be a lovely place to relax! Will definitely be coming back here for sure!",4,2015,12,04
225,Very comfortable in the heart of Temple Bar,"Very hospitable staff and great location for those who prefer to walk the city of dublin. One warning is parking is several blocks away, so be prepared if you drove to pay extra and walk a few extra blocks.

Otherwise, one of the nicest places we stayed while in Ireland. Despite how noisy Temple Bar can be, they have doublepaned windows, which kept the noice to a minimum. 

Extremely close to the nightlife and a short walk to Trinity College and other nearby sites.",4,2015,12,02
225,Quick but enjoyable stay.,"Stayed at the Merchant House for the final night of our Ireland Trip.  Flight was out early the next morning and, in lieu of turning in the rental car and staying near the airport, which would require cab/bus to and from downtown Dublin, we decided to stay in Temple Bar and take the cab early in the AM (proved to be no trouble due to the ""link"" app on the iPhone).
Hotel room was beautiful, very homey, and also fashionable (chic?).  Heated tile floors in the bathroom and a big soft bed (we only slept a few hours, though!).  A nice desk beside the bed and a Nespresso maker were definite plusses for me!
The rate is a bit high....around 150 euro for our night...so I would hesitate to book the hotel room again, especially for an extended stay.  However, that's mostly budge based, so if you have the money and want to be in Temple Bar, the Merchant House is where you want to be.   You walk out of the hotel/apartment and are right in the thick of things.",4,2015,11,18
225,Spacious and comfortable suite,Stayed three nights in this luxury suite in the heart of temple bar. Lots of room and very well appointed. We were greeted by the very helpful housekeeper who helped us with cases up the stairs. Extra glazing to keep out noise of vibrant area outside was effective.,5,2015,11,12
225,Artist's garret,"We had a lovely night in the Oscar Wilde room, an artist's garret in the attic of the house. A wonderfully decorated room, with quotes from the man himself all around. The room had a shower room and toilet (lower the blind so the neighbours can't see in), mini bar and tea and coffee facilities. Chocolates, drinks and snacks were available at reasonable prices. A fantastic location from which to explore Temple Bar, and a fine room. ",5,2015,11,10
225,Just perfect James Joyce,"Stayed in the James Joyce suite for my birthday/engagement weekend as wanted somewhere special. We weren't disappointed! Were greeted by a lovely friendly housekeeper and shown to our suite, and given our keys, breakfast and dinner vouchers, also a little James Joyce keepsake diary which was really sweet! The suite was beautifully laid out, super high ceilings, tasteful art on the walls and extremely comfortable king size bed.  Modern bathroom with spacious shower off the little entrance hall and Nespresso machine and very reasonable mini bar provided also. There's nothing wr could fault really, we were very warm and comfortable during our time there and the extra glazing certainly worked! You have the option of a 20% discount for dinner at a great Italian restaurant two blocks away. I would highly recommend this offer! The restaurant, La Caverna, is authentic in every way: the food delicious and well presented, reasonable and respectable wine list and efficient, friendly staff.  Breakfast is available just down the street, in Eliza Lodge. Juice, cereal, toast and a very tasty cooked breakfast with several options, including pancakes! Will definitely be back again and we'll done Merchant House 😊",5,2015,10,26
225,Spacious and comfortable,"We stayed one night in the Yeats suite and it was okay. The location is great (pretty much in Temple Bar) and I liked that they had double-paned windows - we didn't hear any noise from the street. However, the people staying in the suite above us came in really late and left really early, and we could hear everything - they were loud, clomping around (at least it sounded like it) and the floor/ceiling creaked with every movement. I don't know if it's like that in other suites, but that's an issue with the Yeats suite for sure. Also, if you're with a couple or solo, it's fine, but the bathroom door is partially frosted glass, so if you're with a friend or colleague (or even a new relationship), it may be a bit awkward. It was good value for money (we got a good rate on Booking.com) but I'm not sure if I'd stay there again. Maybe?",3,2015,10,18
225,Quiet gem in Temple Bar,"Stayed in the Bram Stoker suite which was clean, beautifully laid out with a modern bathroom and the only noise on the busy weekend we stayed there was from the clock ..which was eventually muffled by a couple of towels. Breakfast at cafe close by was also excellent. Before I checked out I had a quick peek at other suites which were bigger than the Bram Stoker with a little sitting room included at not much more in price...so will be booking one of those for next trip. Reception person was very welcoming and happy to answer any questions re restaurants, transport, weather etc. will be back.",5,2015,10,05
225,One night stay in the Oscar Wilde Suite,"When looking initially I was looking for a nice place to stay for my wife and I and overall we were not disappointed. There were a few minor things we thought would improve the room, there is a small mark in the shower tray, and it needs re caulking. Staying in High end rooms is all about perception, there is a nice bottle of red wine in the room in a high heel shoe make it complimentary along with a nice box of chocolates that would have been a nice touch, if you felt this would affect your margins too much then review your prices add the price of the items to the cost of the room no one would know.
One further observation take the breakfast option it's in the Italian corner restaurant approx. 100mtrs from the Merchant House, it was a fantastic breakfast fresh orange juice, cereal, followed by a lovely fried breakfast with toast and jams. Someone on here suggested eating at the stage door café which we did the first morning we arrived it was the worst breakfast we have ever had and I have eaten at truck stops before, just saying.",4,2015,09,28
225,"Things to know: loud, busy guest house","First, it's a guest house, not a hotel. So it's basically a converted apartment building with a street side doorway (a cage door, then a giant door, then an airlock that smells like urine before a glass door with a code lock) into narrow halls, stairways, and no lift. With our 4 bags of luggage it was a bit daunting. There are no on-site services available though the attendant is very friendly and helpful. The rooms are indeed quite nice but this proved worthless to us for the following reason...

It's in the loudest, busiest part of Dublin, Temple Bar. There is a sex shop downstairs and a very loud and popular club across the street. The street (a narrow cobblestone alleyway) is surprisingly busy. The touted double windows did nothing to keep out the noise at night and even earplugs weren't enough.

Wife and I stayed in the James Joyce Suite on the first floor above ground facing the alley. It was a Saturday night in late September and the riotous din went All. Night. Long. Constant hooting and hollering with occasional yelling and foot ball chants, against various thudding sound systems. I thought it would quiet down by 2am, no big deal. Or maybe 3am. 4am?? By 5am the clubs had closed and the alleyway drum circles broke out.
Not a wink of sleep for either of us. It was so challenging after weeks of travel that we moved to the Westin without any hope of getting a refund for the two additional prepaid nights at Merchant House.

Maybe it's better during the week but I would only recommend this to people looking to party in the heart of party town. Giving three stars for nice rooms, good service, and the admission that it's not my scene but could be great for others",3,2015,09,28
225,In the center of things,"This is a beautiful guest house with only 4 rooms, and since there were 6 of us we had almost the whole place to ourselves. Each room is a period piece, very nicely decorated with every comfort you'll need - the beds are very comfortable and the bathroom floor is heated (which is incredible, i miss it at home), the staff, while not on-site, was very helpful and attentive to our needs. The only downside, and its what keeps me from giving this place an excellent rating, is the noise. The bad side of being in the center of things is that its loud, they have double windows and provide earplugs for sleeping, but the partying outside is impossible to block out and goes on well into the night. Temple Bar is an area known for its nightlife, so if you stay here, prepare to take the bad with the good.",4,2015,09,24
225,"Fantastic location, huge rooms",My husband and I stayed here for just one night as we only had limited time in Dublin.  Jorge met us and kindly took our bags up the stairs.  Our Oscar Wilde suite was huge with a very comfy bed and relaxed atmosphere.  Considering the central location in Temple Bar it the hotel was not noisy at all.  The closeness to great pubs and restaurants was a real winner for us and we would stay again.  Thanks Jorge!!,4,2015,09,22
225,Special treat for our anniversay,"I was a little worried since the Hotel doesn't have an elevator, but Jorge, met us at the door and helped us get all our luggage up to the top floor. What a magnificent room it was, with 2 fireplaces, a comfy sitting area and a huge modern bathroom. There was plenty of room to spread out our three suitcases, out of the walkways and still had space to relax on the sofa. They provided DVDs many of which were classic Irish films. In addition to coffee maker, there was an espresso machine. The second set of windows at each window opening completely eliminated any sound from the very noisy Temple Bar action below on the street. there was a fan in the room, which we used one night when it got a little warm with the windows closed. The hotel is on a side street in Temple Bar so it was very convenient to go out in the evening. I would definitely recommend it and hope to be able to return myself.",5,2015,08,31
225,Great location,"Great spot in city center.  Just one block from main bus routes.  Great service.  Offered to hold bags and then got room ready early for quick check in.  Good sq, but storage is not as much as it looks at first.  No separate room spacing to allow for movement without waking someone else.  Don't know if this exists in Europe.  Still, the lighting and carpeting help a lot in this regard and were able to have one get up early without waking the other. Bed was good.  If you were dead silent in room at night you could only faintly here some chatter on street.  This is a big win and any fan or music app easily covered the sounds.  Great value.  Bram stoker room. ",5,2015,08,29
225,A Weekend in Dublin,"The Merchant House is outstanding.  We were met by Jorge and dropped off our bags as we were a bit early.  We then explored Dublin and checked back in at 2pm.  The James Joyce suite is stunning and massive perfect size for a couple getting away and exploring Dublin.  You are in the centre of Temple Bar.

If you are visiting Dublin for a weekend and can get a room trust me you will not be disappointed.

Outstanding and thank you for a great stay.",5,2015,08,14
225,Fantastic accommodation in Dublin's temple bar ,"Very large fantastic suites. Rooms were so large they provided a homely feel. Large bathroom. Very well appointed. In the heart of temple bar so there is a little noise from the street, but I found this very minor and it didn't affect my stay at all. Being in the centre provides many dining and pub options right on the doorstep. Easy to walk to anything. Some noise from the suite above walking around, however this didn't distract from the quality of the suite and fantastic location. I would recommend. ",5,2015,08,13
225,Fantastic!,"I visited Dublin for my 21st birthday and wanted somewhere nice to stay and came across here on booking.com and was not disappointed! It exceeding expectations. We were met at the arranged time by A very helpful member of staff who then showed us to our room where we were pleasantly surprised. We love it! The had everything we could have wanted for the purpose of our trip. From underfloor heating, to a nice selection of drinks in the fridge to a very comfortable bed. It is very safe and secure and right in the middle of where the fun happens, however it is still quiet enough to get a good rest ready for the next day of adventures. My experience was made extra special by this hotel and when I return to Dublin again this WILL be where I'll be staying.",5,2015,07,31
225,Fur coat and no knickers,located above a fetish shop should have been a clue. In the party area we expected the are to be lively but night one was like having a brass band playing in your bedroom such was the lack of effectiveness of the secondary glazing. we were awake for four hours until the party ended. Night two was a Sunday but tonight we could not get to sleep simply because we were on a busy street - the noise of people moving around outside under the influence. The sleep was then awoken with the couple above us spending hours having noisy sex so illustrating that there is no sound filter between floors. Night four was a combination of upstairs orgasms and external noise. The intent to defraud - advising us that they had installed secondary glazing to ensure our stay was interrupted - was complete when we uncovered packets of ear plugs. Hardly what you expect for the money. The apartment is beautiful but when you have experienced sleep deprivation it clearly becomes more difficult to be balanced and embrace the environment. Plenty of Thai massage parlours ironically nestled near a church completed the strange set of experiences on offer. I suspect I would have slept more had I been with the homeless on the streets surrounding the property.,3,2015,07,23
225,Best place to stay in Dublin,"Having arrived after 30 hours of travel from Australia the Merchant House and our welcome by Julijana was wonderful. Easy to find after using the bus from the airport, we waisted no time to find a pub (of which there are many), and had some very nice ales (for medicinal purposes).
In the heart of Temple Bar was the best place to base ourselves for three days of exploring. 
Great location to sample the best of Dublin.
Thank you for the little gift too.",5,2015,07,21
225,A touch of class in the heart of the action,"I'd booked this as a surprise for my partner on the occasion of his birthday, which coincided with the last night of our mini tour of Ireland, and I was truly delighted with my find.

The location above a sex shop, the absence of a formal reception area, the lack of a bar or restaurant...none of these matters. It's impeccably decorated and furnished, really comfortable, has an affordable and really well thought out minibar as well as a guest fridge, and its location in the heart of Temple Bar would be hard to beat.

Having been met on arrival by George, we found him to be highly informative and really helpful. I'd prearranged 'bubbles' in our room and pre purchased tour bus tickets courtesy of Merchant House's advance communication and was delighted to find the tour bus stop no more than 150 yards from the front door. 

The triple glazed windows ensure minimal disruption from the lively activity going on all around and I would not hesitate to recommend this establishment to anybody looking for a touch of class in the heart of the action.",5,2015,07,18
225,"Good Stay, Some Minor Glitches","Stayed here midweek for 2 nights with my wife.
The room itself is a decent size, as is the bathroom. One minor gripe is that it is slightly overstating itself when it is advertised as a 'suite'. It is more a larger hotel room (although a good one at that - we stayed in the Bram Stoker room).
Everything that came with the room was to a very good standard and the underfloor heating in the bathroom was a nice bonus. On the other hand, no air con in the room was pretty uncomfortable and a sleep was not the easiest because of the heat.
Jorge (sp?) was very very good on arrival and check out. Very informative and helpful.
The area is perfect for Temple Bar although there are a few unsavouries hanging about that area who look like addicts, however, we didn't get any problems.
If I came back to Dublin, I would definitely consider the room again.",4,2015,07,05
225,Best Hotel in Dublin,I know so cliche but this was just beautiful. My wife and I wanted to move from our country to hotel to one in the Temple Bar area and we loved this hotel. We were worried the noise level would be high but we couldn't hear a peep from the outside. The wifi is okay but the charm in the Oscar Wilde room just cannot be matched. This is a must have (even for a day) if you love a great hotel.,5,2015,07,01
225,What a find!,"Stayed here for two nights in late June.  Absolutely loved it.  Easy to find an on arrival we were met by Jorge who showed us to our room, The Oscar Wild Suite on the top floor.  56 stair but totally worth it, the suite was fantastic.  Jorge kindly showed us around and let us know how things worked, before he left he gave us a small gift to remember our stay - a lovely touch.  The suite was huge, homely, relaxing and clean.   The bathroom was perfect with good toiletries and a nice big shower. The suite is very well soundproofed - we slept very well on both nights.  We didn't take breakfast as there are lots of restaurants and cafes nearby - the location is brilliant.  If we return to Dublin we will definitely be staying here again.  Thank you Merchant House (especially Jorge!). ",5,2015,06,29
225,Dublin Retirement Bash,"This complex is privately owned and is absolutely fantastic.  The trip was with family + best friend to celebrate my recent retirement.  Jorge (I think that was his name) was waiting for us to show us the 3 rooms that we had booked (2 per room).  The rooms were very spacious, exceptionally clean and stocked with both soft and alcoholic beverages which were reasonably priced. The bathroom was area was quite large with a good sized shower.  Next time I go I will take my wife with me as this is an ideal location to take advantage of both the night life and shopping. The Liffy is just 10 minutes away for a romantic stroll.  10-15 minute stroll also takes you to St. Stephen's park.",5,2015,06,26
225,Bram Stoker room perfect for a couple,"We stayed at the Merchant House a couple of weeks ago and had a brilliant time. There are some reviews on here which say the Bram Stoker room is too small, but we found it much bigger (and more homely) than most hotel rooms. Last year we stayed in a similar district of Paris and got a lot less room for a lot more money! 

Bearing in mind the central location of the Merchant House, we found the price very reasonable. As it is a guest house, it is more like staying in an apartment than a hotel or B&B - but we found this a refreshing and more genuine experience as out got us out and about in the city more. 

The room was really quiet considering we were in the middle of Temple Bar and I loved the remote controlled sky lights.

We would definitely stay here again!",5,2015,06,21
225,First class accomadation,"Just back from spending the weekend in the merchant house and it was the best guest house i have ever stayed in.

We were met by Jorge who was waiting at main entrance to greet us, Jorge was such a lovely person, he showed us to our room (carried by case up to top floor) and gave us a little gift after showing us around which was lovely.
Our room was the oscar wilde suite and it was simply the best. We were so happy with everything, whoever designed this layout was spot on with their layout and with everything else in this room.

If you like upmarket accomadation, then this is the guest house for you. You get what you pay for.

It was down an alley way but you were soon stuck for words when you arrived indoors.

Don't worry about the sex shop remarks, i was a bit worried about this but it's more like an Anne summers shop, so nothing to worry about.

Entrance was well secured.
There was no reception in building but this wasn't a problem, there was an intercom system to contact someone if needed.
There were refreshments to purchase at low prices in room.
There were lovely toiletries in bathroom which was fab.
Free water left everyday.
Breakfast, you need to walk to end of street, about 1 minute away, which was lovely.
We took the voucher to local italian were you get 20% off your bill which was lovely.

Maid visited on saturday and she put in 100% with cleaning her work was to a very high standard which was excellent, she was so polite and such a lovely person.

We will be visiting merchant house again soon, i don't think we would ever get anything better than the merchant house.

Bed was so so comfy
Triple glazing was a bonus
No noise heard at all

Thanks for a lovely weekend to all at the merchant house.",5,2015,06,14
225,Birthday Treat To Dublin,"Wow! Stayed at The Merchant House in Dublin for a Birthday treat for my husband's 50th. We arrived on Saturday 23rd - 27th May didn't know about the referendum for same sex marriages was taking place that day so explains why Temple Bar was mental. All good though.
Had emailed The Merchant House during week stating estimated time of arrival as these are Luxury Suites and therefore has no reception or bar/restaurant they send a member of staff to greet you.
Julianne met us and showed us to our suite - W B Yeats Suite on the 2nd floor. Well one word describes this suite WOW! It's stunning with extremely high quality furniture and gorgeous attention to detail with flower arrangements, mirrors,pictures and ornaments.
Julianna explained all to us and was so helpful with things to do over our few days so Thank You Julianna you were a great help.
The suite houses a luxurious bathroom and lovely hot shower,although this isn't a power shower it was still great pressure and wonderfully hot. The suite has a well stocked mini bar all reasonably priced and also a seperate guest fridge should you wish to use it. There are complementary tea and coffee facilities including a Nespresso Coffee machine again Julianna gave a master class of how to use this! Complimentary water and all the above were replaced daily and if you required your room serviced you simply left your prompt  hanging on the door. Nothing could be more simple.
The suite has two fireplaces which sit against a lovely brick wall, again mirrors above these were beautiful. There are plenty of lamps and light this pleased us as we like subtle lighting rather than huge bright lights. As I said the furniture was of high quality with all drawers and wardrobes having soft close doors and drawers.The Guest book gave you information if you needed to contact any member of staff out of hours or during the day. You are given your own set of keys and security codes to gain entry and lock up after herself. We also met Jorge he introduced himself and asked if everything was to our liking again very helpful and polite.
I paid for the breakfast option and as the suites don't have a restaurant you are given vouchers which you simply hand in each morning. The breakfast takes place about a minutes walk away from The Merchant House at the bottom of the road in Eliza Lodge. The staff were lovely and the Irish breakfast along with lots of toast and tea,coffee were a great start to a fun packed day. The breakfast restaurant is also an Italian and we ate a lovely meal there one evening so Thank You to all at Eliza Lodge.
Really didn't want to leave Dublin we met some lovely people enjoyed some great food and obviously enjoyed the odd pint of Guinness - what could be better! Thanks again to all.",5,2015,05,29
