Location Name,Title,Text,Rating,Year,Month,Day
134,Wonderful experience from beginning to the end!!!,"My experience at this hotel was top-notch. I was welcomed warmly by James. He informed me of room upgrade through my Mariott membership. James offered me a free beer and even volunteered  to bring it to my room to allow me to get settled as soon as possible, which was so thoughtful. The room had a breath taking view of the city, included so many free amenities (snacks, treats, Nespresso coffee and tea)  The rooms are so modern and comfortable. They've manage to be new, modern, and create an impressive, unique experience as well. Not all hotels can manage to strike such a delicate balance so easily. The hotel restaurant for dinner and breakfast was good as well. Not to mention, the customer service at the restaurant was also wonderful and personable. Plus, the hotel is so close to the train station making arriving and departing so easy.

This is the first time I've ever felt special by being a Mariott member. MARIOTT please take note, this hotel really know how to treat their customers. And again a very special thanks to James for providing such a great start to my stay at the hotel. I will definitely be back again.",5,2023,11,17
134,Recommended ,We stayed at the Bankside for 2 nights with our children (age 2 en 0). The experience we had was amazing from checking in till checking out. The team was lovely. We had an amazing breakfast and in the evening we enjoyed some drinks in the restaurant. A special thanks to Carmella who showed us the beautiful art in the basement. We are definitely coming back. ,5,2023,11,13
134,Awesome experience with Manuel!,This was my first time in London. I can honestly say this was the best hotel experience I’ve had in my entire life. The staff was awesome and so friendly. Upon check Manuel had two glasses of wine for us before we could even get to room. I’m addition Jay was great as well when we had issues streaming on tv. Small staff but well trained and experienced in customer service. I will highly recommend this place to anyone on the world!,5,2023,11,11
134,Love the Stylish Bankside Hotel London!,Second visit to the Bankside Hotel London and we love this stylish boutique hotel. The art and decor are modern and fun. The beds are so nice. The restaurant hosts a lovely breakfast every morning. For the gym bunnies there is a nice fitness center with cardio and strength equipment. The front desk is super friendly and helpful. The hotel is environmentally minded with carafes for water in the rooms that can be filled in the hall. The location is splendid for business or leisure. Next to the Thames Link and short walk to Waterloo Station and Borough Market. Great for Marriott enthusiasts ,5,2023,11,07
134,Bankside gem,"This hotel is the perfect place to stay in London. We had a wonderful stay and can’t wait to get back. We visited many other hotels during our visit but this one and its location is our favourite! The staff go out of their way to ensure you’re happy with everything: special shout out to the front desk staff Raquel, Richard, Manuel and especially to the restaurant staff Joshua, Liza & Tomas. The food in the hotel restaurant is amazing which is great when you don’t feel like going far for dinner after a long day of sight seeing. We will absolutely stay here again, we were so happy with everything and everyone.",5,2023,11,07
134,Great Boutique Hotel in Bankside!," This is my first time at this property as I usually stay in Mayfair.  We chose to stay here as we were visiting a family member who lives in the Bankside/Southwark area of London.  The hotel is fairly new.  The location is wonderful for those wanting to visit tourist sites and the Borough Market.  The staff is friendly.  Our room (we used our suite night upgrade) was large with a lovely view of Blackfriars Bridge.  The morning breakfast was nice and the lattes were fabulous.  The gym in the basement was adequate.  I would definitely stay here again if traveling to this area of London.  
",5,2023,11,02
134,Artfully Elegant,"Everything about this property  was amazing.  The front desk staff had the answers to all of our questions - and provided us with converters when the ones we brought did not work.   The restaurant was lovely ...the tomatoes for breakfast were the best we have ever eaten.  The cocktails were delish and we particularly liked the Bees Knees with its slice of honeycomb.  And the art and the ambience delightful. There was a water station on every floor with sparkling and still water.  The rooms were spacious (yes, in London) and the beds and linens soft and comfy.  First time we went ""modern"" across the pond and it turned out to be a great decision! ",5,2023,10,30
134,Great hotel,"This hotel was wonderful.  We typically avoid hotels and stay in airbnbs but this was exceptional.  Really nice staff, quiet rooms, great bathrooms, very comfy bed.  We loved it!

The breakfast buffet in the restaurant was wonderful-Dimbu was especially kind and helpful-she went above and beyond each morning remembering what we wanted to drink, my gluten free toast and paid close attention to every detail.  ",5,2023,10,26
134,Stay here if you need two queen beds!,"Wonderful hotel if you need two queen beds! Spacious room, fantastic shower, plentiful waters, comfortable beds and convenient location. I traveled with a friend and was so happy to find a place that had two queen beds. The only improvement would have been that the AC in our room never fully cooled down, even after maintenance came- however, we’re Americans that like it cold and we’re running hair dryers. Would definitely stay here again!",5,2023,10,25
134,Wonderful London Hotel,"We had a wonderful time in London last week and are glad that we chose the Bankside. Check-in took less than a minute, and our room was ready early upon our arrival. The front desk is always well staffed and they are very friendly. 
Received complimentary buffet breakfast with titanium status, which was great. It is well appointed, including made to order coffee beverages. Our first day we ordered some coffees in the afternoon from Tommy and we saw him for breakfast the following 2 mornings. His friendly demeanor and smile did not go unnoticed. 
Location is excellent. We walked to many spots (Borough Market, Tower of London, St Paul’s, Westiminster Abbey, The Eye, etc…). When not within walking distance,  we took Ubers which were readily available at all hours.",5,2023,10,23
134,Newish hotel in a great location ,"This modern and fairly new hotel is superbly located on Bankside, a short walk to the Tate Modern, Shakespeare's Globe, and Borough Market. 

The staff are friendly and welcoming and our room was very nicely decorated with partial views over Blackfriars’s bridge. The room included a spotless walk-in shower room, a Lavazza coffee machine, some free snacks, and water. The only issue we had was our TV which kept loosing its signal and switching off. 

There's a small gym on-site and a nice restaurant too. The buffet breakfast was very decent and included excellent freshly brewed coffee. 

Overall, this is a very good hotel which is highly recommended if you are planning to stay in the area. ",4,2023,10,20
134,My favorite Hotel of our European Travels this year,"The location was great, the food was excellent, but the service is where they really shined. The front desk and wait staff were attentive, friendly and professional all at the same time.

Thank you specifically to Raquel and team for making our stay so enjoyable.",5,2023,10,12
134,No worries love.,"My wife and I stayed here for two weeks recently.  We selected this hotel for its location and proximity to the Tate Modern, the Borough Market, St Paul’s Cathedral and the London South Bank Walk.  We enjoyed everything about this hotel: the restaurant is great, our room (and the hotel in general) was very clean and the staff is exceptional.  On Monday thru Thursday evenings there is a complimentary wine hour hosted by rotating members of the hotel staff.  It’s very nice and gives you the chance to meet and converse with members of the staff you may not normally interact with.  It gave my wife and I the opportunity to meet Sofiane Kaced, the Chef d’Hotel and Morena Mannino, the Director of Sales.  Sofiane was very gracious and insisted on giving us a tour of the hotel’s art collection.  Morena, who chatted us up for some time, was very helpful with tips on transportation and sights not to missed.

We also had great experiences with the front desk staff.  From Mohammed, who checked us in, and Mariana, who went above and beyond the call of duty, to help with hailing cabs and everyone else who made our stay special.

And I would be remiss if I didn’t mention Manny.  I’m not sure of his job description.  He is a very tall young man who is very helpful and seems to be everywhere.

It is our plan to return next fall.  “No worries love”",5,2023,10,10
134,Amazing first visit to London,"From the moment we checked in at the front desk, Marianna and the entire Bankside staff has been nothing short of amazing. The restaurant staff were very kind and attentive. Rooms are beautiful as well as the entire establishment. Next time we visit we will most definitely stay here again and for a longer period of time. I also wanted to surprise my husband for a belated birthday with this stay and the staff provided desserts, snacks and bottle of champagne.",5,2023,10,01
134,Amazing hotel in London ,"Amazing hotel in every respect!  From the warm and friendly welcome at check in, to the beautiful and clean room, to the perfect breakfast and restaurant.  Literally everyone we met from the staff was as friendly and kind as you could hope.  I stay at over 100 a year with Marriot properties and this is by far my favorite in a very long time.  Cannot wait to come back.  I suggest stopping in the restaurant for a dessert and drinks - the chocolate lava cake and the warm apple tart were truly spot on.  ",5,2023,09,30
134,"The London Hotel fit for Kings and Queens, an experience we will never forget!!! ","Our experience staying at The Bankside Hotel, Autograph Collection was absolutely stellar!! Of course the hotel is beautifully designed… but the staff, food, beds, ambiance and artful decor is incredible and we truly felt like VIP guests with every interaction!  If you are going to London, you will not find a more sophisticated, elegant, warm and luxurious hotel!!! This was my 5th visit to this amazing city and I would not stay anywhere else. Thank you to TEAM Bankside for making our vacation the best ever!!! ",5,2023,09,30
134,Fabulous location on South Bank,"This hotel by far exceeded our expectations. Brand new and a few steps from south bank and Blackfriars bridge, the hotel was centrally located for all of our outings. At check in, the lovely assistant (jet lagged - i cannot remember her name) was able to get us into our room earlier than expected and we are so grateful. The room was superb with the comfiest of pillows and bedding. The temperature in the room was pleasantly cool and quiet as a whisper. Housekeeping (fantastic) provided turn down service, plenty of fresh water and coffee and the room (upgraded to a suite) was well appointed and beautifully designed. The breakfast was outstanding  with plenty of healthy options each morning provided by our server, Olga, who made our experience even better. Management Richard and Mohammed, made sure our stay was exactly as we had hoped. We absolutely loved the location for our trip and definitely plan to come back in the near future. Thank you for a wonderful anniversary. Eileen and Frederick C",5,2023,09,28
134,The pillows and bed set this apart.,The pillows and bed set this apart. Luxury hotel with closeness to many fun tourist attractions. The reception was professional and polite with a speedy check in service!  Will recommend this to anyone looking for a fabulous night sleep:),5,2023,09,28
134,Just Wow! Fabulous property and staff.,"What a beautiful property and accommodating staff. From the early morning requests for coffee to the kind assistance of the front desk and restaurant staff, the Bankside proved to be the perfect place for our party. The rooms were immaculate and comfortable and the restaurant food was delicious. Great value and location as well. Special thanks to Richard, James and Raquel at the front desk for their kindness throughout our stay.",5,2023,09,20
134,Hotel in a quiet area,"Traveled with family for an extended layover.  Had 2 rooms, a spacious ""starter suite"" and a ""generous room"".  Tried to get connecting rooms. Started the process (weekly calls) a couple of months in advance, but did not get it. Rooms were fairly far apart but on the same floor. Kids aren't that young anymore so it wasn't a big deal but something to keep in mind if your kids are younger.
Breakfast buffet was a nice way to start the day. Coffee service was amazing although when I asked for a second cup, sometimes I'd get a weird look and more cutlery. Perhaps it was my North American accent? Ordered room service once and the salmon is about the size of a piano key so beware. Everything else we ordered was fine.
The front desk is set up like a conference table. It did seem like I was bothering them when asking a question.  They do give out umbrellas like candy when it's raining so that was really helpful. Taxis (be very specific where you are headed. If you don't say ""Marriott"", they're taking you elsewhere) and Ubers had a bit of difficulty finding the hotel and sometimes the entrance. 
Was initially unsure of the location but once we made it out to other more congested areas, found it was lovely to go back somewhere that is less crowded after a full day. There is also a small Waitrose as well as an Asian market around the corner for all your snacking needs.
This location was within walking distance to Borough Market though the place is insanely crowded so don't go starving and be ready to queue for a bit. Can also walk to Shakespeare's Globe and some museums. It's a really lovely stroll along the river. 
Overall the stay was pleasant but it didn't exactly gain my undying loyalty. Will try another next time. 
",4,2023,09,18
134,Great location and a special hotel!,"My wife and I stayed for 5 nights and loved the place. Staff are very friendly and helpful, and the hotel is clean and reasonably new. While no concierge lounge is available, the quality of the food and breakfast selection helps to offset this. They offer great little perks that make it a little bit special. Add in the fantastic location, and you won’t be disappointed.",5,2023,09,18
134,World class service and all the comforts of home.,"We had an absolutely fantastic day. The staff was personable and professional. The rooms were very comfortable and beautifully decorated. We loved the breakfasts downstairs and the beautiful amenities. Special thanks to Richard, James, and Racquel for their kindness and professionalism. We will definitely stay again when we are back in London.",5,2023,09,18
134,Fun Family Trip to London,"Loved this hotel. Great location and large rooms. Nice little touches in the room including free cold waters, snacks, and NESPRESSO coffee maker! Hotel breakfast was yummy too. Would definitely stay there again! ",4,2023,09,12
134,Family at London,"Great hotel, fantastic room and location.
Breakfast of high quality and a very friendly staff… from the receptionists, to the cleaning ladies and restaurant staff.
A special KUDOs to Manuel & Fábio for the friendly support.

Recommend you to book the hotel with breakfast included.",5,2023,09,10
134,A trip to remember!,"We stayed at the Bankside hotel for two weeks. The proximity to the prominent sightseeing places, walking alongside Thames and the cheerful staff made the trip quite memorable. I would like to extend my gratitude to Tamas and DeDe for making our mornings very pleasent. ",5,2023,09,09
134,Not happy place,I visited this hotel I found  the staff on the front desk rude and extremely unhelpful. Unkind. This is not a hotel that wants to attract return customers I feel. I will never enter this hotel again. They should learn to be more helpful and kind.,1,2023,09,08
134,Beautiful Bankside,"Hands down the best experience I have had in a very long time! 
Visited this beautiful hotel on my honeymoon. From booking, reaching out in advance, chatting to the team before arrival, checking in, coming and going, the list goes on. Huge kudos to the General Manager for running a spectacular property!",5,2023,09,06
134,Stay here! Amazing from start to finish!,"We recently stayed here for 9 nights and it was a wonderful experience from start to finish.  Everyone was so welcoming, friendly and helpful.  Our room was extremely clean, the bed and pillows were so comfortable and the shower pressure was great! We also enjoyed the breakfast buffet which had a nice selection of items and a very friendly staff. It was a very relaxing hotel to come back to after a day of running around.  It’s in a great  location in walking distance to the Thames, Tate Modern, many restaurants and pubs, the underground, etc. I have to give a big thank you to Richard and the front of house staff who were always so genuinely nice.  When my husband and daughter were going to the Reading Festival and there was a train strike that day he took the time to help them map out a way to get there!  Our daughter was staying in London to study abroad.  As we were leaving Richard mentioned, she knows where to find us if she ever needs anything.  We would 100% stay here again! ",5,2023,09,05
134,Truly Amazing Property,"Hard to describe how fabulous this hotel is.  The location is fabulous if you’re looking for something other than the typical  central London experience.  The staff are amazing, warm, generous and truly epitomize the meaning of hospitality.  It felt like you are staying with family.  The decor of the hotel is thoughtful and inspiring.  Big shout out to Alina at the front desk and Julia in the restaurant.  You are very special people and you made my stay even more amazing!",5,2023,09,04
134,Wonderful London hotel!,"We enjoyed our 10 stay at this hotel with friendly staff especially Manuel. He always greeted us with a smile and made us feel welcome every time we would return  from our London adventures. Our room was great and  super clean!  Bed was sooo comfortable. Really liked floor plan. We had a king size bedroom with lots of room and appreciated the big desk to use our computers  and charge all our devices. Technically, the room was fantastic with convenient outlets, automatic black out blinds which was perfect  for sleeping well and getting over jet lag. Above the nightstands there are buttons to control all the lights in the room. The bathroom was plenty big for two of us with a walk in shower and a night light under sink and at front door, clever. One issue with shower was there was no cold water. We had to turn the knob to the coldest setting otherwise the water was scorching hot! Even on coldest setting is was very warm, but we were ok with that.  Sink taps were fine. The restaurant staff was great and we had a few good meals there. The evening manager was kind and friendly making sure my husband’s meal was dairy free.  We loved this hotel and would stay here again! ",5,2023,09,02
134,Amazing!,Great hotel! Room decor is awesome! Lobby checking was great. No complaints here! Room service food was REALLY good! A quick walk outside and you are at the bridge with beautiful views of the River. Definitely one of my favorite hotels. I was placed on 5th floor (top) no road noise. Hotel is a bit tucked away from Farringdon street so that’s nice. Cabs can be called within 2-3 mins. Lovely hotel all in all,5,2023,09,01
134,See London from the Bankside!,"Our stay at the Bankside was outstanding from the moment we arrived — and were greeted with warm smiles at the reception desk by Mikaela and Kasha (sp?) — until we departed. The accommodations were very comfortable and well designed — with multiple electric outlets on both sides of the bed!! A multi-option breakfast in the dining room was ample and served by friendly and accommodating staff. While not in the obvious location for first time London visitors, it is just a couple of blocks from a Tube station and a block from a Railway station that can quickly get you anywhere in London or beyond. It’s also conveniently located close to the boat system for water travel up and down the Thames. Then, in the evening, you return to Bankside and stroll along the River for dinner any/or drinks — or explore the nearby neighborhoods for local restaurants. While we’ve stayed in Central London we found the Bankside to be great new alternative.",5,2023,08,31
134,"Classy, surprising and fun.  Even if not staying you would go for the art and food.","A spectacular unusual hotel with warm staff and lots of surprises.  Art everywhere, people visit the hotel just to see the art.  While the hotel is classy, it is not stuffy.  It is a fun place to stay.  The modern rooms have all kinds of convinces that we have not experienced before.  The restaurant is frequented by locals, always a good sign.  Plenty of Vegetarian and vegan dishes.  The best hotel we have ever stayed at in U.K. and one of our all time favorites.",5,2023,08,28
134,"Fabulous, Convenient  - Yet Quiet!","This is a fabulous quiet hotel just a short walk from the Tate as well as the Borough Market. Conveniently just over the bridge from Blackfriars. Staff was always very helpful, rooms were comfy and well appointed. Showers had good water pressure. Drinking water taps were in the hallways so you could fill up your rooms carafe with soda or plain water. There is a Gails Bakery in the same building complex so breakfast was easy.",5,2023,08,25
134,Sublime Experience at Perfectly Located Hotel,"I can understand why this is in Trip Advisor’s circle of excellence —our experience was fantastic and although we split our stay in London between two hotels (not knowing the neighborhoods), I wish we had stayed here solely for our week long stay.  

The hotel is fantastic and started blissfully with a super early check in allowed (they had a room available for us at 10:30 am after we arrived from an early morning flight into Heathrow) and so grateful since our family of four was able to shower and freshen up before hitting the National Gallery.   They were so sweet to allow us a delayed check out as well (noon check out which allowed us to fit in St. Paul’s the morning we left).

The room was a good size for London with comfortable modern beds, a really clean interior, and I loved the skin care products (fragrant smell and moisturizing).    I loved the modern decor and little touches with complementary water and the bamboo room cards.   With the warm weather, it is impressive how cool the room got and the blackout shades were great to help with jet lag.   

With my husband’s Marriott status, they were kind to give us two complimentary breakfasts and the buffet was excellent. 

What couldn’t be beat though is the fantastic location—walking distance to Thameslink (Blackfriars) and the underground (Thameslink/Blackfriars) and walking distance to so many fantastic sites (St. Paul’s, Tate Modern, Millennium Bridge).   More importantly there once on the tube there are few spots you have to head on for major London spots (eg Westminster with Big Ben, the Abbey, and National Gallery is just a stop away).",5,2023,08,25
134,Great London Hotel Choice,This hotel checked all the boxes! The family room is great when traveling with kids. The drinks at the bar were excellent as well as the children’s menus. Loved the bathrobes and slippers. Location was super close to Borough Market and close to many tube stations. If you are spending a lot of time in central and northern London then this location isn’t for you.,5,2023,08,19
