Location Name,Title,Text,Rating,Year,Month,Day
230,Delightful Boutique Hotel Near Everything,"We were greeted with a smile and friendly service throughout our 4-day stay.  The room was ready and available to us early (a wonderful option) after our long overnight flight.  This enabled us to enjoy Dublin later that morning.  The room was compact, but well laid out.  The quiet side street is a short walk from TCD, shopping and many other attractions of the city.  The concierge gave us thoughtful advice and made dinner reservations at wonderful places for our group.  I would stay here again.",5,2024,10,16
230,Fantastic Stay,"Best experience for a one week stay at a hotel.  The room was well appointed and to call it ""very nice"" is an understatement.  The breakfast, included in our stay, was great with a starter then main course.  The location near Trinity College is ideal.  The nightlife and friendly atmosphere we experienced was superb.  It was a 20 minute walk to Busas station for a bus to Wickllow, and a shorter walk to the train station to travel to other locations was filled with the sights of Dublin.  We took a tour to the Cliffs of Moher also, that was fantastic.   Highly recommended!   Cannot say enough good things about our visit.",5,2024,10,15
230,Great Stay,"Extremely Clean comfortable, Friendly Very professional staff. Breakfast was fantastic.  Excellent location.",5,2024,10,11
230,"good, just one remark","well, almost perfect. But in Room 111 (and potentially some others) it would be nice to have the switch for the towel heater clearly marked, like in room 310",5,2024,10,09
230,Excellent Boutique Hotel,"This is the epitome of what a boutique hotel should be.  We only spent one night here and wish we had stayed longer.

The hotel is located in a great area.  It’s practically next door to the Book of Kells and Grafton Street and is quite close to other sights.  

They have rooms in 3 different buildings.  The reception desk is in one of two adjoining buildings.  We stayed in a 3rd building that is across the street.

I initially booked a classic room but decided to upgrade to a superior room for €70.  It was a good decision as the superior room was larger and similar to a junior suite.  It was nicely appointed and looked just like the website photos.  It was also on the ground floor which was a big plus as they there are no elevators in the hotel.

The bathroom was very nice with a great shower.  The sink was in the bedroom, though, which we didn’t like.

Breakfast was served in the Library Street Restaurant, which is adjacent to the reception area of the hotel.  The restaurant also serves dinner on some nights and received a Michelin recommendation. The a la cart breakfast was outstanding with a very calm atmosphere. It’s surprising that the hotel doesn’t promote its relationship with the restaurant and offer dinner bookings or discounts.

We stayed in Dublin twice on this trip to Ireland.  On the first stop we stayed at the Morrison Hilton. It’s also in a good location but cost roughly €100 more per night for a basic room and mediocre breakfast.  This hotel provided a vastly superior experience and value.

Highly recommended.",5,2024,10,09
230,Ideally situated hotel for visiting Dublin,"This hotel is perfectly situated for exploring Dublin.  Grafton St., Trinity College, O’Connell St, many restaurants all within walking distance.  Being on my own, I felt very safe. The staff were very helpful.  There is no lift in the building but staff help with luggage and storage.  Breakfast is serviced, no buffet, and food was very good.  It is a small dining area and sometimes you had to wait.  Being so close to the main hub, it was a very quiet street.  I’d absolutely recommend this hotel.",5,2024,10,07
230,Perfect location,perfect stay and would recommend - good breakfast - try the Italian restaurant across the street which is very good,5,2024,10,07
230,Very comfortable boutique hotel,"Very comfortable, welcoming and clean. Great central location. Rooms well equipped although fairly compact. Breakfast in adjoining Library St restaurant was excellent ",5,2024,09,28
230,Ridiculous price for a cupboard sized room,"£430 a night , champions weekend , room was minute , you literally had to walk side on to get round the bed , shower room so small you could barely turn round , sink was in the room , outrageous price , breakfast the next day had been incinerated , dry as a bone .",2,2024,09,21
230,Top Notch Hotel,"We just made a second stay at the Trinity Townhouse Hotel and, once again, our experience was perfect.  The front desk staff offered helpful recommendations and friendly service.  Our room was super-comfortable, spacious, and very well appointed.  And the included breakfast included attentive service and was absolutely delicious!  We highly recommend this property.",5,2024,09,17
230,Highly recommended,"We really liked this hotel.  4 rooms, each for a 3-night stay.  Great location in Dublin, walk to most everything.  The rooms were very clean, nice, and quiet.  Mine was a little bigger, but the others also enjoyed their stay.  Delicious full Irish breakfast included.  The staff was very friendly, helpful and professional.   

The only point that could have been an issue, but wasn't for any of us, is no elevators.  Just know that beforehand if your room is on the 2nd or 3rd floor.

All-in-all, we would highly recommend Trinity Townhouse.",4,2024,09,15
230,A cosy room in a cosy hotel,"The welcome at the Trinity Hotel was lovely. Given its age and attention to detail, I was a little surprised there was no lift as to top rooms were on the 3rd floor, so you needed to schlep your luggage up the stairs. Once workout was complete the room was lovely and well appointed. If I were staying more than 1-2 nights, I might have opted for a larger room as there were no seats - so it was sit on the bed or perch on the window sill. Although the room was cosy, it was clean beyond measure, the bed and pillows super comfy and had everything you needed (including a fridge). Breakfast was in the restaurant area down stairs and the menu was excellent. the staff were attentive. I couldn't  have asked for nicer hotel to stay in. Being central to down town Dublin and walk to Trinity College I highly recommend .",5,2024,09,15
230,Fantastic location – a hidden gem,"Fantastic location – a hidden gem on a quiet street. All major attractions are just a 5-15 minute walk away. The room was excellent, and the staff were exceptional. Despite being close to everything, the street itself is very peaceful.  We were able to walk to every where - bring an umbrella.  The weather can be unpredictable.",5,2024,09,05
230,"Perfect location, lovely room and fantastical staff!",The property is just a few feet from Grafton street an walking distance from anywhere you'd like to reach in the city. The front desk was incredibly welcoming and the breakfast was superb with the staff in the breakfast area just as welcoming and accommodating. Beautiful room with extremely comfortable bed ! We would highly recommend this property for a lovely lovely stay!,5,2024,09,04
230,excellent,very comfy hotel in a good location. Nice staff and great breakfasts. The only downside being there is no lift - but otherwise really good place to stay ,5,2024,08,31
230,Exceptional Stay,"I highly recommend Trinity Townhouse to anyone looking for a central place to stay in Dublin. Great location, spotlessly clean, very comfortable, lovely furnishings, extremely helpful and efficient staff, Rituals toiletries in the bathroom, excellent breakfast, overall a great choice to stay in Dublin",5,2024,08,30
230,Great location,"We spent three nights at Trinity townhouse hotel as we begin our do week adventure in Ireland. It could not have been a better start. The location was perfect for everything we wanted to do. The room was quiet, comfortable and well appointed. Each morning we began the day with a beautiful breakfast. Great place to stay! ",5,2024,08,30
230,Cozy and quaint,Pleasure trip to Ireland with my family and this lovely hotel was a HUGE surprise in the good sense!!,5,2024,08,28
230,Great long weekend break,"Great location, great room, great staff, great breakfast - highly recommended , will definitely use again - ",5,2024,08,28
230,Great Dublin setting,"Perfect location in Dublin. We walked everwhere with ease. Rooms are small (as noted by others), but comfortable. Great staff/ service... and very helpful. Very clean, decor was great. Paid for early check-in and we were in our room before noon!",5,2024,08,21
230,Wonderful hotel!,"So close to everything. Great staff, welcoming and very accommodating. We appreciated all their help during our stay. Our room was cozy and very well maintained.",5,2024,08,16
230,Historic Comfort,"Though our time in Dublin was brief, our stay at Trinity Townhouse was superb. The staff were all very friendly and helpful. The breakfast was excellent and the perfect size. Having water in the room when we arrived was a nice surprise, especially after flying all day. It was nice being located so closely to Trinity College, Grafton street and other local places. I would defiantly stay here again and recommended it to friends.  ",5,2024,08,14
230,Fantastic Stay!,"Had a fantastic stay in the Heart of Dublin. Close to everything, but far enough from the craziness of Temple Bar to escape from the crowds of tourists. And great Breakfast.
I highly recommend Trinity Townhouse Hotel.",5,2024,08,14
230,Excellent Hotel!,"Team,, Room, breakfast, location, everyting was fantastic! Lovely space near Trinity Collegue pleanty of calm.",5,2024,08,13
230,1 night in Dublin,"Really enjoyed the property, the room /bathroom were nicely decorated and the bed was very comfortable.  A nice breakfast was included.",5,2024,08,09
230,Homely TTH,"Superb hotel, very warm welcome, well organised, quality rooms with super tea and coffee facilities. Superb breakfast. 
Lovely staff Onrigado!",5,2024,08,08
230,"Very cosy, friendly staff","This hotel exceeded my expectations with its excellent service and friendly, helpful receptionists. The cleanliness throughout the hotel was impeccable, and the room was comfortable and well-maintained. The location was perfect, offering easy access to attractions and transportation. The value for money was outstanding, considering the quality of service and amenities provided. I enjoyed a restful night's sleep thanks to the quiet surroundings and comfortable bedding. Overall, I highly recommend this hotel for its superb service, prime location, and exceptional value. I look forward to returning on my next visit.",5,2024,08,07
230,Excellent boutique hotel,"We always stay here when we visit Dublin, the location can't be beat and the rooms are lovely! Breakfast is a really good too.",5,2024,08,05
230,Great Hotel!,"Great location! Staff was very nice and helpful. The breakfast was just right. Overall, Trinity Townhouse Hotel is a very nice place to stay. ",5,2024,07,29
230,Wonderful find.,Large room tastefully furnished. Lovely people. Great location. Delicious included breakfast. Nice features.,5,2024,07,20
230,Perfectly perfect,"My fiancé and I had been driving around the coast of Ireland for a couple of weeks and Dublin was our final stop. What an amazing place for our ‘finale’. We were made welcome as soon as we walked in the door. Our room was beautiful, the bed comfy, the pillows perfect, the bathroom stunning and the shower fantastic. After a wonderful night’s sleep we enjoyed a lovely breakfast. I would return here in a heartbeat if back in Dublin",5,2024,07,20
230,Excellent Position,"This is a very good hotel, close to most sites of importance and to areas for restaurants, bars and shopping. The room was very comfortable, good bathroom facilities and an excellent breakfast. Staff are friendly and helpful. Highly recommended.",5,2024,07,14
230,Very cozy,"Staff are lovely, it always feels like you're the only one staying here when you're there. It's great. Super clean and showers are great, breakfast was decent, nothing special though and the coffee wasn't very nice. However, the breakfast staff are very accomodating, it's also a very nice breakfast room.I would recommend this for a city stay and will be back. ",4,2024,07,14
230,Beautiful hotel but disappointing experience,"
The hotel was beautifully decorated and very clean. The location is perfect. The breakfast was fine overall, but I would have appreciated more variety.

The room, however, was disappointing. I specifically booked a Deluxe Double Room due to the advertised size of 26 square meters. It was frustrating to receive a much smaller room that was also located in the attic rather than on the ground floor as stated during booking. When I addressed this with the staff, they dismissed it politely, saying that the room appeared smaller because of the large bed. Finally, a staff member promised that I would receive feedback from the manager, but I never did.",3,2024,07,10
230,Dublin City Break,"We booked 2 comfy rooms. Steep stairs to these but we knew at time of booking. Extremely clean and comfy with everything supplied including excellent coffee.

Fantastic location and great staff.
Great service at breakfast and quality of the food was top notch.

All round great hotel would recommend and would stay again.",5,2024,07,09
230,City Centre Comfort,Great location and very central. Rooms very comfortable and clean. Delicious breakfast. Our regular place to stay in Central Dublin ,5,2024,07,08
230,Our trip,We were here for a music concert and the location was brilliant so close to bars and restaurants and shops,5,2024,07,07
230,Lovely hotel,"The location is fantastic. The hotel is clean, comfortable and stylish. The cosy room is small (as expected) but lots of room under the bed for luggage. The staff are very friendly and helpful. Lovely breakfast included.",5,2024,06,25
230,Adorable Place in Dublin,"My daughter and I stayed here two nights. It's quiet, beautiful and has great staff. The breakfast is perfect. The only comment I would make is you need to be prepared for stairs. ",5,2024,06,23
230,Lovely central boutique hotel,"Staff were friendly & helpful. Breakfast lovely. Our upgraded room was really lovely. Spotlessly clean, comfy bed and good bathroom.",5,2024,06,22
230,2 nights in Dublin!,"A wonderful location to explore the city, staff were very welcoming. Enjoyed breakfast, relaxed atmosphere.",4,2024,06,17
230,What a fab place!,"A lovely hotel in a perfect location. Friendly staff, beautiful rooms & a delicious breakfast. Really enjoyed our stay.  ",5,2024,06,16
230,Great Location in the heart of Dublin,"This was our first stop on a holiday to Ireland- four days in Dublin and this was the perfect base. The warmest of welcomes when we arrived. Super breakfast included. Thr rooms are quite small- but perfectly formed! Deluxe bed and linen, spacious bathroom and well worth being on the 4th floor with no lift!",5,2024,06,16
230,Great location,"The hotel was perfectly located for my needs--close to museums, restaurants, tram and shopping.  The breakfast menu was great--could have big breakfast or lite one.  Staff were very friendly and helpful.  They coordinated a cab for my trip to the train station and it was there when I needed it.",5,2024,06,16
230,I Can't Say Enough Good Things,"I just stayed four nights at the Trinity Townhouse and wish I could have stayed longer. My room was large, yet cosy. The staff was wonderful and I couldn't have felt more welcome. The location couldn't have been better. I walked almost everywhere and it was all within ten minutes...museums, Trinity College, and oh so many pubs.",5,2024,06,12
230,Perfect stay,"Great place, perfect location, individual atmosphere, and delicious breakfast, caring personal, short: perfect stay!",5,2024,06,08
230,Room selection,"The hotel is highly recommended. Everything was just right...:

We are a bit older. Our room was under the roof. So we had to climb 3 floors on foot with our luggage. Not an easy task.",4,2024,06,08
230,Charming hotel in amazing location,This is such a charming hotel in a perfect location to walk and see the sights of Dublin.  Wonderful breakfast and service,5,2024,06,06
230,Extremely Pleased,"We were very happy with our stay at Trinity Townhouse Hotel.  We stayed 3 nights and found the room clean and spacious, the bed comfortable and all the amenities we needed were available.  The breakfast was very good and the service was outstanding.  We would definitely choose this hotel again if we have the pleasure to come back to Dublin.",5,2024,06,06
230,Great little hotel close to city centre,"Great little hotel close to city centre and Trinity College. We had a great stay. Very friendly people, great breakfast und nice room.",5,2024,06,04
230,Almost 5 Stars!,"Absolutely beautiful hotel, wonderful staff, excellent breakfast, and great location!  There were only two things that hold back the extra star: our room was very small, although we expected small … this was very small. Secondly, the shower was very awkward. I commend them for trying to use every inch of space, but the angles of this shower were really difficult to maneuver. If you’re a larger person, you would really struggle!  Otherwise, this was a fantastic stay!  On the upside, we got the family room for our adult kids and that room was absolutely incredible! Kinda jealous! Thanks for the great stay! ",4,2024,06,03
230,Holiday in Dublin,Great couple of days walking around the old city areas. Fully recommend trinity town house to stay for your travels. ,5,2024,06,01
230,Great hotel in very good central location.,I loved this place due to its central location. The staff were great and the breakfast is brilliant.,4,2024,06,01
230,A Beautiful Place in Dublin,"After spending two weeks visiting Scotland we ended our trip staying three nights in Dublin.  This boutique hotel was just what we needed to unwind and relax.  Great location, beautiful rooms, and a delicious breakfast served every morning made our stay fantastic.  One of the nicest hotels I have ever had the pleasure of booking.",5,2024,05,31
230,Lovely hotel in the heart of the city,"Our room was well appointed with plenty of space (opted for a Superior room based on previous reviews). V comfy bed. Location superb. Sunday & Monday breakfast service was a little chaotic, but the Saturday experience was excellent. Welcoming staff. Would stay again. ",4,2024,05,28
230,Wonderful hotel,"We stayed overnight at this town house in Dublin. We picked it because it is close to Trinity College and Grafton Street. The room was very nice, the bed was comfortable, the shower was great. The breakfast included in our stay was very good and served in a lovely room. All the staff were helpful and friendly. We were able to store our bags before our room was ready and after checkout. Very pleased with our stay.",5,2024,05,28
230,"Great staff, and location, accommodations small","This hotel has a Great location, but the Rooms very small, but very clean and bed comfortable, loved the staff, Helen at front desk was incredible.... I saw her work a good part of the day and she was very nice, attentive and patient with guests",3,2024,05,16
230,Great Dublin location!,"I loved my stay at the Trinity Townhouse Hotel. I had a cozy smaller room, which was very comfortable, clean, and convenient. The staff were very friendly and helpful. Highly recommended!!!",5,2024,05,15
230,A little gem of a hotel,"I loved everything about this hotel from
The moment I arrived, our stay was exceptional! The staff were friendly, and the room was beyond comfortable.",5,2024,05,04
230,Perfect location,"Great location, lovely room (Superior), fabulous breakfast served by a welcoming, efficient team. We are so glad we stayed and would come back with no hesitation if we ever return to Dublin. We had one small suggestion for the future (and it was small) which we passed on to the reception team when leaving, 

There are many wonderful restaurants and bars within a few minutes’ walk. Our only advice to travellers would be to explore and find your favourite. Don’t just settle for the next door Italian which may be convenient but was not good, in our view. It is not connected with the hotel.",5,2024,05,01
230,Good hotel close to Trinity.,"This hotel would achieve a 5 star rating apart from several small niggles. The room was small, to the point that the wash hand basin was in the room rather than the en-suite. We were moved from our table at breakfast each day - simply a lack of planning on the part of the restaurant manager. Room service was OK but limited choice of tea, when asked about a tea pot the staff member rudely insisted that there was one in the room, which was not the case also seemed to have  problem with refreshing tissues and toilet tissue!",4,2024,04,30
230,Cosy hotel in perfect location,"Very nice hotel near Trinity college and Crafton Street. The room was ok for a weekend trip (oldstyle and with carpeted floor) , the modern bathroom and amenities were  good.We love the outständing breakfast and very friendly staff . ",5,2024,04,29
230,Perfect! Rarely stayed in such a beautiful hotel.,"The hotel couldn't be better located, very central to the university, museums and shopping facilities. At the same time very quiet in a side street. Very nicely furnished rooms with a flair of traditional Dublin. Invariably friendly and helpful staff. The breakfast is exceptional, rich selection with service. I really didn't notice anything negative.",5,2024,04,27
230,Great Breakfast,We had a great stay at this hotel. Our room 203 was big enough . King bed and big bathroom. Breakfast at the hotel is excellent.,5,2024,04,24
230,Perfect location,Everything about the hotel was great especially breakfast. Our room 205 was very small. There are steps to go to room but they help you with the luggages.,5,2024,04,24
230,Lovely place to stay in the heart of Dublin,"Lovely boutique hotel spread across Georgian style town-houses. Good location very near Trinity College.  Quiet street so sleep was good even though the windows are not double glazed. 
The refurbishment is really good and once you are in your room it is a modern hotel room with much better furnishings than most. All services in the room such as coffee machine, kettle, water bottles and good lighting. Even books left around. 
The rooms are small as is normal in this type of building; our bathroom was tiny. 
Breakfast in the adjacent Library Street restaurant was excellent - they actually serve you!  Beautifully prepared fruit salad or yogurt and granola and great freshly cooked hot dishes accompanied by a basket of fresh bakeries. Coffee also good.  Only Quibble was lack of range of herb teas - they think that mint or Earl Grey (!) are enough
Service in the hotel is fine. 
Only quibble is that there is no lift (elevator) and some rooms are 3 floors above the ground.  Annoying with luggage...",4,2024,04,22
230,Superb hotel with lovely staff,Absolutely gorgeous hotel with super helpful staff. Delux room was really great with a delightful ensuite. Cosy and noise free. Breakfast was delicious. All in all a great experience and we will be returning ,5,2024,04,21
230,Superb Boutique City Centre Luxury Hotel,Absolutely loved our stay at Trinity Townhouse. Fabulous bedroom and bathroom. Extremely comfy bed. Spotlessly clean. Well appointed en-suite. Loved the freshly cooked breakfast. Cannot wait to return. ,5,2024,04,18
230,March '24 Trip,"Excellent location - convenient to everything we needed. The rooms were beautiful and comfortable, the staff was very attentive and helpful.  Breakfast was very good with great service.  We would highly recommend The Trinity Townhouse - we've decided that this will be ""Home Base"" during our next Dublin trip!",5,2024,03,25
230,Amazing Hotel,"This is one of the most unique and amazing hotels I’ve ever stayed at. The staff is extremely helpful and so friendly. Everything was very clean and the rooms were very comfortable. The location is perfect, right in the middle of the city but also on a quiet street. We only have great things to say about this hotel. Thank you for having us. ",5,2024,03,23
230,Trinity Townhouse,"The hotel is really central and the service from all staff members is exceptional.  The only downside was the lack of a lift, but considering the age of the building it is understandable.  Next time I will request ground floor.  Definitely worth a second if not third visit.",4,2024,03,19
230,Adorable hotel in a great location,"My husband and I stayed in one of the cosy rooms and we loved our stay! The property was very pretty and the staff was super friendly and helpful. The cosy room was a bit tight, but it was clearly advertised as such, so we weren't surprised by the slightly small space. And even so, it was roomier than other ""cosy"" rooms we've stayed in elsewhere. The hotel was within walking distance to all of the main attractions in Dublin which made it the perfect hub for a weekend trip. Overall we loved our time there and would definitley stay here again!",5,2024,03,19
230,Perfect choice for Central Dublin,"The hotel is on 2 town house sites opposite each other. As you come up from Trinity College the reception and the breakfast cafe is on the left, our accommodation was directly opposite.
First class room, very clean with a comfy sofa, a fridge & good amenities. The bed was super comfortable and the. Breakfast definitely worth crossing the road for ",5,2024,03,16
