Location Name,Title,Text,Rating,Year,Month,Day
21,Howard’s Visit to the Grand Hyatt,"The executive room was dark and we were greeted by a bowl of mouldy fruit. Went to the executive lounge and that was just as bad, no staff, no food, small selection of colas and water but no wine.
Between 5 & 7 there was a buffet and drinks available in the main restaurant for executive members which was a big improvement on the lack off anything lunch time.",3,2024,10,14
21,Fabulous hotel with superb staff,"This was my first time staying at the Grand Hyatt and I cannot say enough wonderful things about the hotel.  From the friendly chap who opened my taxi door and took my bags, to the seamless check-in, beautifully comfortable beds, excellent rooftop bar/restaurant and helpful staff (calling taxis, finding out where I can buy the pillows that they use, and what size, providing sun screen because I forgot to bring any) I really enjoyed my time here and was very sad to leave!",5,2024,09,17
21,Nice Business Hotel,"Good Hotel, a lot of convenience.
...........
Upgrade as woh member.
...........
Nice Staff
...........
Gym very good
..........
Pool ok
.........
Location perfect
........
Plenty of space for car Park
........
Will be back
...........",5,2024,10,13
21,"Most not ""Grand Hyatt""-like Grand Hyatt","No tissue box. The shower floor is slippery, no anti-slippery mat, no place to hang towels but only in the shower, causing the towels to be drenched. No face towel. Dirty stained marks on window. Insufficient lighting in the room. There is no dim light. It's so dark at night when going to the toilet. But had to turn on the brights, waking up the other person in the room. ",3,2024,10,11
21,A hotel worth the visit,A fantastic hotel that’s stylish and elegant with staff to match. The staff in every team were attentive and very helpful and the location was fantastic. We were visiting prior to boarding a cruise and this was the perfect launch point. Easy from the airport and to the cruise terminal.,5,2024,10,07
21,Quick but memorable stay,"Hotel was at capacity for our two day stay, however, the team at GH Barcelona made it a very memorable one! Every member of the team we meet was beyond courteous, eager to help, and always had a smile. We even got an upgrade(honeymoon stay before our cruise) for the second night and they moved all our luggage(with permission) while we were gone for the day. The entire hotel is immaculate and has great design. Great variety of food options at multiple price points. Grand Club has limited hours but a wonderful grad and go spread throughout the early afternoon. Definitely checkout the “Tapas Hour” if you have Grand Club access located on the lobby level from 5 - 7 pm. Not the most convenient spot to downtown Barcelona, but an easy cab ride to all spots and an oasis from the craziness that can be Barcelona. Will definitely return soon!",5,2024,09,30
21,Perfect stay at the Grand Hyatt in Barcelona,"Great modern hotel, amazing relaxed and friendly staff, always helpful and deliver what is needed. Great Concierge, fountain of knowledge",5,2024,09,27
21,Loved it here. Hotel very spacious,The hotel is so big and I loved my time here. The spa is probably the best spa I have ever been too. So much space and sauna room. I enjoyed the spa the most. The views of the city from the room are amazing too. Staff are very friendly. I would definitely come back. I wasn’t keen on breakfast and that is the only constructive feedback. Pancakes and waffles are only nice if made fresh. I appreciate it is a big hotel therefore for efficiency could maybe get a pancake machine which makes these fresh and would still save time. ,5,2024,09,25
21,Don’t be fooled by the photos,"My room’s TV and phone were broken, and when I returned one day my phone charger USB phone charger was bent and broken. I went downstairs to tell the front desk, these two ladies said they would send someone from IT. One of the ladies said she would come up herself as well. I never saw her again. She was probably training the other person next to her - that not setting a good example. About 45 min later no one came to my room. I had to go downstairs again to ask what’s happening - I wanted to relax after a long day and I didn’t have much time before I had to go out again. The front desk staff member said he didn’t know when IT would be able to come fix my TV and phone, and he asked me to call the front desk to check in if they didn’t arrive soon. But my phone is broken so how am I going to call the front desk? That’s some brilliant problem solving right there. They later “replaced” my broken USB charger with another one, but it was probably a cord another guest left behind, it looked old and it was sticky. 

Later I went to the spa where the jacuzzi/pool looked like the aftermath of a Las Vegas pool party with towels everywhere to the point where you don’t even know which lounge chair was occupied. Also the ladies locker room had about 5 pairs of used flip flops strewn around. The pool floors and stairs are made with metal and are very slippery - I saw two people slip on the stairs as they entered the pool. 

Also in the end, I had late check out at 1pm but my key card stops working at 11am. So I make that extra trip down to the front desk to get a new key. We all love doing that right? 

I wouldn’t be fooled by the shiny photos this hotel has on their Google and Expedia listings, this place over promises and under delivers.",2,2024,09,22
21,Amazing Hotel,"From the room, to the pool, restaurants and staff, all deserve a 5+ Star Rating. Truly exceptional experience! I will return and highly recommend it for those traveling to Barcelona!!",5,2024,09,22
21,Not as expected,"Basic things in room did not work ( phone, tv, airco) and duty manager did not take complaints seriously. He was pretty much nonchalant and did not want share even his own name.
Not happy about incheck procedure which took longer than expected. Also super busy at breakfast. 
The room was very average nothing special, shower tales would need some cleaning extra. 
Some depo is charged on your credit card, not received that back yet. Anyhow for what the charge? 
Our request to be placed at higher floor with some view completely ignored. 
No outside bar open in the evening. 
Also super busy at breakfast, long looking for table and again waiting to be served coffee. 
Parking charge 30€ per day but if you drive in and out you need pay at machine every time",1,2024,09,21
21,Never again,"Very disappointing- check in took 15. min, pretty arrogant lady. We requested higher floor and were placed and floor 2. 
room average, outdated, apps on TV don’t work so if you want to see movie, no way. Strange sound from fridge or cooling all the time. Very odd and disturbing. 
Phone to reception does not work either. 
Pool small … 
Even ice machine does not function. 
And they charge you deposit for things you could possibly damage …..
Ridiculous, i will be never back . Expensive and worthless.",1,2024,09,18
21,Great stay!,"Great stay at the Grand Hyatt Barcelona. Hotel is right next to the convention center as has that feel in the lobby. The rooms are small, but well apportioned and very clean and new. We were upgraded to an Eiffel Tower view and it was spectacular!  The club lounge food for breakfast is great and we made a dinner of the night food three times. 

The hotel is a 4-5 minute walk from 3 metro stations and a 25 min walk from the Arc de Triomphe. It’s an amazing value for the price. ",5,2024,09,15
21,Be careful - this hotel charges your account after checking out and doesn’t bother assisting after taking your money,"The hotel lived up to its star rating with its mass produced styled rooms. During your stay, expect to be attended to, but afterward, when the hotel has charged your account twice for your stay, no one will get back to you, despite emails and calls.",2,2024,09,14
21,"Excellent Location, Great Staff, Modern Decor",We recently stayed at this location while on vacation. From arrival to departure the staff and facilities were nothing less than amazing. We opted for club access and enjoyed a wonderful breakfast and midday coffees in the club. The location is great and the hop pn and off bus stop was around the corner. ,5,2024,09,14
21,Barcelona Round 2,"Our stay at the Grand Hyatt was simply awesome. While farther away from traditional tourist areas it is located in the heart of a major shopping and dining district. The staff was awesome,the bar a great haven - and the coffee shop a gift. ",5,2024,09,12
21,Barcelona Experience,"Not disappointed at all.
Would recommend the trip and hotel and location. Helpful, friendly and courteous staff at the hotel- Grand Hyatt.",5,2024,09,12
21,Staff exceeded expectations.,Staff go above and beyond. Facility was clean and comfortable. Daily breakfast and tapas were excellent. Spa is a bit small and busy—make a reservation. One block from subway which takes you directly to all attractions in Barcelona. Excellent restaurants nearby frequented by locals. Rooms are a bit dark. ,5,2024,09,09
21,A beautiful vacation,"Barcelona is a beautiful city for visiting and vacation. It offers many great sights, food, and entertainment. We love the city so much, especially our hotel, Grand Hyatt Barcelona. The staff were amazingly friendly, courteous, helpful, and professional.",5,2024,09,07
21,"Fantastic property, incredible staff, a real 5 star!","I stayed at this property for two nights while working remotely and visiting friends. As a Hyatt Globalist member, I received all the perks that come with my status. The staff was incredibly professional, attentive, kind, and helpful—making me feel special throughout my stay. The breakfast spread was outstanding, and the restaurant, which is absolutely gorgeous, also hosts a daily happy hour for select guests.

I was upgraded to a standard suite, and the room was spacious, clean, and modern, with a beautiful bathroom. I couldn’t have been more comfortable! The internet was very fast, which was crucial since I needed to work during my stay. The pool area was pretty and secluded, and the swimming pool itself was a good size compared to other hotels in Barcelona. My only recommendation would be to add more lounge chairs, as it can get quite crowded in the summer.

Lastly, the hotel's location is quite good, though not exactly in the city center. There are a few restaurants nearby, as well as a shopping mall, and it's conveniently connected to other tourist spots via the green line, which is just a five-minute walk away.

I can't wait to be back to this incredible hotel!",5,2024,09,04
21,Best hotel at Barcelona,"Amazing experience, staff very educated, fast service at the pool, perfect pool for a summer, comfortable room and very clean",5,2024,09,02
21,Incredible service and amenities,"The amenities, the service, the welcoming atmosphere of this hotel is the perfect place to stay in Barcelona. Located closer to the airport and beautiful walkway into the city shopping areas. ",5,2024,08,31
21,"Great hotel, beautiful views, top customer service",The hotel is in great location with eqsy access to public transportation. The rooms are very modern and beautiful. I wish they were a little bigger but other than that they were beautiful. Customer service was great. The food at the restaurant in the 19th floor was delicious and the views of the city from there simply beautiful.,5,2024,08,31
21,Lovely rooms and great stay,"We had a wonderful stay at the hotel. The beds were so comfy and the rooms had everything we could need. The spa is such a lovely relaxing experience and worth the 35 euros each. We did arrive in the spa about 240 though and the sauna and steam room were cold. Took until about 3 for them to warm up. Spa opens at 2pm so I would have thought they would have turned them on in advance for people to use. There is bottled water provided but it ran out quick and I didn't manage to get a bottle. No staff around to ask for more.

Although the rooms were amazing, dirty glasses were put back in their place during housekeeping I have never experienced this in any hotel and expect a lot better from one which is 5*. Also old water bottles were put back where we would usually receive new water.
Location is quite a way from the centre of Barcelona but the metro is close by so it's not much of an issue ",4,2024,08,31
21,A pleasant surprise,"When we booked this hotel, we were kind of expecting an average experience.  The room is lovely, we had a little mishap with the lifts on arrival today as you need to select the correct floor outside and not inside.  The pool is delightful, the service, drink quality and food we have found exceptional.   So far, cannot fault the hotel from the moment we arrived.   We are here for a few days and I’m looking forward to the stay.",5,2024,08,29
21,SAFETY OF GUESTS AT RISK,"*Anyone can enter the hotel off the street and try to get into rooms/lounges to steal from guests*

I had a frightening experience here. I was advised to wait in the Club Lounge while my room was getting prepared. Then I was robbed in the Club Lounge. 

-The hotel does not enforce a key card entry in the elevator and does not have personnel checking guests into the Club Lounge. 

-Video showed a plain clothes thief came to the lounge, opened a bag of mine and stole money and credit card. Then he Went to department store and ran up charges.",1,2024,08,28
21,Great Service And Modern,"The hotel was very nice. Clean, modern and the staff were GREAT. Everyone was very friendly, polite and very helpful.",5,2024,08,27
21,Very good but pricey,"A really nice hotel, very clean and rooms are excellent. Facilities including the pool are very good. The breakfast is excellent but very pricey for what it is. Good location for Camp Nou but need to use taxis or other public transport to reach all other tourist hotspots. A minor gripe - the water is only replaced in your room if you are in there at the time!",4,2024,08,27
21,Fantastic hotel with great staff,We really enjoyed our stay at the Grand Hyatt. We loved especially the rainshower and the friendly staff. Rooms are spacious and clean. Location is +- 30 min by metro from main tourist attractions. ,5,2024,08,27
21,High Five to the Hyatt,"I stayed at the Grand Hyatt Barcelona for one night in August. The hotel has a decent location, with only about a 6 minute walk to the Maria Cristina Metro station and less than a 10 minute walk to Restaurants and shops. The Hotel itself looks modern and stylish, The Check in experience was Ok if a bit long, When I arrived, the reception area was very busy and there were queues of about 5-6 people deep, that said the guy who dealt me was very friendly and professional. 

The room (508) was very impressive, with a nice design, consisted of a separate loo, fabulous separate rainfall shower and dual basins, so it's great for families. The room also had all the usual amenities, Tea/Coffee making facilities, Safe, Fridge etc. and the bed was very comfortable. 

Check out was once again a bit chaotic, there were people queuing everywhere, however the girl who dealt with me was super friendly, so deserves a mention (I wish I had caught her name). 

Overall, I had an enjoyable stay for the one night I was there and would definitely consider staying at this hotel in the future if it stays a reasonable price.",4,2024,08,25
21,Excellent hotel and facilities,"Stayed here for one night pre-cruise. Excellent hotel and rooms extremely well equipped. 

Friendly and helpful staff and located only 15 mins from the airport. We can’t speak for location of city centre as we had no time to explore l, but really impressed with rooms. Modern with some nice light options and helpful sensor lights. We stayed with our daughter who had a separate put up bed and glad to see the room ready and set up for three of us - you would be surprised how many hotels forget this bit! 

Nice design of room too with separate loo, fabulous separate rainfall shower and dual basins, so great for families.

We ate in the Sofia bar, located on the ground floor with an outside terrace; where we had a burger and club sandwich which were good. We also ventured inside for a cocktail - espresso  martini was excellent! 

Breakfast was excellent with so many options. Three stations to choose from of fruit and cereals, pastries and toasts and a hot section which we didn’t venture to. Helpful and attentive staff served hot drinks and continuously cleared up.",5,2024,08,24
21,"Grand Hyatt, and you can never go wrong.","This, like other Grand Hyatts, is truly the best compromise you can find between price and quality. It’s not located in the middle of the hustle and bustle of Barcelona, has ample parking, and the prices during our stay were absolutely unbeatable compared to other establishments of the same caliber. I spent 4 delightful days here, and the staff is absolutely friendly and kind. Highly recommended without any doubt!",5,2024,08,21
21,Great Hotel!,"Great hotel, staff and facilities. Situated in quiet location with good public transport links to get around Barcelona.  Had a couple of issues during stay, however these were resolved satisfactorily by Erica at reception. Would stay again!",5,2024,08,21
21,Pleasant stay!,"This is my first time visiting Barcelona, and I received a warm welcome at Grand Hyatt Barcelona! I checked in on the day of my birthday, and the hotel sent a bottle of champagne to my room to celebrate it, which was really lovely. As a Globalist member, I also got upgraded to one of the junior suites, which was spacious, new, and cozy. The room service was timely and the staff had responded promptly to my requests (e.g., to fix TV, for amenties, etc.). The hotel is also close to the metro station and shopping center. I'd totally recommend this hotel to anyone traveling to Barcelona!",5,2024,08,20
21,Management makes mistakes - Give you a bad feeling about,"Very nice hotel and rooms (although a bit on the dark side with the black interior).

Management is terrible. They make mistakes and give you a bad feeling about it when you point it out that it's not professional instead of apologise.

Due to this fact it leaves a very bitter aftertaste and I will not return.",1,2024,08,20
21,Very disappointed,"Fridge was not working
TV was not working
Speakers in room were not working
Telephone had a technical issue almost everyday during my stay
House keeping service was weak and missed providing complementary water bottles almost every time
I raised complaints yet no one actually attended to them
 ",2,2024,08,20
21,Worst customer service,"Had a very bad experience with the hotel. Stayed there in april for 4 nights on a business trip. Accommodation was paid in advance by the company. Upon check in they requested credit card for guarantee, nothing an usual in a 4-5* hotels. After departure i discovered they had charged 1700 euros from my credit card without any notice. I contacted them several times to request information about the charges and was not given any details. After 3 months, countless emails without response and over 20 phone calls they reimbursed me with 1600 euros without any response. 100 euros was probably lost on the way...Worst experience ever",1,2024,08,19
21,Wonderful!,"Great first out of county trip!! 🤗

I will certainly be back with my family and friends, it was our first time tasting duck and it was SURPURB.",5,2024,08,18
21,"5 star for front desk, rooms, location. 0 star for maintenance in the room","We stayed for 3 nights with our kids. Front desk people were great, breakfast was very good and the serving crew was very polite and friendly as well. Being a Globalist, I was upgraded to a suite, and the suite was spacious and beautiful. We had Sagrada Familia view from our suite. 

The problem was the maintenance staff and maintaining the stuff in the room. The whole stay, the phone in our room didn't work. The crew came to fix, replaced, but couldn't fix the phone. Whole stay, I literally had to go down to the front desk for every little thing as they couldn't get the phone fixed. The sound bar was broken and hanging from the wall. Let the staff know at least 3 times, but never saw the maintenance staff. Water came out from the shower area to the bathroom floor as the shower door was not properly closing, again, complained and front desk immediately called the maintenance staff in front of me but they never showed up to my room to fix.",3,2024,08,17
21,Highly Recommend!,"Excellent hotel. Spent a lot of time chilling at the pool, great vibe over the weekend with really friendly and attentive staff. Good food and drink at the pool also.

Check in process was pretty quick and simple and we were provided a free upgrade. Room was very well decorated but there is a lack of storage in the room.

Bed was super comfy and free water and coffee refills everyday which was brilliant.

Bar and restaurants were fab, staff were really friendly and good fun!

On day of check out we were given access to the gym and full shower and changing facilities so we could freshen up before the flight. Very helpful and and great service.

Location is good, although slightly out the city center it’s 5mins to metro and during the day really quiet and peaceful.

Highly recommend and will certainly go back there.",5,2024,08,16
21,Disappointing welcome and service. Terrible sewage smell in the room,"A few weeks before arriving I called the reception to let them know we were celebrating our 5 year wedding anniversary at the hotel. They told me they were going to surprise us upon arrival. Unfortunately we were disappointed to not find anything in the room. On top of that we had to wait 30 minutes before somebody was able to check us in at 1 AM. And when the person was checking us in, he didn’t provide any hotel information. We had to ask when the breakfast was the day after or else we wouldn’t have known anything. Not the 5 star service you would expect. The room is nice and the beds are great but their is a very bad sewage smell in the bathroom that spreads all over the room. Overall not the best first night and welcome. We are still staying for 4 more nights so hopefully we can change our minds after this.",1,2024,08,15
21,Pretty Good,"It is a clean hotel, and beds are comfortable. Customer service was wonderful, with a few exceptions. Very good location, there are many shops and cafes nearby but it is a bit far from downtown. ",4,2024,08,14
21,not ok for a 5* house,rooms dark and huge bathroom but also very dark. pool was ok but small. expected more luxurious from a house with 5*,3,2024,08,14
21,Wonderful stay at the Grand Hyatt Barcelona,"Wonderful stay at the grand Hyatt. Very friendly and helpful staff. The king room was clean, quiet. Pool area gorgeous. Close to subway station for a quick ride to downtown. ",5,2024,08,12
21,Barcelona trip,"My stay was very nice as the hotel is located in good place, staff was friendly, food and ambience was amazing. Pool side service was very nice . I would highly recommend this hotel for its staff and service ",5,2024,08,12
21,It was a good memory stay,"It was a great stay the location is close to all the shopping brands and nice restaurants. 

The lobby was my favorite part of this hotel and our view from the room was over looking to the city and mountains in the middle of Barcelona.

I loved and would recommend this hotel.",5,2024,08,08
21,Watch out before you step into your room,"I found some shiny pieces in front of my room. I thought that’s the design. When I went to bathroom, I noticed they are broken glasses. Hotel refused to change the room. They came up twice to clean the room but still have broken pieces in the bathroom and in the room. I have pictures and videos.",1,2024,08,07
21,A nice hotel,I recently stayed at the Grand Hyatt Barcelona and had a fantastic stay. The hotel was very modern and clean and the bed was comfortable.  I was in Barcelona on business and the hotel was conveniently located next to the office building I was working at.  Some of the other reviews mentioned limited breakfast hours and I would have to agree with them.  I travel to Barcelona several times a year for business and most hotels offer breakfast around 11:30AM but this hotel closes breakfast at 10:30AM which is very early for Spain.  Everyone likes to sleep late and the breakfast area gets very overly crowded at around 10AM.  Hopefully management will adjust the breakfast hours to a later time so that they can better accommodate the hotel guests.,4,2024,08,05
21,Hotel = 10. Location = 6,We stayed in this hotel as my wife was attending a conference. While it’s outside of the main attractions there is plenty to see in the area. Rooms are clean and modern and the staff is fantastic.  If you’re in town as a tourist there would be better options closer to downtown.,4,2024,08,05
