Location Name,Title,Text,Rating,Year,Month,Day
224,Julie O Connor,"Impressed with this lovely hotel. Would stay again if in Dublin.  Located within walking distance of city centre. Double room good size. Stayed for concert 1 night. €259 for 2 people sharing with brekkie which had a great variety to eat. Hotels very expensive in Dublin for concerts, but this was the best value we got. Some hotels overcharge far too much.",4,2019,07,08
224,Great stay,Stayed at the hotel for 1 night to attend a concert -  room only stayed with friends in 2 separate rooms. Hotel was clean and tidy and staff were friendly. Hotel was decorated really well and was easy to tell was a relatively new premises,5,2019,07,06
224,Excellent Hotel,"When planning a week's visit to Dublin for holiday and visiting relatives we chose this new (opened November 2018) hotel in a location we know is convenient close to the Luas (Tram) and within walking distance of the city centre having stayed at another hotel nearby that is now getting shabby.

We had a warm welcome from concierge Damir Nemet and the reception staff. This gave a good first impression that was reinforced by every member of staff we encountered for the whole of the stay. All gave the impression that nothing was too much to ask and there was always a pleasant smile and greeting. 

The room and facilities were also excellent and though there is no restaurant serving lunch or dinner adequate food options are available in the bar area where, again, the service is excellent. The breakfast buffet is the best we have experienced in Ireland to date!

We had one small problem with laundry that was resolved promptly and with genuine apologies.

We would highly recommend this hotel and will certainly use it again in the future.",5,2019,07,03
224,Lovely stat,"The hotel is beautifully decorated and exceptionally clean. The staff were warm, welcoming and kind, especially Damir who was most helpful! 🤗👍 Many thanks for a wonderful stay! I look forward in returning to the hotel on my next trip to Dublin!",5,2019,06,30
224,Fab hotel,"Damir Nemet was a fantastic member of staff, he was super friendly and very helpful!  Great breakfast with loads of options, lovely décor and was a great location. It was a bit pricey or would have given 5 stars.",4,2019,06,29
224,So overpriced,"I'm not sure why I chose The Clayton, but we were there for a short stay. We arrived in Dublin at 5am and went to the hotel. I had mistakenly booked two nights, thinking that we would arrive earlier. That is, we paid for the night when we were actually en route to Ireland. But that's on me - my mistake. I talked to the manager, explaining that we would be there for just over 24 hours, but he said they would have to charge us for both nights. OK, like I said, my mistake. However, when we went to eat and were told that our room rate did not include breakfast, I had to say something to the manager, and he would not comp us for breakfast. What kind of price does one have to pay to get breakfast included? We were paying 240 per night. Every other hotel on our stay cost less and included a full breakfast. So, for nearly 500 euro, we paid for a small room for 24 hours. We did end up paying for their lackluster continental breakfast at the rate of 22 euro each - such a waste! All I could say for the place was that it has a pretty lobby. The Barge, a nearby pub, had a good lunch and nice staff. And a little breakfast place across the canal - where we ended up the second day - had way better food for a fraction of the price. I would NOT go back there. There are so many charming inns in Dublin. This place is part of a large chain with no local flavor at all and has an unfriendly, stuffy staff.",1,2019,06,27
224,Shopping trip,This hotel is beautiful. What a great location. Great value. The service was impeccable. Room was fabulous. Great choice for a shopping trip to Dublin. Will definitely book again in future. Thanks again. ,5,2019,06,25
224,Clayton Hotel Charlemont,"We had a great time in Dublin, going on tours and seeing the sights. We stayed at the Clayton Hotel Charlemont in Dublin. It is a beautiful new hotel, very close to parks, cathedrals, and Trinity College. The hotel was clean, and room service, breakfast, and amenities were great. We would especially would like to commend the help and assistance of Mr. Damir Nemet. When we first arrived in Dublin, we were confused and totally exhausted.  Mr. Nemet first helped us with our luggage and then got us a room early so we could get some sleep.  After we woke up, Damir gave us some great tips on what to see and do in Dublin. He is a really friendly, nice guy who definitely made our trip much more enjoyable.",5,2019,06,22
224,Very small rooms at considerable cost!,"Here now in a room booked for 3 adults ... the rooms are extremely small and so do not adequately accommodate 3 - there is barely any room to move! The hotel clearly do not like catering for 3 either as only 2 cups and glasses and towels for 2.  There is only one shower gel and one shampoo (no conditioner) so as 3 women we will struggle! Have now asked for an extra item of each missing to be brought but the hotel staff do not understand- after 3 attempts we have been brought a cup, towels and a glass (all separately) don’t think I can bring myself to call for toiletries so I’ll end up going to buy some! Building work outside our room (not told about at the time of booking) so no view for the £278 per night cost either! Location is not ideal for walking into the city centre as the route takes you down some ropey looking roads - I would say better hotels for less more central than this! Wish we’d paid a little more for the Conrad which was excellent!",2,2019,06,21
224,"Nice clean hotel, a bit far from the central","The hotel is clean and nice, with friendly staff.  However it’s around 30 mins from the Temple bar and the rest. Try to get a hotel closer to the downtown. Breakfast so expensive.  There is store next to the hotel which is very useful.",4,2019,06,19
224,DISSAPOINTING,Very disappointed with the service provided by this hotel.  We stayed here last night as we were going to the pink concert and we availed of the valet parking which was 25e which was paid on check in.  When checking out this morning at 10.30 we were told we would have our car in 10 minutes to which we still had not got by 12 o clock and asked different members of staff at numerous times how long more it would be and was just brushed off and told it was on the way.  Not once did a member of staff come near us to apologise or to even offer us a cup of tea or coffee whilst we were waiting for 2 hours to get our car back with no explanation.,3,2019,06,19
224,Okay visit ,"Room was clean and tidy with a lovely bathroom
Very surprised it didn’t come with a fridge and bathrobes but I guess you get what you pay for. 

Tele signal was awful kept going on and off 

We also stayed in room 229 and there was a slight noise (sounded like a washing machine) underneath our room. 

Also ordered a taxi for a guided tour which was told it would be here there in five minutes. A group then took all the taxis coming to the hotel. Meaning 25 minutes later and no taxi the girl then tells us to take someone’s else’s taxi. 

Both us and the taxi driver was annoyed with this. But he helped us out of a pickle. 

Hotel itself is lovely and clean, and great for a short break. Bathrooms are really the high point here. However the service needs a bottle polishing up. There was a lovely blonde (straight) hair at reception who was helpful. The other one wavy hair (I think maybe a supervisor) could of been more helpful but I guess she couldn’t be asked it seems with regards to the taxi matter. 

",3,2019,06,18
224,"New Hotel, great staff, good beds","We stayed in the Clayton Charlemont at the start of an Irish Odyssey.  It just  opened in November of 2018 and even our taxi driver of 36 years thought we meant the nearby Hilton.  Staff, and especially Eve, went above and beyond to meet our every need.  Good location a block from the team and 4 tram stops south of Trinity college and the Book of Kells.  Ernst and Young, Deloitte and KPMG have their headquarters nearby for business types.
Superb full breakfast, though at 20Euros, not cheap.  And do not overlook the beds, which are new, firm and excellent. ",4,2019,06,17
224,Nice stay!,"This is the hotel that me and my friend chose to stay at when staying in Dublin, This is one of the nicest hotels that I have been to in a while I have to say. From checking in we were greeted with a friendly member of staff who was very helpful with checking us into the hotel. The room we stayed in was a twin room and I cannot fault it! The room was clean and tidy! It was perfect, granted we didn't have a great view (view of the wall) but you cannot complain for the price. I cannot recommend this hotel anymore, Such friendly staff who were very helpful with any queries.",4,2019,06,15
224,Good find for the price ,"Stayed here for two nights in the weekend. We arrived at 9am, taxi driver was confused and dropped us off at Hilton. There r two entrances in this hotel, connecting a new and old building which was a former hospital. Early check in wasn’t available, so we dropped off luggage and had a nice Irish breakfast in the restaurant next door. Everywhere is about 10-15minutes walk and the tram station is just a block away. There’s a pharmacy on the same block. I like this location as it’s slightly away from the crowd and yet very easy to get into town. Our hotel room is new, nice and simple with carpet floor. It has big window but it’s facing the back of some apartments. Shower water pressure is great, however the toilet seat was a bit narrow and uncomfortable. The hotel has a nice bar, it doesn’t serve food late night but room service is available. One night I had a chicken curry rice and it was quite tasty.",5,2019,06,10
224,Loved our stay here,"This is a more modern hotel in Dublin, so if you are looking for old, authentic this is not your place. But if you are looking for clean, modern, well appointed, robes, lovely bed and linens, convenient location to the LUAS rail line, air conditioning, restaurants, grocery and bars nearby... this is the place.",4,2019,06,07
224,"Nice Hotel - great breakfast, decent gym","The location was slightly outside of the main downtown area. We preferred this because it was quieter. We felt safe and could walk 15 minutes to popular parks and streets. A Lidl (grocery store) was a 10 min walk away. 

The hotel had a nice lobby, great breakfast and was recently renovated. There were two wings of the building and we were in the older one with narrow stairs and no elevator. You could hear the stairs and noise from hallway in the room. The room was modern but small.  We had an issue with a fire alarm but the hotel manager resolved our complaint.

The gym was small but decent with modern equipment in good condition.",4,2019,06,07
224,Good for a business trip,"I booked this hotel through work due to client commitments in the local area.  It is a lovely, fresh hotel with excellent transport links nearby and a tasty varied breakfast in the morning (the soda bread was particularly good!).  The room pictures on the hotel website are very true to reality and it was always beautifully cleaned, with bottles of still and sparkling water replenished daily. 
The only issue i faced was that the walls are a little thin- I could hear the conversations of my neighbours at 6am in the morning.  Other than this occurrence, however, i had a very pleasant stay and would return if I am in Dublin again.",4,2019,06,07
224,Great hotel,Stayed for one night. Check in was really easy with polite and informative staff. Room was a great size and very clean. There was an extensive choice for breakfast which was all fresh and tasty. Only very small complaint was a couple of the channels on the tv in the room (ones we wanted to watch!) had bad signal and there weren’t really many to choose from as an alternative.,5,2019,06,05
224,"Comfortable, but beware of the parking charges","This was a relatively new hotel that provided a very comfortable stay not too far from the main action in Dublin City. The room was comfortable and the breakfasts had everything you would ever want. Staff was helpful until we asked for recommendations on seafood restaurants for dinner. Maybe this was because they are new or not too many option in Dublin, but if it was not on google they did not know about it. Only gripe was the 25 euro per night to park there, explanation was that this was in line with other hotels in the city center, but I did not consider them city center as it was a 30 minute walk to get there. Overall clean comfortable place to stay if you do not have a car you required to park.",4,2019,06,05
224,Just the right balance,"A really good bolt hole when visiting the fair city of Dublin. Possesses all the attributes needed to make your visit really enjoyable without spending shed loads of money. I will qualify that with the following:  
  
All the staff are a friendly, engaging bunch and always eager to help.
The place was spotlessly clean throughout our stay.
Comfortable air conditioned studios/rooms.
Excellent breakfast, for both choice and quality.
Well positioned. 15-20 minute walk along the canal into the centre of the city.   

'Nuff said.

   
 
",5,2019,06,05
224,Lovely stay in Edinburgh...,"We stayed in the Clayton Hotel for a week, while visiting Dublin.  The room was clean and spacious!  Breakfast was what is expected and ample.  Customer Service was able to answer any questions about the area and events.  We enjoyed eating at some of the local pubs, which we could access by walking from the Clayton Hotel.  They were able to find some face cloths for us, which we found was not common in Europe. We would stay here, again.",5,2019,06,05
224,Lovely ,"Lovely new hotel ground floor incorporating the old house is done in excellently. It’s is in a great location quick walk or Luas ride into town . Room super quite, comfortable bed and well furnished loved the TV with Cromecast was great feature. Will definitely stay here again.",5,2019,06,04
224,Brand new hotel in Dublin D4,We booked the valet parking to save walking to the nearest qpark. Efficient staff on reception. Took care of everything. Room was perfect for us. Breakfast in the morning was delicious. We would definitely be back again. ,5,2019,06,01
224,"Good overall, with some caveats","Overall, a very nice hotel. They connected and remodeled three somewhat historic buildings; the hotel faces both Charlemont St. and the canal. That proved somewhat confusing to at least two taxi drivers. The Charlemont St. entrance is closer to the reception. 

Nice lobby, extremely helpful staff, reasonably good restaurant, good choice of beers and whiskeys in the bar. Nice spacious rooms, a bit low on storage for both clean and dirty clothes, but nice overall. Plenty of restaurants nearby. The usual Clayton breakfast choices. LUAS close by - gets you to downtown in about ten minutes for EUR3 or so (then again, a pleasant twenty minutes walk will get you there for free).

Caveats:
- there are two rooms located on the first floor. The windows face the street entrance. Okay if you are out most of the time, otherwise better avoided. Honestly, these two rooms would work better as a gym.
- The gym is ridiculous: a closet in the basement, with a low-end elliptical, a treadmill and a couple weights. Clayton Burlington is a much better choice if you expect to work out.
- some growing pains. E.g., there were water supply issues one day, apparently b/c of some activity by their water utility, Irish Water. There were written apologies everywhere, and it was back to normal soon.

Overall, a pretty nice place - will have no problem staying there again. However, consider also the Hilton next door. Prices look to be similar.",4,2019,05,30
224,Best overall hotel during our whole trip,"Must give compliments to the management.  Excellent service throughout the hotel, wonderful food, and everyone couldn’t do enough for us.  Love the location.  Easy walking distance to center city.  Lovely foot paths along the canal.  Beautiful rooms.  
Wish we were going back soon.",5,2019,05,29
224,Beautiful hotel,"I stayed at this hotel with my 5 friends over the weekend and must say it was a really beautiful hotel.

We arrived really early at around 9am so we couldn’t check in straight away so we were able to leave our bags in the secure luggage room behind the reception desk.

We then went out to explore Dublin, the reception happily ordered a taxi for us to get into the main city centre bit. We could have walked but according to my maps it would have taken us about 25 minutes. A taxi journey for the 6 of us cost around €13 and is about a 10 minute drive.

When we checked into our rooms the reception ensured we had both rooms on the same floor which was great. The rooms were very clean and comfortable, the beds and pillows were perfect. The bathroom had a shower over a bath and it was a powerful shower.

When the rooms got cleaned it was done really well and the shampoos etc in the bathroom were replaced as well as the tea, coffee and water in the room.

Even the lifts in the hotel were so quick, as soon as you click the button a lift practically arrives.

One night we had bought a bottle of Prosecco to have in the room not realising it was a cork one and would need a cork screw bottle opener to open it. One phone call down to room service and somebody brought one up straight away with no issues.

The staff at breakfast were really friendly and whenever you asked for something there were no issues or bad attitudes. The breakfast was lovely, so much choice. The only negative thing about breakfast is the orange juice, it was just very watered down. However they had other juices available e.g apple, pineapple.

We did not use the gym facilities so am unable to comment on this.

Overall the hotel was so lovely and beautiful. Around the hotel there are plenty or restaurants and bars to choose from. I would definitely stay at the hotel again, thank-you very much.",5,2019,05,28
224,"Excellent hotel , related staff","We stayed 2 days and it was amazing for us. The location is very good , only 15-20 minutes to city center by walking. Staff , especially Graham O'Dwyer is so nice. When I arrived Dublin , I wanted to go Kilmainham Goal but I couldnt buy a ticket due to my credit card's problem. Graham called Kilmainham Goal and somewhere else and I could buy a ticket. He spended 10-15 minutes for me and all the time he just smiled , he was sincere. Thank you Graham , thank you Clayton , you made us happy.",5,2019,05,28
224,Nice but a bit out of the action,"This is a new hotel - the carpeting is still outgassing. The room was fair sized and the bathroom quite lovely.
The staff were friendly snd helpful. 
The hotel breakfast wad overpriced and not stocked with the best quality items. Thr orange juice was not fresh nor was the grapefruit juice.
The hotel is located along the canal andcthe surroundings are quite scenic. However, if you are planning to shop or sightsee, St. Stepen's Square is a good 15 min walk away.",4,2019,05,26
224,Very good hotel,"It’s new, it’s fresh, it’s exactly what you look for on a business trip. 
Hotel had a casual but professional atmosphere created by the friendly staff in reception, bar and breakfast.
I really enjoyed my 3 nights here.  ",5,2019,05,26
224,"4 star rooms, 3 star service","We stayed here for 3 nights to celebrate my 30th birthday. When checking in, the reception staff told where our room was then asked if we wanted information on the hotel, forgetting to mention there was a gym, what breakfast options were etc. 

My partner paid extra for a birthday package as a surprise. When we arrived in the room we had a small dessert with ‘happy birthday’ written on it and they wrote on a plain Clayton Hotels card as well as about seven balloons with the number 1 on. May as well not even bothered.

The rooms are lovely but we were interrupted on 2 separate days when in our room, for the staff to check the room had been cleaned. 

When walking in and out of the hotel, the reception staff don’t welcome you or smile, they keep heads down which is not what is expected with the price paid

Hotel itself is about 15/20 minute walk to the centre and the tram is 5 mins away for ease. 

If you want a lovely room with basic service and happy to pay a bit more then would recommend.",3,2019,05,25
224,Fantastic Hotel,Attended meetings in Dublin for a week and was booked into this Hotel by the organization that hosted the meetings and was really pleased with the choice. Just recently opened the Hotel was in a great location and the facilities were fantastic. We walked into the city centre from the hotel and as it was located by a canal and surrounded by lots of resturants this proved to be a great hotel. The rooms were fresh and had everything that I needed.Would stay here again,5,2019,05,22
224,Enjoyed staying in this hotel,"Stayed in this hotel for 3 nights during our recent Dublin trip.  Very modern new hotel in a quiet neighborhood that's close to a tram station.  The entire staff was always very helpful and the restaurant convenient with great selections for breakfast.  This is our first experience with Clayton Hotels, but we would definitely stay in one of their other hotels based on this experience.",5,2019,05,20
224,No hot water all morning,"We had no hot water from 7am until 11am, 1 hour prior to check out. Once highlighting this to reception they were already aware of this but decided not to notify us of this. Once the water came on it was cold, meaning we had to shower cold before checking out then starting a long day of travelling home. Apart from this the hotel is lovely, the staff are friendly and all round a really well presented hotel. I hope they can ensure the water issue does not happen again and people can enjoy this wonderful
Hotel.",3,2019,05,19
224,One of the best hotel,I’ve stayed there in first week of April for business visit. Hotel is super nice and staff is very friendly. I would recommend everyone to try this hotel atleast once. It’s 2 mins walk from nearest train station.,5,2019,05,19
224,"Ultra modern, great location & service.","Less than six months old, ultra modern electronics hookups, great location and very easy access to tram station.  Special shout outside to Raphaela & Rus at reception.  Their assistance with everything from where to go, how to get there, every question or need answered with a smile.  I have had several experiences with Clayton (Cork, Dublin & Galway) and the service is top notch.",5,2019,05,10
224,Impeccable staff,"Stay here for business and the staff are fantastic - can't do enough to help. Thanks to Arsalan in particular for your patience in getting me a room with a bath. Brand new modern hotel with everything you need plus a fantastic location, 20 minutes walk from main strip.",5,2019,05,10
224,"New, On the Canal, Great Service","Located on the Dublin canal, the Clayton Charlemont is a perfect, comfortable, high service hotel near enough to the city center to enjoy it and far enough away to avoid being consumed by it. The hotel restaurant and bar are excellent, there’s a good exercise room and the lobby area is social and comfortable to work in. And going back to the view, it’s really a great location with the windows of the Dockside restaurant looking directly on the footpaths of one of a great stretches of the canal. ",5,2019,05,08
224,favourite hotel experience,"Stayed here over may bank holiday weekend and had such a lovely time. The hotel has not been open long so everything is new. I love the design of the lobby, very impressive. Because of our flights, we arrived to the hotel at about 9am and even though check-in is normally 3pm, we were able to check in at 9am which was very much appreciated. We enquired about late check out (its normally 12pm) but it was 25 euros just to check out at 2pm so we left it. 

The bedroom was lovely and spacious and the bed is the most comfortable bed we've ever slept in. We had room 426 and this overlooked the canal with a huge window meaning we could lay in bed and enjoy the view in the morning. The room was cleaned and all toiletries that we used were replaced. The bathroom was pristine and the shower was a proper spa experience. 

The staff at the reception desk were friendly and happy to help. We had one drink in the hotel bar and they served the G&T perfectly. These came to 20 euros. Although pricey, so is everything in Dublin.

When planning, I overestimated the distance from the hotel to the city centre. The hotel is right next to the Luas stop and three stops gets you into the city centre and main bar/shopping district. The city is very walkable, anyway. We got a Flexi-ticket each day which is 7 Euros and is unlimited use on both lines. Well worth doing so we could explore a little further afield. If you don't want to go into town, behind the back of the hotel is a small collection of bars and pubs which are pretty fun. 

We plan on coming back soon and we will definitely be staying here again!",5,2019,05,08
224,Amazing service Delivery.,"The Restaurant is Amazing And the chef “method” he was really gud wid presentation skills as well as the taste. Will recommend a definite visit. 
The attendant in the restaurant were real friendly and professional. A service With warmth. “Tyler” and his colleagues are really nice. Cheers",5,2019,05,05
