Location Name,Title,Text,Rating,Year,Month,Day
21,Simply amazing,"This hotel is great value for your money. Hardware and interior are brand new and high tech. Staff is simply amazing and very friendly.

The hotel has been rebuilt quite recently and they did a good job. There are a lot of facilities to use on the property, including a spa. Entry is free, but only for once per stay. That was kind of a bummer because the alternative is the pool which closes pretty early.

The rooms are very modern with very comfortable beds. The design is quite fashionable with an eye for detail. The TV for example is integrated in the wall and consealed behind a black window. Only once you turn it on, does it become visible. Only downside about the room is the fact that our shower leaked a little bit that made the wooden frame mouldy. Besides that it was perfect.

Our breakfast was included in the room, and probably one of the best I've ever had. The hotel has a restaurant, that looked great but we haven't been there. On the other hand we did order room service and although a little bit expensive it had a lot of flavour and was simply amazing. 

Overal, we had a fantastic stay and we got great value for our money. Only advise I can give to the management is: the mini bar is too expensive. If you would bring the prices down we probably would have drank the champagne. As a result the glasses aren't used very often so they were very dusty. Perhaps you'd like to swap them once in a while. ",5,2018,06,25
21,Best Stay and Service,"I stayed in SOFIA hotel last week for our annual corporate conference. I can go on and on about the hotel beautiful and practical design, the great food and the outstanding service. It is definitely one of the best hotels I have stayed in. Good location, very comfortable and welcoming and the staff is extremely helpful, which I did not expect in a European hotel. 
Thank you to Luis, Mathieu and Christian, the fantastic concierge team of the hotel for all your help with every single request, even before I made it.
A special thank you to David from A/V, who seemed to be in 3 rooms at any given time to make sure that we do not have any issues during the conference.
I highly recommend this hotel for any business trip, conference or personal vacation.",5,2018,06,25
21,Business Stay and cocktail,"I have stayed at this hotel for a night to attend a cocktail there.  The service at the front desk was excellent.  They spoke in English fluently and they were helpful and friendly.  As breakfast opens at 7 am and I had to leave hotel at 6.30 am the day after, they offered me to have a lunch box prepared at check out.  And this was done with fresh orange juice, bottle of water, fruit, sandwiches and croissant.  The room was perfect and lightning modern and easy to turn off from the bed.  Bed was comfortable with a huge duvet.  Everything was perfect",5,2018,06,25
21,Still love Sofia !!!,"Don't be put off by the lack of a royal title in the newly updated Sofia hotel - This hotel is fit for Royalty and the rest of us !! This is my first visit back to this hotel since the renovations has occurred - I have stayed here a few times in the past and loved this hotel for its charm and indeed the amazing employees that work there. This visit I was greeted by the new  updated and upgrade lobby .. no longer is the old outdated reception area now we are greeted with a very updated architectural delight  - almost like visiting an exhibit at an art gallery - very bright and welcoming .. The Sofia out does every hotel I have stayed in while in Barcelona with the employees they hire from the door to the front desk and beyond - Everyone was so welcoming and the service was second to none. They all go that extra little bit to make sure they make you happy. ABSOLUTELY amazing. 

The rooms in the hotel are now all upgraded - this is evident as soon as you step out of the elevator on your floor. ""Ultra modern cozy"" is the best way to describe the halls and rooms. The beds are comfortable with an assortment of pillows for everybody's taste. The room lay out (in my opinion) was perfect - everything was perfect. The TV has a good selection of TV channels in various languages to cater for all guests. My other favorite part of the room was the shower - WOW !!! The shower unit in my room was amazing - perhaps the best shower unit I have experienced. 

I had breakfast included - great selection of foods for every tastes - several different food stations to cater for every global taste bud ! I had dinner in the hotel one night - food was amazing. If I could fault anything in the hotel I would have to say the restaurant was a little unorganized and I heard guests around me complain about slow service - I was in no rush so it didn't bother me at that time but I could see how people could get upset. 

Finally location of the hotel is great  - safe and a few minutes walk to the metro which is the gateway to everywhere you need to get to in Barcelona. I would highly recommend this hotel to family and friends. I for sure will be returning. Thank you SOFIA for a great stay. ",5,2018,06,22
21,Fantastic - WISH I was staying longer!,"The WISH floors and Team at the Sofia are absolutely exceptional! I am in the hotel business and know quality when I see and experience it, and everything about the Sofia and especially the WISH experience was perfect. I look forward to returning and was sad to leave...",5,2018,06,17
21,Excellent,"I enjoyed the service, the room and all the facilities of the hotel.
Above all, I really appreciated the warm, kind, friendly staff. 
I was appreciative of the proximity of the hotel to our venue.
Thank you for a wonderful stay.",5,2018,06,15
21,SOFIA Hotel Barcelona is Excellent!,"This hotel has been recently remodeled, and it's beautiful! The rooms are very modern, and very comfortable furniture. Dual sinks in the room we had made it easy for two people to get ready at the same time. Staff at the desk were exceptionally professional and helpful. Overall an outstanding hotel in every way.

We also had a breakfast at the hotel that was as good as any I've ever had!",5,2018,06,11
21,Excellent Hotel,"Really good hotel with great service and beautiful rooms. Hotel is located about 15-20 minutes to the very center of the city but very easely accessible by metro as there is a metro station 200m next to the hotel. Taxi/cab will take 10 minutes and cost 10 EUR. Beautiful rooms with all amenities you can wish for and even more. Service is excellent. Very nice food as well (breakfast). The bar is lovely with an outside terrace, nicely furnished. I can only recommend this hotel. We had a very pleasent stay and would love to come back.",5,2018,06,10
21,5* - absolutely perfect,"Superb food. Only had breakfast but the selection was huge. Excellent room. Walk in shower, apple tv. Spa was fantastic and really good to relax after a busy day. All staff very friendly and attentive. Nothing too much. Would love to return.",5,2018,06,05
21,"Modern , smart , friendly , next to football stadium","This is a first visit to this renovated , modern hotel right next to the iconic Barcelona football stadium ( my limo deliver called the church of the city as all show up there on Sunday ). Welcome at the door ( no real bell captain , looks like the front desk work as a team to cover the entrance too). , check in friendly , and  pointed me to dinner at BE SO ( a superb and surprise restaurent in the hotel ). My room is modern and fresh looking , the bedroom and bathroom are equally sizable and comfortable . Internet is free.  The exercise room and pool is very nice too , I am glad I have a chance to enjoy. . The only drawback is this is a bit away from town . The conference however is at the football stadium which is just minutes away  and 30 minute to airport ( with min traffic )  A pleasant experience ",4,2018,06,02
21,Fabulous staff and great room,"The hotel staff is amazing at every level. From the front desk to housekeeping to bartenders and wait staff all were polite, professional and helpful. The facility itself is also top notch.Room was spacious, great bed, nice TV with good international offerings, ample and nice toiletries and blackout curtains that actually provide full darkness. Breakfast buffet was plentiful, fresh and delicious. Location was good and easy access to Barcelona public transportation, the airport, Camp Nou and local shops and eateries. Will be back!",5,2018,06,01
21,Major disappointment ,Just rocked up at the hotel. One of the main reasons for booking this hotel was the heavily promoted pool area. Brusquely told at reception it's not open and will open maybe in a few weeks. Now we are stuck in an out of the way conference hotel we wouldn't otherwise have booked. ,1,2018,05,25
21,"Beware: If you stay at Sofia, you will not want to stay at any other hotel in BCN - ever again","It is the first time in my life that a hotel actually picked up the phone and called me for confirmation after I completed my booking online. This was the first impression.
Then you meet the staff right after you get off the cab. They are super nice. You will notice from the first moment how special they make you feel.
The rooms are also very nice -not the classic 5-star luxury, so prepare to be amazed by the modern details.
What else? Ok, I tried spa and it got a 10/10 from me. Trust me, I live in Dubai and we are quite spoiled there, so when I give such a good feedback, you should listen :)
Breakfast is also good. I’m not a fan of continental breakfast in general, but the quality is good so that’s another plus.
In summary... so far so good. 
I’m checking out tomorrow and I so don’t want to. 
I’m definitely coming back to Sofia.
Thanks team for such an amazing experience!",5,2018,05,23
21,Truly 5 stars in every sense of the word.,"I am a frequent traveler and have been to most parts of the world and  have stayed in all sorts of hotels. But truly, Hotel Sofia is one of the best I have stayed in so far. Impressive  hotel facilities and amenities- clean and modern. Great great great staff- from the welcoming butlers, to receptionists , concierge and housekeepers- all very welcoming and attentive to your needs. Fabulous breakfast spread as well. Staying in the same hotel with the professional tennis players playing for the Barcelona Open is such a bonus too. :)  Im very impressed in fact Im stll due to check out today, but couldnt  wait to write a fitting review.  I would definitely stay here again if I had to go back to Barcelona!",5,2018,04,29
21,Best conference venue so far!,"newly refurbished, possibly the best hotel for a conference, perfect facilities, the staff were second to none, from the doorman to the manager. Pool not yet finished but there is a brilliant spa and a disco.  Everything is automated from calling the lift to closing the curtains in your room. Great location, 30 mins to the beach by car.  The lady in charge of events - Ana and her colleague were brilliant, nothing was too much trouble. Highly recommend this for business or pleasure.",5,2018,04,23
21,March Barcelona visit 2018,"My wife and I recently stayed at the Princess Sofia Hotel, Barcelona celebrating a special birthday. We cannot thank the hotel staff enough for their support during our visit, nothing was too much trouble. We used the hotel concierge for their local knowledge and because of that we experienced some amazing restaurants, the food was superb. Our room was a junior suite which was excellent and very spacious. This is a very good hotel and wouldn't hesitate it recommending it to others or a return visit. ",5,2018,04,16
21,A Fantastic Hotel,"The new Sofia hotel is beautiful but what makes it special is the staff, everyone is so sincerely welcoming and attentive. The new decor is modern and sleek. The food is delicious. The service is outstanding. It is a true gem in Barcelona. If you are planning a trip there, this is where to stay. I will be back.",5,2018,04,12
21,So much personality with comfort,"Everything is really well done, with quality and a style of its own. I see this hotel fit for single business traveller, but also for a couple looking for a romantic gateway. What they offer is a cocktail of innovations around all the basic utilities and facilities you would expect from an hotel of this category, and its truly mind blowing. The restaurants & Bars are pure, original and sufficient. Must try the fine-dining ""Be So"". 
Personal plus: The largest hotel shower room i have ever seen.",5,2018,04,05
21,Amazing staff,"We stayed at the Sofia over Easter (29th March 18 to 2nd April 18).

We cannot fault the service at the hotel at all. They were all very attentive and extremely helpful. Nothing was too much trouble and any request was dealt with efficiently, effectively and with enthusiasm. 

The hotel is a little out of the centre but there are always taxis outside the hotel, good local bus and tram stops and we enjoyed the 45 min walk into the centre.

The rooms are modern, clean and have good facilities. The cafe and restaurants on site are also excellent. We ate in the cafe one day and had lunch in the main hotel too. The food was fresh and good. The travel host Christian helped us organise our trips and was very helpful. In fact all of the team manning the concierge were great.

We would stay here again as we can not emphasise how great the staff were.  

",5,2018,04,03
21,Fantastic hospitality,"Stayed at SOFIA March 17-18. Chose this hotel as it looked like the nicest hotel close to the Nou Camp football stadium. I stayed with my 9 year old boy.

Service is fantastic at this hotel. From the front desk, to bell boy, to concierge. Friendly, responsive, attentive and extremely proactive. 

Prior to our arrival, I had several email exchanges with concierge about restaurant bookings, and they were very helpful with suggestions. 

We arrived early at mid morning on our day of check in without prior notice, and they were able to put us into a room within a few minutes which was very nice. 

Christian at concierge absolutely made my son’s day by giving him a few autographed pictures of football players from FC Barcelona, the team went to watch play that weekend. Such wonderfully attentive and personal service.

Room was very nicely decorated. Hotel’s about a month old thus there was a particular previously unidentified issue in our room - the cold water wasn’t working in the shower so we had super hot water. It was late on Saturday evening but they managed to fix it in about 30 mins even at that time of the night.

Buffet breakfast was excellent. 

Aesthetic of the hotel is great. Very contemporary and current, yet warm.

I’ve stayed in many hotels over the years and I continue to travel extensively. This hotel had lots of little unexpected touches which made it a fantastically memorable experience. 

I would definitely stay again. ",5,2018,03,25
21,Great hotel! ,"This hotel was great! I attended a conference and from the moment I walked in to the moment I walked out, I knew this was a top notch hotel. Everyone was friendly and the hotel was very clean. 

I loved the natura bisse amenities, the comfortable bed and most importantly all the power USB outlets for your devices! I would’ve needed 4 converters :) 

The coffee shop was my favorite though. 

",5,2018,03,23
21,"Great modern style, amazing people!","I stayed in Hotel Sofia and the place is beautiful it has been just renovated and still smells like new its in a good location and the staff is absolutely amazing they make you feel like home, I lost my voice on the second day and Christian from Concierge offer me tea to be send to my room, the staff from Front office was always supper helpful Jose Manuel and Carlos, and from breakfast Emilio and Felix totally make you feel like home, absolutely enjoy my stay and will totally recommend is definitely the place to be in Barcelona, we went to a football game with is walking distance, the hotel has a bar/club really cool to check out called Zuu and you have walking distance good restaurants like Santa Clara Restaurant and some shops :)",5,2018,03,21
21,Beautiful and beyond expectations,"They really nailed this renovation. Rooms are remarkable, showers fantastic, blackout curtains great. Everything push button in the room. Can't say enough. This place is it. 
Luxury at finest. I will stay here again.",5,2018,03,18
21,Cultish ,"Hotel’s best asset is not the great location or the magnificent and trendsetter architecture. It’s best asset is the staff and their probably unsurpassed service I’ve ever experienced in Barcelona or Europe. 

Thank you for such an amazing experience 

",5,2018,03,17
21,Best rooms in Barcelona! ,"I was there mamy times before the reconstruction. But now ot is the best hotel to be. The room infinity was so nice. Big screen (never had a TV screen bigger than that!) comfy bed and roomy bathroom (marvelous shower). I can only recommend this place
",5,2018,03,15
21,Beautiful hotel NOT family friendly,"We visited for a total of 3 nights (happy we didnt book any longer) wanting to stay in a comfortable hotel close to Camp Nou. Staff were nice but we never felt welcome. Hotel is not for families! We had to book an extra room just for my 6 year old at a discounted price which Im grateful for since we never used! We've visited many places and 1 room with a Queen bed has been enough for a family of 3. They do have a policy so we had to book the extra room. Hotel is AMAZING, latest technology, beautiful room, friendly staff and 5min walking distance from Camp Nou (reason we stayed here) I will never stay here again though. ",4,2018,03,15
21,Simply Elegant ,"I stayed in the Junior suite room, and it was more than enough . And the food on property is deserves a Michelin star. Simply amazing overall experience. Staff has incredible attention to detail. Definitely will return and recommend ",5,2018,03,13
21,Best Part of My MWC 2018 Experience,"I travel globally and rarely write hotel reviews but the Sofia Barcelona exceeded my expectations. Without traffic, it's approximately 20 minutes from the airport to the hotel. Check in was easy and the rooms are modern, elegant, clean, tech forward and the bed is divine.Every single staff member is well trained, helpful and very thoughtful. One evening after a long day and the harshest weather, I trudged into the lobby exhausted and famished. Isaac, one of the very attentive lobby staff asked me if I needed anything and I told him I needed warm clothes and a good meal. He brought me into the dining room where the wait staff helped me compose my own entree and they told me to go upstairs and change and they'd have everything ready for me. When I returned a short 10 minutes later, they had my table set up, a glass of wine was immediately poured for me and they brought my scrumptious meal. I went from cold and hungry to happy, happy, happy. Every night the turn down service usually included a little chocolate treat but on my 4th night, a little box of macarons were waiting for me. The location is also close to a couple of restaurants and shopping malls so I was able to pick up a bottle of wine and some snacks. MWC is usually a long week for those who attend. For me this year, the best part was returning to the Sofia Barcelona and being greeted by the same friendly doorman every time. The staff are absolutely the best!",5,2018,03,02
21,Up to Date Hotel for MWC,"Stayed here for MWC 2018.  Great up to date rooms and fantastic service from the front desk, concierge and other staff.  The downstairs bar is very nice with live music and there is a really nice coffee shop.  I would have given it 5 stars if it were closer to downtown, but the metro is an 8 minute walk.",4,2018,02,28
21,An amazing Hotel in Barcelona ,"Sofia Hotel has a special style with beautiful rooms.It is situated in a business district in Barcelona max 30 min away from airport. The staff is very friendly and helpful everywhere-reception, restaurant, entrance, spa etc. The food in all hotel restaurants is very good .If you are a footbal fan Camp Nou-FC Barcelona's Stadium is 5 min walking from the Hotel.The metro Maria Cristina Station is 3 min away. It is a very good hotel if you are coming in Barcelona with business and you need comfort and luxury for you and your partners. ",5,2018,02,27
21,"Clean, new and comfortable ","Staied there for 4 days in a biz trip, very clean and modern, totally renewed with supportive staff, nice buffet breakfast, ambianced bar, movie should be purchased to watch on tv, 
Recommend to biz travellers and families for sure.",5,2018,02,27
21,Hyper-modern yet very comfortable,"Sofia is not in the city center, so if you are looking to be within walking distance of the main attractions, this hotel is not for you. However, if you don't mind being a short taxi ride away, and yet want to have a very luxurious experience, you should consider staying here. The styling is very chic and yet the rooms are very comfortable. I would stay here again.",4,2018,02,05
21,Excellant,5 star hotel in every way. The staff are perfect. The rooms are as good as you can get. Yes its just had a refit but has everything you need in your room. I have stayed three times. I travel to Barcelona at least twice a month. This would be my first choice hotel.,5,2018,02,02
21,A beautiful hotel with amazing attentive staff,I visited Sofia for work commitments and from the second we arrived until the moment we left I was given 5 start treatment. The complimentary bathrobes and the attention to details in our rooms gave our stay that extra special touch. I will be visiting here for pleasure next time in in Barcelona. I cannot recommend enough! ,5,2018,01,08
21,Business trip,"I was there during Mobile word congress in Barcelona, the hotel rooms is clean and have a good space for relaxing, prices also normal compare with the same class, having car park is one of the advantages of the hotel as well. a small shops inside the hotel also can be useful for getting and buying gifts.",5,2017,11,08
21,Amazing time we spent,"We had beautiful days in the city. So many attractions including parks musium etc, it was little cold which is not unexpected but not that bad .
Local people are friendly and helpful.
This was our first visit to sofia , we stayed in a Hilton hotel which was a good one",4,2017,11,06
21,Excellent,"We stumbled upon this hotel due to cancellation of our flight it was provided for us but I must say the service, the room and the staff was amazing. Highly recommended and definitely will be coming here.",5,2017,10,27
21,Conference Hotel Barcelona ,"Very well appointed hotel that is impressive as you walk through the front door, outside is nothing to write home about and let's it down. 

Room comfortable and fitted with mod cons like electric blinds and motion sensors on the floor that come on in the dark as you step out of the bed to gently guide you on your way. 

The shower is to die for with a big rain shower and hose with unending water. Complimentary toiletries are fragrant and of a reasonable quality.

Breakfast is a delight with plenty of choice and beautifully laid out by the chef's manning the stations.

Approx 10mins walk from the football ground so if that's your thing then stay here.

My own negatives are 1. that my bedroom window did not drown out the noise for the streets below, only 4 floors up. It seemed to be single glazed so voices and cars below were evident as were the building works. This will annoy alot of people as it wasn't tranquil lying in bed. 
2. My air conditioning didn't work on the first night so the handyman was called at 02:30 so chalk up a sleepless night.

Would I stay here again.. Yes. Could it be improved... Yes, sort out the soundproofing. Hence a 4* overall from me. ",4,2017,10,25
21,Excellent hotel,"Very impressive hotel, staff not really the best, but here i had the best Grilled Octopus of my life. I even returned to the hotel in a next trip due to this amazing dish...hahaha....comfortable enough and good service at the restaurant. Will be back to eat but not to stay at the hotel",5,2017,10,24
21,Nothing is too much trouble.,"Due to a strike by Air traffic control in France we had our flight cancelled and were put in the Sofia for 2 nights. I just want to thanks the hotel staff for the way they handled a sudden influx of 120 extra guests at 11pm.They were so polite, friendly, helpful and just made a bad experience a lot easier to cope with. The hotel is lovely , just been refurbished. We had breakfast and dinner included and the waiting staff were lovely too, especially Victor who was really helpful. So thank you again Hotel Sofia .",5,2017,10,21
21,Work in Orogress,"The hotel is going through a complete refit. What has been completed is so far very good.

The hotel staff are as near perfect as you can get. Always a smile, Nothing is too much trouble and the really want to please. The manager Jordi Maestro is as good as it gets. He notices everything, and hand picked the staff.
Only one restaurant is open at the moment, the food was was very good indeed, Spanish with a twist. The other restaurant will be open shortly.
I visit Barcelona often and I will certainly stay at the Sofia.",4,2017,10,11
21,Best hotel!!,"My experience in Sofia hotel was amazing, the design of the hotel is gorgeous the stuff really made me happy, they are really helpful and specifically a guy called Christian from the concierge, he helped me in everything I really appreciate his help and all the stuff help.
Finally, when i go to Barcelona again defiantly i will choose to stay in Sofia hotel.",5,2017,10,01
