Location Name,Title,Text,Rating,Year,Month,Day
14,Great location and helpful staff at this beautiful gem hotel in the Gothic Quarters!!!!,"Beautiful Hotel in the historical Gothic Quarters.  Walking distance to the Barcelona Cathedral and all the best restaurants and shops.   
Thomas was such a huge help.  His radiant smile and energy were so welcoming, he helped with our transportation and gave us great suggestions on everything from where to eat, to what to do.",5,2024,10,12
14,"Gem in the Gothic Quarter with an intimate , friendly and low key charm.","Warmest welcome !!!!  From the moment Thomas (the charming and energetic door man and welcome chief) collected us and our baggage, to the easy and personal check in , to the personal touches   to the fantastic location in the historic Gothic Quarter , everything about Hotel Neri makes me want to return!
Strongly recommended….
Don’t miss the exquisite roof-top terrace",5,2024,10,11
14,Fabulous Service and Stay in the Gotham Quarter,"I came into my solo Barcelona trip with high expectations, and somehow Hotel Neri exceeded it. Some highlights:

– Attentive service. Everyone from the concierge to the bellhop to the restaurant staff went above and beyond to make me feel at home.
– The details. Oh, the details! Welcome truffles in my hotel room, more chocolates each night with turn-down service, the most comfortable robes ever.
– Every foot of the hotel was spotlessly clean.
– The location was perfect – right in the middle of the Gotham Quarter, but still very quiet.
– And the breakfasts. WOW. We got a full pastry basket, fruit tray, in addition to two entrees of my choice (I went with a tasty omelette + smoked salmon plate).

Thank you Neri and your amazing staff for giving me a Barcelona trip to remember. I will be back!",5,2024,10,09
14,Great choice for Barcelona!,"We had a fabulous time at Neri.  It's many great features include:  super location, incredible design details, very comfortable bed & pillows, terrific breakfast & snacks.  Best of all is the staff headed by Ivan who are friendly, helpful, efficient, knowledgeable, & caring.
Drs Larry & Meryle Gellman",5,2024,10,09
14,Fabulous hotel in the Gothic Quarter,"One of the best hotels I've stayed in. The Staff is incredibly helpful and knowledgeable, including Thomas the porter. The rooftop pool is beautiful and always empty. The room was so quiet even tho it's right in the heart of the Gothic quarter, with floor to ceiling windows. I really can't say enough wonderful things about our stay here and will definitely be back. Thank you Casa Neri!",5,2024,10,08
14,A wonderful first visit to Barcelona,"It was my first trip to Barcelona, and Hotel Neri was a great place to spend it.  The staff was professional and attentive.  Thomas was particularly friendly, informative and helpful.  ",5,2024,10,08
14,Historic hotel in gothic quarter,Beautiful hotel in a perfect location. Located in the gothic quarter in a historic square. Perfect for walking. Hotel is beautiful and has old charm. Staff are so friendly and welcoming. Ivan made us feel at home and helped accommodate us when our flight was delayed. Julian went out of his way to help us get transportation during busy times. The rooftop was lovely. We didn’t get a chance to eat at the restaurant as our trip was cut short with flight delays but my parents loved the chef tasting menu. Would definitely want to come back and stay longer!,5,2024,10,02
14,Wonderful Stay - Highly Recommend,"We had a wonderful experience staying at Hotel Neri! It was a quiet and restful place to be in the midst of the Gothic Quarter. The staff, like Tomas and Jean-Louis, were very helpful and friendly. The small touches - soft robes, welcome gift, quality linens - really stood out for the thought that went into choosing them. Plus the food was amazing! Highly recommend the breakfast.",5,2024,09,20
14,Look no further - Hotel Neri is incredible,"I truly cannot put into words how highly I recommend this hotel. We had the most incredible stay. The location, the design, the comfort, the staff, the food — not a single detail was left untouched. 

Our concierge/doorman/host Thomas went above and beyond to make sure every moment of our stay went smoothly. He provided world class service with recommendations, bookings, and more. He personally walked us over to get a taxi multiple times. 

This hotel is incredible and in the heart of Barcelona’s old city, the gothic quarter. If you’re considering this hotel, book it.",5,2024,09,19
14,Beautiful 5 star Boutique Hotel,"We have only left this morning but already miss this wonderful boutique 
hotel set in the most intriguing part of Barcelona     The edge of the Jewish quarter.    

From our greeting at reception to departure we have had the best service and assistance.   A special
Shout out to Thomas for his efficient help confirming our pick up transfer to the airport !!

We had an appt for the week.   So much room and so timely to have a washing machine and a wonderful sunny rooftop pool with space to relax from the sightseeing and business. Plenty of wonderful eating places/tapas bars all within easy walking and so much history to absorb

We had a beautiful
Meal at the restaurant and sat in the courtyard for drinks two different evenings. 

We loved Barcelona  and if we come back we would stay here again without a doubt.",5,2024,09,12
14,Great experience! I would stay here again!,"From the moment you make your reservation,  the hotel is tuned to you and your comfort.  Their driver service picked us up at the Barcelona Airport and whisked us to the hotel. Located in a renovated castle, each room was comfortable and clean. It was small, but comparable to the area; we were greeted by the "" bellhop"" ( I'm sure he does much more) and we checked in. Make sure you have European converters,  if you are from the US. No TV to speak of. But there was free wifi and a speaker, so i connected and listen to my music and a couple of pod casts. Every detail was above and beyond. The bed and linens were awesome. The staff made sure we had everything we wanted. I would definitely stay here again.",5,2024,09,08
14,Stay Here.,"We loved our stay at Hotel Neri. The location is perfect, the building is beautiful, the beds are oh so comfortable, and the food (dinner and breakfast) were delish! Also, the service was personal and so attentive. Thank you Thomas for making us feel like such special guests!!",5,2024,09,03
14,Amazing Experience- Must stay here!,"Our stay at Hotel Neri was perfection. The hotel is gorgeous, the beds are divine, and the staff goes above and beyond. Tomas was wonderful and so helpful with anything we needed- restaurant recommendations, city suggestions, and even scheduled a free virtual doctor’s appointment and took us to the pharmacy to pick up the medication that was prescribed. Many taxis are reluctant to drive to the front of the hotel because of the narrow streets in the Gothic quarter, but rest assured, if you call ahead, Tomas and staff will be waiting wherever you arrive to get your bags for a seamless check-in experience. This is our second stay at Hotel Neri and we will return for any of our future trips to Barcelona. 12/10 recommend!!!",5,2024,08,29
14,Wonderful hotel in the perfect location!,"A true gem in Barcelona. My family stayed at this hotel during our stay following a cruise - everything from the staff that greeted us, to the housekeeping staff, all were incredible. The hotel is in the perfect location in the Gothic quarter, it is impeccably designed and had every comfort & amenity we needed. The staff went out of their way to ensure we were comfortable and had what we needed. The concierge was also fantastic. I really appreciated the organic amenities in the bathroom of our annex apartment - lovely! The breakfast was also a top highlight-each morning we were so full! Dinner was also delicious. We loved Barcelona and will definitely return to this hotel. Thank you to everyone at Hotel Neri for a wonderful stay.",5,2024,08,27
14,"Lovely accommodation, average restaurant","This is a fabulous little hotel in a very special location.  There are not many places which get you this close to the cathedral and many other attractions and still gives you a quiet space.  The staff we encountered were all very helpful and informative.  We thoroughly enjoyed our spacious room.  The only reason they did not get 5 rating is we were very disappointed with the restaurant, which we tried for dinner and breakfast.  Both were disappointing.  Not getting what we ordered at dinner.  We both gave a different egg order for breakfast and received our meal exactly the same and not what either of us had requested.  
We would absolutely recommend staying here, just find elsewhere for your meals.",4,2024,08,22
14,A perfect hotel in the heart of the gothic section of Barcelona,"Perfection in the heart of the Gothic section of Barcelona.   Our family of six ( 4 kids ages 13, 16, 18 and 21) stayed at Hotel Neri for our one day in Barcelona.  First- the location was amazing - tucked on a quiet alley in the heart of the historic gothic district.  The Cathedral of Barcelona, the Plaça de Sant Felip Neri, street opera at night and many other amazing historic landmarks were mere steps from our hotel … a perfect base from which to explore.  From the moment we arrived - the hospitality was warm, friendly and genuine - from all staff.  Mauro greeted us, checked us in and made sure all our needs were addressed throughout our stay.  Thomas was entertaining and great help getting us settled and accompanied us out into town to be sure we found the perfect lunch spot.   Our waiter for dinner whose name we did not learn was warm friendly and very helpful with spot on recommendations.  We had an amazing dinner in their chic restaurant and our usually unadventurous eaters were convinced to try many new food items and everything was delicious and devoured.   We also enjoyed a perfect breakfast with delicious pastries, the sweetest fruit, and perfectly prepared omelets and French toast.   And finally the rooms - they were heavenly… the most comfortable beds ever, tasteful lighting and spectacular bathrooms with lovely skin and hair products.  We would not hesitate to recommend Hotel Neri to our most picky traveler friends.",5,2024,08,16
14,Great location and service,"Great hotel! Location is hard to beat for this high quality of a hotel. The staff is very friendly and helpful also helped to give us a good insider view of the city. The bellman, Thomas is very helpful, friendly, and energetic. What a great face of the hotel!!",5,2024,08,11
14,Lovely hotel with nice staff  in a great location,"Lovely hotel overall. The rooms are exceptionally clean, beds are very comfortable. The extra bed we had for our child was great, a real mattress, not a cot. Our room had a tub/shower combo that was not easy to get into, it was steep, slippery, and there is nothing to hold onto, so if that is a concern for anyone, do ask for a room with a walk-in shower. For those sensitive to odors, there is a very strong flowery/perfume smell in the lobby. Some may enjoy it. I did not. The rooftop is a very. nice place to sit. The pool is cute, but not a pool for swimming. It's more for dipping your feet. The staff was great, very nice and helpful, and it was clear they wanted to offer a nice experience to guests. The one disappointment was the breakfast, which was nothing like other amazing breakfast experiences we've had in Spain, with beautiful buffets and wonderful cheeses and meats, yogurts, pastries, etc. This hotel offers a bit of fruit, a small not so tasty bread basket, and our eggs arrived cold. 
The location is excellent.",4,2024,08,10
14,Romantic hidden gem in the gothic district,"This was my first trip to Barcelona and I was looking for a cool place to stay with a friend and the Neri hotel was superb!!! Located in the heart of the gothic district, the hotel is within walking distance to Boqueria market /la rambla/, place catalanya, gaudi buildings, and main shopping streets. The Gothic area is filled with cool tapa places and bars which made it quite convenient. The hotel is located on a pedestrian street so be prepared to walk 5-10minutes with your luggage from the nearest taxi drop off point.

The interior design and service were top notch /Miranda at the front desk took very good care of us/- with all the amenities of a luxury boutique hotel. The only downside- the rooms are a bit small but were very clean and the bed very comfortable. 

The rooftop pool is very small / not for swimming/ but provided a nice little oasis on a hot day. Had to use the phone by the elevator to call someone for cocktails as the call button by the sundeck didn’t work. Cocktails were good. 

The hotel does not have a gym but the front desk provided us passes to a nearby gym /15min walk/  & spa facility which was quite decent and had an indoor pool /there was a 20euro fee to enter/.  They do require swimming caps to use the pool so be prepared.

Overall, would def recommend this hotel to friends looking for a luxury boutique hotel experience in a historic part of Barcelona!",5,2024,08,05
14,Neri hotel,Great hotel in the middle of the Gothic area. Great location and super staff. Met at the door by Miranda and Tomas as well as a gentleman from the bar with water. All were wonderful and helpful. Tomas even rolled our bags several blocks to load into the limo! Would stay there again in a heartbeat! All of the staff were great!,5,2024,07,31
14,"Incredible Hotel, Staff and Location","Visiting Hotel Neri as a family of five on holiday we were immediately struck by the friendly and warm welcome. We were also struck by the incredibly lobby, which centres the history of this amazing hotel. The experience was faultless from the spotlessly maintained rooms to the incredible restaurant… and at every stage it was obvious personal attention was being given to every guest. It’s stunning central location also made the city visit more memorable. A special shout out to Marina, Thomas and Ivan – you made our family holiday even more special in gorgeous Barcelona. My wife and I look forward to returning as soon as possible.",5,2024,07,27
14,"5 star stay in a quiet, centrally located and charming area in Barcelona","A Stunning hotel with beautiful, clean and comfortable rooms in the heart of the Gothic Quarter. The restaurant and lounge serves delicious food and has a great assortment of wines and cocktails. The entire staff was very friendly and warmly welcomed us into their city. In particular, the maid staff kept our room pleasant and clean. We especially want to thank the bell-man Thomas (the “superstar”) for greeting us every day with a smile and helping us carry our luggage to the cab a few blocks away. We would love to return and stay again soon.",5,2024,07,21
14,"Great hotel, central location.","Great hotel in a nice area of Barcelona. I stayed at the hotel for one night, while traveling on and found it to be a great place to spend a night. The guy who works at the front door was awesome and very helpful. The restaurant was ok, I wish we had gone elsewhere for dinner, but overall very happy with the hotel.",5,2024,07,16
14,"Lovely, historic hotel","I stayed at Hotel Neri with my family. We had a wonderful experience. The hotel staff (Julien, Thomas, and Miranda) we all so accommodating and friendly. The hotel is a perfect combination of old world class and modern amenities. I wouldn't change a thing about my stay. ",5,2024,07,08
14,Would love to come back!,"What a beautiful hotel and lovely staff. We felt welcomed and looked after in this great location. Our calm refuge from the heat and crowds. We were in an apartment across from the hotel which gave us room to ‘spread out’ but still enjoy the ambience of this hotel. Everything was thoughtfully done, from breakfast trays to fluffy dressing gowns and lovely natural bathroom products",5,2024,07,05
14,An oasis of calm with superb service,"We were made to feel welcome the minute we stepped through the door. Staff were superb. Thomas, Christos and Julianna were amazing. They called us taxis, booked out restaurants and made sure that we were happy at every possible opportunity. The building was beautiful and perfectly located in the medieval city an oasis amongst the little alleyways and cobbled streets. 
After a days exploring what better to return to a tranquil roof top garden for a cool dip and a beer. Our room was perfect- quiet, comfy bed and lovely bathroom. Our terrace was lovely to sit out on with a book and the sounds of birds and occasional church bells. Breakfast was excellent quality and choice.",5,2024,07,04
14,LOVED IT - the perfect spot for our family!,"Super charming, beautiful small hotel adjacent to large plazas in heart of Barcelona. Rooms were very well designed, functional, clean and aesthetically pleasing. The BEST part was the amazing service we received - special call out to Pedro, Carlos and Thomas who were all friendly, fun and went above and beyond to make sure we enjoyed our stay. Not just at the hotel, but in Barcelona. Cool feature is our room had an private outdoor tub/shower on the balcony!",5,2024,07,01
14,A wonderful sojourn in the Gothic Quarter,"The hotel was interesting and well presented. The front desk staff were all very friendly, accommodating and attended to every need. Despite a couple of glitches, everything was attended to and resolved efficiently and with goodwill. Despite the fact that cars needed to stop 100 m from the hotel, the front staff came and assisted with moving  our luggage without any fuss. Being in the middle of the gothic quarter meant we were central to most tourist attractions. The hotel arranged a fabulous guide to take us to the Gaudi buildings, which was amazing, and well worth the cost. The highlight was the smiling face and repartee of the doorman Tomas, who exudes joy with every interaction with the guests, often in multiple languages. We’d happily return next time we travel to Barcelona.",5,2024,06,29
14,Perfect for a couple’s trip!,"This boutique hotel has some really awesome decore and a cool vibe all around which was really nice for a couples trip, but it was the people who made our stay so special! Thomas was the best bellhop I’ve ever interacted with and all of the staff we talked to were so friendly and helpful! The espresso martinis that we had at the bar were some of the best I’ve ever had too. All around, would come back and recommend in a heartbeat!",5,2024,06,29
14,Hidden gem at the heart of Gothic Quarter,"We had a wonderful stay at the Neri hotel. Many thanks to all the staff who made us feel so welcome and were always on hand to assist with recommendations and bookings. The hotel is perfectly situated at the heart of the Gothic Quarter making it easy to walk everywhere.  Although very central, it was very quiet at night. The room was spotlessly clean and the hotel itself has a wonderful boutique feel to it with a charming rooftop terrace.",5,2024,06,28
14,"Great stay, highly recommend","My mom and I stayed here for four nights, and it was a fantastic experience. Everyone was extremely kind and helpful, making it a wonderful trip. Our room was very comfortable, with a window overlooking the picturesque square outside of the hotel. The hotel itself is charming, beautiful, and in a great location within the Gothic Quarter. Highly recommend Hotel Neri to anyone looking for a great place to stay in Barcelona! Oh, and the restaurant is great too!",5,2024,06,26
14,Unbelievable hotel!,"Really, really love this hotel.  Great location, nice physical plant, but most of all, an amazing staff.  Can't imagine how our stay could have been better.  ",5,2024,06,25
14,Beautiful hotel in perfect location,"The hotel was in the perfect location, in the heart of the gothic quarter and a block from the cathedral. The hotel was historic but the rooms were very modern and comfortable. The staff were fantastic and the restaurant was very good (we ate breakfast there each day and dinner one night). Booking through Amex came with great perks. Highly recommended.",5,2024,06,19
14,Great place to stay,Wonderful hotel great breakfast. Thomas is amazing so positive and friendly. The rooms were comfortable and clean and the hotel products were a treat. The candles are a really lovely addition to the lobby and add to the overall ambiance. Highly recommend,5,2024,06,15
14,Perfect stay in the heart of Barcelona,"Beautiful hotel in the perfect location for visiting everything in the city. Full of character and on a beautiful little square. Restaurant here and their sister hotel is first rate. The staff are lovely, helpful and attentive. Especially on reception and Thomas who will help with anything.",5,2024,06,10
14,What a luxury stay!,"This is the second time we stayed at this hotel. The first time was 8 years ago. The location is perfect to us. Some people complain about that they cannot get to the hotel by car. Yes, you have to wlak to/from the hotel enterence for a few minutes to the near by location to be picked up or dropped off since this area is restricted to general traffic. That is one of the charm points of this hotel. The classic room is smaller side but very functionable. The window is soundproof and do not hear very much noise from outside. Bathroom amenities, such as soap, shampoo, and hair conditioner are nice. However, the seramic containers are very hard to use in the shower booth. I wish the hotel comes up with better container design. 
We have breakfast and dinner at the hotel restaurant, ""a"" a few times. There was a waiter very kind to us to accommodate our request. 
There was a very up-beat bell staff at the hotel. I believe his name was Thomas. He greeted us with a big smile in the morning and afternoon whenever he saw us. 
Our reservation was made with regular rack rate and it included ""invited to La Hora del aperitivo."" It means that you have a chance to enjoy one drink with a few tapas at the hotel restaurant. You need to reserve it in advance so the restanrant is ready for you. I believe ""invited to La Hora del aperitivo"" is set for either 12pm - 1pm or 6pm - 7pm. We loved this hotel. I do not mind going back again if I have another chance.",5,2024,06,05
14,The very BEST!!!!!,Hotel Neri was fantastic!!! Great and fun location right in the heart of things.  Thomas was energetic and an excellent concierge!!!  He helped in any way he could.  The day we needed to get to the cruise terminal they hooked us up with a driver even when there was a taxi strike going on!!!  The included breakfast was fantastic and a great way to start our day…. Sometimes it was my favorite meal of our day.  Treat yourself and stay here… it was totally worth it!!!!,5,2024,05,28
14,Incredible!,"Absolutely incredible staff. Tomas, Mauro and Julian are informative, kind and professional. 
The rooms are clean, comfortable and spacious. 
The food is fresh and delicious. 
This hotel is in the Gothic district/center of Barcelona, so there is no shortage of historical sites and cafes!
It really doesn’t get much better.",5,2024,05,26
14,Our exceptional experience at Hotel Neri and Restaurant “a”,"Me and my girlfriend had a great experience in hotel Neri and an amazing dinner at  restaurant “a”. With the hotel located next to placa de sant Felix neri where you can also find the terrace of restaurant “a”, we had a very romantic evening with great food, excellent wines and cocktails.",5,2024,05,20
14,5 Star in the Heart of the Old City,"We really enjoyed this hotel carved out of a medieval home- lovely room, excellent service and great food.  The staff was very attentive and helpful.  The location was perfect - tucked away in the center of the old city just steps from the cathedral.  Hotel Neri was the perfect place for our introduction to Barcelona.",5,2024,05,17
14,Hotel Neri,"Our friends and I booked 2 rooms. We were supposedly upgraded. I got a room which was 1/3 smaller than our friends room. Our “deluxe” room had only a desk and 2 hard chairs. Our friends room was significantly larger with plenty of walking space, a large sofa and a desk and chair. We paid exactly the same amount. They admitted our friends room was larger but said that’s the way it was. 
Just beware of the differences in room sizes in the same room category. 
Thomas, the bell man, was extremely helpful with not only luggage but also directions and restaurants. Our stay was very good because of Thomas. 
The food in “a” restaurant was very good. The menu was interesting and delicious. Breakfast was also very good.",4,2024,05,17
14,"Warm, welcoming, Home away from home.","We have just come back from a fantastic stay at Hotel Neri in Barcelona. From the moment we greeted at the door, we were blown away by how welcome we were made. The Hotel itself is beautiful and steeped in history. We were given a lovely tour of the hotel before we were shown to our room, which  again was beautiful. This visit to Barcelona was for our 20th wedding anniversary and all I can say is we had a fantastic stay at Hotel Neri, all the staff were so kind and helpful, and we would definitely recommend staying here. The hotel is in a great location,, tucked away down an alley, so was nice and quiet, but still close to Everything. Breakfast was also good, a lovely platter of fresh fruit, different pastries, jams and orange juice , with a choice of two other options off the menu (delicious). Thank you so much to all the staff at Neri, I’m sorry I can’t remember all your names, but keep up the good work, you’re all amazing.",5,2024,05,16
