Location Name,Title,Text,Rating,Year,Month,Day
01,"Great location, beautiful hotel, however - reception had no record of our prepayment and erred with reservation","Beautiful hotel, fabulous location, expensive. We were expecting an exquisite experience and were disappointed at check-in when manager informed us he had no record of our prepayment and they had reservations for only 5 of our 6 family members. Our family of 6 had ordered 2 superior suites to accommodate 3 guests in each suite. Hotel had reservations for 2 suites to accommodate total of 5 guests. We had to present documentation of our electronic payment of reservations made five months earlier. Our first suite was situated on 1st floor and was beautifully decorated and spacious. However, air conditioning was not working properly - room was hot and we had to open up windows at night to cool off. Our second suite (for our children) was situated on 3rd floor - the second suite was considerably smaller and plainly decorated, however the air conditioning worked fine for 3rd floor suite. All in all it was a nice hotel located in convenient area of Rome that lacked attention to detail.",3,2015,06,11
01,Good stay in the right location ,A decent price for the value. The hotel is in a very good location. Insist on a suite and not the regular room. The view from the restaurant and bar on the roof is one of the most beautiful sites in the city. Next to the center of the city and far enough not to be in all the noise. ,3,2015,06,10
01,Good location,"The Berlini Hotel is ideally situated in Rome, the rooms are of a moderate size , clean and with all mod cons.
Breakfast was ok with adequate buffet with hot options.
There is a roof terrace bar and restaurant which is very nice,
A good place to stay when in Rome.",4,2015,06,08
01,A lovely old building,"This hotel has the location and the looks. The rooms are nice, but it had the hardest beds I have ever slept on anywhere! Mind you, others that were travelling with us didn't have the same problem. Breakfast was less than average.",4,2015,06,07
01,Some Poor service spoilt things a bit,"This hotel was picked for us by our Mediterranean cruise company, for a pre cruise stay of three nights.
The rooms are sumptuous, but lacking a bit of maintenance here and there... leaking toilet, a strange cord over the bath that turned out to be  a panic alarm & not the switch for the exhaust fan ( that didn't work anyway).
The roof top bar is great fun, but again the adjoining restaurant is sub let to outside caterers so you can't  eat restaurant food on the bar terrace & vise versa, which is a little annoying... so we eat out at good local restaurants.
Breakfast was good & plentiful.
The consierge was a little pedantic when we asked him to contact our airline for changes & this caused delays.
Overall a nice hotel but I am not sure that it is value for money",4,2015,06,06
01,Nice hotel,"This hotel would probably be considered a 3 1/2 star in the U.S., however it was nice.  The rooms were clean and the bathrooms are good sized.  The lobby was very nice.
We arrived around 11:30 am, and asked if a room was available.  The front desk said that it would be about an hour, so we left to go grab a bite to eat.  We were gone over an hour and a half, but a room was still not ready.  We were told it would be another 30-45 minutes.  We were so tired from our flight, but we left again to return after about 1 hour.  Our room was still not ready.
The front desk did not apologize,nor did they really acknowledge us after this.  We waited right in front of them on a lobby sofa, and my husband ended up falling asleep because it took so long.  Finally, after about 5 hours, we got a room.
Horrible front desk service, but the concierge was very good the next day.
Also, the breakfast buffet is incredibly expensive.  They should provide a complimentary continental breakfast like other Rome hotels do.
I probably would not stay here again, but the location is very good and in a nice neighborhood, with close proximity to subway.",3,2015,06,04
01,Beautiful Hotel,"We stayed in the hotel for 4 nights before heading out on our cruise.

The hotel was beautiful.  Our room, #502, had a balcony overlooking the fountain in the square and our bathroom had a window with gorgeous views.  With the bathroom window and balcony doors open, the Rome breezes flowed through our room. The location of the hotel was perfect. We were in walking distance to almost everything and when needed, there was a cab stand at the entrance.  The hotel was surrounded by cafes and restaurants as well as shops.

Service was outstanding. The room was on the smaller side but clean and comfortable.  

We opted for the hotel breakfast in our room charge and it was well worth it. A beautiful spread with fresh fruit & pastries as well as the usual breakfast buffet items.

Our only complaints were the free Wi-Fi that constantly required us to re-log in and the roof top restaurant was extremely expensive and service left a lot to be desired.

All in all, we would stay there again whenever in Rome.",5,2015,06,02
01,Reasonable but not 5 Star in my opinion,"I would say the usual with Italian Hotels, rooms quite dated, but the rest of the hotel is fine.  Breakfast is poor, probably best to go out for breakfast, but at least there is something there to eat before you set off on you site seeing trips if you want it.  Staff are friendly and helpful.",4,2015,05,28
01,WHEN IN ROME: HOTEL BERNINI BRISTOL,"Just returned from Italy- third stay at Bernini Bristol.No disappointments, as usual. Staff uniformly  friendly and attentive, facilities well-maintained. Great location at foot of Via Veneto, 10 min walk to Spanish Steps or Trevi Fountain (presently closed for repairs). Metro stop steps away. Breakfast wonderful in beautiful dining room, nice terrace bar on top floor.Will definitely return next visit to Rome.",5,2015,05,26
01,Nice Hotel but not Outstanding and Overpriced for what you get.,"Very nice hotel but nothing out of the ordinary. Very attentive & efficient staff and the daily breakfast was very good in a beautiful, well appointed dining room. Service was good as well. We had a standard room that was—well—very standard. Faux hard wood floors and an average bed. Sleep quality was adequate as the bed was a bit uncomfortable. You also hear a lot of noise from the outside so don’t count on sleeping in. Linens were of average quality. Bathroom was very small—not much room for toiletries. Small fitness center, adequate by 3 Star Hotel level by inadequate by 5 Star level. The roof top bar was nice but the area with the best views is for private parties or reserved for those with suites on the top floors so it was closed to the general public (or at least is was during our 3 night stay). The roof top bar is covered so it can be used when it’s raining however when it rains, the roof leaks in places (is this really a 5 Star Hotel?). The hotel is in a great location and dozens of nice, cozy restaurants are within walking distance. During our stay, we visited a few other 5 Star Hotels in the area & they appeared to be more elegant based on the public areas we saw such as the lobby and bar areas. The Bernini Bristol is nice—but would not consider it 5 Star. Overpriced for what you get.",3,2015,05,25
01,"Bernini, from barock to the present time.","You are living in the hart of Rome, overlooking Piazza Barberini with the impressive Triton fountain. You will find a very comfortable hotel with friendly and professional staff. The art and style of the whole interior (18th century) is like an island in the pulsating environment of the city.",5,2015,05,24
01,A five-star Rome property,"The 127-room Bernini, in the heart of Rome overlooking Piazza Barberini and the impressive Triton Fountain, (1642), has a great location and reflects the art and history of the area with rare 18th century tapestries and period furniture. Guests over the years include the Queen of England, Churchill, the Rockefellers, Woody Allen, and Mussolini during the World War II years. A huge bonus is Chef Andrea Fusco honored with a Michelin Star. His prestigious restaurant on the eighth floor with views forever is ranked among the best in Rome.",5,2015,05,22
01,Rome Gem,"This is a very comfortable hotel in a great location in Rome.  The rooms are a great size, comfortable beds, and nice towels.  The bathroom was large and had a bidet, and remember not to pull the cord in the bath tub since it's an alarm.  (Luckily, they call before they send in help.)

The front desk staff was helpful in terms of providing directions and assistance with check in.

For me, though, it is indeed about location.  It's right next to the Hop on, Hop Off bus as well as walking distance to the Spanish Steps and lots of shopping and restaurants.  I would stay here again.",5,2015,05,20
01,Magical Hotel,This is a 5 star hotel located in the centre of Rome. It is lavishly furnished in Italian Baroque style and offers comfortable and spacious accommodation.  It offers  rooftop drinks or dining at the O'limpo restaurant with stunning views over Rome. Dining there was a special experience which was complemented by the seamless service provided by the restaurant staff. An excellent breakfast was served on one of the lower floors which overlooked the Bernini fountain.  You cannot get better than this. This hotel surpassed our expectations and It also had WiFi that worked.,5,2015,05,18
01,Its all about the location,"This was our third stay at this hotel.  We keep coming back as the location can not be beat. Walking distance to the Spanish Steps, Via Condotti and even the Vatican if you have good shoes, not to mention the many Cathedrals housing remarkable art. Ah but to call this a five star hotel, I don't think so! Our upgraded room-bare floors-no carpeting (not unexpected from our prior stays). But the decoration, though clean and in good shape, was pure 1953 F.W. Woolworths from the white plastic headboard to the lamps and other furnishing. That the table lamp could not be shut off, (but was replaced) was one thing, but that the air conditioning throughout the hotel was broken for our entire three day stay was inexcusable. Otherwise, service was as expected in a good hotel property, breakfasts were fine and the staff was pleasant, responsive and helpfull.",4,2015,05,18
01,Best location ,Best location and class room i like it  and recommend it the staff was friendly the hall was nice and wounderfull location is 8 minute wake to spanish step and 10 minute wake to  fountana di Trevi، and also its in front of tour bus station also its 10 minute to vatican ,5,2015,05,17
01,Great location; Excellent Staff,"Lovely hotel with beautiful rooms and views. Staff exceeded expectations from front desk , to housekeeping, to engineering. Even minor problems taken care of immediately with courteous and helpful personnel. Bell Staff knowledgeable and friendly; Concierge superb and with a glorious sense of humor to boot! Rooms spacious and very well appointed. Location very convenient to resturants, shopping, Trevi Fountain and the Spanish Steps, not to mention the ""step on, step off "" bus tours.",5,2015,05,14
01,Perfect location for walking around Rome,"We spent 3 days in Rome and the Bernini Bristol was the perfect location for us. East of the Spanish Steps, this location worked well for all the walking we did. We arrived by shuttle from the airport and we took a cab one morning to get to the Vatican tour at 9:15 AM. Other than that, we walked to everything; and we did as much as you could do in Rome in 3 days. The room was clean and comfortable. The shower and bathroom very nice. The breakfast that is included with the cost of the room was wonderful. Scrambled eggs, omelets, bacon, sausage, potatoes, hard rolls, meats and cheese, fresh fruit, sweet breads and croissants, juice, water, and coffee. If you are going to stay in Rome, I recommend this location!",5,2015,05,10
01,Decent but not a 5 star,"It's 32 degrees In Rome and the hotel has not turned the air conditioning on!  The system apparently takes time to start up-- the forecast has been accurate and we checked last week to see the warmer temps coming. Our hotel in Florence (also a Sina hotel ) was freezing but we could fully control the thermostat in our room. I have no idea why this hotel cannot get their system going earlier!!!  When I first asked for assistance, a lovely fellow showed up. He pulled the panel apart with his screw driver, flicked a few buttons, then said it was ""fixed "" (in Italian ). This was odd, as the front desk admitted there was no a/c!  They said it would be on by May 7th. It's May 8 and still no air. The gym is unbearable so not a great place for a workout. Also, a personal trainer is always there training clients who are not hotel guests so the rather small gym gets crowded.",3,2015,05,08
01,THE BEST,"lovely large room,big balcony with the best view of rome,on the 6 floor(gunior s. near the lift,also can be for 3 ).very good location,quiet eara. the best service,gave us a free upgrade. nice breakfast,free upgrad",5,2015,05,03
01,"Nice hotel, but lock up your valuables.","Spent four nights at the Bernini Bristol.  It was generally very good, but one afternoon we came back to the room to find the TV running (we never used it) and my wife's computer/tablet gone. Searched the room well and concluded that somebody with access to the room stole it. We immediately reported this to the management. They seemed flabbergasted and said it couldn't have been one of their employees. Their advice was that we go to the police and report it.

Now, since this is a hotel with card keys, they have a record of every time someone unlocks the door and who it was. The maids' keys carry codes that tell the hotel's computer who unlocked the room and when. The desk clerk indicated that they would check the record.

We were stuck there for two more days, but the hotel never bothered to inform us of what they discovered. 

The hotel does provide safes in the rooms. From then on we used it for almost everything other than clothes.",4,2015,05,01
01,Excellent location,"Stayed for one night on business. My room was overlooking the Piazza and was well appointed. One or two issues with the room i.e. no TV signal and stained toilet which was slightly surprising.  However, the hotel is well positioned to meet view the attractions of Rome. Breakfast was slightly disappointing with a limited choice.",4,2015,05,01
01,Fabulous location and great views from the rooftop restaurant,"We stayed for six nights, we were on the second floor and had a terrace with table and chairs.  The staff were very pleasant and the room very smart.  We got a complimentary bottle of wine on our first night.  Continental breakfast was excellent.",4,2015,04,28
01,Beautiful and Well Situated,"Lovely lobby and rooms.  It looks just like the photos; no surprises.  The room had lots of little extras like slippers and robes and a scale!  Fabric wall covering, like a palace.  And a private terrace too!  They were able to get us into our room before the usual check in time.  So we took off running with our sightseeing.  I was a little leary when they said the room was next to the elevator but we never heard it.  We didn't even hear it when we were in the hall waiting for it because it doesn't bing.  The front desk was very helpful every time we asked for assistance with anything (usually a Wifi problem).  There are lots of fantastic restaurants in the area and the Hop On Hop Off stop is across the street.  Really, everything is not far.  Absolutely great in every way.",5,2015,04,24
01,Old world hotel with great views,"I spent the past few days in the Hotel Bernini Bristol, the servce was great , the bed was super comfortable, t was quiet which considering the location was a surprise. The staff was excellent and very helpful. The breakfast was ok but I rarely find good breakfasts in Italy outside of some place like Bulgari Hotel... I had no complaints.",5,2015,04,23
01,a good hotel for walking lovers,"the hotel is located just near the metro line (Bernini station) the next station is ""spagna"" you can enjoy the historical spanish steps and the most luxurious shopping street Via Condotti ,a few stations after the Vatican and the ""castle of the holy angel"" and  within a walking distance is the ""fountain of four rivers"",and the previous station is Terminus station so you can change the line and go straight to Ancient Rome Colossus and the Forums.or simply you can abondon the mass transit system and get all these fabulous places visited on foot starting by Ancient Rome early morning and go to the castle and walk in Renaissance Rome in one day and grab a Gelato while walking late at night to go back to your comfortable warm  hotel.So,the location is unbeatable and the rooms are soundproof so don't mind the traffic noise which is non sense in fact.
the restaurant upstairs gives you a splendid view of Rome at night,the food is of good quality but this is regarding the in room dining but with those friendly restaurant staff i easily got the royal treat i deserve ;-) the menu goes upstairs especially for me to choose and special chef recommendations and you can ask for whatever that suits you so they can make it specifically for you.
the concierge and checking in and out experiences were very nice and especially when the young gentleman at the concierge made the local tourist office (whom provided me a day trip outside Rome) to come pick me as i am a very important guest and a one who should not be missed with (and they swallowed the bait and provided me with a private transfer from the hotel and back too!!
The WIFI is average regarding speed and it needs frequent signing in.
the room sizes are average with big bathrooms but a little bit small shower area",5,2015,04,02
01,"Beautiful hotel, great service, perfect location.","This is a beautiful hotel, set in the perfect location, not only within walking distance of the Spanish Steps, Trevi Fountain and the Pantheon, but also has metro, bus and taxi links within a few steps on Piazza Barberini.  The entrance to the hotel is beautiful, as is the bar and surrounding seating area.

We were very kindly upgraded to a beautiful suite on the 7th floor, which was very comfortable, clean and afforded us amazing views over Rome. The Italian marble bathroom was nice, and the kingsize bed was very comfortable. In my view, the room was very fitting of a 5* hotel, and we also had complimentary bathrobes and slippers and plenty of soft, clean towels.  We overlooked the lovely fountain on Piazza Barberini, but at night, although this area is busy, our room was very quiet.

We used the breakfast room for the first two mornings of our stay, which we found to be a pleasant room.  The breakfast is buffet style, with plenty of selection, from cereals, fruit, cold meats and cheese, lots of bread rolls, croissants, brioche, and flan, as well as bacon, sausage, potatoes, tomatoes, and omelet and scrambled or fried egg.  The staff were helpful and we were served quickly with our coffee.  My only comment would be that the scrambled egg and bacon I had on the first morning and the omelet (no bacon available) on the second morning were cold.  The hotplate servers just don't do their job in keeping the food hot.  

For the other three days of our stay, we paid an extra €12 per day, to have breakfast delivered to our room.  The first morning was perfect, with the continental breakfast choice, with a good selection of jams and spreads.  On the second morning, they delivered breakfast for one, instead of two, but a quick call to the breakfast room, and the guy was back to our room with the extras within five minutes.  On the third morning, they forgot the toast we asked for, but there was so much in the 'bread' basket that we didn't need the toast.  Overall, we were impressed with everything including the staff, especially Robert.

We mentioned at the reception desk that we wanted to turn down the heat in our room.  Almost as soon as we got back to the room, an engineer was there to show us how to control the heating.  We found the service from all the staff we encountered to be exceptional.  The doorman, Mario was very nice and helped us with our Italian pronunciation. The reception staff were friendly and helpful, and we were made to feel very welcome and like nothing was too much trouble.  We also had the pleasure of meeting the front office manager, Marco, and also Roberto, who were keen to know that we had enjoyed our stay. 

I cannot recommend this hotel enough, and we very much look forward to staying here again in the future.",5,2015,03,24
01,Rome and rugby,"First time for me in the Bernini and an ideal place for walking around Rome. Lovely facilities although the bar in the lobby was not often manned.
The highlight was Stefano on the door....what an asset he is to the hotel, so knowledgable and helpful.",4,2015,03,24
01,Terribly unimpressed... and booked by Amex,"Tough experience in this hotel, could be bad luck, could be they're just not that good. Arrived sleep deprived with my family of four... my travel agent had asked for an early check-in. Was told there was nothing available, we'd just have to wait in the lobby. Son fell asleep on the sofa, wife the same, eventually they found a room for us to sleep in for the 2 hours until our rooms were ready.
Heat was still on in the hotel and we were on the top floor so rooms were incredibly hot. Called the desk and was informed there was nothing they could do... oh well, windows stay open. Bathroom in room 715 stunk... called the desk again, tried but nothing they could do... oh well. Bedrooms requested were for a connecting king or queen and two twins in other... beds in both were two twins pushed together?
Sleep during the night was tough with sounds of the street in our rooms, (not a sensitive crowd, we live in NYC).
Breakfast at the hotel was not so good, service really non existent.
Front desk staff was lovely, but not very effective.
Had a tour guide come early one day, supposedly ask for us in the lobby and was told we were not there. When we got back and asked if anyone had been looking for us, were told no one was there all morning?
Wish I didn't have to recount all the misses, but I was really, really disappointed in how these guys conducted themselves. I'd like to say bad luck on our part, but too many misses to be coincidence.
Think you can find a better stay when in Rome...",2,2015,03,23
01,"Lovely for Location and Service--but not really ""Luxury""","We booked with our BA flights and found the reviews below were largely accurate.  

While we're not sure this hotel fully deserves its SLH membership, we found the location ideal for full days of wandering on foot, getting to Roma Termini, the Vatican, Colosseum, Capitolio, Cathedral of Rome.  If you don't feel like walking there is a taxi rank and Metro station on the square--and getting back to Barberini is a breeze.  

The staff were charming and helpful, recommending restaurants, logistics, walking vs taxi-ing, and providing map and directions.  

Our room was reasonable, but perhaps in need of a little TLC.  The shower far from luxurious--a bathtub with a swinging half-screen, which leaves the entire bathroom flooded after even the tidiest bather.  The room also needs a proper king-sized bed.  (For the life of me I can't figure out why European hotels pretend that pushing two twin mattresses together and tossing a sheet over them equals a king. It does NOT and it makes for awkward snuggles with your partner when one of you falls into the gap!!!  This does NOT feel luxurious!!!)  

Our main disappointment was the rooftop restaurant:  the food was decidedly average, the service disjointed and the price unjustified.  Even with the 15% discount we found it excessive--and we really don't mind paying for a nice meal.  

On the whole, a pleasant stay.",4,2015,03,18
01,Amazing overall!,"We arrived very early in the morning and were quickly accommodated in an upgraded room by Alessandra. Room was perfect, everyday, turndown service was just right. Daily breakfast is well worth it, and Dinner at the hotel's restaurant was very good. Perfect location in Piazza Barberini, will definitely stay here again!! Ciao!",5,2015,03,18
01,Good hotel in Rome,Really enjoyed my stay at the Hotel Bernini in Rome.  The location is great for restaurants and access to the metro is very close.  The room was perfect and was cleaned early each day.  The breakfast was excellent and the cafe' was delicious.  I didn't eat in the hotel restaurant on the top floor but did have a drink on the terrace.  The view is wonderful.  I would recommend this hotel to anyone going to Rome.,5,2015,03,08
01,Fabulous Hotel,"The Bernini is fabulous and in a great location! I've stayed in many hotels in Rome and this stay has been by far the best. The staff and services are beyond excellent. They are extremely welcoming, friendly and bend over backwards to help their guests! The front office manager, Marco treated us on March 8th, Women's day, to an Italian tradition of giving ladies Mimosa flowers to recognize the special day. The Bernini has an incredible roof top deck and restaurant that over looks the piazza. Cannot say enough good things about this hotel. My friend and I being young travelers are not always treated with respect but at the Bernini we were treated like queens and will be sure to stay again next time we visit to Rome!",5,2015,03,08
01,Nice place,"very well worth being a 5 star hotel...location is great, you can take the train from Airport to right outside of the Hotel enterance...I would strongly suggest this Hotel... rooms are a good size and very clean...",4,2015,03,02
