Location Name,Title,Text,Rating,Year,Month,Day
09,Not worth 5 stars and Actually overpriced,"Just spend a nice weekend in Courmayeur at the Grand Hotel Courmayeur Mont Blanc. And I'm disappointed to say it, but I will NOT recommend it to anyone and will not come back. 
First advantages: the design is really nice and it was actually the point why I chose this hotel. It is situated in the residential area, so outside is really relaxing and quiet. 
To have a great view I recommend the rooms overlooking Mont Blanc, paired numbers - 202, 204 etc. 
breakfast is ok, the basic level for a 4 star hotel with a nice view. 
The great disappointment is the spa - a small indoor swimming pool with 10 (!!!!!) relax beds. So immagine the high ski season when all the guests of the hotel come to relax in the spa at 5-6 p.m. 
Actually it's a very basic spa, nothing special. If you want a really great and luxury experience - just book the best spa hotel in the area QC Terme Hotel Monte Bianco in the nearest town. Or try Nira Montana in La Thuile. 
Hope the manager of the Hotel will realize that the 5 star service doesn't include only facilities (he cannot change the spa unfortunately). But he could add some pleasant compliments etc like do other luxuries mountain hotels - welcome drink, relaxing mask. Something that could make the stay not average but special. ",3,2017,04,01
09,Wonderful Contemporary Hotel,"We have just returned from a fabulous 4 nights in this lovely hotel. Every single one of the staff were all so courteous, welcoming and couldn't do enough to help. Definitely 5* service. We were upgraded on arrival to a deluxe. Room C201 (4th floor) was very comfortable with huge bathroom. V peaceful overlooking mountains. (Requests: A bath! UK channels on TV without supplement. Tea/coffee making facilities in room. 24 hr Room Service (closed at 11pm).) The shuttle minibus service to Dolonne gondola was very efficient and flexible. (Tip: hire your skis up the mountain- makes life much easier!) Very easy max 10 mins walk into the centre (Via Roma) for shops, bars, restaurants. Breakfast was a delicious buffet. We only had to mention once that my daughter was gluten free. Every meal, the waitress automatically brought gluten free options. We even had a whole tray of GF snacks delivered to the room with no charge. Only ate dinner once in the hotel : good choice of local dishes, excellent quality, reasonable and exemplary service. We loved the spa- warm jacuzzi swimming pool, sauna, steam room (dressing gowns, flip flops, products, towels all readily available). Also free hot drinks, fruit, water in the spa to help yourself. We just didn't want to leave! Mille grazie- we will be back!",5,2017,03,23
09,Beautiful hotel close to downtown,"Nice relatively new hotel in Courmayeur; conveniently located near downtown but in a very quiet area and with beautiful views of the mountains. Modern fittings mostly glass gives lots of light to the inside. Might appear a bit 'cold' (lacks the cozy athmosphere of some mountain hotels) but all very clean and high quality. 
Dinner in the restaurant was very good quality and waiters very nice with us and the kids. 
Rooms very nicely furnished all very modern. 
Nice terrace to enjoy the sun. 
",4,2017,03,22
09,Long weekend skiing,"The building is great, modern and contemporary, rooms spacious and clean, and there is a great spa area and pool. Ideally located for walking into town to the many restaurants and shops, and there is a free shuttle bus to the ski lift.
The staff were super helpful in recommending and booking restaurants, but I would recommend checking your bill when checking out as both couples had charges for the bar which were made before we even arrived! I am positive that this was a genuine error and nothing untoward.
Drinks at the bar were costly, but so was everything else in Courmayeur so this isn't a reflection on the hotel.
The breakfast buffet was delicious, especially if you have a sweet tooth. There was a great variety to suit everyone though, and plenty of food and good coffee.
The only negatives were that it felt more like a business hotel than a ski resort accommodation; there wasn't much atmosphere. The staff, although very courteous and friendly, were slow in responding to requests, and it's not really necessary to bring a bottle of wine to the table on a trolley!
In summary, everything was fine, but some ambience missing!",4,2017,03,13
09,Ski vacation ,"Certainly not 5 star. 
Disjointed in layout 
Rooms small
Noisy 
The insulation between floors/ rooms a bit thin 
Spa ok 
Breakfast rubbish .
Reception helpful 
Ski service ok 
On the edge on the town so walking needed to go into town 
",3,2017,03,13
09,Nice hotel but not a 5* service,"The hotel is a very recent building with good design. Rooms and bathrooms are nice although standard doubles are small for a supposed 5*. The spa is pleasant, can get crowded in the afternoon. Location is good, car/shuttle is necessary to reach the lifts up to the slopes.

Staff is friendly but service is not exactly in line with price they charge: eg difficult to get anything to eat if arriving late, private car parking costs Eur30/night but you may be asked to go get the car by yourself, the shuttle to the lift should run at all times but we once had to wait for close to 1h before being picked up. Restaurant food is fine but would not say the best in Courmayeur, the breakfast choice is underwhelming for Italian standards.

Overall a nice and pleasant stay and good value if booked on discounted rate, but hardly worth the rack rate.",3,2017,02,25
09,Lovely hotel that doesn't quite deliver,"Beautiful hotel a short walk to the centre of town. We found out on their website about a great anniversary package, which resulted in us being upgraded to a beautiful junior suite. The room was fantastic with the biggest bath tub you've ever seen. 

The spa is good, but they need more beds to relax on around the pool.

Breakfast was good but I was very disappointed with the choice. I am gluten free and had phoned ahead to inform them - they said that was no problem - however, no gf bread appeared on the 3 mornings we were there even after speaking to the front desk twice about it.

Another frustration was the satellite TV wasn't working in our room, so we  couldn't watch any English speaking channels. The front desk blamed it on the weather (even on a fine day). We were not convinced given we are in a mountain resort + all the bars were able to show sport, etc, on their TVs.

The real let down for our party was the shuttle service from the hotel to the cable car that takes you up the mountain. There is one shuttle bus that seats 8 that they use to shuttle guests. There are many guests, so the queue is long and we waited 45 mins on the first day outside in sub-zero conditions so as not to lose our place in the queue. On the second day we had to split up our party of 6 to fit on the shuttle, which resulted in more wasted time. They really need 2 buses at peak times, or a bigger bus.

In summary: the hotel itself is very nice, but needs to work better on customer service to be worthy of their 5* rating and the price tag.",3,2017,02,08
09,Grand Hotel Courmayeur Mont Blanc,"With friends we spent in this hotel very nice autumn weekend. Accommodation and meals perfect. I can also recommend a very clean and modern spa - swimming pool and sauna, which offers lovely views of Mont Blanc.You can enjoy with ur familly and friends.",5,2017,01,23
09,"Good property, nice staff, poor food","The room was fine, nicely designed, could have used a little more closet space. Facilities excellent. The staff were always helpful and friendly, though some seemed inexperienced and stretched. The restaurant was poor, especially for a five star hotel. Most restaurants in Courmayeur were better, and food is not the priority in a ski resort. Parking charge is now 30 Euros a night..",3,2017,01,02
09,NOT A 5 STARS HOTEL,"I have visited Grand Hotel courmayeur for the new year's eve 2017. Stayed for 9 nights. The hotel is a definetly 3 stars one,  not a 5 one. The staff is mostly rude, not willingful to help. They do not have a decent lobby as a 5 stars hotel should have",3,2017,01,02
09,"Amazing new hotel, for skiing the rooms are small, not close to piste!","the beautiful  hotel is brand new, just openend. the rooms are nice but for skein maybe a bit small. id like to have a bit more space. the badroom is big enough! so thats a big plus. the breakfast is big and serves all sorts of food. in the hotel you can rent skies and change clothes, a mini van brings you to the ski lifts just 5/10 min fro the hotel. and picks you up again. if you want to be close to the skilifst this might not be your hotel.",5,2017,01,01
09,Great place and great location ,"Been here December 2016. Hotel is great, top class in terms of location, rooms clean and luxury as expected. 
Spa is not huge but very good, even if customer service is not as top as the place itself. 
Cortina city center is at walking distance. 
 ",4,2016,12,03
09,Very nice hotel ,"We really enjoyed our one week stay at the hotel.  It's not truly 5* but a very comfortable 4*.  Public areas are bright and modern with breathtaking views.  Top notch spa.  Our room was comfortable and had great views.  The only drawback is that there is no A/C and it was hot during our visit in late August.  If you open the balcony door there's beautiful cool mountain air but also noise from the street if you're facing the front.  So ask for a rear facing room.  We were part of a kosher group and the food and the service was excellent.  All the staff were friendly and helpful, especially the front desk, so I'm puzzled by some of the negative comments.  It's true that the hotel is a little outside the center of town, but we viewed that as a plus, and it's a pleasant 10 minute walk to the center of Courmeyeur.  Parking is a a bit of a pain. You can either pay Euro 20 a night to park in their garage, or you can park on the street nearby - although spaces are limited.   ",4,2016,09,17
09,The worst 5*,"As a real client who has been in the hotel this weekend, I will classify this 5 star hotel as the worst 5 star I have been in, from the service to the infrastructure and maintenance.
I know the infrastructure is not the fault of the people who are present daily that execute the different services, but daily operations can make one forget the imperfection in the infrastructure.
Arrival at the hotel, no one to welcome you and help with the luggage, but mind you someone is busy talking on the phone outside whilst we wait, turn out it was the management staff who could not be bothered until he finished his phone call. 
Check in procedure, we are directed to public parking as parking infront of reception is full and mind you we had paid the parking beforehand. We are requested to pay 20euro should we want to use the underground parking. The reception did not know we had paid (they did not have the information). At arrival we learn that the restaurant are closed for the two nights for the profit of a private event, they could have been informed.
The room is big , enough space for the four of us....brand new and modern. However the bathroom is not ventilated at all thus smell of mould.
At night impossible to sleep as its hot, asked about the aircon, answer is there is none because it is a mountain hotel. So we slept with the balcony door open, thanks god the surrounding is quiet.
Friday night we wanted to go to the bar, waited, no bar man thus we ended up leaving.
Breakfast, simple with the necessities except for cream for coffee, they do not have cream for coffee.
Spa swimming pool is nice, we enjoy the swimming pool, though a bit surprised at the note on the door that  you cannot use the spa/swimming pool the day you check in and the day you are checking out. Why?
Twice in a row (Saturday night and Sunday morning) in the garage, the staff use the garage as smoking and break area. Seriously? So your guest have to walk next to your staff smoking in the garage, and your guest has to see your kitchen staff in the white uniform sitting down in the garage smoking? Unacceptable for a 4 star and let alone a 5*.
Courmayeur is a lovely area, very green, clean and beautiful. In great company we had a nice weekend and did not let these hiccups ruin the weekend., but you can be sure I do not reccomend this hotel as a 5 star.
Advise, sometimes the little difference, the human touch makes all the differences in the imperfections.",1,2016,09,05
09,"Gorgeous views, boutique hotel","Courmayeur is a beautiful place to relax in the summer.  The Grand Hotel Courmayeur is  great place to relax in Courmayeur.  The hotel only has about 72 rooms in three connected buildings.  The view from the terrace on our room was awesome !  What a sight to get up to every morning !  

The room was spacious, queen size mattress ( we usually sleep in a king), but very comfortable.  Bedding was excellent with choice of pillows.  The bathroom was extremely spacious.  The hotel is new, having just opened a couple of years ago and still has that new hotel smell.  The staff is extremely courteous and attentive.  We had a problem with the safe and the receptionist that answered the phone immediately came up to the room to reset the safe.

The spa is wonderful  I had a great massage at a reasonable price.  They have multiple shower experiences and am indoor pool with a button triggered waterfall.  A spacious outdoor deck is located by the pool with numerous loungers for sunning oneself.

The only negative was the lack of air conditioning in the rooms.  The weather cools off nicely at night, but one needs to leave the door to the terrace open.  Our room was off the road, so it had a great view but you heard cars going by most of the night with the door open.  The room was soundproof with the door closed.  A ceiling fan would be a great addition to the rooms.",5,2016,09,02
09,Mixed but overall disappointing experience,"We chose this hotel because we thought we would have a five star hotel experience, and we were willing to pay a bit more for a perfect visit, but we were not happy overall with our choice.  In summary:  (i) The location of this hotel is not ideal.  It is set high on a hill above a park, and the main attractions are all downhill.  Our visit was in the summer, but we imagine this will be especially inconvenient in the winter months.  (ii) FYI - The hotel advertises a 'private ski slope', this is just a small gentle 'bunny slope' for children.  (iii) The hotel is relatively new and has a nice modern design, especially in the layout of the junior suite we occupied (big and nicely appointed bathroom and walk-in closet), but surprisingly does not have the benefit of air conditioning.  The room had doors, not windows, so we had to sleep with the doors open.  The light on the porch could not be turned off which was annoying.  (iv) Bottled water is not provided free to guests.  WE thought this odd for a hotel of this stature.  (v) The gym is tiny and not well ventilated.  (vi) Our room faced the valley, rather than Mont Blanc.  On the same side of the hotel is the hotel pool and a children's park next door, so we heard a chorus of screaming children every afternoon. (vii)  There is free parking available in front of the hotel for only 12 cars (if parked well).  A garage is available for a nightly fee.  (viii) We were told before our arrival that the hotel dining room was fully booked for the entire period of our visit; what we were not told was the reason for this - a tour group was there throughout our visit.  Not our idea of a quiet and relaxing holiday break.  Overall, we would say this hotel did not provide value for money.
However, we would conclude by saying, the most positive aspect of our stay were the staff who were all friendly and very helpful.",3,2016,08,30
09,Beautiful location,"We had a room with a balcony facing Mont Blanc. What a view to wake up to each morning. Nice small spa with a small pool, sauna with a glass wall with a view, hamam and aromatherapy showers. Really comfy beds. The staff were exceptional and went out of their way for us. Good location for hiking, canyoning and other summer activities.",4,2016,08,23
09,Amazing hotel,"we stayed here as part of a group tour for a week in August 2016. I found that the service was excellent. very pleasant and always available to help. the waitstaff was always friendly, available and eager to help. The hotel itself is gorgeous both in the views and scenery it affords and the actual hotel as well. We would not hesitate to come back and stay here.",5,2016,08,23
09,Spa and restaurant were closed,"The hotel is probably not too bad,especially spa, room was big and clean (luxe), but the politic of the hotel was more when surprising-they had the 'special guests' from Israel, and spa was reserved for them for the evening hours,and the restaurant was closed as well!! Because they cooked only 'kosher' food-NONSENSE! Thanks god,they served a breakfast, but also,separately. Could not even order some food at the evening because of that-very disappointing decision to close all the services for the other clients,because of the 'special' guests. So be advised to check at the hotel before, would you be able to use spa and restaurant.",2,2016,07,20
09,Not recommended for those looking for good service and luxury hotel,"No charme or appropriate service in any part od the hotel. Non existant concierge. Recommendations for restaurants terrible with no possibility to book any decent one weeks in advance. Hotel restaurant understaffed. Spa overcrowded (6 beds and 6 chairs for hotel this size) Kids running around the pool in the evening eventhouth hotel policy does not allow kids entering after 3pm. Room cleaning not finished by 4pm ?? On the positive: Good beds and pillows. Nice sauna room with a view. 
Service, attention to details and warm welcome not perceived as important. Any of our complaints was not followed by a feedback. Never experienced something like this. All in all... If management of the hotel does not understand this very soon the hotel will only cater one time guests. Ok but far away from special experience. Would not return.  ",2,2016,03,27
09,Best 5* hotel in Courmayeur ,"Brand new, opened one year ago. Second time here and probably it's not the last one. Comfortable and well decorated rooms, nice SPA, breakfast buffet is rich and full of local product (Panizzi yoghurt is a must). We were on half board and restaurant menu changed every day, get ready to put some kilos on during your stay. Last, but not least, shuttle bus to Dolonne.",5,2016,03,25
09,Shocking service,"Nice design, but it really doesn't mean much, when the service is so shocking that all you can think of is moving to another hotel. Unfriendly and even rude staff, lack of hygiene, awful room service. I am genuinely puzzled how they passed the 5 star rating. Shockingly overpriced for the services that they provide. In my view 3 stars for their services would be a stretch.",1,2016,03,22
09,"Great facilties, poor service","Fantastic facilities and beautiful location, however the service was especially poor from the front of house staff. The other members of staff were very helpful and attentive- but reception were continually rude and unhelpful to multiple members of our group. Not what you would expect from a five star hotel.
Breakfast was excellent and the rooms were pristine and well decorated.
",4,2016,03,13
09,Sleek hardware marred by weak hospitality,"We stayed one week at this hotel. It was our second visit to Courmayeur, and though we enjoyed Au Couer des Neiges last time we decided to try GHC because of the modern design and spa photos on the hotel website.  I regret this decision:  the hotel hardware is indeed nice but there was a distinct lack of hospitality.  Staff seemed cold and seldom smiled. They didn’t seem interested in welcoming guests, a big contrast to Au Couer and hotels like Auberge where even as dinner guests we felt very warmly received. 

The rooms are modern, with cute bronze snowflake door handles and comfortable beds. Our room was in the main building on the lobby level and had a sliding door to an outdoor patio.  There are some design quirks:  our regular room had little room for luggage but the adjoining junior suite had an enormous walk-in closet.  There is a long desk but it lacks plugs.  The bathroom is big but has limited counter space and the water splashes out of the shower due to an inadequate glass enclosure.

The free Wifi requires user ID and password which are on little slips of paper you need to request from the front desk.  Though the paper says valid for 1 week but it expired within 4 days. It was tedious inputting these into my phone and computer and sorting this out for the kids as well.  There was no guide on how to use the hotel phone to dial the operator, room service, spa, etc.  Sometimes when calling the operator, there was no answer.  

The 2/F restaurant was disappointing.  There was little ambiance and the lady in charge who took our order seemed stressed.  Our order took 1 hour and when it arrived two dishes were incorrect and steaks were well-done instead of medium-rare.  The carpaccio was beautifully plated but flavorless. There was no children’s menu either.  As a result, we needed to pick up food from places in town when the kids wanted to eat in.  Fortunately there are plenty of nice restaurants in Courmayeur so we didn’t eat in the hotel restaurant after the first night.

Breakfast is reasonably good but isn’t available until 7:30am.  There is a selection of juices and fruits, hams and baked goods.  Too bad the scrambled eggs and bacon on the buffet were cold because the serving tray had no heat source.  Other hot items like omelettes are extra.  Service here was better except for the same lady supervisor from the dinner restaurant who was unhelpful.

The spa has a lovely pool and various chromatherapy showers, steam and sauna with a view. The spa attendent was the most energetic and friendly staff in the whole hotel. 

There is a shuttle van to take you to the various lifts/trams in Courmayeur as the hotel is not ski-in/ski-out. It’s a nice brand new van but only seats around 5-6 people max so isn’t the solution for a big group. The main town centre is about a 7-10 minute walk away.

In summary, this hotel has beautiful hardware but the hospitality didn’t match up to the physical premises.",3,2016,03,08
09,Amazing 5 star hotel but some of the staff very poor,"I write this review having stayed 6 night and the hotel was first class and very high quality. Rooms to a high standard and Spec. Sadly the hotel does is not really set up for English guests, I ordered poached egg 3 morning 2 of the staff did not understand the order, 1st morning they were dumped on the plate 2nd morning I sent them back as they very raw 3rd morning they never came so I just had toast.  On the final night I order a veg option rather then fish and was given some very over cook vegetables. On my table one of the organisors ask Marcos about an issue and he become very rude with her. The issue seemed to be that a number of the staff did not speak much English and has very limited customer care experience. So the tip would be if you are Italian it should be fine, if you are not or do not speak Italian. Also for large booking the dinner was poor when have 80 for dinner and kitchen was out of it's depth.",3,2016,03,07
09,Skiing in the Italian Alps,"The hotel is one year old and is beautiful. The people her are as helpful as can be. From breakfast in the morning to drinks in the bar lounge apre' ski was a great experience.  My wife says the Spa was a little noisy but, the facial she received was fabulous. Not a lot of excitement here but very nice. I will return.",5,2016,02,18
