Location Name,Title,Text,Rating,Year,Month,Day
224,"Fantastic service, great stay.","Carl - big shout out for exemplifying luxury hospitality and great customer service.

Not only did he take great of me but as I was working in the hotel lobby for much of the day I also observed that I wasn’t just lucky to get special treatment - he delivered special treatment to every individual, that is to say a top-notch experience.

The 4th floor room with view over the canal towards the rolling countryside definitely a great way to wake-up.

Breakfast was well stocked with option for freshly made, on request, porridge and variety of egg options (if you didn’t want scrambled).

If you want a quick bite to eat, great Asian fusion eatery next door (Asahi Asian Street Food).",5,2022,11,25
224,Amazing experience… The best hotel in Dublin. Great place to stay. Staff is wonderful.,"Amazing experience… The best hotel in Dublin. Great place to stay. Staff is wonderful. The services, attention, hostility, support, meals and hotel rooms are fantastic. Well being is the focus since the beginning of the experience at the hotel. I would like to congratulate Carmel… wonderful person… she is amazing … thank you for all support Carmel … we are very happy with you …",5,2022,11,24
224,Delightful hotel; great staff,"We are enjoying our stay very much. Hotel is located perfectly - we can walk to many attractions. The rooms are comfortable, cleaning staff is excellent, and Petru the bartender is a very charming presence - and an artist behind the bar!",5,2022,11,23
224,Absolute joy to speak to Rita from reservations and also front desk staff are very friendly,I dealth with Rita from reservations through email today and I am glad to say she came across very humble and helpful. I've stayed here before at the Charlemont and always welcomed by the staff at desk. ,5,2022,11,21
224,Breakfast,"Breakfast was delicious. Ioana, Javier and Glen were very helpful. Fresh and healthy options in the buffet and also fresh porridge to order to the table. The Irish breakfast was very fresh and of great quality.",5,2022,11,19
224,Really nice lunch and service,"We went for lunch and we really enjoyed the food, the ambience and the set up. 
Larissa was brilliant with us, she made sure we had everything we needed and took really good care of us. We will be back soon!",5,2022,11,18
224,Excellent Food and Amazing Service with Great Ambiance,"I went to Clayton hotel last week with my girlfriend we had great breakfast, fun and perfect start for our day. Food was amazing with lovely staff and great surroundings. Special thanks to breakfast manager Ioana and Javier for their great service and looking after us. Will definitely visit again soon and recommend to everyone, the place is awesome with a lot of happy people. ",5,2022,11,15
224,Best experience,"beautiful experience in Clayton, outstanding service, delicious food, the cocktails were the icing on the cake. special thanks to the bartender Petru for the passion and dedication in his work and simone for the best service.
thank you so much guys",5,2022,11,13
224,Fantastic  service,"Breakfast was amazing. Staff was very friendly and helpful, specially Ioana (manager) and Javier. We will definitely go back. Perfect location, very nice area and very close to city centre (walking distance)",5,2022,11,13
224,spectacular stay and service,"Me and my partner booked this hotel for a weekend in Dublin, I would Highly recommend this hotel as it is close to all the best places in the city and everything is walking distance. we were pleasantly surprised with the bar in the hotel the bar staff were so friendly especially Petru who was behind the bar making the most delicious cocktails, an Amazing night.",5,2022,11,13
224,Experienced staff. Good service. Amazing food.,"Very good experience to Clayton charlemont. Very friendly and experienced staff. 
Special thanks to loana. Very nice girl. All the staff was nice. Food was amazing and service was great. 👍
Highly recommended.",5,2022,11,13
224,Amazing Buffet,"Superb Breakfast
You can tell a good breakfast by the quality of the sausages and bacon and the guys serve really great quality produce. My only regret is that I couldn’t taste all their beautiful buffet as we were going to the Marathon. Beautiful service and professionalism from Ioana the restaurant manager and the team. I look forward to a second visit. 
Thank you.",5,2022,11,13
224,Exceptional Breakfast,Breakfast was fantastic and the breakfast had a wide variety with a lovely view of Dublin’s Grand Canal. Glen was very helpful and friendly on both days of our trip to Dublin. We can't wait to come back! ,5,2022,11,13
224,Amazing service and staff. Full marks guys ,"We were in Clayton charlemont for breakfast. It was the best thing happen early in the morning. Staff was very friendly and nice. Ioana I think she was the manager on the floor, and javier, they both were amazing  and professional. It was good to see happy face’s in the morning. Keep it up guys. Full marks. ",5,2022,11,12
224,Exquisite experience,"Staff is very friendly and polite, specially Javier.  I felt amazing and really enjoyed the experience. Special thanks to Ioana, the brekfast manager, for the great professionalism and brilliant service. Food is absolutly delicious.
I'd highly recommed it to everyone who is looking for an amazing atmosphere and lovely service.",5,2022,11,12
224,Amazing service,"I’d love to visit Clayton hotel charlemont  again. I'd recommend it as a nice place to go with friends, family, or a partner. Especially many thanks to Ioana( the breakfast manager) and Javier for being attentive and offering a great service to every one .
Thank you",5,2022,11,12
224,Classy bar with great choice of cocktails,"Classy bar with lovely ambience and music. There is a great choice of cocktails including non-alcoholic variants available. Special mentions to the bartender, Petru, who served  up some of the best negronis we've ever had! Would highly recommend for anyone looking for a cosier night in!",5,2022,11,11
224,"Amazing bar service, thank you Petru","Amazing service, me and my friend went for a drink at the bar, we  were served by PETRU and he does amazing craft  cocktails. PETRU is very professional and friendly. Lovely atmosphere, I was impressed by the service and the overall experience. ",5,2022,11,10
224,Outstanding hotel in Dublin,Loved this hotel. It’s great location is very convenient. Hotel itself is very modern and stylish. Rooms are spotless. Food is delicious and service throughout is exceptional. They have everything needed. ,5,2022,11,06
224,Very good stay,"Stayed there for a couple of nights on business, room spacious and very clean, breakfast was very nice and not so busy, would like them to start a bit earlier than 7am though, overall the hotel was a bit quite but all in all it a nice stay and would stay there again.",4,2022,11,06
224,Great hotel for business,"Well equipped modern hotel. Good Wi-Fi , room service available all day. Food os nice and breakfast choice great. Location is very convenient with with minutes walk to city center.
Staff and service at the high level. Overall highly recommended.",5,2022,11,05
224,Superb hotel in prime location,"Greta location, so convenient with all the transport available at the doorstep. Room are modern and comfortable. Service is very friendly and staff are very polite and knowledgeable. Food is also delicious. I felt comfortable and really enjoyed the experience.",5,2022,11,05
224,Enjoyable stay in Dublin,Love this hotel. Especially staff. The friendly and most hospitable staff I have ever encountered in my travels. Rooms are bright and and comfortable.I highly recommend this hotel especially for their exception customer service. I look forward staying here again,5,2022,11,05
224,Best hotel,"Truly lovely hotel. Fantastic service, one of the best I have experienced. From the moment I have arrived everything I needed was taking care of. All the information and assistance. Interaction with staff is superb. Food is lovely and the cocktails are amazing. Thank you to all all staff for truly genuine, personal and great experience. I will definitely be back again.",5,2022,11,05
224,Amazing Experience - Excellent location/food/staff,"Perfect location, lovely rooms and excellent staff. We dined in both the restaurant and bar and the service received and atmosphere in both were amazing. Excellent food and drink options available and the staff were extremely knowledgeable in providing recommendations. I will 100% return in the future. ",5,2022,11,04
224,Excellent,"Just passing through,sit down for a beer and enjoy the big screen tv.As recommendation, bar manager bring me this beautiful chicken burger and with a large smile and happy face.
Bar looks great,clean and the staff are very friendly.
I’ll be back!
JS",5,2022,11,04
224,Brilliant venue,"My girlfriend and I recently stayed here for a weekend get away. The staff were extremely friendly and couldn’t have done more to help us. 
In particular the bar and waiting staff, their standard of service was exceptional. As someone who worked in the industry for 8 years it’s always been a pet peeve of mine when the level of service isn’t up to par.  I couldn’t find any fault during our stay. I couldn’t recommend it highly enough!",5,2022,11,03
224,Great location and friendly staff!,"I recently stayed at the Clayton Charlemont for a few days during a short stay in Dublin. I can't fault the hotel. The rooms were clean, the staff were helpful and attentive. The restaurant and bar team were great. The hotel is a great spot to base yourself when exploring Dublin. I'd stay there again in a heartbeat.",5,2022,11,03
224,Quiet hotel,"Stayed there last night in Ireland 
Very quiet neighborhood 
Room was very clean 
Had breakfast; staff was very attentive 
Front deck very helpful when we asked for a TV remote since none was in the room
Able to walk to nearby restaurants",5,2022,10,29
224,Beautiful hotel in city center,"Loved the lobby, restaurant and bar and meeting rooms. Can highly recommend!
Room was spacious, quiet and cozy. Staff was very welcoming and helpful. Breakfast had many options - loved the Chia pudding and Cheddar especially.",5,2022,10,20
224,Fantastic Bar for Travelers and Locals,"Amazing Service and a great atmosphere.  A better selection than other Dublin bars for beers and good craft cocktails.

I had an excellent craft old fashioned cocktail and exceeded all expectations.  Even with the usual ingredients the bar added flavor with a  additional spray foam.  The staff is considerate of individual tastes and makes good recommendations on drinks.  14ish different beers on tap, and open late.

All of my Dublin-local colleagues are impressed with the beers and bartenders.",5,2022,10,19
224,Great hotel in a great spot,"We had a great experience at this hotel. Staff was very friendly. Beds were comfortable, food was good in the restaurant and location couldnt be beat close to lots of restaurants and bars. Would highly recommend for anyone travelling to Dublin",5,2022,10,13
224,Excellent hotel stay,"We stayed a lovely night in the hotel. Everything was amazing: Nargiz and Carl at Reception were absolutly professional, the room’s cleanliness was faultless, Restaurant staff was brilliant especially Erica, Aishling and Diana. 
The hotel is beautiful beside the Grand canal with a very nice View from our room on 4th floor.
I would highly recommend this place.",5,2022,10,02
224,Friendly staff and amazing atmosphere!,"Our stay was extremely pleasant mostly because of Nargiz who is just exceptional at making sure her guests are looked after :) She was very friendly and helpful for small needs throughout the days. The food in the restaurant was also quite good and most importantly the location was a big win as it is central and close to the city :) 
Looking forward to come back!",5,2022,09,28
224,Recommended hotel,"Stayed here earlier this year and had no issues. Excellent management and guest support coupled with clean room, great location and local amenities. Will definitely recommend to other travellers whether it is for business or touristic purposes.",5,2022,09,26
224,Irish mini break,"In between travel and spent a few days here in Dublin. This hotel has a nice quiet locale away from the fray  2 minutes to LUAS tram which we used alot with elevator  access. Right on the Canal with swans and locals walking their dogs. It's more a neighborhood  feel. The hotel staff were very kind and helpful  with anything  you need. Our room was clean and had coffee, tea facilities  with fresh water replaced daily. We did miss having a mini fridge !!! The double bed was a bit cramped for two of us. I would need to book bigger next time.
 Handicap bath was super! Well equipped  with making life easy .  Restaurant was yummy, especially  the breakfast.  Very kind staff.  Qe felt extremely  welcome.We had to pay separately  and only wish it was included  in our package like the competitors.   Overall, a comfortable  stay and would  recommend.  We like Clayton hotels and stayed in others in Dublin.",5,2022,09,19
224,Mr,"Nice hotel, clean, not noisy, central location.  TERRIBLE WIFI, the worst I've encountered anywhere in my 12 weeks in Ireland.
Drops in & out with great frequency.
Impossible to do any business here using this non wifi.",3,2022,09,15
224,Work and personal trip at Clayton Charlesmont,"I arrived at the Clayton very late in the afternoon after a very tiring 16 hour flight. I just wanted a meal and shower. Firstly I was shown to a room on the lower level (3601-3603). The room is down a passage which leads to door which leads to another passage. It is pitch dark. No window or light shining through. The passage lights up when the door is opened. It was absolutely creepy. 
Because the room is on the lower ground floor levels the windows weren’t easy to open and I couldn’t manage to. As you enter the room you are hit with musty damp stuffy smell. The bathroom is worse. Ventilation is needed. After settling in, I called for room service. It took 8 tries to get through. At this stage I was so exhausted and frustrated. The food arrived and the waiter was very friendly. Menu is very basic and pricey. On weekdays or after work opt to go out as you will find better options down the road. On the other 2 occasions I ordered room service, those calls never go through on the first try either. At least 3 attempts needed.
On Day 4 strangely there was no hot water in the shower. Lukewarm water but not hot despite moving the tap settings to the extreme. 
Throughout my 8 night stay, the tv chromecast setting did not work and despite calling the manager who tried and promised to resolve it the next day it never happened through my stay. This means you are stuck with very limited channels. Housekeeping is also very slow. I left at 10am on my free days and arrived at 2-3pm only to find my room not cleaned. I had to wait on two occasions in reception whilst it was getting cleaned. 
Overall there is no sense of urgency. Housekeeping staff, room service waiter are friendly and get things done but the managers and reception teams are slow. They don’t even greet you when walking past you. For work and personal travel I would opt in future for another hotel. I have advised colleagues to do the same. I travel for long periods and comfort is important. I question the 4 star rating honestly. Conrad, the Marlin and Hilton are good alternatives. If I stay at the Clayton again, I will definitely ask for a different room at a bare minimum. Hope they improve as there is a lot of opportunity for them with the tourism and businesses in the area.",2,2022,09,10
224,"Paid a lot for the room , but the hotel isn't worth it","Considering the cost per night, I expected more. Housekeeping didn't clean or make up our room the first day , and we had to ask for someone to come-- at 7pm. The next day, a similar experience. They came in the evening. They leave the dirty towels and trash in the hall. The more deluxe rooms require walking up several steps in an older part of the hotel (no elevator). It was odd. 
The reception staff was fine. The location is ok if you don't mind a 10-15 walk to the center/ Stephens Green.",3,2022,09,05
224,5 star Quiet hotel by the Canal,"We had a fabulous stay at this hotel. The rooms were spotlessly clean, the breakfast was amazing including a great selection of gluten free breakfast items and the staff were extremely helpful especially when we had an emergency and an ambulance had to be called. The staff even checked in with us the day after to check everything was ok. We will definitely use this hotel again.",5,2022,08,29
224,Pleasant stay at the Clayton,"Staff were extremely friendly and helpful.
The hotel was extra clean,well serviced,nice bar and restaurant with great food, the hotel has all amenities.

Location was great and close to the center, there are many pub’s and restaurants within walking distance.
My family and I wouldn’t hesitate to stay there again.",5,2022,08,23
224,Corporate Group,"For 2 weeks in a row we had 2 large group bookings at the Clayton Hotel Charlemont, the reservations team were excellent in helping with the preparations and very accommodating to all the changes we needed to make along the way. Check-in went smoothly for all our guests and everyone thoroughly enjoyed their stay. I would highly recommend the Clayton for a stay in Dublin.",5,2022,08,22
224,The best hotel i have stayed in!,"I got a chance to stay in this lovely hotel for 2 days.

The kind , sweet and amazing staff here makes this hotel one of THE BEST hotel in the area. That being said the rooms great so was the food .

I highly recommend this place to everyone you visit dublin. 

And i would love to express my gratitude to 2 of most lovely staff at Clayton i.e. Lianne and Goreg🥰💗

They always went above and beyond their way to make sure my stay was comfortable 🙂

I know I have written all good this about this hotel but trust it is that goodddd✨✨",5,2022,08,21
224,"AMAZING, THANK YOU LEANNE AND GEORG","Very helpful and friendly staff, was a fantastic experience staying here as a complete newcomer first time in a foreign country alone, did not have any problem handling anything thanks to the lovely people of this hotel!!",5,2022,08,21
224,Amazing Experience,"I recently stayed in the Clayton Charlemont with my partner. We had drinks on our first evening, and breakfast each morning and I have to complement Caoimhe from Donegal who was so helpful and polite throughout our stay, giving us lots of local tips and recommendations",5,2022,08,20
224,Perfect City Break Stay,"Beautifully kept, modern, clean hotel. Extremely spacious rooms & lobby area. Pleasant staff, enjoyable breakfast. Good location, far enough away from the hustle & bustle of tourist hotspots but close enough to walk/enjoy the tram in. We’ll certainly be returning!",5,2022,08,20
224,A definite place to stay!,"After staying in very small rooms in London and Paris, we were delighted to walk into our room at the Clayton and find in comparable to hotel rooms in the US. Very clean and professional, and always ready to assist with questions and travel suggestions. Nargiz, who was one of the front desk attendants,  went out of her way to see that we knew where we were going, how to get there, and any and all other questions that we had. She was like our personal tour guide who made us feel very comfortable in Dublin. The hotel itself is about a mile from Grafton Street/O'Connell Street, but if you don't mind walking, its a fine place to stay.",5,2022,08,19
224,"The BEST cocktail experience in Dublin, hands down","I had cocktails here and there was no request Petru couldn’t fulfil, Erica, Simone, Caoimhe and Frank provided the best services, hands down, Dublin’s hidden gem, would highly recommend to anyone visiting the city, best cocktails I’ve had in a long, long, time, maybe ever!!",5,2022,08,17
224,Deluxe Double and Single Room,"The hotel has a good location, close to the center. The staffs are very kind! The reservation staff was enthusiastic to help us solve problems before coming to check in. There is only one small problem with breakfast and they are not varied.",5,2022,08,12
224,"Modern hotel, perfect for business trips...not so good food","I stayed here for 3-4 days on a very warm visit to Dublin. I was impressed with the facilities at the hotel and the location is great. The staff is really pleasant and knowledgeable but the lunch left. a lot to be desired. 

Conveniently located next to WeWork, a pub, and the canal. There are also quite a few good restaurants in close proximity.

One complaint...housekeeping too all day to do their job and clean the room.",4,2022,08,12
224,Holiday trip,"Initially stayed 8 days then returned for 2 nights . I was warmly welcomed back by Edwardo and Narqiuz. Apart from these two, all the staff were fantastic, and extremly helpful. Thank you.
I would recommend more drawer space in the rooms. Rooms were clean. The location of the hotel was perfect",5,2022,08,09
224,Great place to stay,The staff go just that little bit extra including settings nice note with a bottle of wine upon our arrival just to make her feel at home.  Meals are great and the location is in the centre of everything.  Nothing is too difficult and there is always a yes we can do that attitude.,5,2022,08,05
224,Fantastic,"We stayed for 2 nights during 6 Nations and thought this hotel was good value for money given how crazy prices get when there is a game on!  The location is excellent and rooms are well laid out, well equipped and quiet.  Will definitely stay again when we return to Dublin.",5,2022,07,31
224,"Great Hotel, Location and Super Staff Team","Modern Chic and beautifully located beside Dublins leafy Grand Canal Really offers a relaxing weekend stay, The fact that the hotel is on the edge of Dublins town centre means that you can get away from the hustle and bustle with a Walk along the Canal to any number of restaurants.

The Staff really make it personal.",5,2022,07,26
224,Nice hotel with poor services,"The Hotel is quite nice and the restaurant as well but unfortunately what a bad service!! The first day I discovered that even if we were 3 in the room, we had only 2 towel sets and I needed to ask for additional one. Moreover, behind a towel there was a leftover from a previous guest!! The second day I got the room cleaned at 4 pm. The third day they came to clean the room at 5 pm and when I asked the cleaning guy to come back in 15 min, he first told it was ok but then after 2 hours I've discovered that he marked that I've asked him not to have the room cleaned for the day !! And when I've asked an expiation to Jelena, the person in charge of room service, she told me I needed to understand that it was a busy day.... Anyway, after that I've asked 2 different receptionists an advise on where to have dinner nearby the hotel and none of them was able to advise on a name!!! Finally, I've asked to checkout the evening as the following morning  I had to leave early in the morning and the reception told me it was not possible . After an hour I've asked the same thing  to a different reception and it was perfectly fine!
Honestly, not the kind of service and attention to guests that you are expecting from a 4 star hotel",3,2022,07,26
224,Staff A+,"This is a very nice hotel that gets 5 stars because of the staff. So helpful and so professional- from the breakfast staff to the maintenance people. The reception crew is top notch. 

Beds are comfortable and rooms are nice and modern.  

Location is ideal. Away from the hustle of Grafton but a short tram away. 
A couple of nearby pubs too for some variation. 

The restaurant food is also good - pay for the breakfast - it’s worth it. 

Look forward to returning.",5,2022,07,25
224,Fabulous Hotel,"This is the best hotel in Dublin…beautiful location, near canal and a friendly relaxed vibe.  Food excellent…room immaculate and nothing is too much bother…loved the dressing gowns and slippers and the shower was grove…excellent.  I will be back",5,2022,07,17
224,Best Hotel and Staff!,"Lovely hotel.  Very  clean and comfortable. Anything you could ask for at breakfast and more!  The bar manager,  Razman was  great.  Made an awesom margarita!  His staff (esp. Giam)  was super and  fun .  The front desk suggested a visit to the Epic museum.  Best 4 hours ever spent in a museum.  Brilliant and moving presentation of Irish emigration.   As for bilingual staff, we only speak English, but we are sure that many of their staff  (being from non-English speaking countries) were able to assist guests from other countries.   We could have stayed longer, but the tour was moving on....",5,2022,07,16
224,All in all 5,"Clean hotel in walking distance to city center - outstanding friendly and service oriented staff. Very rich breakfast with wide range varieties. The only downfall was that our room No. 148 the bathroom is too small for 2 people to move in any way - should not sell as double room. 

Anyhow very pleasant stay in Dublin with high recommendation.",5,2022,07,16
224,Best Hotel,"The hotel reservation team went out of their way to accommodate our motorcycles! The staff where extremely helpful with everything. Special thanks to Petru from the bar who is very interesting to talk to and also went out of his way to make our stay memorable.
We are three motorcycles who are on the road for three weeks already and this has been so far the best hotel with the most amazing ten !

Thank you guys",5,2022,07,16
