Location Name,Title,Text,Rating,Year,Month,Day
134,"Beautiful hotel in quiet neighborhood, but close to the Tube","The staff and service at the Bankside was what really stood out. We arrived in London from the States, and were exhausted from our flight with a 3 hour delay. We were warmly welcomed at the Bankside, given seats and offered water or a drink to check in. Our room wasn't ready, so they took our luggage, and we asked where to get SIM cards for our phones. They gave us exact walking instructions, and when we returned, our bags were already in our room. One of the super-friendly staff took us to our room, and showed us how to work the window shades, the A/C, etc. We were in a double queen room, which was large for European standards. It was spotless, and we had a welcome gift of macarons and chocolates. There were also cans of water, tea and coffee, bags of popcorn and chocolates included with the room, plus a coffee maker and refrigerator. There was a small grocery store across the street and Gail's bakery just downstairs. The bathroom was small, but well appointed with luxury towels, a rainfall shower head, and bath products. The beds were very comfortable. We asked if we could have bowls for some of the groceries we bought, and the staff immediately went and got 3 ceramic bowls from the restaurant for us to use the rest of our stay. We overlooked an overground train line, but the room was very quiet. The neighborhood was safe and quiet, but close to several Tube stations. We could also walk to several tourist attractions, which was convenient. Whenever we arrived or left for the day, the staff greeted us warmly. It was a wonderful place to stay for our time in London.",5,2022,06,23
134,Fantastic hotel,"This hotel got everything right and that’s coming from a very experienced traveler who’s very picky. The room was large and the bed was heavenly, with a feather pillow. Everything was in the right place, modern, clean, etc , etc. Nothing missing. 

A huge buffet breakfast was included. Everything was delicious. The service was especially good. Kudos to Tomas. He couldn’t have been more welcoming. 

The hotel is near the Thames, but on the wrong side of the bridge, making it a little inconvenient.  But that little inconvenience is worth staying at this hotel. 

One more thing. The staff was super. Every single person we encountered was friendly and helpful, to a person.",5,2022,06,06
134,Close To Perfect,"I've been looking for this hotel. Been coming to London for 20+ years. I'm a Marriott guy so I try and stay at a Bonvoy property. 

Firstly, the location is just perfect. You're in walking distance to the best parts of town. 

Secondly, the staff are off the chain professional without being over the top. Soon as I got out of the car, someone greeted me, asked me how my trip was, reception was casual (loved the lobby and lounge room feel). 

It just didnt feel like you were checking into a hotel. They asked me if I needed anything - and I casually said ""I'd love an espresso"". Seconds later someone brings me a espresso. 

They just nail the attention to detail. Loved the room, the tech in the room, the cleanliness of the room and all the amenities. This is the standard that all business hotels should strive for. 

When my ride didnt show up for my trip back to Heathrow, the front desk team literally had a car on the doorstep within 5 mins.

I only ate at the bar - but the food and service was excellent and the menu was refreshingly unpretentious. 

I cant wait to come back...",5,2022,06,06
134,Flawless.,"Exactly what one expects for a luxury boutique hotel at this price point. From check in onward, every possible need has been anticipated and met.

Reception and concierge are combined, so the check-in process feels very unique. While checking me in, the staff were asking my interests and checking on tours. 

I was led to an absolutely beautiful and immaculate room on the top floor. Everything in the room is automated and integrated—lighting, blinds, etc. Fit and finish are high end and gorgeous. Housekeeping is exceptional. Location is in the heart of all London’s attractions.

This is definitely the place to stay if you’re looking for a top-tier, unique experience in London. Perfect for the solo traveler or a perfect hotel for a romantic getaway.",5,2022,06,03
134,Favorite hotel in London,"Fabulous hotel. Feels brand new and top of the line amenities across the board. Loved the free carafes and sparkling water dispenser on each floor. Room was beautifully apportioned, as were the lounges and terrace. Staff went above and beyond - when they saw us coming in with takeout, they immediately asked if we needed cutlery and sent it right up. Plus a great location on the bankside. Our new favorite in London.",5,2022,06,02
134,Excellent Hotel.,"This is an excellent facility and within easy reach of places your likely to visit.

It was raining when we arrived, but the gentlemen at the concierge got us an umbrella as we were heading straight out.

He also took the time to show us where everything was, including the exec lounge.  

It was all excellent.  

Thank you - its been hard getting back to travelling post covid, this experience reminds us that we all like to go on adventures, and that we have missed travelling.",5,2022,06,01
134,Loved our stay!,"Spent 6 nights at the Bankside Hotel.   Great location and close to two different Tube stations.   We also enjoyed being so close to the riverfront walkway.   The staff was very helpful, particularly with my 80+ year old parents who joined us for the last two nights.  LOVED the water on tap  and all the amenities in the room.  Had breakfast every morning and dinner twice at the Art Table restaurant.   The street outside the hotel was very breezy - the only downside of our entire visit.",5,2022,05,19
134,Best hotel in London.,"Brilliant hotel. All of the staff from the front desk to the people working in the restaurant are so friendly.
Great location. Plenty of good restaurants and pubs close by.
Hotel is modern and comfortable. Beds are great, big nice shower. Nesspresso makers in rooms
Will definitely return and reccomend. Thank you for wonderful stay.",5,2022,05,16
134,Great place to stay in London,I stay at a lot of Marriott properties and found this to be one of my more enjoyable stays. The staff was very accommodating and knowledgeable. The room was nice and reasonably spacious. I like the way they refilled the waters as well as all included products. I also found to me the unique water service near the elevators to be a great addition. I like refilling a lot of water bottles.What I used of the restaurant I found the food to be very good. I thought it was very well located for my needs. I really enjoyed being located very near the Thames river. I would highly recommend this hotel for anyone staying in London.,5,2022,05,08
134,Wonderful Hotel,"My fiancé and I had a wonderful stay here. The staff is very friendly and helpful. The rooms are comfortable, have adjustable ac, and the bathrooms are nice. The curtains/shades are not 100% blackout though so if you need complete darkness to sleep then you will not be satisfied. The breakfast is good, I loved the scrambled eggs. Allergy info is clearly posted on buffet items. We will be back here next time we're in London for sure.",5,2022,05,06
134,Great stay with amazing hospitality,"We were at Bankside hotel in April and were wonderfully treated by the full staff. the checkin was done excellently by Soyful, who took great care in getting us what we were looking for in a hotel. Inviting us to wine hour (can recommend!!), and explaining the various amenities of the hotel and room. 

would highly recommend staying at this beautiful hotel, with great service all round!",5,2022,05,04
134,Loved this hotel!,Our room was clean and comfortable. The beds were fabulous. The bathroom was luxurious and clean. The food and service were great too. The front desk wowed my kids with a toy upon arrival. My son loved his mini cooper and my daughter loved the slinky. The location was convenient and a stone's throw from the train station and close to the tube too.  Soyful went above and beyond to make our stay nice!,5,2022,05,01
134,"Nice location, great staff, modern hotel","The hotel is modern, is in a nice location and the staff were welcoming, friendly and helpful.
I upgraded to a larger room and happy I did as the room was a comfortable size but more of what I would have expected as a base sized room.
It's located close to the Tate Modern, Shakespeare's Globe and in walking distance of the City. ",4,2022,05,01
134,Amazing!,"I stayed here with a friend while we visited London for a few days. It was perfectly located just opposite the train station and a few mins walk from the Tube. It is a stunningly beautiful hotel and within walking distance of the Tate Modern and numerous restaurants. I really enjoyed my stay, the staff couldn't have been more helpful or friendly. Will definitely be back.",5,2022,04,27
134,Excellent location & fabulous staff,"Second time I have stayed at Bankside and it is truly a next level experience - even the hand soap smells amazing. From check in to check out the staff cannot do enough to help you and always with a smile on their faces. The hotel itself is spacious, modern, and spotlessly clean. There is an excellent buffet style breakfast with something for everyone.",5,2022,04,23
134,Stellar stay at Bankside,"We stayed at Bankside for three nights. From beginning to end - everything was excellent. We were taken care of by great staff, from all the receptionists to F&B and Housekeeping. Especially Soyful made sure all details were in place and his personal approach made us feel right at home. The location is AAA, with trains one minute away and all sightseeing available within walking distance. We would highly recommend and would definitely stay here again.",5,2022,04,23
134,One of the best,"From the moment you walk in to the lobby area you know you’re going to have a great stay.  I’ve been fortunate enough to have stayed in some pretty amazing hotels across the globe but this is one of my favourites.  Why? No. 1 reason has to be the staff. I love the reception set up where they all sit as a grand table and whilst you’re checking in you feel like one of the gang,  My daughter and I had room 508 which was a lovely corner room.  Most luxurious and comfortable bed and some lovely furnishings to the room.  We ordered breakfast in bed from the room tablet and it was delivered hot and accurate to order on pretty swift timing.  Totally loved this hotel.  We deserved 5 stars!",5,2022,04,10
134,Truly a gem!,"Truly can’t say enough about this beautiful hotel and the people who work there. We visited for 7 nights and it was the first time ever that we’ve wanted to stay in a hotel longer! Normally, by the 5th night, we’re eager to get back home to our own beds, but this place is really a gem. 
We’re a family of 5 with 3 kids (14, 13, 11) and had two connecting rooms. The rooms were lovely, modern and comfortable. And for London, very spacious! We arrived at the hotel after a long (delayed) flight and we’re greeted even before getting out of the car by the loveliest two men who helped with our luggage. Every single hotel employee we encountered were just so kind and friendly. The breakfast every morning was delicious - a huge variety, from eggs, hash browns, sausage, cereal, fruit, yogurt, meats and cheeses, pastries. So good! I wish I had gotten the names of the wonderful servers that we saw every morning who made an effort to talk to us, smile and remembered our tea/coffee preference. 
We were a bit hesitant to book a hotel on the “other side” of the Thames, as we’ve always stayed in the Kensington area, but we were so close to the Underground (Blackfriar’s is only a 5 minute walk across the bridge, and it’s a nice, calm, clean station) and we loved the area we were in. 
Favorite “cool” feature of the hotel - the water station outside of the elevator, with glass bottles we could fill with water for our room. So clever and convenient! 
Wish we could give this hotel more than 5 stars. One of the best hotels we’ve ever stayed in!",5,2022,04,06
134,Wonderful anniversary,"Staying here made our 4th wedding anniversary extra special! Thank you to all the amazing staff!! Thank you especially to Soyful and Richard for making our stay amazing! The poem on the card was so beautiful, we’ve taken it back to Canada with us!
When we’re back in London, we’ll be staying again!
Thanks so much!
Candice & Christian",5,2022,04,05
134,YOU MUST STAY HERE!!,One of the best hotels I have ever stayed at. The front desk staff are so helpful and go over the top to make sure you have everything you need. Can not recommend this hotel enough. Will definitely be coming back. Great location! Short walk to Blackfriars tube station.,5,2022,04,03
134,This Place is a Gem,"Just an amazing property from top to bottom.  Just returned from a 3-day business trip and this will be where I stay from now on in London.  Exceptional service, great attention to detail, cool vibe.  The rooms are certainly not over the top (with small bathrooms) but this hotel is really about the staff and level of service.   Top notch in all respects, and in a great location.",5,2022,03,25
134,10/10 Hotel,"We had a wonderful and we really enjoyed everything about the hotel. 
The location is great, the hotel is superbly furnished and the style shows exceptionally good taste. The staff was extremely courteous and incredibly personable.",5,2022,03,23
134,Just beautiful!,"Just beautiful! We had the most wonderful weekend. The only bad thing about out stay was that we had to leave and go back home at the end. There was not one member of staff that didn‘t make us feel at home and welcome. Reception, Housekeeping, Bar and Restaurant, everyone really enjoyed what they where doing and we loved out time. You wont find a place like this a anywhere else. We cant wait to come back.
Love x",5,2022,03,22
134,Restaurant review,"I rarely leave reviews but we received such kind, attentive service from Tamas in the restaurant and thoroughly enjoyed a very tasty lunch. Very impressed how he remembered what we had ordered from one day to the next and always brought a welcoming word! Great food, nice atmosphere and excellent service. Highly recommend!",5,2022,03,09
134,Great time in the heart of london,"I had a great time staying at the Bankside hotel last week, the hotel was lovely, great location by the river. The rooms were clean and staff were helpful. James on the front desk was great, he recommended some great restaurants and knew his way around london. Will be staying again",5,2022,03,03
134,Best Hotel in London!,"Had an amazing weekend with my gf for her birthday. The staff made a huge effort to make the stay extra special, they filled the room with balloons and even made a handmade birthday card! James on reception was very helpful and gave us some great recommendations of things to do and the best places to eat. The room was perfect and the art throughout was amazing! I can't wait till my next stay.",5,2022,03,03
134,Best hotel staff EVER,"Best service I’ve ever experienced from a hotel! The staff are a testament to the hotel and Marriott group. Looked after our party and ensured we had a perfect stay. So friendly, hospitable and make you feel like family. Will always be my go-to hotel when in London ❤️",5,2022,03,01
134,We had the best hotel stay that I have had in ages!,"I would like to rate this hotel 10/10.

 I never normally write reviews but on this occasion it would feel wrong not to.  My husband took me to this hotel as a romantic break and I could not fault it. The staff were so genuinely friendly, helpful and kind. The rooms are really comfortable with lots of nice tea and coffee (we also appreciated the free minerals water taps on each floor). The best was possibly one of the most comfortable I have ever slept The restaurant it great and the breakfast was so delicious.   I really love this hotel and I cant wait until we go and stay there again.",5,2022,02,21
134,Perfect stay at Bankside - can’t wait to go back,"Just stayed with a friend at Bankside for a birthday weekend in London and we honestly couldn’t have asked for a more perfect stay. The hotel is beautiful and our room was lovely - we had high expectations after reading the reviews but it was still somehow even better than we’d imagined.

The staff were so friendly and accomodating - Soyful at reception went above and beyond to make us feel welcome and make sure everything was perfect for our stay, and the other staff members we met around the hotel were just as lovely. The service at the bar and for breakfast in the morning was 10/10 - we both had the avocado on toast with poached eggs and they were delicious.

Can’t fault this hotel or it’s lovely staff - thank you Bankside for a 5* weekend. We’ll definitely be going back very soon!",5,2022,01,30
134,Excellent Hotel and Great Customer Service,"We stayed here for a long weekend after reading positive reviews.

Cannot fault this lovely hotel at all. 

The staff were welcoming, friendly, and go the extra mile.

The rooms are clean, quiet and stylish.

The location is an easy walk to many London hot spots - Southbank, Covent Garden, Westminster.

The restaurant food was delicious (Fish and Chips) and reasonably priced.

We'd happily stay again on our next visit.",5,2022,01,24
134,Weekend stay,"From the moment we arrived in the early afternoon the reception team set the tone for the weekend, the smiles and friendly welcome made us feel at home.
The hotel is unique and superb throughout, spotlessly clean everywhere, the bar and restaurant are great spaces and most comfortable, our room 407 was superb, great space, huge shower room and commanding views over St Paul’s and the city. 
What makes this hotel a cut above the rest are the staff, attentive, smiling, professional in every way
All in all a superb weekend in a perfect hotel.",5,2021,12,13
134,"Incredible team, fantastic environment - my favourite in London","This place is where I want to be when I am in London. The staff is so kind and genuine, making you feel safe and at ease. The design of the rooms is spacious and practical, the architects must have worked closely with the operations team to reach such a level of comfort.
The feeling of being in an art gallery is there and having a latte in the lounge is so cozy. I definitely recommend this place for romantic trips, for work or leisure purposes. Fantastic front office team, thank you to Soyful, Richard, Aida and Viktoria for their warm welcome.",5,2021,12,09
134,Yet again Fabulous,"After lots of, unavoidable, cancelations we finally got our weekend in London staying at one of our favourite hotels.  It was so nice to see that after all the closures and problems this place is still as fantastic as before the pandemic.  We had a wonderful room that was so comfortable and spacious.  Every little details thought of from the slippers to the tea cups.  Extra clean with bacterial wipes provided if you so wish to use.  And the staff, well second to none.  We were struggle to get to the hotel and then park due to so many road closures as there was a parade we didnt know about.  We rang the hotel when we were close as couldnt physically get to any of the car parks we had found.  They directed us to them and then by luck found us a spot outside and stood there till we managed to turn around and get to them.  It was fantastic.  Check was a smooth as always and they advised us re their breakfast offers for the next morning.  We all decided to book and what a great decision.  It was excellent in quality, quantity and again service.  We also had a night cap in the bar when we came home the night before and again the staff were impeccable.

We had invited some friends to come with us this time and you always worry that its up to the standard that is was before.  They assured us that they also would return without question as the best they had stayed in in London.  PHEW!!

Its not the cheapest hotel but by far the best value for money in regards to what you get.  Some more expensive hotels can feel quite stuffy or business like but this one is most definitely not either.

We cant wait to return again next year.

Thank you to all at the BANKSIDE.",5,2021,12,08
134,Wonderful Team,"My wife and I stayed in Bankside to celebrate our Wedding Anniversary. 

We were blown away from the moment we entered the hotel. 

We were a little lost so a blonde chap approached us and helped us into the hotel. The hotel has its in scent which is very calming as you enter. 

We were greeted up Aida and Sara who effortlessly made us feel comfortable and when we told them it’s our Anniversary, Richard suddenly appeared with two glasses of champagne. My wife was just blown away. 

We stayed in a spacious room overlooking the bridge. The room is a good size for London and has everything you could possibly need for a short trip away from home. 

The breakfast offering is perfect and the team especially Jamie are very warm. We didn’t have dinner there as we had plans. 

This hotel is very different in terms of style and staff. It’s very arty and the staff feel like your friends and seem happy to be working there. Top marks to the GM there. 

We shall be back and thank you for a great stay!",5,2021,12,05
134,Bankside Hotel is an Amazing Hotel in London,"This is an amazing hotel. It was very comfortable for my stay in London. The front desk staff were very nice. Room was always very clean. As a gold Bonvoy member, I got upgraded to a Spacious room which was awesome. Will definitely stay here again!",5,2021,12,04
134,Fantastic 50th celebration,Fantastic stay for my dads 50th birthday. The manager and team couldn’t do enough to make it a special evening for my family. The atmosphere and location was perfect -we look forward to staying again soon- thanks again.,5,2021,12,03
134,Great experience Bankside,"Lovely hotel across the Thames in Bankside. We were a family of four in one room with two beds. Not a lot of extra space, but very well done. The beds were extremely comfortable, the amenities nice, they had a water bar on each floor. The staff was very friendly. Especially Victoria! Coffee bar in the lobby and excellent cocktails at the bar in the restaurant. There is a Gail‘s coffee shop in the back of the building and a pharmacy across the street if you need to get your Covid test for your flight.We walked into town and also took the tube, which is quite close by.",5,2021,12,01
134,Fantastic Stay,"Upon entering the Bankside you are greeted by friendly staff who make you feel at home. We were offered coffee and help with our bags. The scent that is throughout the vents in the lobby was amazing, would love to know where to find that. Lobby is bright modern and beautiful!

Rooms were spacious and bed was extremely comfortable. Usually my stays in Europe are on small rock hard uncomfortable beds. These made it hard for me to get up in the morning they were so great!

Breakfast was full of options and delicious, plenty of pastries and warm buffet options. Also beautiful comfortable and modern decor!

Water fountains on your room floor came in handy to refill and reduce plastic waste, loved this!

Location was right next to the Blackfriar underground line. Plenty of sights to see right by the hotel, 15-25 min walk to the tower bridge, covent garden, London eye and Westminster bridge.

Each member of the staff was beyond helpful and went out of their way to make me feel at home and comfortable. 

Highly recommend staying here, would absolutely stay here again. Thanks for such a great experience!",5,2021,12,01
134,Loved the Bankside Autograph Hotel!,"This was our 3rd London Hotel on this trip and by far the very best! Beautiful modern hotel in Southwark and close to Blackfriars Bridge. 

Everything was new and wonderful, everyone was so kind and helpful. Especially Richard and Aurora. They went out of their way to make sure we had all that we needed. 
We will most certainly return to stay here next time.",5,2021,11,30
134,Amazing experience!!!!!,"WOW...What an amazing stay we just had.  The staff is just outstanding and made us feel so welcome we didn't want to leave...Always used our names and made us feel so special. The room was fabulous, bed super comfortable and the view amazing.
We can't wait to come back.
Thank you to all the staff.",5,2021,11,29
134,"Expensive, but kinda worth it.","Stayed here for work, otherwise it was too expensive for my taste.  I debated on giving it four stars, but after we switched hotels, it was definitely five stars.  

Let me first say the service was exceptional.  Everything from the initial greeting and check-in to the promptness of the service (we requested ice and other items).  If it were not for the staff, I would have given this four stars. 

The rooms were nice, shower was a walk-in, loved it.  Very Eco friendly hotel.  The only thing disappointing was the restaurant.  It wasn't my style and breakfast was expensive.  You would think that some sort of breakfast would be included.   But the service in the restaurant was also exceptional. 

If you can afford it, stay here.  Totally worth it.",5,2021,11,28
134,Beautiful Hotel in Excellent Location,"I would recommend this hotel to anyone.
Super relaxed atmosphere, amazing decor, lovely gym space. The room was modern and comfortable and the art is fun and different! The staff are so helpful! 

Great location for south bank and young Vic theatre!",5,2021,11,26
