Location Name,Title,Text,Rating,Year,Month,Day
21,Would deffinately stay again,"Staff all very friendly. Breakfast was first class. Thought they could have given water each day in the room but only offered free on the first day. Prices for the options within the mini fridge were far too expensive. 7 euros for a very small bottle of coke. 10 euros for a palm size bar of chocolate.
Staff could not do enough though. Rooms cleaned each day any issues sorted. If you require drinks go the little bar on the opposite corner. Very cheap.
Would stay again",4,2023,07,09
21,Excellent hotel with great staff,"Rooms were excellent and clean.
Spa was amazing as well. Staff always helped with sight seeing. Me & my wife wanted to do a tour of Barcelona stadium the concierge helped with this. Truly 5 star hotel.",5,2023,07,08
21,Great find,"Lovely hotel, classy and immaculate. Not overly fussy. Great location and good to be away from the hub bub of the Ramblas. Great transport links and close to the metro station. Easy to get around. Staff were attentive and the concierge gave us lots of great tips for dinner and travelling around the city. Close to El Corte Ingles and another very large shopping mall. Great resturant in the hotel and a cafe which serves only gluten free food and pastry. Worth a try even if  you are not staying at the hotel as the coffee was lovely. ",5,2023,07,05
21,"Horrible Experience, Ruined my Laundry and not Customer Friendly","The hotel housekeeping ruined my silk shorts and emailed me that their insurance company will reimburse me and after providing them what they requested they ignored all emails with no response until now! In addition, they are not customer friendly, their bedrooms are dark and when asked for extra lighting they didn’t seem bothered to even accommodate. We had multiple rooms booked and one of them was empty, when asked to get a light from one of the other rooms they said that room is occupied and I explained that is one one of the rooms under our booking and they just didn’t want to help. I’m shocked that this is a Hyatt branded hotel. The fact that they’re not even replying to my follow ups regarding reimbursement shows how horrible the hotel is.",1,2023,07,03
21,Actually 5 stars BUT!,"Really good hotel! We have chosen the Sofia mainly for its infrastructure like amazing pool and gym. Totally worth the price.
Important for us to highlight the hospitality of Daniel poolside, whom we already knew from the W Hotel. 

Down side:
Location, far off the beaten track
Late check out policy: 25% of room price for 1 hour, 50% for 2 hours and full price after that (300€ in average) !!   Although room had been booked as a member",4,2023,07,02
21,Awesome!!,"This was our first trip to Barcelona. We were looking for a quiet hotel with nice amenities. Hotel Sofia went beyond our expectations!!! Very clean and quiet rooms, the staff was extremely friendly, welcoming, and helpful. I would also recommend spending a few extra bucks for the hotel’s breakfast. 5-Star quality. We will definitely stay here again!!!",5,2023,06,27
21,"Sofia Hotel, Barcelona","Amazing hotel, you will not be disappointed! Stylish, beautiful hotel, everywhere was very clean and well looked after and staff were  very friendly and helpful. Breakfast was out of this world! Will definitely return. ",5,2023,06,26
21,"Incredible staff, impressive property, delicious food","I recently stayed at Hotel Sofia for a personal vacation with my husband for our first time in Barcelona. I was extremely impressed with the staff’s attentiveness, accommodations, and attention to detail. It was better service than I have had in a long time. The hotel has everything you need: multiple f&b options, a pool, gym, and spa (we took advantage of it all). Not to mention, the rooms were impeccably designed. I loved my experience here and would recommend to anyone looking for an elevated stay in Barcelona. One of the nicest hotels we have stayed in. Thank you Hotel Sofia staff! ",5,2023,06,22
21,Beautiful Property - quick access to L3 train,"We wanted to stay at a more modern property and chose Sofia even though it was a bit further from the areas we visited.  Nevertheless, the hotel was well staffed, well trained and beautiful.  The amenities were top tier and would love to go back there.  The L3 train was a 5 minute walk from the hotel and took about 25 minutes to Licea station.",5,2023,06,20
21,Near Perfection,"This hotel is beautiful. The amenities (gym, pool) are top-notch. The bathroom in our room was stunning. Very large and well-designed with a standalone tub, high-end toiletries, and a massive shower. The bed was super comfy. The only issue we had was the TV would not allow streaming (like from Netflix or Chromecast). The staff at the front desk was amazing, and the breakfast was one of the best we've ever had at a hotel. Lovely visit!",5,2023,06,20
21,Very highly recommended,I have been staying here since over 25 years. They renovated the hotel. Excellent condition now. The rooms are renewed. The beds are very comfortable. The bathroom is spacious and classy. The personnel is very friendly. The front desk young lady Julietta was very welcoming and let us feel like at home. Very well trained. The breakfast  buffet was rich and had many varieties. I very highly recommend this hotel. Excellent value for the prize.,5,2023,06,20
21,Beautiful hotel but not central,"The Hotel itself is beautiful and everything fitted to a very high standard but it does have its flaws.
We were in a Harmony room or ‘standard’ ad I was informed by reception.
The room was light spacious, very comfortable bed and pillows however I felt lacked drawer space , yes there was shelving in the wardrobe but only 1 drawer which for those traveling light like us was ok but not for those needing more storage.
The pool area is lovely but the day we decided to have a relaxing day we could not get any sun beds and people were laying on the floor on towels !  I felt it didn’t cater for the amount of people wanting to relax.
On a positive note, the staff were very friendly, courteous, attentive snd worked very hard.
Although not a central hotel the metro snf taxis are easily available big I don’t think this would be my first choice of hotels to stay if I return .",4,2023,06,17
21,Bad status recognition for World of Hyatt members,"This hotel's upgrade policy is really stupid. Arrived, the gentleman at check-in said ""sorry there weren't any suites available to upgrade you to"". Previously, I always had sort of a suite here, with a very large bathroom, and the bed was pretty big, too. The room they gave me this time (which was supposedly an upgrade) was very small and dark. (I'm a World of Hyatt Lifetime Globalist, but neither they nor I ever mentioned my status explicitly.)

Quick look at the app, two types of suites available, called First Wish and Great Wish or something like that. So I went to the front desk and said can't you give me one of those rooms? Made me wait for ages to talk to the ""supervisor"" who was (wo)manning the WoH check-in and dealing with another complaint.

Then she says, no, we have no suites available. I said, but there are these suites? (the price difference to them wasn't even very big from what I had paid). She goes ""no, they are not suites"". lol? ""But they are 'wish'""? I asked, what is ""wish""? She then said she could give me this type of room if I paid 200 Euro extra. But she couldn't really explain what it was. I said if I can book it if I pay the difference, why don't you upgrade to them? I get it, their policy seems to be to only upgrade to whatever the lower level of suite categories is. But she was so clumsy about explaining it, said, Hyatt tells us that's what we must do, etc. blabla. Way to unnecessarily frustrate a returning guest.

Anyway, I said thanks, but no thanks, I'll go somewhere else - she was kind enough to cancel my reservation without a penalty (supposedly, let's see if there will be a charge).

LHW it is for this stay, and I'm done with this hotel.",1,2023,06,16
21,I’m pleased,"We had 7 wonderful days at Sofia. Great location only 5 min walk to metro station. 5 min walk to great shopping. It took about 15 min to get into the city centre. After being in the city, we really enjoyed getting out where there was more peace and quiet. 
Only thing that was a bit down. The weekend at the pool turned in to kids hell. I have kids my self. How ever I respect that people comes to relax. There were way to much noise from little kids, where the parent dident have a look at them. ",5,2023,06,16
21,Exceeded expectations,"I almost reconsidered booking this hotel because it wasn't that close to the areas I planned to visit and I'm so glad I didn't. The hotel is very modern, high tech and clean! We had a ""sphere"" room and it was awesome! My husband still raves about the shower!  We took advantage hotel bar, coffee shop and spa which were all phenomenal. To top it off, they provided us with great customer service and all the recommendations the concierge had were fantastic. I'm definitely looking forward to going back!",5,2023,06,15
21,Wishing I stayed longer than a night,"Excellent customer service -  rooms may be on the smaller side but modern and practical,   Gym was great as well as pool area.   Everybody very friendly and proactive.   Askef for a higher floor room and was offered an upgrade.  Asked for a check out at 1 pm and was offered a 2 pm one.",5,2023,06,12
21,"Property is great, Staff is not","My stay at Hotel Sofia was moderately pleasant. The facilities are clean, spacious and modern. I recently spent 6weeks traveling around Italy so my view may be skewed in comparison but the service was very mediocre. Staff, will not even greet you, if you dont say anything to them first. I found the staff minimally cordial and almost rude. Its not a place I felt very welcome and every inquiry was met with very curt responses. My stay wasn’t horrible enough to cross Sofia off my list completely but I honestly would only stay there again if I needed to be close to something in the area. ",3,2023,06,11
21,Nice stay,"Quite comfortable room. Really functional, I donde miss anything really. The cleaning service above expectations and very friendly. The shower one of the best i have experienced, may make me come back only because of this.",4,2023,06,09
21,Will not be returning.,"Context: I am a globalist member of Hyatt who stayed with the hotel for 7 days, globalist benefits met expectations, did not exceed. SUA was used.

Pros - 

Fantastic Hard Product, really nice physical hotel. Great beds.
Room service was top notch, did a great job cleaning room every day. 

And thats it.

Cons - 

Horrible location.

Had an 80 minute massage treatment. Was initially at 6:30P, they called us at 6:15 and pushed it back to 7:30P. When we got there at 7:30P, one of the masseuses arrived late and was sweaty and huffing and puffing the first 15 minutes of the massage. Not exactly soothing. Massage began at 7:40P and ended 70 minutes later. Got stolen 10 minutes. Since the massage was at 7:30P and ended at 8:30 they refused entry to the spa after, pretty much just kicked us out of the floor after.

The massage itself was extremely uneven in pressure and very painful. Was never asked if the pressure was good. Wife had radiating neck pain for 3 days following.

As compensation hotel gave us 20% off the treatment and offered us to return to the spa without paying their 35 dollar charge the next day, but after this we had zero desire to return.

The manager we spoke to was very dismissive and seemed to act like we just wanted a freebie but it wasnt about the money, it was about the negative experience.

We ordered room service one night and the pork rib dish came and was a pork shank not ribs. I was hungry and ate it anyways. That night I projectile vomited. I was sick the entire next day. It is the only thing I ate that my wife did not, who was fine, so it was definitely the pork.

The breakfast was free due to status which was overall mediocre. Not bad but definitely not good. My wife did try to bring a bottle of water up to the room from breakfast one morning and a male member of staff rudely yelled at her which put her in a very poor mood for the day. We ended up skipping breakfast many days as we felt wed rather pay for a better breakfast outside. 

We asked for a bottle of water to be sent to our room as out globalist water was finished, as I had been puking the night before, and the hotel staff reported we would have to pay. Wow. For water.

Some of the taxi cab employees were very good. Some of them were not very good and would not follow proper line order when calling cabs for people. They do not address you unless you address them first which is not how a hotel should function. 

All in all this hotel was horrible for us",1,2023,06,06
21,Not a good location for tourist - unless you are a football fan,The hotel is quite modern and generally quite pleasant but it is not within walking distance of the main tourist attractions in Barcelona.  The hop on hop off bus stop is only 2 min walk from the hotel but it takes the bus awhile to get to specific tourist spots.,3,2023,06,06
21,A Good 5 Star Hotel in Barcelona,"This hotel offered a very high standard of quality for our business trip. The rooms were spacious and clean. Good use of technology for lighting, air con and black out curtains. the bathrooms were clean and spacious. 

The Bed was very comfortable and space in the wardrobes and cupboard met expectations. 

The staff at check in were diligent and communicated well. All staff presented themselves to a high standard throughout the trip. 

The improvement areas have to be:

The lifts - A poorly designed system and not a good use of technology.
Ironing Board - Needs to be in the room
  ",4,2023,06,05
21,Beautiful,"Absolutely gorgeous hotel. Very modern decor, the room had all push button features. The breakfast was unbelievable. The omelette chefs needed a little more training on presentation and presentation, but they were young. ",5,2023,06,04
21,Spoiling a special occasion,"My Wife and I decided to holiday in Spain for her birthday.

Prior to arriving I reached out to the hotel to ask if they could help me arrange some flowers a cake, some candles and to decorate the room with some balloons. All of which I was happy to pay for in order to make the occasion special for my wife.

I was sent a catalog to select from. I mentioned that my wife hated red roses so any other colour would do. I also selected and cake. I was later told that the cake I wanted was no longer available so I had to select another one. Slight issue as the limited options had nothing which my wife would like, but I ordered one anyway because at least she could have a cake with candles for her birthday. 

The morning of our checkin I received an email saying that the flowers hadn’t arrived so they had placed a bouquet of red roses in the room. They very colour which my wife despises!

When we finally got to the room there were 6 cheap balloons placed on the bed. This was a sad, sad, sad birthday arrival.

I’ve been to hotels before where they filled the room with helium balloons and they went out of their way to make a special occasion. Not the people of the Sofia though. 

Worst of all, no candles with the cake. No none of my requirements were followed and I had to pay for this tragedy!

I would have gladly paid extra to avoid a sad birthday",1,2023,06,03
21,5 Star Excellence in Barcelona,"I stayed for almost one week to attend a conference and also too a couple of day to explore the city. The overall friendliness of the staff was excellent. The hotel was in superior condition and well maintained - rooms were comfortable and quiet, food was also very good. I would stay again!",5,2023,05,31
21,Perfect for our needs,"We needed a place to stay for one night after getting off a cruise in Barcelona.  This checked all the boxes.  We were thrilled we were able to check in early.  Hotel staff is exceptional.  Friendly and helpful from the first moment arriving.  Clean, modern, and comfortable.  All interactions were top notch. ",5,2023,05,31
21,Loved absolutely everything about this hotel!,"From my entrance, until I left, loved every minute spent here, tried the spa and other areas and loved how clean and how well I got treated by the staff. Can’t wait until I come back here to stay for more days. My room looked the same as in the picture, I stayed in the ""sphere"" and it’s absolutely gorgeous! ",5,2023,05,24
21,Hotel Sofia Barcelona,"Loved this hotel. Beautiful hotel with a nice, clean room and large bathroom. The breakfast was expansive and delicious. Hotel staff was very responsive to my needs. Definitely will stay there again when returning to the beautiful city of Barcelona.",5,2023,05,16
21,Extraordinary Service and Beautiful Hotel,"We stayed here for two nights before our cruise and it was a great choice! The service is extraordinary and the hotel is beautiful. There are plenty of bakery’s, coffee shops and eatery’s within walking distance. The soccer stadium is also within walking distance, along with a park to walk through. It’s about a 24 minute taxi ride to old downtown and Gothic Quarter. We will stay here again.",5,2023,05,14
21,Excellent hotel with wonderful staff,"We had an amazing stay at this beautiful hotel. Everyone we contacted for any of our needs or questions was great at helping us!
The room was comfortable and clean. Room service had good food and service. And everyone at the front desk and door was incredibly helpful!",5,2023,05,10
21,Hotel Sofía exceeded every expectation,"This hotel was modern, clean, and the service truly set it apart. 

Check in with Bruna and Julieta were amazing, welcoming, and set the tone for our entire trip with their warmth and professionalism.

Nacho in Bar Sofia was absolutely incredible, and we had some of the best cocktails we’ve ever had (saying a lot coming from Miami with excellent bars and restaurants). He was truly one of the highlights of our trip!

Isaac from concierge set up the most memorable meal we’ve ever had, helped us set up our taxis, gave excellent suggestions, and took the stress out of our planning. He was a huge part of our wonderful anniversary. 

Everyone we encountered from beginning to end went above and beyond to make our stay unforgettable. Thank you Hotel Sofia staff! The hotel is gorgeous, but the people are what make it unforgettable ",5,2023,05,09
21,"Luxury, safe and reliable property","Highly recommend this property for your stay in Barcelona. We were concerned about the distance to the city but my wife and I got very comfortable with the metra and bus systems which were very close to the hotel to take into the city. Hotel is also great at requesting taxis for you. Overall, rooms were luxurious, bar was wonderful and spa services were great as well. It was also in a safe area so we didn’t have to worry about pickpocketers in the surrounding areas at night. ",5,2023,05,09
21,Great welcome,"A fantastic and wonderful hotel, 
The service was good, friendly and charming.
A special thanks to Briana and Xavi who went extra mile for a tourist to find good locations for dinner and shopping.
The location was perfect , walking distance to malls and shop. Rooms were luxurious.
Will stay again in this place on my next visit",5,2023,05,09
21,Stole my Jewelry,"This trip was ruined by staying at this hotel, although the staff has been great at dealing with the situation the fact that a hotel staff member stole my belongs while in my room is unacceptable. I wouldn’t recommend this hotel to my worst enemy because of this.",1,2023,05,08
21,Short stay,"This hotel is perfectly placed within a ten minute walk of the Nou Camp, and has excellent public transport that surround it to easily get into the centre of Barcelona. 

The staff were very helpful with any requests made, and always responded quickly to any requests I may had. 

",5,2023,05,03
21,Excellent hotel,"Having stayed in many hotels this was my first experience of a Hyatt hotel and I must say it was an excellent experience. All the staff showed great care and attention to detail and I thank them all, but to Albert who helped us check in a particular thank, he was an excellent first face of the hotel.",5,2023,05,02
21,pleasure you can't measure,"very friendly staff helping with any kind of need you might flag; good location; excellent quality of breakfast and overall food & drink offering; clean and comfy rooms of the highest standards; bottom line, higlhy recommended",5,2023,05,01
21,Exceptional property and service,"Despite being Accor Diamond members, the Sofia has become our Go To fave property in Barcelona over the last two years. Adore the decor, everything thought of in the rooms, and the service is absolutely faultless. Came for a big match at the Nou Camp, keep coming back as often as we can",5,2023,04,30
21,Lovely boutique hotel and excellent staff.,Lovely boutique hotel. The staff is very friendly and attentive. Excellent food and beverage. Convenient location and easy access to taxi service. We had an excellent meal in the restaurant. The bellmen were very helpful and caring. ,5,2023,04,29
21,Barcelona2023,"Couldn’t recommend enough! Could not fault one thing about it! Amazing large rooms, very modern, staff took attention to details. Taxis are fast and easy. Will definitely be returning here next time! Thankyou for a lovely stay it made our trip in Barcelona:)",5,2023,04,28
21,Great Stay !!!,"What a great job with the renovation ! Super hotel with super service !
We enjoyed our stay and will visit again.
Close to camp nou close to the subway to visit the city.
Very close to Corte Ingles where you can find a supermarket en lots of shops.

We will visit again !",5,2023,04,26
21,A modern hotel with a lovely pool in a quiet area,"Hotel SOFIA Barcelona is a lovely hotel in a quiet area in Barcelona.  The pool area is great with attractive plants and a bar.  There is a great casual restaurant, Philosofia, where you can get wonderful coffees, light food and pastires.    I didn't make it to IMPAR, the more formal restaurant, but the menu looks great.  You can also walk to the SantaGloria cafe for coffee and breakfast.  We enjoyed our stay!",5,2023,04,25
21,The Best Hotel in the World!!!,"I lived at the Sofia for several months. I've stayed in the best hotels in the world and am an owner of several hotels myself and never came across a staff as spectacular as the SOFIA. I would live there if they had the option. They should condo the place, I'd buy a suite a second.",5,2023,04,23
21,great service and wonderful nights,"great service and wonderful nights, I'm willing to stay again once I come back to Barcelona.
Food was good, Room was nice and the front desk people were nice.
and the location! I could go anywhere with taking just one bus or subway.
all in this hotel was good enough to attract people.",5,2023,04,23
21,Good business hotel,Located in the university and business area it is not near the really nice tourist areas of the Rambla.  Not a lot of choice of nice restaurants and shopping. Found the room corridors and room itself dark due to choice of lighting and wall decor.  Bed was very comfortable.  This is a good hotel for business but not for walking tours of old Barcelona.,3,2023,04,21
21,Wonderful Hotel in Barcelona,"Hotel Sofia has very Gorgeous Decor, Great Location, and Great Bell People and Travel Associates. Their Spa is Great. I would Recommend to Anyone traveling to Barcelona. It does need some work on accommodating Guests",4,2023,04,18
21,Prefect 5 star hotel in the center,"Outstanding hotel , very trendy , great service . Elevators don’t work between floors with rooms , need to go downstairs to the lobby before heading to another floor with rooms . Staff is very friendly . Early check in available . This is not a boutique hotel, it’s huge . Has a pretty good restaurant inside and a cafe . Location is perfect. Concierge was best helpful. 
Would definitely come back.",5,2023,04,14
21,Wonderful hotel,Everything about this hotel was wonderful. The staff were extremely helpful. The room was comfortable and well kept easy walking distance from a number of metro stairs . Very close to camp now Highly recommended ,5,2023,04,12
21,Excellence in every sense!,"From the moment we arrived our expectations were exceeded. As avid travelers, my husband and I spend quite a bit of time in hotels and Hotel SOFIA is nailing it. Everyone was so helpful and hospitable and the premises were absolutely stunning. We can’t wait to return! ",5,2023,04,11
21,Bad experience,"Young man in the parking lot, very rude. He doesn’t want to help me out to find the ticket machine, refusing to speak English (“solo espanol). And very angry speaking to me with aggressive attitude. After some time, other guy from inside office appears and ask him and reply me.",1,2023,04,10
21,Excellent experience,Great property though slightly away from city center but well connected with metro. Staff at the property is helpful and all request are promptly attended to in the shortest time possible. I’m e of the better properties under Hyatt chain.,5,2023,04,09
21,Up to standard...,"Spent 3 nights in the hotel...
Location: 20 min ride to downtown, 20 min to the airport. 
Not too much to see within walking distance however pleasant area for taking walks. 
Reception very professional and helpful.  
Rooms are spacious, modern, high tech and overall comfortable. 
Amenities as usual, nothing additional.
Breakfast very descent and with good variety. 
Bar & coffee shop as expected.
Overall, a good experience. ",4,2023,04,01
