Location Name,Title,Text,Rating,Year,Month,Day
134,OUTSTANDING!!!,"The total experience totally exceeded my expectations!  The reception desk staff,  Laura, Kasha, Sebastian, Manual and Mohammad were warm, friendly, knowledgeable, patient and accommodating EVERY time there was an interaction!  Housekeeping staff and restaurant staff were the same. Food was great and entire hotel clean and hygienic!  A must stay conveniently located hotel.  OUTSTANDING!!!",5,2024,10,18
134,Fantastic Stay with Exceptional Service and Memorable Breakfast,"We had a fantastic one-week stay at Bankside Hotel in London. From the moment we arrived, the staff were welcoming, and Mohammad, the assistant manager, provided outstanding service throughout. He was attentive and made sure we had everything we needed, which really made our stay that much more enjoyable.

One thing that really stood out was the breakfast. It’s not your usual buffet offered at Marriott hotels. Everything was fresh and well-prepared, and the variety was impressive. The poached eggs and artisan breads were a highlight, smoked salmon spread was super fresh, and it felt like a lot of thought went into the quality and presentation of the food. Definitely one of the best hotel breakfasts I’ve had.

The hotel itself is modern and comfortable, with rooms that are well-designed and spacious. The bed was super comfortable, and the bathroom was clean and stylish. The location is also very convenient, making it easy to get around and explore different parts of London.

We had a great experience and would definitely stay here again.",5,2024,10,17
134,"Welcoming, Cozy, Ideal Location","What a wonderful experience from start to finish. We were warmly welcomed by Kasha, a charming and inviting person and fantastic customer service representative. Kasha was a great resource for everything, from navigating the city to choosing the best restaurants. She made us feel very much at home. The room itself was extremely comfy and quiet. Between the blackout curtains and ultrasoft bed, it was hard to get up in the morning. The breakfast buffet was delicious and a great way to start a day of exploring the city. 10/10 love the Bankside!",5,2024,10,16
134,We will definitely come back again!,"We visited Bankside hotel/Artyard restaurant with my parents, partner and myself. The service was impeccable: Attentive, incredibly friendly and we got good advice in the restaurant. The food was exceptional. For instance: every ingredient in the burrata dish was used to its full potential, creating a flavour explosion! And even the plates where a thoughtful touch. As they were made from recycled broken plates. We will definitely come back again!",5,2024,10,11
134,Excellent Hotel Staff,"The front desk staff of this hotel was the nicest I have experienced! We were in town for a short trip to see Taylor Swift and they helped us fit in all we could during our quick visit. Kasha, Mustafa, and Sebastian were especially helpful and friendly in answering our questions and making recommendations to make our trip special! I highly recommend this hotel!",5,2024,10,08
134,Excellent business and vacation hotel near Blackfriars,We stayed at the Bankside for 2 weeks while I was on a business trip. The hotel is close to the city and the attractions while still being in a quiet neighborhood close to the River Thames and train service. The on-site restaurant was really good and there are good pubs nearby. The room was well appointed and comfortable. I would definitely stay here again!,5,2024,10,08
134,"Wonderful staff! Kudos to Marcel, Raquel and Mohamed Hassan","We lived working with Raquel at the front desk. Her smile was so bright we almost needed sunglasses at her reception. Marcel and Mohammed rescued us from our own jet-lagged absent mindedness by gracefully returning our passports and credit cards that we left in the room safe! Yikes, that was a close call! The room was well made up everyday. We couldn’t have asked for better!",5,2024,10,08
134,Bankside Hotel weekend stay,"My entire experience was positive. All of the staff at Bankside were welcoming, from reception to housekeeping to the Art Yard restaurant. Mustafa Omar at reception was particularly attentive by helping us with our bags and bringing us refreshments upon arrival and departure. It added to the overall comfort of our stay.",5,2024,10,06
134,Beautiful and Warm 5 Star Hotel on South Bank,"Hotel was beautiful and beds were so comfy! James Burns, the Head Ambassador, was amazing! He remembered my husband and me from our stay 2 years ago! He gave us amazing food recommendations and quaint places to visit. We felt like we were with family. The wait staff at breakfast and dinner were lovely and the bartenders kept us laughing all night. 

Will definetly come back and stay here again next time we are in London!",5,2024,10,03
134,Excellent 3 course menu in its amazing Art Yard Bar & Kitchen,"Had the pleasure to lunch here this week: absolutely excellent!  Besides a beautiful designed location (this includes into the table setting), the just recently updates menu for the season had great choices for all of us and all the dishes were spot on: well prepared, good flavours, nice portions throughout our 3-course menu. Wine pairing was well chosen by our great staff, that was super attentive and pleasant. Will come back for sure!",5,2024,10,02
134,"Fantastic hotel, delicious breakfast!","Beautiful rooms, fantastic location, delicious breakfast, and super friendly staff! The rooms were spotless and comfortable, and the hotel is in a perfect spot for exploring the city. The breakfast had a great selection, everything was fresh and tasty. The staff made us feel welcome and were always ready to help with any questions. Overall, a wonderful experience—will definitely come back next time I’m in town!",5,2024,10,01
134,Extremely nice boutique  hotel experience,"Excellent service in all respects. The front desk staff were exceptionally courteous, helpful, informative and accommodating. The breakfast room wait staff were polite, attentive and efficient. The hotel's lobby and room decor was interesting, upscale and very well maintained. The room amenities (particularly the automatic espresso coffee maker!), electrically controlled window shades and comfortable beds were made for a luxurious experience. Only very minor issue is that location is not closer to the Underground. I would highly recommend this property.",5,2024,09,30
134,Lovely hotel,Wonderful hotel and staff. They had an art exhibition with free drinks. They also gave us free upgrade and wine. Laura was particularly lovely. It was a bit tricky to turn off and on our hotel lights and The bed seemed short and the pillows were a bit thick for my liking but apart from that all good!,5,2024,09,30
134,Weeklong Vacation for Two in London,"My wife and I went to London for a weeklong vacation. We had never been before. The South Bank looked interesting and the Bankside was rated highly and cheaper than similarly rated hotels. 

Right from the beginning, the service was excellent. Leena, one of the staff up front, helped me set up the reservation, making sure my wife could get into the room without me, as she arrived in London a couple days before I arrived. I then got a nice follow-up email, about a week before I headed to London,  from Leena saying they were looking forward to our visit.  A very nice touch. 

Then, when I got there, Laura T was able to get us tickets to a football (soccer) match for my favorite team - tickets I had been unable to procure.   Sebastian made us fantastic cappuccinos every morning, serving us with a smile. Every person on the staff did whatever they could to make our trip better. Could we have an extra electrical adapter- done. How about a corkscrew for the bottle of wine we bought this afternoon - done. The staff is simply fantastic. 

As for the hotel itself, it’s in a great neighborhood. We enjoyed the culture there (Tate Modern, Globe Theatre) while enjoying the food at the various venues, particularly Borough Market. And the Tube and buses are very accessible for getting around to the other parts of the city. 

The decor is modern. It is extremely clean.  The hotel is human-sized, as opposed to a big convention-style hotel. Sized so the staff can get to know your name during your stay. 

Our stay at the Bankside was one of the best hotel experiences I have had, and I do travel a bit. I look forward to going back.",5,2024,09,29
134,The beautiful Bankside Hotel,"The Bankside Hotel is a small hotel, and meticulously clean. The staff is helpful and friendly, going out of their way to make sure we had everything we needed.  They made great recommendations for local pubs and restaurants.  The location is great, just a block or two from the Thames River.  The lobby is modern and not at all like the standard lobby in hotels.  It is a comfortable and relaxing space.",5,2024,09,26
134,Exceptional stay!  Book this now.,"This is a long review because you, fellow travelers, need to know how wonderful this hotel is. I spend 100+ nights in hotels annually. This is a rare find. 

Having read many rave reviews about the Bankside, my expectations were high. The service and quality of my stay vastly exceeded them! The fantastic location also makes easy in/out and moves you away from much louder and busier parts of London. 

My favorite part is the time the staff takes to get to know you and — best part of all — call you by your name! A small gesture that demonstrates thoughtfulness and attention to detail. Greatly appreciated. 

What a delightful stay from the moment of arrival! Mohammed greeted me with a welcoming smile in the lovely reception area — where you sit down to check in. It’s a nice departure from the standard process. 

He offered me a beverage to enjoy while we worked through the details of the stay, including some birthday plans for my friend arriving the next day.  He personally made arrangements that made her celebration extra special. What a star! I cannot thank him enough. 

But the excellent service didn’t end there. Many staff made our stay memorable. 

Special thanks to Kacia in reception for being welcoming and kind as we came and went from hotel. She always had a smile for us and gladly answered questions that we probably asked more than once. So thankful for her. 

Laura in reception was also friendly and helpful in giving us guidance. Very much appreciate her. 

Mersim in Art Yard Restaurant at breakfast was an absolute delight, as well. He warmly greeted me each morning as he made sure I had a hot beverage of choice when I sat down. From there, he arranged for anything I wanted or needed. He’s a gem!

Hanji and Dimbe in Art Yard were also wonderful, as was Raquel in reception. 

And, please know the food is outstanding! I had daily breakfast and a room service dinner. Fantastic food. 

Cannot wait to return!",5,2024,09,23
134,"Wonderful evening with family. Our server, Stephanie, was top tier!","My family and I enjoyed our first experience here at the Art Yard restaurant. The recommendations we received for the dinner options were perfect. The entrees, cocktails, and wine are fantastic. Also, Stephanie, our lovely server who assisted our table, was excellent. She provided on time service, delicious recommendations, and kind conversation.",5,2024,09,22
134,Overnight stay,"We stayed at this wonderful hotel, on arrival was met with a glass o bubbly and eased into check in, Angela on reception is a credit to the hotel and hopefully climbs the ladder as she went over and above helping us out after I messed up the booking. The hotel is stunning, the rooms spacious and delightful, the beds extremely comfortable. Breakfast was amazing plentiful. The only downside to our stay was having to leave. 100% we would Highly recommend this hotel and especially Angela. ",5,2024,09,22
134,Best hotel we’ve stayed at!,"I can’t say enough about this hotel! From the time we checked in we had the best service of any hotel we’ve been to. If you like walking this hotel is central to most London highlights such as the London Eye, Big Ben, Tower of London, Borough Market, St. Paul’s Cathedral, pubs, galleries,  the list goes on. Room was clean, bed was comfy and spacious and the staff were incredible! This hotel won’t disappoint!",5,2024,09,21
134,Top notch as always ,The same fantastic service as always. People at front desk and breakfast are si nice. They always ask how your stay is going and helpful. I've said this before. But my favourite london hotel by far. See you again in 2025. Thank you again for relaxing stay.,5,2024,09,20
134,Impressive employee.,"The entire staff was wonderful. One, Rio,came to our rescue with knowledge and kindness. I felt we should tell someone in authority how great she is. She was able to help with an electrical problem with both knowledge and kindness. I tripped circuit breakers and singed my adapter trying to plug a hair dryer in. She was able to fix everything and allay my fears.",5,2024,09,13
134,The highlight of our anniversary!,"Our one-night stay at the Bankside Hotel in London for our anniversary was absolutely perfect! From the moment we walked in, the amazing front desk staff made us feel so welcome and really went the extra mile to make our stay memorable, in particular Raquel, Kasha, Mo and Elena. The room was gorgeous—sleek, modern, and super comfortable. They even surprised us with a thoughtful anniversary treat, which made the night feel even more special. The hotel’s vibe is stylish yet cozy, and the location is unbeatable for exploring London. It was the perfect way to celebrate, and we genuinely didn’t want to leave. Dinner at the restaurant was lovely too! Highly recommend for anyone looking for a flawless stay.",5,2024,09,12
134,Immaculate hotel with amazing staff!,"Easily the nicest hotel in London hosted by the nicest staff in London. My girlfriend and I stayed there for my 19th birthday and receptionist Raquel upgraded us to an amazing suite with unexpected touches including balloons and champagne! The bathroom was almost as beautiful as the view, and the bed was unbelievably comfortable. We also had access to other facilities, so I took advantage of the outstanding gym they have. The staff were incredibly welcoming and made our night unforgettable. I cannot thank them enough and I would definitely recommend!",5,2024,09,11
134,No.1 choice for London,"This is my hotel of choice whenever I travel to London!! 
The front desk staff Richard, Mohammed, Raquel, Elena, Manuel, Sebastian & Herman are second to none ..
The rooms/beds are delightful and the  breakfast is diverse
The only time I would consider staying at another property in London is if Bankside was fully booked and even then I believe they would make a plan for me! 
6 stars",5,2024,09,10
134,Bankside is the right side for us!,"What a wonderful hotel!  I would especially like to thank the concierge team - especially Richard, Mohammed and Mikael.  I wondered about the location, but it was perfect.  We could walk along the Thames and walk to many places.  There was a small grocery across the street, the Waitrose, and easy walking distance to M&S Foods and Amazon Fresh.  The chocolates at M&S Foods were so good.  Lots of chocoholics in our family, so perfect souvenirs.  I use hiking poles to walk but it was no problem.  Our goal was just to ""walk around London"", and this fit the bill.  We did take some tours to other places like Windsor Castle, but ""walking around"" was our favorite part.",5,2024,09,10
134,Beautiful hotel in the heart of London .,"Beautiful hotel , with a contemporary relaxed style . All staff , without exception ,went over and above the expected to make our stay enjoyable .
 The standard of all communal areas was  very well designed . The bedroom was very spacious , clean and beautifully furnished .",5,2024,09,07
134,Lovely meal for party of eight,"Came here as a family and had a lovely evening…Had flavoursome good quality food, the broccoli was lovely. Really enjoyed my  Salmon dish as well. The other dishes were brilliant. The ambience was welcoming and we were able to feel very relaxed as a group of eight.

The waitress Stephanie was a credit to her team, was very attentive to our requests and took time to explain the dishes.   She made the night special.   Thank you Stephanie. :-)

We will be back i am sure",5,2024,08,31
134,Strongly recommend,The hotel is very new. Great location and staff. The breakfast was delicious and the buffet had a ton of selections. The front desk manager was so nice that he waived my breakfast since I told him I thought the breakfast was included. Would def come back again!,5,2024,08,30
134,Great experience!,We had the best experience at the Bankside Hotel! The staff remembered our names and treated us like family. They took care of our every need. Kasha and Mustafa were exceptionally kind. We will definitely be staying there again. Highly recommend it.,5,2024,08,27
134,Amazing Staff and Accommodations! Love this Hotel,Amazing experience! The staff was friendly and helpful.. The greeted us every time we walked through the door with a smile and a friendly Hello! beautiful accommodations and outstanding breakfast. I will be back Thank you for starting our European Vacation off right....,5,2024,08,25
134,London Calling Family Vacation,"We had a great stay at Banside hotel. The entire staff from the front office, the folks in the Artyard hotel, housekeeping were absolutely brilliant and extremely pleasant. They helped in every way possible to make our stay absolutely wonderful and pleasant. A big shout out to Mihael who was extremely pleasant and he gave a good tour of our room as well. Also, Rachael from the front office helped us book the premier league game tickets that was a wonderful experience foe our entire family. Thank you again Bankside Hotel for a wonderful vacation.",5,2024,08,24
134,Modern Hotel with friendly professional staff,"One of the top 5 hotel experiences I have had globally. The hotel features the latest modern upgrades and attention to detail that made me stop and appreciate my decision. 

Walking distance to local atmosphere (pubs) and the Uber to the train station took 2 minutes to arrive.

I will look for the Bankside the next time I travel to London.",5,2024,08,24
134,Bankside is a must stay,"Absolutely the BEST! Close to many amenities - including Blackfriars station (across the bridge). Amazing staff- so helpful and friendly. Rooms were very comfortable, clean and well-appointed. Restaurant was delicious with attentive wait staff. Will stay here again!",5,2024,08,22
134,Best restaurant,"Best service by Raghuram and very delicious food, great restaurant, everything was very good, experience was excellent, the best restaurant in that area, recommended, also dog friendly (our dog got a bed) water and toys, salmon was excellent",5,2024,08,21
134,Perfect!,"Excellent hotel. Very clean rooms. I got there very early off my flight expecting them to hold my luggage but they were able to get me in a room! Very accommodating, great breakfast, great location walking distance to everything you’d want to see in central London!",5,2024,08,12
134,A new favorite hotel in London,"We loved this hotel.  It was a bit farther away than we usually stay when in London, but found the walk to everything not a problem.

It is in a much quieter area than most other hotels we have stayed at, yet within a couple of minutes you can be in the hustle and bustle.

Here is what we really liked:
-We arrived early coming from the US and our room was ready.  That is a real win for a hotel.  
-The hotel was very clean and modern.  
-The staff was very friendly and helpful
-They had welcome water available and bottles of water to take out for your days outing
-The Rooms were very comfortable
-The beds were great with very soft cool sheets
-The breakfast was great
-The ac worked great and the room was nice and cool

Here is what we didn’t like:
-The pillows were very firm and bothered both of us

We would absolutely stay here again",5,2024,08,10
134,Bankside is a 10!,"We loved our stay at the Bankside! The staff is incredibly attentive. when we arrived, our room was not ready yet and so Mustafa Omar helped my husband with parking the car, sat at acquaint table, outdoors, continually checked on us to see if we need anything while we waited and made sure our bags were delivered when the room was ready, he was so sweet and acted like we were the only guest there. Bartender asked what I like to drink in custom blended a cocktail for me. Our room was beautiful very clean. I wish we could’ve stayed longer is my only regret and truly and enjoy the hospitality in the comfort of this charming hotel.",5,2024,08,08
134,"Perfect place, great staff, clean and trendy vibe. EXACTLY what we were looking for.","This was a fantastic hotel for business or leisure travel! This trip was for leisure and it suited us perfect. The rooms were spotless, the amenities were great and the staff was 100% focused on their guests. After a long 10 hour journey we were greeted 
by Manuel who made it a perfect check-in experience.  He also helped us through our entire 5 day stay and made us feel at home.",5,2024,08,06
134,Excellent service and great location.,"Great hotel from the moment we walked in. Greeted by reception staff who were extremely helpful and took our bags to allow us to explore London, even though we arrived very early. In particular, Mustafa was incredibly courteous and helped us in terms of planning our trip with my 7 year old. He went over and above to help us. Fantastic service and excellent location. Couldn't recommend Bankside more!",5,2024,08,04
134,"An excellent, high quality hotel on the South Bank","This hotel is excellent.  The reception is funky and high quality and feels like a sanctuary from the outside.  Check-in staff were friendly and efficient, both on arrival and departure.  We had two rooms - a room with 2 queen beds (Generous), and a king room (modest).  The generous room was very spacious, with high quality bed linen and a good bathroom with bath.  The modest room was also nice, with bathroom with shower.  It was a very short stay, so we didn’t eat at the hotel, but the generous supply of complimentary cans of water were much appreciated in the summer heat. I wish more hotels provided this! Everything in this hotel was immaculately clean, and furnishings and decor are high quality.  Would definitely stay here again.  Tip: spend some time in the cool little library area on the mezzanine floor, with its furry grey armchairs and books!",5,2024,08,03
134,Beyond all expectations. A hidden gem in London.,"We had simply the best stay at Bankside Hotel. I stayed with my daughter and a friend along with her children for a 'Girls' Night' in London and we ended up not leaving the hotel we were so comfortable! From the moment we arrived we knew we were in for a treat. The staff are above and beyond welcoming and caring. The rooms were true luxury and the bed was possibly the best I have slept in.  It was all topped off by the delicious menu that catered for everyone's personal preferences at dinner and breakfast. The hotel interior is beautifully decorated with unique furniture and art pieces and in fact every item was clearly curated with such great care (we loved discovering the rocking.horse, Bankside honey and the added bonus of an Artist in Residence). Everything felt truly sincere and genuine Thank you to the whole Bankside staff for creating  such a special experience. We can't wait to come back.",5,2024,07,31
134,Amazing Experience,"This is an amazing hotel!! We came into the hotel exhausted after a grueling road trip. They quickly checked us in and provided a drink. Even though they don’t have valet, they helped  us locate a garage for the night. The beds were the most comfortable ones of our trip! We felt welcomed and appreciated!! The only thing I’d love to see is a pool. Thank you Bankside!!",5,2024,07,31
134,Excellent customer service & hospitality!,"Our family stayed at the Bankside Hotel, Autograph Collection during April & May 2024. We wanted to let everyone know that we would give this hotel 10 stars if we could! Excellent customer service, cleanliness, friendly and welcoming! All meals and drinks were outstanding! We will definitely stay at this hotel when we return to London. Walking distance to many venues, museums including Tate Modern, Bourough Market and bridges. We found it much quieter than being on the other side of the Thames.",5,2024,07,26
