Location Name,Title,Text,Rating,Year,Month,Day
224,Fantastic stay in central location =],"Stayed in the Clayton for my husband's birthday a few weekends ago and we were beyond delighted with our stay from ease of check-in with valet parking at arrival, most friendly and helpful staff, our room was amazing, modern, all mod cons and  immaculately clean not forgetting the wrap around views - the city on one side and mountains on the other. We were greeted with a lovely handwritten card in our room on arrival, a bottle of red (that went down a treat!) and macaroons - beautiful touch & a fab way to start off our weekend. We have to commend the staff on abiding by all COVID regulations we felt so safe despite us being fully vaxxed we have to say they were a credit to themselves. After a weekend of eating out and meeting old friends we retreated to the hotel for a night cap and the atmosphere in the foyer was lively albeit super save and everyone was well spaced out - finally back to some normality!! This hotel is ideally located, the popular Barge pub across the road, St. Stephens Green in short walking distance, and if you want to pop down Dublin south the Luas is literally 2 minutes from the hotel! Thanks to General Manager Callum and Team for such an enjoyable experience - will be back for sure!",5,2021,08,25
224,Clayton hotel charlemont,"I have stayed few nights with my family for a small getaway. Great hotel , very clean and beautiful . Rooms are very tidy and well looked after. Location  is very convenient . Highly recommend and definitely comming back again.",5,2021,08,23
224,Everything ok,"Last minutes booking after back from glendalough.no interconnecting room so i need to booked 2 different room for my self and my family.room is clean and nice deco but price is very expensive for one night.pay extra 24 euro for breakfast for my 3 kids but when we put the food order ,the waitress was refused to order for us cuz my kids order 3 portion pan cake and 3 portion fried egg.the waitress saying to us eat first pan cake and then you can order egg later..incase the kids didnt finished ..i know my kids every well ..they can eat all of them in 10 minutes..seriouslly im staying many place but this is first hotel 
,waitress was refused to order  for me after im spend money on breakfast for my kids .",3,2021,08,16
224,Amazing food and staff,"I stayed here with a friend of mine and we had such a lovely time. The food in the restaurant was amazing and the service by the barmen and their cocktail knowledge was great. Breakfast in the morning was also delicious and the pastries are out of this world. Our room was located at the end of the corridor which was lovely and quiet and the shower was so nice too. 
We will be back!",5,2021,08,14
224,Fantastic Hotel,One of the nicest hotels I stayed in everything was perfect . Had dinner on two nights and the food was excellent . All the staff was very friendly especially Cian and Andrea in the restaurant who looks after us for the two days . The hotel is spotless clean great to have the air conditioning with the warm weather. Exec rooms were fine and big with a coffee machine. Valet car parking was very good just leave your car outside and they parked it for you .I Will be looking forward to my next vist,5,2021,08,03
224,Made some great memories. ,"A truly wonderful visit, friendly staff, great food and room was so clean with brilliant air conditioning. Our first time staying anywhere since lock down and we felt so safe, we will be back and will be telling our friends about this gem of a place. Margaret and Ann Walsh, 24th and 25th July. ",5,2021,07,27
224,Great stay,"I had a pleasure to stay in this hotel and I must say it was perfect. I was welcomed by attentive and friendly staff,room was comfortable with excellent amenities and most importantly quiet dispite being in city centre, great location and delicious food. Highly recommended and I will chose this hotel for my next visit.",5,2021,07,20
224,Derek & Danielle Geraghty,"Just had our wedding here this month, this hotel is fantastic, modern and the rooms are well equipped. The food that we received on the day was absolutely top quality and with two chefs in our wedding party that raved about the food, that’s all you need to know, the staff were very helpfully in facilitating our vision for the day and couldn’t do enough for us, in particular our events manager Ciara was very helpful and communicated with us constantly on the lead up to the day and on the day, they made it feel very personal and special for us even the general manger Callum came to talk with us and to make sure we had everything we needed, I could not recommend this hotel enough for a small intimate wedding. Thank you all so much and I look forward to coming back next year for our anniversary",5,2021,07,20
224,Fantastic ,Had a fantastic night here with friends using the Heroes deal. Staff from front of desk to the dining area the next morning were all very accommodating. We all felt very safe and could see that their Covid precautions were taken seriously. Lovely spotless room . Great location. Would highly recommend,5,2021,07,13
224,Poor service,"Currently staying here, bar service very slow. Despite being resident no residents bar , bar for earlier in evening should have been booked for a seat ??? And we were told ealrlier in the evening time in bar was limited to 1hr 45 mins and people sat at a table at 6:30 and didn’t leave until
after 11 pm.",2,2021,07,11
224,Beautiful Hotel 🤩,"What a stunning hotel!  Booked in on Tuesday 6th July.. Got a great deal on date night,  breakfast and evening dinner.  Check in was seamless and Jordan at reception was so helpful and completely took charge on our departure when the taxi firm let us down.. what a star 🌟 Our room was outstanding, literally, no negatives at all ☺️  The staff that looked after us.. thank you 🙏 your service was outstanding and we really appreciate it.  Many thanks to everybody that looked after us during our stay, You were not aware but during these hard times my husband and I lost 3 siblings and to be honest.. we needed the break!  Everybody at the Clayton in Charlemont made us feel special and we were able to relax and rest for a little while.

It was nice to talk to the General Manager, Callum who had a wee casual chat with us just before we left.. what a great guy!!  Ok ladies.. this guy knows we need extra plugs for straighteners etc.. I promise, the Clayton Hotel in Charlemont is not short on plugs 😉
All in all..beautiful hotel in a great location with such lovely stafff.. definitely, we will be back 😘",5,2021,07,07
224,Exceptional Service and Experience,Spent Friday evening with friends in the hotel and the service and atmosphere was brilliant! Highly recommend the hotel for all occasions. Food was delicious and cocktails were amazing! 10/10 for location too!,5,2021,07,03
224,Need for better room revenue management,"The hotel is and will always be beautiful. The staff and amenities are all strictly adhering to covid regulations which was good to see. Everything is clean and tidy. However, despite I am sure a lower demand than usual so more space in the hotel, we were put right next to two rooms with Bachelorette parties…. Who partied into the early morning. Didn’t get a minute of sleep before our alarm went off at 5 am. I would expect better planning in this regard, especially nowadays.",3,2021,07,03
224,Amazing stay,"Amazing stay  the team was so amazing I was greeted by Ruslan , Georgie and Gloria they where so welcoming towards myself and my partner,  they helped us out at dinner thanks again to Andrea , Geovani ,Thomas and the rest of the team .

The room was spacious and comfortable the food was also brilliant .

All round amazing experience,  I'd like to also thank Rebecca in reservations for helping with my booking .

We look forward to coming back soon thanks again.",5,2021,07,02
224,Great hotel,"We had a fantastic time at the Clayton Charlemount hotel. It is a very stylish hotel in a great location,  with friendly staff that exceed all expectations, from checkin at reception where the lovely Jordan was so helpful and cheerful to the fabulous restaurant staff. We had a lovely breakfast the next morning. I would definitely recommend this hotel and look forward to staying there again.",5,2021,06,28
224,A long awaited stay made better!,"After a long absence due to the pandemic, we decided to treat ourselves with a stay in Clayton Charlemont. The service was perfect from beginning to end; everybody greeted us with a smile and made sure we were taken care of. The food and drink was exceptional and the bed was as comfy as you're likely to get.

Without wishing to single people out, I'd like to thank Gloria, Ruslan, Andrea and Giovanni in particular for their hospitality and making our stay one to remember. We will be back!",5,2021,06,14
224,Lovely Hotel and fabulous staff,"I stayed for one night on the bank holiday Sunday, and I couldn't wait to get out of the house to be looked after and this hotel didn't disappoint.  We booked into the hotel using the online check in which was seem less and collected our key cards at reception from the very friendly receptionist who double checked we were booked in for dinner and breakfast which we had done prior to our arrival.  Our room was just so comfortable with a gorgeous bath and shower and had air conditioning which was needed as it was very warm out.   We came down to the bar and ordered drinks and again greeted with friendly staff and then headed to the restaurant for dinner.   The menu had all the favourites and when the food arrived it was delicious.  We had ordered the salt and pepper cauliflower which I hadn't seen before and was surprised on how fab they were,  I will be going back for these alone.  We then had fish and chips and the chicken curry which were both delicious  .  We headed back to bar for more drinks and ordered some superb cocktails.  The next morning after a great nights sleep on the most luxurious mattress we headed back to the restaurant for breakfast.  The hotel still have restrictions in place as per govt guidelines but it doesn't effect the relaxing atmosphere of the hotel.  The breakfast was served to the table and the service was very quick and food hot and delicious.  I would highly recommend this hotel to anyone who wants a fab break to switch off and within walking distance of St. Stephens' green and the city centre if you wanted to get out and about.  I can't wait to return here as I was looked after so well.",5,2021,06,14
224,OUTSTANDING,"This was not our first stay in The Clayton.
Its perfect in every way. Great Location - Wonderful Staff Very comfortable hotel 
Great breakfasts. 
Covid protocols adhered to 100%
I cannot reccommend this hotel highly enough. A very personal touch where the General Manager chatted to us as we were leaving to make sure all was well for us. Lets face it nothing beats that personal touch. Well done Callum & your great team",5,2021,06,13
224,SUPERB WEEKEND/ Leisure break,"We stayed last weekend...amazing hotel.quick check.in and room.resdt even when we arrived early ..service impeccable..food delicious for lunch and dinner...very easy access to city centre for shopping "") fully covid compliant all round",5,2021,06,13
224,Debs,"We had a fantastic time at the Clayton Charlemount hotel. It is a very stylish hotel with friendly staff that exceed all expectations,  from checkin at reception to the fabulous restaurant staff. Our evening meal was very nice and we had a lovely breakfast the next morning. I would definitely recommend this hotel and look forward to staying there again.",5,2021,06,13
224,Great experience,"I have stayed twice quiet recently and have two very positive experiences,  great attention to detail, staff superb so friendly and helpful. Great location, good food and atmosphere. Would highly recommend.",5,2021,06,09
224,Excellent hotel!,"Our stay was excellent from start to finish, the hotel completely exceeded all of our expectations. The staff were all so friendly and helpful. Our room was very clean, comfortable and modern. Food and drinks were lovely in the hotel. Great location, we will back for sure!",5,2021,06,05
224,Wedding Stay,"The Clayton Hotel, Charlemont made our special night so personal. Everything was perfect. Callum and Ciara went above and beyond for us from the moment we entered the hotel.
Top class service in a top class environment.
I would recommend this hotel to anyone. Food, drinks, service, culture and comfort all wrapped up in a spectacular hotel in Dublin City.
One of Dublins hidden gems.

A very happy,
James & Melissa",5,2021,06,03
224,Beautifully room and great service ,"Recently I was staying in this hotel, I must say it exceeded all my expectations. My room was very nice, very clean and comfortable. Despite current situation hotel staff provides excellent service while adhering to all Covid-19 guidelines. Everyone was really helpful from the moment I arrived. Food was also great and location is very convenient. I highly recommend this hotel.",5,2021,03,01
224,Very nice place to stay in Dublin,"Hotel location is probably the best in the city, just by the river and 5 minutes walk from the centre. The hotel itself is very stylish and staff are really friendly and helpful. I really recommend this place for either business or leisure trip ",5,2020,12,16
224,Wonderful weekend for my son's 21st,The hotel couldn't have been more appealing for a family break to celebrate my son's 21st birthday. From the valet service to take our car on arrival to the lovely desk clerk who checked us in. There was a lovely card and a hand-made bar of chocolate awaiting my son when he arrived at his room and my wife was presented with a bottle of prosecco. Location was perfect with an amazing view of the canal from our room. The regulations for Covid were really well handled by the hotel staff and it was just wonderful to be able to have a pint and a lovely meal now that we have moved out of lockdown in Ireland. I have stayed here before with friends and knew that my family would love it. Breakfast was excellent and the barista at the coffee bar served fabulous coffee (see picture). Thanks again. Will definitely return.,5,2020,12,07
224,Mini break ,"Stayed last night in this lovely hotel which was clean ,spacious and inviting ..staff were very friendly especially Georgi and Simone who made our stay even  more special..thanks guys.
Our executive suite was luxurious so were very happy..the bed was very comfortable and the rituals product were a lovely surprise..
The food was of a high standard and also delicious which we were really pleased about as we had stayed in another Clayton hotel a few months back and we were a bit disappointed by the food.
So overall I would recommend this hotel to family and friends so thank you Charlemont for a lovely night’s stay.",5,2020,12,06
224,Excellent service,"We were staying in the Clayton for business. We were served by Dylan, who is an absolute gentleman. A highly exemplary member of staff, who greatly added to our dining experience. I would highly recommend after such an enjoyable time.",5,2020,10,26
224,Outstanding in every way,"It's been a very long time since I was this impressed with a hotel. From the valet parking, stunning decor and the friendliest staff I've ever encountered, this hotel is an absolute treat. The food is fantastic, particularly the salt and pepper cauliflower, and breakfast is excellent. Perfect hotel for business, couples or a girls getaway, I will certainly be back. Particular thanks to Ruslan, Mark, Gloria and Sasha for their excellent service.",5,2020,10,11
224,Amazing customer service!!,"I havent atcually stayed here myself.
We were booked to stay here but unfortunately because of covid and lockdown we were unable too.
We booked through a third party company who were absolutly awfull and no help, so I decided to contact the hotel directly to see if they would help in anyway. The customer service I recieved was absolutly fantastic on every single call and email! So polite and helpful. Rebecca really went the extra mile to help me and I am so so grateful for her help, she managed to get me a refund which I know I I wouldent have gor if the company. I highly reccomend to stay here with the fantastic customer service, when covid has gone I will 100% be coming to stay.
I really appreciate all the help you gave me, you went above and beyond.
Thank you!
Poppy x",5,2020,10,08
224,Lovely weekend break,"Stayed in the absolutely lovely Clayton Charlemont on Saturday. Stay on check in was very welcoming. Rooms are lovely and brand new. Staff in the restaurant were nice and food was lovely. Such a great location as well as its very close to Camden street. Would definitely look to come back and support the hotel. 

Paddy",5,2020,09,28
224,Great Stay,"Quite a new hotel and in a very convenient location - walking distance to St Stephen's Green and less than 100m from the Luas tram line.     Hotel was spotlessly clean, staff were friendly and very professional in the current COVID climate.    Breakfast was excellent and served to us at the table - all freshly cooked.   I will definitely return.   (Be aware that on-site car parking is limited.)",5,2020,09,19
224,Anniversary weekend,"We were so disappointed with the whole experience, Sasha and Gloria were fabulous at reception but that's where it ended, Bar staff extremely rude, outrageous prices for smaller than normal cocktails. We were told about a click and collect service where you'd pay by card and collect, when we approached a male at reception he said it finished at 11 that the kitchen was closed, when we checked in that wasn't what was explained to us. We had dinner booked in the hotel but decided to go out instead as no atmosphere, I can understand Co-Vid regulations and requirements and we were extra safe. It was our Anniversary so was very disappointing we won't be returning, but thank you to the amazing girls on reception you were all exceptional",3,2020,09,12
224,Amazing staff!,"I ordered a delivery to the hotel and had issues with it, long story short Michael and Leo at the reception jumped to help me out , they were making calls on my behalf and when the order finally arrived, Michael went up and delivered it by himself to my room instead of calling me to come down. I travel alot because of my work and i can honestly and truly say that the staff in this hotel is one of the best if not the best staff i ever had the honor to deal with! Thank you all and special thanks to Michael and leo ! 🙏🏼",5,2020,09,08
224,Lovely stay,"My partner treated me to a night at the hotel. The room was lovely,bed very comfortable & the bathroom was great too. My only suggestion is to have chromecast on the TV.

The restaurant was beautiful and the food delicious. I had steak.
Breakfast the next morning was nice too. You could choose your choice of egg. Pastries & fruit came included with an full Irish Breakfast.",5,2020,08,23
224,Great Hotel!,"Had a Lovely stay at this hotel, room was nice and clean. Amazing location, situated right on the canal. Ruslan and the rest of the staff were great to deal with and very welcoming upon arrival. Would reccomend and will stay again!",5,2020,08,20
224,Exceptional Clayton charlemont hotel Dublin!🌷,"We stayed at the hotel for 2 nites and had a lovely breakfast which was served by Andrea,this girl was very nice and  she knew how to treat the quests ! Top marks all the way!  I was very happy with the service second to none ,I would highly recommend as everything in the hotel was immaculate,from the food and the reception staff greet you with a big smile! The guy that showed us to our breakfast table,just lovely!  Now the room was beautiful and spotless ,amazing beds ,I just couldn’t believe how perfect  everything was even the lifts were great,the whole hotel is so professional and new hotel and the staff wow! I felt like a queen the whole time,a massive big shout out to you all,thankyou for all your kindness ,I will be back soon!",5,2020,08,17
224,Disorganised Mess,"Staff were friendly however, there was multiple incidences we experienced of mismanagement which ended up impacting our trip greatly.  

Firstly when I arrived I was checking in for two rooms which had been booked by my parents. I paid for the rooms then and there but only received one room key. When I went down later to get the second room key I was told that another person in our party needed to pick it up and fill out a form. I then sent my brother to do this, and no form needed to be signed. 

Secondly as a surprise my parents had added two bottles of champagne to be in the rooms. These were never put in the rooms and as we didn't know about them, we didn't know to ask for them. After leaving the hotel our parents asked about the champagne so we rang the hotel for a refund. On the phone we were told that the front desk manager wasn't there, but to come into the hotel tomorrow and our refund would be issued. The next day I went to the hotel and spoke to the same girl whilst she was standing by the manager. She said that the refund would take 20 days to be processed (this is a ridiculous amount of time to wait for money that is mine). She also said that she had never said on the phone to come in. I left quite angry, it was late in the day at that stage and she could've called at any time to tell me that the refund would take 20 days, I don't understand why she didn't call back once she had asked the manager about the refund policy.  

Lastly, my brother had left his passport in his hotel room. However, we had no idea it had been left there. He missed his flight and had to reschedule. If the hotel was organised properly they could've let us know that the passport was there either the day we called, or when I went in to supposedly get my refund. 

Overall I think the staff may have looked down at us because we are young (age 20-25) and they could get away with not looking after us properly. Had my parents not asked about the champagne which totalled to  ‎€70, I feel that the Clayton would not have gotten in contact with us to give us back the money we were owed. 

Overall I think the staff are untrained and unable to communicate with each other. This points to an issue with management.",1,2020,08,13
224,Group of 6 ,"Stayed here for two nights. Staff polite and professional in particular Dylan and Tomas from the bar. 
Hotel very clean and comfortable. 
Good location and would highly recommend this hotel. All six of our party were very impressed.  ",5,2020,08,09
224,"Amazing, top class! ","Me and my boyfriend booked here for 2 nights for our anniversary last minute after a bad experience with another hotel and we are SO glad we did! Amazing location, amazing service and amazing food :))",5,2020,08,04
224,Best Hotel In Dublin!,"I've been coming to Ireland umpteen times throughout my life, visiting family and sightseeing. On this occasion, my dad and I decided to treat ourselves and stay a couple of nights in Dublin. This was the perfect hotel. It's near the canal (perfect for jogging and walking) and its also near the best pubs/grubs around town. 

The staff were second to none and were very hospitable. Thank you to Gloria and the exceptional staff for making our stay comfortable, safe, and accommodating during Covid-19. You guys were stellar and provide us with the best service. 

The part of the hotel is that it has a fantastic restaurant and bar. Please order the chicken curry, its amazing! And you definitely don't want to miss out on the coffee! The latte art is on point! We valet our car for only $25 a night. With everything being so close, we walked everywhere. 

I was able to use the fitness center and work out by myself. You can book the fitness center for up to an hour. Everything was super clean and accessible. 

If you don't want to overpay for a comfortable night stay in city center and for excellent service, look no further and book here.",5,2020,07,31
224,Fantastic,"Stayed for one night - Two rooms - What a fantastic hotel -Central location,  Valet parking, easy check-in. Super friendly & helpful staff - Rooms were immaculate & there was a great feeling of safety in these strange times we find ourselves. After check-out they stored our luggage & kept our car parked till we left  @ 3.30pm. 
Mark, very attentively , served us what I can only describe as the best breakfast I've ever had in a hotel or restaurant - I will definitely be back & will also recommend to everyone - Bravo Clayton - You never missed a beat !",5,2020,07,23
224,"Super friendly and helpful staff, great location and fab decor","My husband, daughter and I stayed for one night in the hotel.  The hotel itself is very new, nice decor and has a really nice spacious, airy lobby area.  However the most impressive part of our stay was the staff, every staff member we encountered were super friendly and helpful.  The chef even cooked pancakes specially for my daughter despite them not being on the menu.  We were super impressed with both the hotel and fantastic staff.  I would highly recommend the hotel.",5,2020,07,15
224,Daily coffee trips,"I come here with my mum at the weekends for yum coffees and occasional lunches.
Mum comes every day for her sit down morning coffee on her own. She loves the atmosphere, delicious coffee, spotless hotel!
But mainly she loves the staff::: so friendly and helpful, especially Andrea!! 
Andrea also gave me a free coffee as  frontline worker. Thanks Andrea",5,2020,07,11
