Location Name,Title,Text,Rating,Year,Month,Day
14,"Great service, great location, helpful concierge services","The breakfast is good, and worth including in your package. The concierge is most helpful in recommending restaurants, giving walking directions and arranging transportation. Many good restaurants within walking distance. Arrange airport transportation from hotel, as ordinary taxis do not take you to the hotel doorstep, which is on a very narrow street next to the Cathedral, (so that you do not have to transport your luggage through the streets).",5,2015,10,15
14,Barcelona at it's best!,"My wife and I travelled to Barcelona on the 14.09.15 and stayed for 5 nights in a deluxe room with a terrace!  We loved the location,decor,intimacy and the historic features of the property. Our room and facilities provided all our creature comforts and fulfilled all our expectations. Staff were professional and polite!  Breakfasts were good. Would have preferred more options to choose from on the a la carte menu for dinner! We particularly enjoyed visiting the Sagrada Famila and the Nativity Tower, La Pedrera (we booked the 9:pm slot to see the light and music show on the rooftop, which added to the museum experience), the trio of guitars, with flamenco performance at The Palau de la Musica and the Cathedral. We had an amazing trip and in between the sightseeing we just simply enjoyed strolling along the Barri Gotic region and relaxing on Barconaletta beach! Would stay at the Neri again should we choose to come back.",5,2015,10,09
14,amazing time in Barcelona,"this was not only a great hotel (the balcony was a wonderful plus) but the perfect jumping off point for the La Merce festival, which was the main reason we came to town.  It was easy to get to the squares we wanted to get to and the Metro was fairly easy.",5,2015,10,08
14,Fabulous experience!,"Wonderful room in historic building x 2! Terrific breakfast included.  Attentive staff, beautiful decor throughout.  Hotel booked a city tour for me with Ramon which was one of the top 10 days of my life!",5,2015,10,04
14,Expensive Haven,"Rooms amazing - in the gothic quarter so vies classic Barcelona back streets/squares.  Breakfast was laid back, lunches and evening meals a bit more formal with high quality interesting taster menus.  Hotel was very relaxed and relaxing.  Expensive but worth it to recover from the wonderful exhausting tours and festivals that make up the wonderful Barcelona.  The; staff very helpful on booking museums, directions, where to eat out of the hotel but a bit rubbish on parking advice.  If you HAVE to take your car - try to suss this out ( we never did!) and train or bus is probably better.",4,2015,10,04
14,"Magnificent location, luxury and charm trump views and weekday noise","My wife and I spent three nights at this hotel and would likely stay there again.  We wanted to be in the heart of the old town (part of the original Roman city) where it is an easy and magical walk to all sites.  The hotel itself has many high end touches and the breakfast, though pricey, was always satisfying.  You will be within steps of the  side entrance to the ancient Barcelona Cathedral and the underground excavations of the Roman city and the first Christian church built above it, not to speak of two excellent tapa bars (La Alcoba Azul and La Vinateria del Calle).  On the negative side, the rooms are smallish, most rooms are 15 to 20 feet away from another 700 hundred year building (now apartments) and from 8:00 to 5:30 on weekdays is a small private elementary school nearby.  You will definitely know when the children have recess.  All that said, the positives far outweigh the negatives if you enjoy being in an ancient place that is well preserved.",5,2015,10,04
14,Not high end,Far from a Relais and Chateaux.  Can't imagine how they became a member.  Lobby badly furnished.  No closet just shelves with a tiny curtain. External noise and view into apartments.  Food not very good.  Expected something more upscale.  Very difficult taxi access.,2,2015,10,03
14,Fabulous hotel,Thank you hotel Neri for all of your hospitality.  This hotel is intimate yet funky and cool at the same time.  The rooms are  extremely comfortable and the beds pillows  are fabulous.  The location couldn't be any better.  But most important is the attentiveness that the staff offered in helping to explore the great city of Barcelona.  Everyone there was beyond amazing but I need to especially thank Daniel  and Marta.  You both went beyond what a guest could expect and I graciously thank you for all the extrass. ,5,2015,10,02
14,Charming and elegant hotel with one of the most lovely and gracious staffs we've ever encountered in years of travel...,"The Neri was a fabulous place to spend  our ten days in Barcelona.  This is an architecturally stunning hotel in probably the most charming part of the city... casually elegant and impeccably run.  Besides an ambiance that is infused with rich history, character and style, my husband, son and I were struck by how wonderful everyone who works at this hotel is.  The staff -- Marta, Maria, David, Georgina, etc. -- is  truly charming, warm and gracious. Every single one of these lovely people went way out of their way to make sure we had the best kind of experience in Barcelona possible, and when an unexpected medical situation arose, they jumped in and went way beyond their professional obligations in making sure that expert medical care was arranged for and to express personal concern and caring. We will return, and, meanwhile, we are happily recommending it to anyone traveling to this amazing city.",5,2015,10,01
14,Tranquil hotel amidst bustling city,Perfect location to base sightseeing of Barcelona.  Very tranquil setting and atmosphere. We spent 2 nights here at the end of a cruise and loved every minute of it.  Staff was very helpful and we loved everything about the hotel.,5,2015,09,30
14,Sucha Special Place,Wonderful place to be in the old section of town. Hotel is so intimate and the staff are amazing. Always ready to assist and make your stay a bit better. Rooms were lovely and don't forget to sneak out on the patio upstairs on the roof.,5,2015,09,29
14,Wonderful Wedding venue,"We chose hotel Neri for our daughters wedding on 18th Sept, the staff were fantastic, there but not there if you see what we mean. The food was first class, the foie was the best ever, and the roof terrace perfect for the dancing. Well done and thank you to Claudia and her team. Our next goal is to stay for a few nights next year.",5,2015,09,28
14,Everything we expected and more,"Spent 6 days at the Hotel Neri and we would highly recommend it.  The location is perfect, central to everything.  The rooms, while small, are luxurious, and my husband wants to take the shower home with us.  Breakfast was delicious, the staff was amazingly helpful.  Cava at the rooftop bar under the stars was magical.  We would definitely recommend this place and hope to return!",5,2015,09,28
14,Fantastic - Well Above Our Expectations,"This hotel is not just gorgeous (well thought out modern architecture within layers of history), the service is also excellent. 

The staff were very friendly, helpful and accommodating, which was very welcome given we were travelling with a 2.5yr old! 
Our room was comfortable and clean, with complimentary wifi.

The breakfast was relatively simple, but great quality and reasonable selection- just don't expect a giant US style buffet feast.

We would recommend this hotel to anyone that wants a quality, boutique hotel experience in the heart of Barcelona's historic Gothic Quarter- couldn't be more convenient.

If you're travelling with an infant, just be sure to call ahead and ask for them to provide you with a cot - the cot in our room was great- they even included an activity pack with a set of colouring pencils, and also kid size towel & toiletries.

If one was to be extremely fussy and picky, the only negatives might be that the passenger lift is slow (seems to be common in Barcelona), the roof terrace is a bit of a non-event (small, no real views), and that your room's windows will likely be overlooked by the neighbours, who are just across the narrow lanes - something that you can't avoid in a place like the gothic quarter, and should really be seen as part of the location's charm - Besides, one can simply draw the curtains and you have all the privacy you need!

What you really need to know is that we would not hesitate to go there again - hopefully for a longer stay!",5,2015,09,28
14,THIS IS A HARD ONE!,"Having booked 3 nights at the Neri and having read all the wonderful reviews we were really looking forward to our stay. Our party of 4 were greeted in the small front lobby upon check in and informed that our rooms were not ready and offered a free wine/beer outside in their rear terrace , that someone would be back to let us know when our rooms are available! After about an hour wait and finishing our wine/beer without hearing from anyone we decided to have lunch.Two hours later without anyone telling us our rooms were ready we went back to front desk to find out our rooms were ready. 
Our room was small but very well appointed with a nice stone shower. The first night at approximately 10:00 pm the toilet keep running and would not flush. I tried to call the front desk but could not operate the phone, so I got dressed and walked down the steeps to the front desk, but the front desk girl was in a conversation with another guest, I waited several minutes then finally had to interrupt their conversation to inform about the toilet problem, she said she would have someone check it. Several minutes later the front desk girl showed up at the room to try and fix the toilet, she got it to stop running and we went to bed. Next morning my wife went to use toilet and it would not flush. Learning the phone system I called the front desk to inform about the problem, and in the mean time by taking the top off the toilet and pushing with my finger I at least got it to flush. Later the plumber showed up and fixed the toilet.
The second day of our stay the toilet would not work again, and being very Irish my temper started to boil, paying 355 euros a night without the use of a toilet 2 out of 3 days.

To the hotels credit on the second day they offered to move us to another room, but we had already unpacked and figuring they could fix the problem we stayed in the room #208. Our last evening we had a wonderful dinner at the hotel with our traveling friends and the hotel manager did comp our meal and drinks , plus gave us a bottle of wine in our room.

Other than the toilet problem, this is a wonderful hotel in the Gothic section (within the old Roman Walls) of the city.  Larger taxi's can not drive to the front entry and must park about a 100 yards from hotel, making you drag your luggage thru the narrow cobblestone streets. 

It appeared to me that the hotel at certain times was understaffed!",4,2015,09,24
14,Another Great Stay at the Hotel Neri,"My husband and I and four friends stayed at the Neri this past week.  We have been there twice before and are very pleased to report that it is still a super hotel and we look forward to going back again in the future. The hotel is a boutique property in the best sense of the word - not super trendy but beautifully thought out and maintained.   The rooms are modern but not cold, the housekeeping service is top notch (rooms are incredibly clean) and the service overall is excellent.  There is a lovely breakfast.  And to make it all the more exciting it is a very good value.  Wonderful!",5,2015,09,23
14,A tranquil gem in the heart of the Barri Gotic,"We absolutely loved Hotel Neri during our recent stay.  My husband and I were celebrating our anniversary with a 5-night stay in Barcelona, and we selected Hotel Neri based on the many positive reviews on TripAdvisor.  Our stay was everything we hoped for and more!  The location in Barri Gotic was perfect - very central to everything we wanted to see in that area, and yet quiet and peaceful.  The boutique hotel has the charm of an old building with the amenities of a fully refurbished and updated building.  Our room was a beautiful corner room with stylish décor and plenty of light.

Every morning we enjoyed the breakfast, which was included in our room rate.  We sat in the quiet dining room and enjoyed a made-to-order omelet, pastries, fresh fruit, cheeses, lattes, etc.   Every evening we took advantage of the roof-top bar, a lovely and romantic setting on a warm summer night.

The staff was incredibly professional and attentive.  One morning, I mentioned to a woman at the front desk that the dry air from the air conditioning was causing me some trouble, and she had a humidifier set up in our room before we returned that evening (which made all the difference).

My only suggestion for Hotel Neri is that it would be helpful to have more staff working at the rooftop bar at night, as it seems to be a popular place to hang out and the server had to go to the first floor to pick up all food and drink orders.

Our stay was perfect in every way.  We cannot wait to go back!",5,2015,09,22
14,Fabulous time at the Hotel Neri in Barcelona!,"We loved the hotel.  The staff was very accommodating in assisting us with transportation, tours, dinner reservations and airline check-in.  The location was superb...very close to restaurants, La Rambla Plaza Cataluyna, the Port,  Museums, the Cathedral and bus tours. We booked the Neri Suite.  The room was very spacious and comfortable.  The rain shower was exhilarating!  Thank you for making my 49th Birthday trip with my mom very special!",5,2015,09,21
14,Boutique Hotel right in the Gothic Quarter,"My husband and I recently stayed at Hotel Neri Relais & Chateaux and we were not disappointed.  The situation of the hotel is ideal for exploring both the Gothic Quarter, the Born District / La Ribera area as well as most other neighbouring districts.  The hotel itself is lovely, atmospheric and very nicely appointed.  Our deluxe room with terrace was quiet, very comfortable and large with a very large terrace.  The staff were  very friendly, helpful and approachable and were happy to help with any and all questions that we had.  We would definitely stay again and, hopefully, we'll have another opportunity to.  Thank you Hotel Neri for a lovely stay!",5,2015,09,15
14,well located in the gothic district,"Hotel Neri
Is situated in Barcelona's gothic district a few minutes walk from La Ramblas, the Cathedral, and a 20 minute stroll from the beach and port area of Barcelonetta. The hotel backs on to the famous St Felipe square where Franco's troops massacred 48 citizens, mostly children, in 1938. The school which housed most of the infants is still located in the square.
The hotel is 5 star with stylish contemporary decor and an impressive stone and glass atrium in its centre.
However, we found the 5 star rating a little excessive. The rooms are well appointed although somewhat drab. The restaurant is small and disjointed and the bar area lacking in atmosphere.
We stayed as a family for two nights prior to New Year and the staff were welcoming although I would say this hotel is mostly used by affluent older couples on romantic city breaks.
Our two night stay for a family of five, in two rooms, cost €1,800, including breakfast and a taxi transfer from the airport to the hotel.
Pricey, but Neri is well located in Barcelona's most atmospheric district, with plenty of authentic tapas bars,restaurants, boutique shops and galleries within a short walk of the hotel.",4,2015,09,15
14,Amazing boutique hotel in great location,"My wife, 6 yr. old son and I recently stayed at the Neri for two nights. The staff was gracious throughout or stay and the hotel has a very inviting and relaxing feel. The room was wonderfully designed with a nice view of the plaza. The food was delicious and we really enjoyed the rooftop bar. They made our young son happy with a welcome gift and even had cookies for him at check in.The hotel is well located for touring Barcelona and we highly recomend it!",5,2015,09,14
14,Very nice neighbourhood in walking distance of all major sights,"Standard was not very big but bed was very good. The only thing we did not really find fitting was the curtain in front of the closet. Restaurant and bar were very nice.
The reception desk was very helpful when we seeked for help to retrieve vouchers for tours we booked.",4,2015,09,14
14,Luxury in Gothic Barcelona,"The hotel is located in the center of the Gothic quarter of Barcelona. The rooms are beautiful and comfortable. The included breakfast buffet could feed an army, with excellent service. The concierges were outstanding, fluent in multiple languages, and attended to your every need.",5,2015,09,13
14,Amazing ,"Besides falling in love with everything about this hotel .. The position was tops!

Great location in the Gothic Quater 
Decor was simply amazing 
I cannot fault this place, we stayed here for three funfilled nights and I would go back any day ! The staff were great - a very stylish boutique hotel - the restaurant was amazing as well as the breakfast which looked out into the quaint streets.. See pics ",5,2015,09,09
14,An excellent stay in Barcelona at the Hotel Neri,"Accommodations were perfect, extremely comfortable, and clean. The consierge always had excellent suggestions for food and activities. The central location made it very easy to get anywhere we needed to be quickly either by foot or train. Overall, we thoroughly enjoyed every minute of our time at the Hotel Neri.",5,2015,09,09
14,Once again at Neri,"This august me and my boyfriend went for the third time to Barcelona, and it was our secound stay at Neri (the first time was in 2013, and by that time, the hotel had 4 stars), so you know what this review will reveal. 
Neri is a very pleasent hotel in the Gothic Quarter. It's location allow us to move around downton without many fisical effort. The decoration is mininamlist, classy and exquisite. The staff has extra care with cleaning and tidding up the room. The amentaties are proper to the hotel and the city, althow it's always good a cup of tea at night, dispite the hot weather.
The reception staff were always up to the task, being friendly and joyfull (thumbs up for Jacopo!).
The deluxe room with terraza is an excellant room. In the terraza you can find a matress on the floor and some pillows to enjoy the warm nights. 
The only thing to point a finger is the noise of the machins cleaning the streets early morning, but it's a good way to get up of bed early to visit Barcelona avoiding the heat.",5,2015,09,08
14,Delightful Barcelona surprise.,"Discovering Hotel Neri's location -- tucked away on mysterious alley in Barcelona's Gothic district -- is fun in itself, though merely a teaser to the Hotel's excellence. Quite convenient to the Picasso museum and other Barcelona ""must sees"", the hotel will happily arrange transportation to venues not within walking distance. A former residence transformed to an intimate and charming hotel, Neri provides travelers every loveliness missing from busy lives: attentive staff (especially Alex, the evening concierge), comfortable rooms, surprising amenities, wonderful food, a complete knowledge of Barcelona and all its brilliance.",5,2015,09,08
14,Superb hotel with a great location and very helpful staff,"Make sure you find time to sit in the little square at the back of the hotel - San Felip Neri.
Also visit the rooftop bar for cocktails and a lovely view.
This is a wonderful hotel, with a great location right in the Gothic quarter. The staff could not be more helpful and went out of their way to make us feel welcome.",5,2015,09,07
14,More than we could ask for!,"Very recently stayed at Neri Barcelona. Fantastic experience from start to finish. Easy communication from home to reserve room, set up transportation from airport (not easy to drive to in narrow streets of the Gothic Quarter. Picked up with Mercedes and a very helpful driver. Check in to a wonderful glass of Spanish white wine. Taken to our virtually perfect room per our request (quiet/spacious) room 305 on third floor with wrap around terrace - outdoor chairs, relaxing bed and hammock! Room very nicely appointed. Lovely full breakfast (part of our package). Service was 5 star! Anything we needed was attended to with great attitude and apparent pleasure. Great location very close to Cathedral - easy to walk to so many wonderful sites.Nice outdoor area to have drinks or food in historic square. This is exactly the type and quality of small boutique luxury hotels we look for. Would have liked option of breakfast outdoor in back area - only suggestion. Would stay again for sure, will recommend to others actively.",5,2015,09,06
14,Gorgeous Barcelona Haven,What a lovely place to stay. The staff was bend-over-backwards welcoming to us. The room was wonderfully comfortable. Love the shower. The food in the restaurant was delicious.  This was a five star experience in every way. Can't wait to come back!,5,2015,08,31
14,WOW,"This is a great property: great staff, great food, great location. It was an expensive hotel but we loved it. The bathrooms were large, lots of luggage storage and the breakfast is not to be missed. If you have dietary needs let them know ahead of time and they will do a great job meeting them.",5,2015,08,30
14,Hotel was worth the splurge!,"I was really impressed with this hotel - everything from the location to the staff to the showers (rainfall with another great nozzle and the best water pressure!).  Beds very comfortable - the bed is similar to many European hotels (2 singles joined together to make a large bed).

I loved the location as it was easily walkable to El Born in the evenings and right in the middle of Barri Gotic.

2 things to note - First, no pool, so although the rooftop terrace was very nice, the no pool factor is a negative if you are going in the summer and that is important for you.  Second, it is kind of hard to find and on a really narrow street in the old quarter.  I didn't have a great map before I arrived, and my cab driver just dropped me in a Plaza nearby and pointed.  I was actually only 2 short blocks away (once I found it, it was easy from then on), but my cab driver's pointing to the wrong street left me wandering for about 20 minutes with my luggage.  I would either hire a car service or print out a detailed map of the location if this is your first stay as to easily find it!",5,2015,08,26
14,Light filled atrium but dark rooms,"Well, the location unless your arriving early or very late is an  extremely  busy walking area , so get dropped of close by.... the room we booked of the net was rather dark and small as we were only staying for a night i couldn't be bothered complaining or paying for an upgrade ...., the food from the kitchen was of extremely high quality so recommend dining here , boutique feel , good staff...they have a roof top bar which is fun but no pool where as the Mercer and the Serras have small pools with their roof top bars if your staying in the height of summer  or have little ones could be considered. Beds ok comfort factor , though joined in the middle ( 2 x singles with a joiner) hmmm",4,2015,08,25
14,Almost perfect,"This property is fabulous. The location albeit a heavy traveled corridor, is awesome. The interior design is spectacular and the rooms are extremely comfortable with all the  comforts you would need.
A few things to note though. I would have said this place is perfect but aside from one lovely girl named Marta at the front desk, the staff is severly lacking in any local knowledge and experience. They are young hip kids but i expected a little more from a relais and chateau property as far as top notch staff. I am speaking specifically about the front desk here...twice our restaurant reservations were made at the wrong times but worse, when we were given directions to specific restaurants no one warned us that we were walking throught some tough...really tough neighborhoods at late hours. I am a new yorker and trust me i know tough neighborhoods, but this was a bit jarring. A little heads-up would have been helpful. Dont get me wrong they were lovely, but not very savvy about the area in which they should know inside out. Back to the good stuff now.  The maid service and cleaning staff were absolutely some of the best i have ever seen. Truly top notch. So, all in all this place is wonderful but i suggest you research restaurants and safe areas to walk at night before you arrive.",5,2015,08,22
14,"Great Hotel, Perfect Location","The hotel is literally next to the Gothic Cathedral. You could not ask for a hotel in a better location for seeing the old town part of of Barcelona. The staff were wonderful - especially after the website (independent of the hotel) that we had booked through made a mess of our booking. Out room wasn't ready when we arrived, and the staff made a huge effort to make us as comfortable as possible,",5,2015,08,19
14,Wonderful contemporary feel in the heart of Barcelona's ancient Gothic Quarter,"We stayed several days, to see Barcelona for the first time at a relaxed pace - together far from kids for the first time. Hotel Neri was great - centrally located, luxurious, and the staff was very patient with our many questions. The quiet rooftop bar is a wonderful space. The blackout curtains helped to adjust to jet lag. If you want to get work done, in one room the desk was excellent, but in the other it was cramped - plus wifi was not too fast.",5,2015,08,17
