Location Name,Title,Text,Rating,Year,Month,Day
224,Average,"Hotel it was OK for a night or two. The room was quiet and clean and the beds comfortable. Staff was great. The room was not very well equipped, no ice bucket no refrigerator, freeze dried coffee that’s not very good. The big issue was the shower. The water pressure was really weak and the temperature lukewarm. 
With many choices in Dublin I would probably not stay here again.",3,2024,10,19
224,Great hotel and great breakfast,"The room was spacious and the bed was very comfortable.
Breakfast was fantastic. A shout out to Carmel from the restaurant who looked after us every morning. She was outstanding in her service. It made our stay even more memorable. 
The hotel is about a 20 minute walk to Stephens Green and another 5 mins to Grafton street. Great hotel.",5,2024,10,09
224,Stressful stay made pleasant,"We stayed at the Clayton between 23 and 29 SEP 2024. Our trip to Dublin was stressful as Aer Lingus lost our luggage and we were without the necessities till 28th. Every day we would ring the Aer Lingus Call Centre and the Clayton reception staff was most helpful and understanding. Gonzalo and Dino were especially helpful and kind and reassuring. This removed some of the stress and we are grateful to the Reception staff for all the help they provided.

Thank you.

Sheila & Pervez",5,2024,10,07
224,Would come back again!,"The personel of the hotel was really nice and helpful.  Hotel and Rooms were very clean. Breakfast and meals were amazing and not that expensive at all!

Petru, cian and the other servers were also very friendly and nice, always asking if thing we're fine, to our liking and that kinda stuff. Also having good and interesting conversation with them about Ireland, Dublin, football and other stuff was real fun.

I would definitely go back heren when I would travel to Dublin again.",5,2024,10,06
224,We loved staying here!!,"We have experienced such a lovely time staying here for 3 nights! There has been 7 of us and the staff have always managed to fit us in for food and drink!! The staff have been nothing but lovely, we told one of the staff members (cian)  it was my dad’s birthday trip and they gave him a free drink and a happy birthday note on his pudding!! I asked one of the bartenders called Peteu if he could make me a pornstar martini because it wasn’t on the menu and he went out of his way to make it for me! 10/10 by the way!!!!",5,2024,10,06
224,"Great service, comfortable and clean rooms and a very tasty pub menu.","First and foremost, the service in the restaurant/pub (lockside) was phenomenal!  I was particularly impressed with Cian and Petru who were incredibly helpful and friendly.  I somehow managed to spill a bottle of sparkling water which broke on the floor, and these two quickly cleaned up the spill and refreshed my glass.  The room was clean and comfortable with a newly remodeled bathroom.  They do a daily refresh which is a nice surprise in the post COVID world.  The gym had everything I needed and was empty on a Sunday morning, which may or not always be the case.  The food was excellent...I had a ceasar salad for lunch and chicken curry for dinner which both exceeded my expectations.  They have a great bar, but it is a little clumsily set up, with not much room to walk behind the bar stools and not enough of them.
I would return for another business trip.  The location along the canal is very pleasant.",5,2024,10,06
224,Amazing,"Dear Clayton, hotel and staff were Amazing especially , Nargiz, I was very happy to have her support with our meetings! 
Petro is so special!  Petro's service is the BEST.  When I travel  it is good to know I have someone who really cares for his guests.
Ciao
CS",5,2024,10,05
224,Tired room did not spoil overall experience at hotel,"Stayed at this hotel for three nights with my wife and two other couples.  Found the price point for the location to be fair and competitive. My experience was good. Room was clean and tidy but lost minor marks for the shower having low water pressure and the window fittings being broken which was noticed when opening window to freshen room, (security clip was broken off, window was wobbly when open). 

However the positives defiantly outweigh these pedantic remarks. staff were welcoming, friendly and efficient. Checking in was easy and fuss free, house keeping staff were friendly and helpful, and banqueting staff in morning were friendly and efficient. When checking out, hotel front desk tagged our luggage and securely stored our luggage allowing us a final day exploring Dublin before flying home in the evening.  I only ate breakfast in this hotel and found selection to be good, of good quality and personal requests ie poached eggs were handled efficiently with minimum wait times. I was using this hotel as a base to enjoy Dublin with friends. The fact that all had great time in Dublin indicates that this hotel carried out its function well. I would have no issue using this hotel again and probably will next time I return to Dublin.",4,2024,10,05
224,Extremely professional and helpful staff !,"The best part about Clayton Charlemont are the staff. My family's experience was made really positive by Shreya Malik, Imran (front desk) and another new front desk staff member who was very helpful.  The only drawback I would say was the breakfast for people who don't eat pork or beef. But the staff were accomodating and gave us few alternates. 

We were helped for booking our bus tickets, cancel and get refund, recommendations of what to see, change to a bigger room, luggage storage and breakfast to carry for the airport. Great experience!",5,2024,09,30
224,Great hotel in a good quiet location,"The hotel is very modern, up to date and extremely well looked after. It is  opposite the canal on one side and a busy street the other but it’s set back from this street.  The fixtures and fittings are very new as the hotel was only built in 2018 and possibly wasn’t used for 12 months due to the covid pandemic in 2020.
Everything is well cared for, the bedroom furniture and fittings, the restaurant and the reception area and lounges. 
The staff are very accommodating and friendly. They can’t do enough for you and are there to serve and look after you on every occasion.  The one at breakfast time called Carmel was so friendly and helpful and gave good advice on what to visit. 
Breakfasts are plentiful and varied, hot, cold, fruit, yoghurts, porridge, cereals,  full Irish breakfast too. You help yourself to whatever you wish.  Teas  herbal and black and green teas, coffees on the machine which were lovely. Everything very well presented too.
I stayed in for evening meal as I was on my own and the food although a limited menu was extremely well cooked and tender. Presented in a very nice manner too. The only thing I would say was everything seemed to be overly salted and for one who doesn’t use much salt it made me very thirsty. Maybe the chef could use less salt as there is salt on the tables. 
I would certainly stay here again and would also recruit to anyone who asks me.",5,2024,09,26
224,Excellent service.,The staff were excellent especially Gonzalo.  Breakfast was wonderful. Very comfortable bed.  My only complaint is that the the use of the key card to access the lift and room lights needed to be explained at check in and the sink drain valve is hidden behind the tap,4,2024,09,24
224,Great time with staff! A plus recommendation,"Ciara, Petru and Grace were great! They were so helpful during our stay and will recommend them to all traveling to Dublin. Their hospitality was amazing. They helped us with our car, as well as food orders late into the night. Definitely will be coming back.",5,2024,09,22
224,Lovely,"I stayed here for work but met a friend for dinner in the evening at the bar. They were very attentive and friendly. We had a lovely evening. Cian and Petru really looked after us. The only thing I will say is the shower wasn’t great in the bedroom, but the beds are very comfy. I will definitely stay here next time I’m in town again.",4,2024,09,20
224,Excellent hotel and staff,"I was on a business trip from Manchester to Dublin, and I have to say as far as hotels go, this is an extremely phenomenal.

Petru & Cian was incredibly warm and welcoming and the other bar staff were also amazing. 

The food here is extremely good and i would strongly recommend anyone to travel here for either business of leisure",5,2024,09,19
224,Great for family,"Very accommodating for our family.  Comfortable, roomy, and very clean rooms. A block from the tram which was so easy to take to the park with playground, museums, and area with many restaurants.  Food was available at hotel and walkable, as well. Recommend.",5,2024,09,19
224,really good care even after leaving,"Very good stay as usual, rooms and service perfect, went for food at the start with pints and it was savage
 , however this time i forgot my charger in the room, and Evangelina who works there was such a great help in returning it to me, really went above and beyond. Thanks a million",5,2024,09,17
224,"Server at the bar, Petru","Bar experience and cocktails were fantastic! Our server was Petru, who made some standard, but also signature cocktails. In the meantime during the preparation he explain every step, using his own made sirup. I have to mention taste of Old fashioned, was perfect.",5,2024,09,15
224,Clayton ask for petro for good cocktails,"Petro is the best bar man in Dublin excellent service. very extensive knowledge on cocktails good man. Good laugh and good recommendations to restaurants and bars, very welcoming thank you for your service! Lovely clean comfortable hotel and try sleep cocktail",5,2024,09,14
224,Thank you Petro!,"Lovely hotel very comfortable and staff are absolutely lovely. Petro makes amazing cocktails and is very attentive and great at recommendations he makes the hotel a welcoming place. Cocktails much better than Scotland, I would recommend this hotel and the lovely staff to anyone wanting to travel to Dublin",5,2024,09,14
224,Nice boutique hotel,"Room was ready before 3:00pm which was so nice considering we flew in from Colorado USA and already had a long day. Check in was quick & professional. Our room is compact, but enough for us. After 1/2 hr walk, we went to the bar for a drink. Pretty extensive selection considering the size. Agustin was fairly new, but we didn’t know that until halfway through the evening. He was so friendly and knowledgeable.  After serving us at the bar we moved to the restaurant when it opened at 5:00. Agustin was also our waiter. Food came out quickly and was great. Shoutout to Agustin for great service. We would never guess he had only been there 4 weeks.",5,2024,09,13
224,"Lovely hotel,  employee added that special touch to make it even more memorable.","My friend and I booked here for our last night in Dublin before departing for home in the US.  Very clean and friendly staff.  We were very blessed with the front desk and especially enjoyed the bar where we were able to grab a delicious meal without the need of exiting the building after a day of travel from Cork.  We had the most delightful waiter, James, who surpassed all our needs and we thoroughly enjoyed his wit and personality.  Thanks for making our experience most memorable.",4,2024,09,12
224,Very nice hotel and well located,"Very nice hotel in a quiet area, close to public transport (Green tram Charlemont stop is 3 mns walk 
).
The bedroom was spacious and our bed very comfortable.
We had breakfast elsewhere though,  so cannot comment on its quality.
We wil definitely choose to stay at the Clayton Charlemont for our next stay this autumn.",5,2024,09,07
224,Great stay at Clayton Charlemont,"A wonderful overnight stay. Very comfortable room, spotlessly clean. We ate in the bar and enjoyed a super meal and warm welcome from Frank. Great to be so closento the luas and walking sistance from both the city centre and Ranelagh with its neighbourhood bars and restaurants. We will be back again.",5,2024,09,02
224,"Dublin Trip, Excellent Hotel!","Stayed here for a visit to Dublin for our wedding anniversary. 
The hotel has a great location, far enough away from the city centre with canal facing rooms for a quiet night’s sleep. But well within walking distance to the city centre (and with excellent public transport), Uber rides don’t cost very much either from the centre.  Really nice bar in the hotel, and loads of great bars, restaurants and live music in the local area. 
Beds incredibly comfortable, very clean room and public areas, and really friendly and helpful staff throughout the hotel. All in all, a really pleasant stay. 
Only feedback - The hotel  encourages online check in and check out. I did this around 9am that morning.  Online check in does not allow any arrival time before 3pm to be noted - which is to be expected in line with most hotel policies. So I advised I would arrive c.3pm - and arrived at 3.45pm. The room key process then became messy because I had not been sent a QR code, via email, and when asking at reception I was  told it was because I had come too early, they’d have sent me a QR once they were ready for me - and to wait in the lobby. When I wasn’t accepting of this service, another member of staff on reception was able to manually fix this and book me into another, ready room - a frustrating interaction I expect I could have avoided if I just walked up and checked in ‘old school’ at the reception desk.  There is no doubt advantages to the online check in and check out process the hotel has (check out was fairly slick), but then makes for an awkward human interaction as it doesn’t seem to prioritise room allocation based on customer arrival times. If I were to stay at a Clayton again, I’d probably just use the reception desk without online check in based on this experience.",4,2024,08,30
224,Nice stay at Clayton Charlemont,Stayed 5 nights at Clayton Charlemont.  Great front desk staff…very friendly and helpful.  Awesome breakfast.  Reservation staff was quite helpful making arrangements.  Loved the area near the hotel and the canal.  Nice being near tram stop.  Great pub next door.,5,2024,08,28
224,Great stay,"Stayed for 4 nights, staff was welcoming, helpful, friendly and went above and beyond. Especially Gloria, she made me a great Irish coffee and was helpful to our every need. I would recommend this hotel. Hotel is in great walking distance to all the fun things to do in Dublin.",4,2024,08,27
224,Family Vacation,This place was really nice. It is outside the city but not by much and the train is not more that a 5 minute walk. Within a 10 minute ride to Grafton Street and Temple bar area. The beds were so comfortable. Room was a nice size. Best of all it has air conditioning LOL. I can’t say enough about the staff especially Gloria. She is a sever there and always greeted us with a smile.,5,2024,08,25
224,Excellent Hotel!,"Stayed last nite with my sister-in-law who was celebrating a belated birthday. I requested a nice room through the lovely Patryk in reservations & we arrived into our beautifully clean, well appointed room on the 1st floor with complimentary macaroons, a lovely & much appreciated gesture. The beds were so comfy with excellent pillows. Our dinner in the Bar was delicious where the staff ie Razvam, Petro & Frank could not have been more attentive or helpful. Breakfast this morning while buffet style(my pet hate! ) was surprisingly of a high quality again overseen by excellent staff.",4,2024,08,22
224,Great birthday experience,"Went to celebrate my birthday and had a fantastic evening 
Razvan & Petru made it a very special evening with a surprise dessert and cocktail 
Would highly recommend 👌🏻 
Will be back again as the service is 10/10
If you want a great birthday night this is the place to be!",5,2024,08,19
224,Amazing experience,"It was a amazing experience,a beautiful and comfortable room,amazing bed and breakfast and Arnaldo helped us a lot,the hotel is big and comfy,with a beautiful view and drinks,the bathroom and shower were incredible,room clean,everyone is so friendly",5,2024,08,18
224,"Breakfast,  clean rooms and friendly staff","Amazing!! Very good experience, great breakfast, clean rooms and very friendly staff
I will definitely be back next year!
Don't think you will come across a better hotel
Fabulous experience and thank you all in the clayton for your excellent service 😁",5,2024,08,17
224,Excellent Dublin Hotel,Excellent hotel. Very clean and staff was courteous and professional. There is a restaurant attached to the hotel and the service and the quality of the food was spectacular. We arrived early and the employees went out of their way to accommodate us.,5,2024,08,16
224,Lovely hotel,"Lovely hotel. There was enough space and storage in the room. Bathroom was lovely with walk in shower. Room was very clean and refreshed daily. There was tea and coffee making facilities, iron and ironing board in the room. We didn't eat in the restaurant but we had several drinks in the bar and the staff were so friendly, nothing was too much trouble for them. Good location. Close to tram and bus stops. Would definitely recommend.",5,2024,08,14
224,Service with a Smile!,"We want to thank Frank, Petra, Alberto, Oliver and Ciara for outstanding service to our party.  Despite a very large and chaotic breakfast crowd, they quickly fulfilled our requests with a pleasant smile!  It is unusual to experience great service and wonderful personalities in our hectic world.",4,2024,08,11
224,Lovely location and beautiful hotel,"A beautiful hotel in a great location, situated right on Dublin’s Grand Canal within easy walking distance from museums, shops and restaurants in central Dublin. The staff is friendly and extremely helpful. It’s our preferred place to stay when in town.",5,2024,08,10
224,"Excellent location, friendly staff and lovely rooms.","Highly recommend this hotel, would love to stay again. Spacious room for three people, very comfy beds, all amenities provided in room that would be needed. Room was refreshed nicely after first night, water bottles provided along with fresh towels. Breakfast had great selection, very helpful staff. It was extremely busy and buffet area is small so it was a bit chaotic but staff managed very well and ensured items were fresh and topped up well.",5,2024,08,09
224,Highly Reccomend,"Lovely hotel. Great location, great food and friendly staff. Very modern, will definitely come back.

Breakfast food was very nice, but extremely busy always. Always a que for food and the coffee machine, perhaps the coffee machine could be relocated. Staff very friendly.",5,2024,08,09
224,Pleasant,"Everything was great! The rooms were clean and the staff were attentive. Breakfast here was also great, both the buffet and the menu. Gloria was very helpful! Always around if we needed anything. And Cristina and Aroldo from the Lobby helped us with every little detail that we needed. Everyone was very friendly and helpful.  I’m glad I stayed here with my family. And will always return to this place.  Thank you guys.",5,2024,08,07
224,Great stay at the Clayton Charlemont Hotel!,"Quirky room, all the key amenities! Lovely front desk staff, very happy and helpful :) Arnaldo was particularly great! Breakfast was very nice and lots to choose from, also the valet parking service was ideal as there isn't much parking near the hotel 😀",5,2024,08,06
224,Great Meal in Hotel Bar,"We had a lovely meal in the hotel bar on Friday 2 August 2024. Our thanks to all the bar & kitchen staff, especially our server, Frank Petra, who was excellent. Nice atmosphere. Great views of the Grand Canal. Food was excellent.  Great location!",5,2024,08,03
224,"Great experience, awesome staff","Very good service. Wonderful people. Imran on the front desk is so friendly. He will greet you and make you feel great. I am a repeat customer. He knows my preferences and will offer a room accordingly. The breakfast is fantastic. Iona in the restaurant is awesome. She works hard to keep customers happy. Gloria is very welcoming, cheerful and looks after customers well. My favorite hotel.",5,2024,08,02
224,Gloria the Glorious Hostess,"Dear Sir/Madam,

It was such a delight and breath of fresh-air, to experience hospitality at its most unique level.
Ms Gloria who had served me at the Breakfast Restaurant, was quite extraordinary, she was attentive, kind and glad to serve. 

The staff in general were a rare breed team, of courteous and energetic people. I would return to the Hotel and highly recommend the property, to other friends and family.

Wishing your Organisation Continued Success and Blessings.

Thank you

Kindest regards 
Robert J. London",5,2024,08,01
224,Fantastic birthday stay,"To celebrate my husband's 40th birthday, we went to Dublin.
We had the opportunity to sleep in this beautiful hotel. The room was very spacious with a large bed.
 The breakfasts were fantastic, a very large selection, everyone will find something for themselves. 
Thank you to the staff and reception for a small gift for my husband and for the entire stay.

Instagram @dininginlondon ",5,2024,07,31
224,Superb service by hotel managers Art and Ron,"superb and excellent service, special mention to the hotel managers: Art and Ron thanks for your kindness. Breakfast buffet was nice, highly recommended. The hotel has a nearby convenience store and pubs, rooms are neat and spacious, hotel bar was soo nice",5,2024,07,31
224,"Cost effective for location, good family hotel.","Nice hotel, not too far from the centre (about 15 - 20 minute walk).   I stayed with my kids and the room was big enough for us all. The hotel is clean, modern and deceptively large (looks like a guest house externally).  We only ate breakfast here but seemed to have landed on a football final weekend and one of the busiest hotel breakfasts I’ve experienced.  I noted the name of the breakfast host (Bismark) because he managed everyone calmly, seemed to be finding solutions to police the breakfast traffic effectively and treating everyone pleasantly despite all the chaos.  However, one young blonde girl coming back and forth from the kitchen with a face like thunder barked at him several times to clean tables etc.  If better service was what she was after, she was the only one souring the atmosphere - she should be reprimanded for speaking to colleagues like that and put on a course to help her navigate a customer facing environment/find a new job. Well done Bismark for dealing with her attitude with grace and putting the guests first.",4,2024,07,30
224,Comfortable and Convenient,"This is a great hotel, conveniently located near the Luas along a canal. A 3 minute walk. The room is comfortable and the bed was great. There is no refrigerator in the room, however, we did have a teapot and coffee available in the room. The breakfast selection was excellent. So was dinner the night we dined in. I would definitely stay here again.",5,2024,07,20
224,Accommodating bar staff,"The staff was friendly, and the rooms were clean and lovely. We were especially impressed with Cian, Alberto, and  Frank who went to great lengths to get us  food after a long day! They were amazing! It was after 11, and they ensured that we had hot food. Great location. Highly recommend!",5,2024,07,18
