Location Name,Title,Text,Rating,Year,Month,Day
14,Incredible hotel in the Gothic Quarter of Barcelona,"Wonderful accommodations. We had a Junior Suite overlooking the courtyard. Lovely windows opened up to let the fresh air of early spring in.  Immaculately clean and comfortable. Since I don't like elevators, I climbed up the 3 flights of stairs which for me, is no big deal.  Hotel is charming and dimly lit.  The bathroom was roomy and had all the comforts of a 5 star hotel. The shampoo and conditioner where luxurious on my long hair, but I digress.  Breakfast was lovely, served on long plates consisting of fresh cheeses, fruit, yogurt and granola. Then there was a choice of something hot off the menu.  The restaurant had special dishes that we didn't venture to try.  We had room service which was great.  The staff was wonderful, polite and friendly, always ready to help. Located in the Gothic Quarter, with close access to everything. La Rambla was only a fun 10 minute walk, passing shops and interesting streets.  If we get to Barcelona again, we will surely stay there again.  Totally recommend this hotel. ",5,2019,03,25
14,Amazing Medieval Boutique hotel,"We had the chance of staying at Hotel Neri for one night and wished we could have stayed longer. 
The Hotel is beautiful, the interior design very cosy, the employees are nice and helpful. Breakfast is divine and so it the bed linen!
The localisation is great: in the center of the Barrio Gotico, close to everything.  Thank you Hotel Neri!",5,2019,03,24
14,Perfect small hotel in a perfect neighborhood...,"My stay in Barcelona was too short at two days, however, this Relais & Chateaux property made it very comfortable and lovely. Their (pre-arranged) driver was waiting for me at the airport. This hotel was found down the small alley-like streets of the Gothic quarter; this hotel is perfect for travelers that like small properties which are special in the atmosphere, service, décor, accommodation, and hospitality. I had reserved one room for two nights and two additional rooms for one night (my family arrived). There was, initially (before arrival), a glitch between the hotel reservation system and the R&C system, however, the staff cleared up the problem. Everything they did is done with a smile. The rooms were very clean, comfortable, well-appointed and lovely. There is a charming, small square to one side of the hotel that opens onto a church entrance (chillingly scarred by bullets and shrapnel from the Spanish Civil Way of the 1930s) and a children’s school. While it’s perfectly quiet in the afternoon and nights, if you’re a late sleeper, you should consider a white-noise app for your phone or tablet/pad because the children frolic in the square and may be heard. Not a problem… just forewarned is forearmed. Breakfast is a delicious served Continental-type but served to you by a lovely and accommodating staff. However, a breakfast entrée may be ordered. It was perfect. All in all, we loved our stay.",5,2019,03,23
14,Amazing!!!,"Absolutely amazing stay at Hotel Neri! Attentive, kind and professional staff. Wonderful (and I mean wonderful) room and general atmosphere. And delicious food! Well worth the cost for this luxury stay!",5,2019,03,23
14,They lied about the rooftop terrace,"The staff lied about the terrace not being open for those outside the hotel. Apparently, the terrace “used to be open before but not anymore starting with this year”. That is not true! I can understand that they have the right to select their customers (although there was absolutely no reason for that due to the circumstance!) but I think it’s pathetic to just lie to someone’s face especially when they had been there days before. And if they don’t allow the access then at least they should make sure to specify it on their web, social media and also make sure that there’s no false information out there, so at least they can avoid making people waste their time. Also the concierge (or whoever that person was) had no customer care skills unfortunately.",1,2019,03,16
14,This hotel oozes charm,"My friend and I stayed at the Hotel Neri in September, 2018.  We were thrilled with our room in the Casa Neri Apartments - still close enough to get the full service of a hotel, but nice to have a little independence with a sitting room and kitchen.  The bed was very comfortable, towels and toiletries extremely nice, breakfast was delicious and service top-notch.  But the real reason to stay here is the location and the charm of the setting - the winding streets of the Gothic Quarter, what looks like original stonework on some of the walls, and all the little touches the combine old world charm with new world comforts.  It definitely became a highlight of our Barcelona experience.",4,2019,03,15
14,Great,"A great place to stay. Not cheap, but amazing ambiance, from the moment  you walk in until it's finally time to leave. Situated in the gothic quarter, close to the cathedral in one direction, not far from las Ramblas in the other. ",5,2019,03,14
14,A perfect hotel by all accounts in the best location in all of Barcelona,"Our hotel was the highlight of our trip to Barcelona. We stay around the world always seeking out charming boutique hotels that strike the balance of small but not to small. Its a perfect mix of charming yet modern and warm still sexy. The staff was exceptionally personal and attentive.

I wouldn't want to stay anywhere else.",5,2019,03,13
14,"Convenient, Romantic, Lucurious Stay!","Hotel Neri is the perfect blend of modern luxury and Old-World charm. We stayed in their apartments, and it was so convenient to have a full kitchen and all the hotel amenities. We had our friend staying on the couch and he had no complaints. The housekeeping team did a great job of turning down the apartment at night and supplying enough towels for all of us. 

I've been to Barcelona a half dozen times and this was the first time I stayed in the Bari Gotic and I was not disappointed. I was afraid the neighborhood would be overly touristy, but everyday it was a delight making our way through the labyrinthine streets and popping into the many local mom and pop shops in the area.",5,2019,03,11
14,Highly Recommended in great location,"excellent service by all employees, friendly and very helpful. we loved the aptments we stayed in during 2 different visits in february and march. Would be nice to have a small exercise gym room, especially for travelers.",5,2019,03,07
14,Little Gem in the Gothic Quarter,"Pictures don't fully support what you will expect. It is quite a mix of Stlyes which worried me first. But being there, this worrys vanished immidiately. The Atosphere is welcoming and cosy. The Staff as well is extremly helpful and we felt comfortable the whole stay. ",5,2019,03,06
14,Perfect for first timers,"The second I walked into the hotel I was amazed by how gorgeous it is, as others are mentioning it's found in the Gothic quarter, and has a medieval look, with contemporary furniture. My room was gorgeous, with very high ceilings which gave a very grand look, the location is absolutely the best in town, and that's really why we chose the hotel, close to the Picasso museum, cathedrals, markets, Las Ramblas.. This is the place to stay, especially for first timers in Barcelona.",5,2019,01,21
14,Hardly a 5 Star Experience - Not worth the money,"This will be a rather long review but do yourself a favor and read it all.
I hesitated writing this review, if fact after being contacted by the Hotel Neri to write a review on Trip Advisor we opted to email the Management about our experience. That was back at the end of Nov 2018. It is now Jan 2019 and they never responded. What follows is what we sent them back in November 2018.... I am attaching photos to this review which show details what is in this review. 

""I received an email generated from your hotel, prompting me to leave a review on Tripadvisor. I would be remiss in doing so if I did not first, attempt to contact you regarding my recent stay at your Hotel Neri and my almost complete dissatisfaction with our stay.

First to highlight the positives, the location was indeed terrific, being in the heart of the Gothic neighborhood. The front desk and receiving staff were professional, personable and attentive. The common areas although not used, were all staged very appealingly.

On the negative side, while the Hotel Neri strives for modernism in its ancient beginnings, travelers such as ourselves do not expect minimalism. As a guest of a 5 star hotel I expect a place to hold or store my luggage and a large closet to hang my cloths, instead my suitcase and my husbands had to be put on the floor and the small cupboard covered with a curtain was only large enough for us to hang a fewe items and stow one carry on bag. At the very least there should have been foldable luggage racks for our suitcases instead of having to place and live out of them on the floor.

In a 5 star hotel I expect to have a place to put my toiletry items in the bathroom where they are not in peril of falling off the only tiny storage shelf and into the toilet or stack them haphazardly on the red metal stool under the sink. I also expect to find some niceties in the bathroom like a shower cap and some physical bars of bath soap. I would also like to hang my towels on a rack that can actually accommodate them and a bathrobe, rather than finding my towels in a pile on the floor becuse the tiny metal knobs mounted on the walls couldn't hold anything more than a baseball cap. 

In a 5 star hotel I would also expect the floors to be clean and discovered after wiping a spill in front of the mini-fridge that the floor was FILTHY.

I also expect that the trash would be emptied daily, and that for peak season rates during off season that the “complementary” bottle of water in the room would be replaced each night, neither which happened. Furthermore, when I asked the front desk where I could get some ice I was told to go to the bar and ask for it. When I did, they did provide me a small bucket and jokingly said, “that will be 10Euro….just kidding”. A five star hotel would have had ice waiting in my room or an offer to bring up the ice.

Overall the small, cramped room with the cheap floor lamp listing to one side, the broken little table and two small chairs that were neutral and inexpensive at best and lighting that was dim made the room cramped and is hardly by any standards considered a 5 star property. I might also add that there was a crack on the ceiling and scuff marks along the floors.

Lastly, as we were only on the second floor we often took the stairs which was dirty, marred and at different times cluttered with racks, carts and other miscellaneous items that was not only unsightly but could offer safety issues in the event that there was an emergency.

I feel that for spending over $340 euro a night that we were completely taken advantage of and would never recommend the Hotel Neri.""",1,2019,01,18
14,Fabulous small hotel in Gothic quarter - Exquisite service!,"What a great, charming Hotel - from the warm and genuine welcome -and the staff are always so eager to help with every detail.  It feels like you're in a medeival castle location - with the warm glow of candles and stone facades. 

Our room (Jr. Suite) was very large - a high (15 ft ceiling) with wood beams overlooking the square.  We enjoyed the lounge area for tapas and night caps.  Service was just exceptional - from meeting us out in square to assist with luggage (hotel is on pedestrian only alley) - to helping with museum tickets and restaurant reservations. Location couldn't be more perfect to explore the Gothic quarter and areas from there.  It offers a personalized, intimate feel - and was perfect for our family of 4.

I'll be back!",5,2019,01,11
14,Best hotel ever,"Great hotel, amazing location, wonderful staff....stay here.  We had a suite in their apartments next door.  It had a kitchen and fridge, so you could eat all that awesome food/wine from the markets in the comfort of your hotel...it was wonderful.",5,2018,12,15
14,Hotel Neri Barcelona,Excellent small hotel in convenient location with old world charm combined with modern facilities. Rooms are very comfortable and roomy including lounge area to relax in. Dining area is. Great for breakfast and for dinner with a very good menu available. Staff at reception and Resturant are very helpful and pleasant and multilingual. Most welcoming and make the stay more enjoyable ,5,2018,12,15
14,Perfect location for Gothic quarter  stay in Barcelona,Fantastic location for exploring this unique city. Get lost and found wandering through the streets and eating at all the bars. Would love to come stay again in 2026 when the sagrada familia is complete.,5,2018,12,13
14,Great stay at a first class hotel,"This is a truly great hotel.  From the moment you arrive you feel welcomed.  They really do go out of their way to help in any way possible.  The hotel is small, but has all of the services you would want in a great location.  We stayed in the apartments, which are right across the road from the hotel entrance.  Very nice, with more than enough room for 2.  We booked using the AMEX Fine Hotels and so breakfast was included in our rate and it was really good with plenty of food.  For 2 days we had it delivered to the room.  Small but nice roof deck.  We were there in November so the bar on the deck was not open but one afternoon we grabbed a bottle of wine and went up there for sunset.  The only thing to be aware of is that the street it is on is very narrow and some cab drivers understandably won't deliver you to the front door.  They take you to a square a block or so away, but if walking is an issue arrange your cab through the hotel since the company they used did make it to the hotel entrance.",5,2018,12,12
14,Great location and hotel restaurant,Hotel Neri is very well situated. The highlight for us was the innovative menu and warm service at the hotel restaurant. We dined there twice(unusual for us) and the other evenings would come back for a late evening drink and dessert. The meals were informal but outstanding and the atmosphere warm and inviting. The bartender was an artist and delight to watch preparing cocktails.,4,2018,12,09
14,"Charming Hotel, Very Attentive Service, Unbeatable Location","I can not rate this hotel high enough. The test of a great hotel is how problems are handled. We needed a room change upon arrival due to my error in booking. It is a small hotel  and we were staying five nights. Jacopo , the front office manager , listened carefully to me , explained the challenges and assured me he would solve the problem . He did just that with charm and extreme attention to detail.The rooms are a great blend of historic detail and modern comfort. The bar/ lounge is comfortable and staffed by personable servers who make a good drink. The breakfast is interesting and delicious . The location is as perfect as you can get . The doorman/ valet staff consistently  go above and beyond in offering assistance and recommendations. The housekeeper went out of her way to accommodate our room change. We can’t wait to go back and have already recommended this hotel twice to friends . ",5,2018,12,03
14,Hotel Neri,Wonderful service.  Excellent in all ways.  The room was quiet and comfortable.  We liked the design and location of the hotel.  It was very convenient.  One of us got sick and they arranged a get a doctor.  Very helpful.,5,2018,11,30
14,"Great location, great service","We stayed at the Hotel Neri for 5 nights in November 2018.  The location of the hotel is great, walking distance to many of the areas tourists would want to go, and in the heart of the Gothic Quarter.  We rented an apartment as we wanted kitchen facilities which is a short walk across the street from the hotel itself.  The apartment worked out great for our needs.   We didn't use the laundry faciilities and dishwasher but apartment came equipped with both. The bathroom was a bit cramped for 3 people and the housekeeping service could use some attention..  Housekeeping didn't show up until very late in the day and didn't refill the bathroom with necessary items several times.  We actually had to go to the lobby and get the items on our own twice.  Aside from housekeeping, service at the hotel was excellent.  The breakfast staff was very responsive and the front desk/concierge people were very friendly, very helpful and accommodating.  Breakfast itself was very nice each morning, although we would have liked to see some variety on the menu since we were there for 5 mornings.  Maybe at least a special dish each day on top of the regular menu?  All in all, we would definitely recommend Hotel Neri but suggest their housekeeping staff get  a little more on the ball.",4,2018,11,26
14,Great Hotel in a Great Location,"Our family of 5 (10 y.o., 12 y.o., 14 y.o.) stayed here for 4 nights and had an incredible stay.  The hotel is very charming and well-located, and the staff are amazing.  I would highly recommend staying here - one of my favorite all-time hotels!",5,2018,11,26
14,"Great Location, Awesome Food, Amazing Staff","We were treated to excellence in our two-night stay at Hotel Neri and can't say enough about everything at this hotel.  The location is perfect--easy walking to the Gothic Quarter, great shopping, lovely restaurants, and lots of sightseeing.  The reception on our arrival was warm, friendly, and most helpful.  We were offered coffee, water, sparkling water, and lovely little cookies, right in the front lobby.  You feel like you've stepped back in time and are in an old Spanish manor when you arrive.  Our room was ready and we were escorted (and helped with our luggage) by one of the front desk staff.  She stayed with us, explaining our room amenities, and making sure we had what we needed.  At one point, I needed to make a call to a hotel in Monaco due to an overcharge on our bill--the Hotel Neri staff placed the call for me and situated me in a private room for my call---wow, how great is that!!  They also made reservations for us at a marvelous restaurant (walking distance, local, genuine, perfect) and helped us with our driver on our last day's departure. One night we stopped in to the bar for a quick drink before dinner and sat at the bar.  The young lady bartender was just delightful, we had a wonderful conversation with her and learned about her background from Eastern Europe--again, super friendly, made us feel totally welcome.  There are two more amazing things I want to point out:  one is the breakfast.  It's in the hotel restaurant and is served on a long ceramic plate that includes assorted breads, yogurt, granola, fresh fruits, cheese, meats and salami, jams, honey, and butter.  And that is for EACH person!  On top of that, you can order from a menu that includes eggs to order, omelets, pancakes, and bacon.  It's a breakfast fit for royalty!!  And the server is SO very friendly as he brings freshly made coffee, orange juice, or whatever else you want to drink.  The other amazing thing is the service we received upon leaving.  We had a LOT of luggage, having been on a Med Cruise for 7 days prior to our stay in Barcelona.  We had to take the luggage to a driver that was about a 5-minute walk from the hotel, based on where he needed to park.  One of the Hotel Neri staff members insisted on helping us with our bags and walked all the way to the driver with our bags in tow, making sure we got everything safely transported for our trip to the airport.  This is exemplary service, top to bottom.  We highly, highly recommend this hotel and if we should return to Barcelona it is the ONLY hotel we would consider.  Thank you to the entire staff of Hotel Neri for a fabulous end to our European vacation!",5,2018,11,18
14,A Favorite!,"Hotel Neri is romantic, charming, wonderful, has truly the best location in the city and within the Gothic Quarter. I love the traditional exterior with modern interior. We were taken care of by the staff and there was not one thing that we felt could have been better. We had a lovely first and second stay! ",5,2018,11,12
14,"Hidden Gem, Smells Great","This hotel is hidden im Barrí Gotic, but is a great base of operations to explore the quarter and refresh yourself in the morning and at night. The breakfast was unreal in terms of quality and quantity of food. The room was comfortable, with good lighting and a tiny balcony that made us feel like locals. And everything in the hotel smells amazing.",5,2018,11,11
14,Perfect hotel in a perfect place,"We stay at the apartments, very convenient. Hotel itself is superb, relais standard, very professional and helpful staff, very nice food. Location the best you can imagine. No parking and no direct access for a taxi, so be aware you have to walk with your luggage some minutes or ask for a help. Anyway highly recommended. ",5,2018,11,10
14,Awesome Gem in the heart of the Barri Gotic,"My husband and I had the pleasure of staying here for 2 nights. It was an adventure finding the hotel that is tucked away in the alleys of the Barri Gòtic. Once inside you’re warmly greeted by their amazing staff. The main lobby is 18th century while the bar, restaurant are 12th century. The history is spectacular as was our room. We were upgraded to a junior suite, room 107 which had heigh ceilings that were original wood from the 18th century.
In the back is the church San Felip de Neri which was Gaudi ‘s favorite place to pray.
Thank you to the staff for making our stay so memorable.
I will recommend you for sure.
",5,2018,11,04
14,A treat!,"Was fortunate enough to get transferred, or shall we say significantly upgraded, from another hotel during a business trip. The Neri comes across as a luxurious and tranquil  haven, which is still right in the middle of the old town, a stone´s throw from major sites suc as La Boqueria, La Rambla, etc.  The service level is impeccable from the moment you enter, lobby, the restaurant and rooms are tastefully decorated. Breakfast is excellent, with great freshly baked bread, croissants, sliced fruits and an extensive breakfast a la carte menu. Theres also a dinner menu that I didn`t get to try. I really wish I could have spent more days here : The hotel and the whole experience is an absolute treat, and since we all deserve a bit of pampering from time to time, go for it if you have the chance ! I sure will the next time I`m around.",5,2018,10,31
14,"Pleasure and quiet in noisy,busy area.            pleasure, pure pleasure","The is a great find in bustling city.  The are rooms wonderful with pale colors that instantly help you relax. It’s quite romantic if theirs 2 of you, as well as very private .
The dinning room serves a wonderful breakfast, great lunches and dinners.  The service is the best I’ve had in years. Everyone assist you with your needs. They find private guides that really know history and have keys to locked sites. Once you walk in lobby you feel peace wash over you. The lobby are has many areas to relax and enjoy music that plays all day. As a solo traveler I feel very comfortable and safe here. Deserves 5 1/2 stars.
",5,2018,10,25
14,Heart of Barcelona ,"We recently visited this 5 star historic modern hotel in the center of the Barri Gotic for my wife's birthday and was an incredible experience made possible by the pleasant, friendly,  over the top staff. From the moment you walk in you feel like you are somewhere surrounded by rich history and culture.  The boutique hotel has a amazing restaurant with a view of a historic plaza where there is a church one visited daily by Antonio Gaudi who is a significant architect to Catolonia. Also, located on the top of the hotel was a neat little rooftop for watching the sun go down or enjoying a drink. The general manger Maria and her team Martha, Jacob, Veronica, Joaquin, rest of staff including restaurant personnel have went above and beyond to make this a one of a kind experience we will cherish forever. We are looking forward to our next time in Barcelona with our friends at the Hotel Neri.",5,2018,10,25
14,Home away from Home,"This gem in the Gothic Quarter was overall amazing - we give thanks and appreciation for the service and care we received at HOTEL NERI. It's also centrally located near the Ramblas and walking distance to the Cathedral. Its in a renovated 17th century palace which backs onto Placa Sant Felip Neri which has a fountain and a palm tree - also Dont forget to visit the roof-top with a glass of Cava to unwind from a day of sightseeing.It was the perfect place to celebrate my birthday and make new friends that I now call my family. It was absolutely perfect!And the staff, Martha, Jacopo and Veronica were amazing. Their recommendations of places to eat  and visit did not disappoint. The food in Barcelona was absolutely phenomenal!!! Every staff member with whom we came in contact was attentive and kind including the bar staff and housekeeping. We have already decided to return to the NERI for our next vacation, which will be next year.We had a wonderful time, and I have recommended HOTEL NERI to all of my colleagues, friends and family. Thank you again for such outstanding service and memories to last a lifetime!!",5,2018,10,24
14,"Hotel Neri, Barcelona","Beatiful small hotel in the Gothic Quarter.  Modern renovation of adjoining 12th & 18th century buildings, with all conveninces. Nice, quiet, relaxed, friendly hotel for people who want to be in a civilized environment.",5,2018,10,19
