Location Name,Title,Text,Rating,Year,Month,Day
230,Amazing,"We had the best stay! The hotel kindly upgraded our room, and it was absolutely beautiful. So spacious, elegantly decorated, and with THE coziest bed! 

The location was unbeatable. This was very important to me, as it was my first time in Dublin and we only had 24 hours until the next leg of our flight. I was able to easily walk to everything I wanted to see. 

The Irish breakfast was fabulous. Couldn’t have asked for more. 

The staff at both the hotel and restaurant were professional and friendly. Our only regret was that we didn’t stay longer! We will absolutely stay here again on our next trip to Dublin.",5,2024,03,15
230,Disappointing end to a lovely weekend,"After a restful night in a lovely room we were looking forward to the breakfast which we had read great things about. We had booked the last sitting (9.45am), our room was across the road
from the restaurant area in a separate building, we arrived at 9.48 and
were greated by the pleasant receptionist who showed us where to go. However the waitress looked annoyed when she saw us and checked a guest list in the kitchen, we overheard someone comment that we
should have been there at 9.45, to which the waitress came out and said ""you're late"". We were shocked, I showed her the time on my phone and she replied that we should have been
there at 9.45 (it was now 9.49). We sat down and felt so uncomfortable that
we decided to leave. The waitress stated that she had not intended to insult us and appeared surprised at our reaction to her comments. We then realised that the manager had infact been in the room when all this was happening and had not intervened. We spoke to her and she also apologised for the way we had been treated but by now it all felt very unprofessional and awkward so we left. We requested a refund for the breakfast, a follow up email from the hotel would have been appreciated but unfortunately this never happened.",2,2024,03,09
230,Just What   We  Wanted,"The room was great, staff was great, location was very good.  I am sorry that we only had a couple of days, but will hope to return late next summer. My wife was ecstatic with this location. I would recommend this location to any and all. Try it you will like it.",5,2024,03,07
230,Short stay,"We stayed just one night in the townhouse on a flying visit in a compact but cosy room. The place was elegant, the staff were really pleasant and accommodating and the breakfast was lovely. We would recommend the townhouse to anyone looking fnor a boutique hotel and a boutique experience.",5,2024,02,29
230,Great little hotel in a great location with nice staff and a good breakfast.,"We decided to surprise our dearest friend on his 70th Birthday by joining them in Dublin for a couple of days.
The receptionist helped us with the plan and the surprise was in place and really worked.
We were impressed by the quality of the rooms and the location was great for us.",5,2024,02,24
230,Amazing stay,"Up to now this is my favourite hotel ❤️ perfect room, bed, bathroom, cleanliness, kindness of the staff, wonderful breakfast, perfect location in the city center… a dream!
Many thanks to all! This is the top level!",5,2024,02,20
230,Lovely spot. Perfect access to everything.,Spent a night at Trinity Townhouse last week. It has the Perfect location. Close to Mansion House and Grafton street. Fabulous breakfast.   The rooms were spacious and very well equipped. I would definitely stay again when in the city. ,5,2024,02,10
230,Excellent experience,"Excellent experience overall. The staff is highly professional yet friendly and helpful. The room was super clean, cozy with a very comfortable bed. The bathroom is well maintained with the modern shower and high quality toiletries. The location is central but quiet. I would love to come back. ",5,2024,02,06
230,Fantastic hotel in the heart of Dublin,We have a brilliant stay at the Trinity Townhouse hotel. The rooms were well equipped and very comfortable. The full Irish breakfast was fantastic. The staff were extremely helpful and friendly. We look forward to staying again some day. Would 100% recommend. ,5,2024,01,30
230,Fantastic Hotel in a great location,The hotel was  clean and comfortable to a high standard. The breakfast was good and the hot options individually cooked to order to perfection. There was a car park 2minutes walk from the hotel which the hotel provided discount vouchers for.,5,2024,01,30
230,No other words but perfect,"The hotel is superb. Its location and staff are undoubtedly the highest points of this awesome place. I’d only say that the room is too small for the number of things they have inside, so, if I had to advise a change, I’d suggest them to diminish the number of items in the room (fewer cushions, glasses, etc) as these tend to tighten the space and get scrambled with clothes, suitcases and everything. Anyway, all in all, it’s an excellent place to stay. Breakfast is delicious, staff is always nice and helpful and the location is close to everything you need. ",5,2024,01,21
230,Brilliant boutique hotel,Stayed in a deluxe room which was really comfortable and quiet.  The building is on a lovely street with an excellent Italian restaurant opposite.  Walking distance to all main sights.  Staff delightful and friendly.  The breakfast is fabulous.  Really good value could not fault it. ,5,2024,01,16
230,Excellent service,"Super friendly staff. Lovely room but compact. Our room was 3 floors up, with no lift but that was ok for us. Fabulous breakfast. Will definitely recommend to friends and we will be back to stay again. ",5,2024,01,15
230,Welcoming and super comfortable hotel with friendly staff,"Both my granddaugther ,seventeen years old, and myself enjoyed a two nights stay in the hotel. 
The hotel is perfectly situated for walking to all the sights in central Dublin as well as a short drive from the airport. The room was well equipped with wonderful beds and the breakfast delicious.We both enjoyed not having a buffet but very good service at our table in the charming dining room.",5,2024,01,08
230,Excellent,"Excellent location, very friendly staff and great service. The breakfast was very nice and the room was lovely. Make sure to try the eggs and salmon with guacamole. Perfect location, just outside the busy city center (temple bar) and close to the DART trainstation. ",5,2024,01,06
230,Perfect location,"Perfect location, quiet and nice street in the middle of everything. Comfy bed, cozy rooms, very good breakfast served in the nice restaurant behind the hotel. Staff polite and helpful. Very good experience.",4,2024,01,06
230,Simply marvelous,Location was extremely central. Rooms was very modern and comfortable. Staff were extremely helpful and the breakfast was outstanding. Would definitely stay here again. Well priced too. Close to Temple Bar and we could walk to Jameson Distillery. The DoDublin hoo on hop off stop was very close by. just loved it,5,2024,01,03
230,Excellent post wedding stay!,"We stayed here following our wedding ceremony in the city centre. The hotel itself is a great city centre location. The hotel is beautiful and boutique, the room was fantastic - I'm pretty sure we were upgraded because if our wedding and we were so grateful, would definitely return!",5,2023,12,29
230,Perfect Hotel in Dublin,"The hotel is very central. Most of Dublin's attractions are within walking distance. The room was perfect. All employees were always friendly and helpful. I can recommend the hotel to everyone and will stay there again when I'm back in Dublin.
",5,2023,12,19
230,Very enjoyable hotel on a truly remarkable location in Dublin city centre,"This stay in one of my favourite cities worldwide was one to remember, thanks to the Trinity Townhouse Hotel. The location is really superb: a few footsteps away from Grafton street, but in a very peaceful street. Temple bar is a3 minute walk, and Trinity college is right next to the hotel. Couldn't be any better. 
The room was tiny, I think I never had such a small room, but remarkable nice and a very high finishing standard. All of the staff was very helpful, we felt really welcome! Special notice for the breakfast: truly a gem, and well above standard. Also here: love the staff, nothing was too much. 
My wife and I highly recommend this place, and it will be the only hotel we will attend again in Dublin in the future. ",5,2023,12,18
230,Midweek couple escape,"Cosy hotel centrally located to shops, restaurants, bars, museums all within walking distance. Near Grafton Street. Adjacent carpark. Fabulous breakfast cooked to order. Friendly staff. Highly recommend for short stays.",5,2023,12,14
230,5/5 stay!,"We had a fantastic stay here! I’ve stayed in many hotels in Dublin and this was by far the best stay! Lovely staff, super clean and cosy rooms, excellent location right next to Trinity College and Grafton street. Excellent value for money and has to be one of the best hotel experiences I’ve ever had. We’ll be back for sure! :) ",5,2023,12,08
230,A lovely stay,"My fiancée and I had the pleasure of staying at Trinity Town House for 3 nights for a special trip to Dublin. We were in room 309 on the top floor. As other reviewers have mentioned there is no lift in this hotel. If you are on the top floor you probably will be slightly out of breath carrying your luggage but this was not a massive issue. The rooms are relatively small but we appointed. The bed is raise for extra storage space. I think it would be a good idea for the hotel to install a hook on the back of the door as the only other place to hang a coat or jacket was inside the wardrobe and this had limited hangers. Again not a massive issue. 

The best thing though about this hotel is the service provided by the staff and the excellent breakfast. The location is perfect for a central location but still a quiet street. 

Would definitely recommend and would come back again on our next trip.",5,2023,12,01
230,Thoroughly Relaxing,"This was our first time at TTH and  certainly won't be our last.  Our room was ideal. We were in the building opposite the hotel. It was comfortable, warm, clean and quiet. It was a very relaxing stay and we will definitely return  ",5,2023,11,27
230,Great choice,"Everything in the hotel worked  well - the hotel is nice and comfortable, the room was  cosy, staff helpfull and friendly, the location is perfect, it is quiet hotel in the centre  of Dublin, the only slight discomfort  we felt  is  that you have to book the time for your breakfast as the breakfast is served, it is not buffet - but anyway the breakfast itself was excellent.",5,2023,11,20
230,Lovely hotel in a beautiful part of Dublin,"Exceptional hotel inside and out, staff very friendly and professional. Room of a very high standard with excellent amenities. Breakfast was very high in standard, the restaurant is intimate and inviting would absolutely recommend ",5,2023,11,15
230,Amazing breakfast too!,"Lovely hotel near to amenities with excellent helpful staff. 
Wonderful tasty breakfast offering a choice of freshly cooked food and warm bread and pastries. Coffee was awesome too!
Our cosy room was a little small for two though. ",5,2023,11,10
230,"Lovely, small, friendly hotel",Beautiful hotel on a quiet street right in the heart of Dublin.  Service from the reception and waiting staff was welcoming and helpful.  The rooms are perfect - even the smaller rooms  are well designed and have everything you need.  Breakfasts were perfect!,5,2023,11,07
230,Really lovely stat,Beautiful boutique hotel in a very central location in the heart of Dublin. Room was compact but beautifully appointed. Very cosy. Clean. All necessary amenities and more. The hairdryer was really powerful which was great. The air conditioning was really good. ,5,2023,10,26
230,Perfectly situated....,"excellent quality hotel, excellent location to walk to everything. Rooms are well thought out and tasteful. Healthy and hearty breakfast.  Great Italian restaurant right next door for when you want a break from the many great nearby pubs.  We liked The Duke.",5,2023,10,25
230,"Excellent location, clean room, friendly staff and great food.","My partner has difficulty with stairs, so the hotel allocated a room with good access from the ground floor which was much appreciated. All aspects of our stay were outstanding including a large clean, comfortable room and bed, an excellent selection of breakfast options served in a modern, bright dining area. All members of staff were polite, friendly and helpful. The hotel location is excellend for the city centre, public transport and shops etc. I will stay here on my next trip to Dublin.",5,2023,10,24
230,Excellent,"Great hotel. Nice and pilote people. Fantástic breakfast. Great location, near all points of interest. The suite was clean and confortable. Definitely recomend.  If return to Dublin would stay there again ",5,2023,10,24
230,Fantastic Base for Dublin,"It was the perfect place to stay while visiting Dublin.  It is off a quiet street, but just steps from Trinity college and a short walk to central Dublin.  It is close to the historical sights, museums, dining and shopping.   The room itself was outstanding.  it had a king bed and a studio living area with a couch.   It was much bigger than I expected and comfortable.  The staff were fantastic!",5,2023,10,22
230,Great Stay!,"Excellent stay. This is my 3rd visit and the only place I stay when traveling to Dublin. Fantastic location, friendly staff, extremely clean and comfortable. There breakfast is complementary and super tasty.    ",5,2023,10,22
230,October Visit,"Excellent service all round at Trinity Townhouse, staff were super helpful. Room was spotless and breakfast was delicious. Thoroughly enjoyed our stay. Would definitely return for another stay.  Top class!",5,2023,10,20
230,Excellent hotel in great location,"Booked at the last minute for two nights. We had a “small double room” but it didn’t feel small at all. Bed was extremely comfortable, bathroom amenities were lovely, breakfast was very good and the staff most pleasant.",5,2023,10,15
230,Charming boutique hotel,"What a treat. This lovely little hotel is super upscale, but does it with warmth and charm instead of glitz. Reception is thoughtful and efficient. My deluxe room was spacious, beautifully appointed and had all of the important amenities. The location is ideal for visiting Trinity; it is 1.5 blocks from the main gates where you enter for the Long Library and Book of Kells. There are many attractive restaurants and shops nearby; it is 2 blocks from the glam Grafton Street. Loved it.

To be clear, this is not a ""happening"" place. There is no bar, the restaurant is only for breakfast, and there is no room service. As a result, it is quiet and reserved. And I loved it.",5,2023,10,13
230,Great stay at the Trinity Townhouse,"Location: Excellent! Very near everywhere but silent at night
Breakfast: Excellent as well! The breakfast room is very cosy and the food delicious. 
Room: Very good size room 
Service: Excellent! Everyone was very helpful 
Conclusion: I can recommend this hotel 100%",5,2023,10,11
230,Great All Round,"Me and my partner stayed here for 4 nights, and can say it was a brilliant all round experience.

Amazing service
Beautiful breakfast
Great room
Fantastic location.

Would definitely recommend and stay again if we're back in Dublin.",5,2023,10,09
230,"Charming townhouse hotel in Georgian Dublin, near museums, squares and government offices.","Picked this hotel for location and price - wanted to be walking distance to St. Stephen's Green, Merrion Square, and their adjacent museums, but wanted better value than the ""grand"" hotels that are right on these squares.  The Trinity Townhouse Hotel (consisting of updated Georgian rowhouses) proved to be an excellent choice.
We had a Superior King Room, up one flight of stairs.  Other hotels might call this room a suite.  Besides the sleeping area, it had a large sitting area with classic and comfortable furnishings: a full-size sofa, chairs, desk, TV and (non-working) fireplace.  The room occupied the entire frontage of the second floor of this rowhouse - we had no neighboring rooms and no disturbance from other guests.  
The room wasn't ready when we arrived at 8am - but was available to us by noon.  One benefit of the delay was that the front desk staff brought our stored luggage up to our room while we were out sightseeing.   The staff offered to bring our luggage downstairs when we checked out - eliminating my only concern about being in a hotel with no elevator.
As others have remarked, the included breakfast (with waiters, not a buffet) was excellent.  Waiter staff were very hospitable, as were all the front desk staff with whom we dealt.
The location was perfect - besides being close to Dublin's two classic squares, the hotel was a block south of Trinity College, and an easy walk to Dame Street and Temple Bar.  A stop (Dawson) on the Dublin light rail Green Line, is two short blocks away, allowing easy access north and south.  (The Green Line has a transfer point to the east-west Red Line just north of the LIffey.)  ",5,2023,10,06
230,"Excellent comfort, service and location","This is an excellent hotel for comfort, service and location.  Its the best of both worlds being in a quiet street, but only minutes away from Temple Bar, Trinity College, St Stephen's Green and shopping in Grafton Street.  
The rooms were beautiful, we had a superior one with a nice sofa area and a view to the front of the hotel.
The breakfast experience was top notch - table service with food freshly prepared to order.
We could not fault it and are very likely to return on our next visit.",5,2023,10,03
230,"Great Location, Breakfast and Room","Trinity Townhouse was the perfect hotel for our stay in Dublin.  Location was perfect- easy to walk over to Temple Bar and other major attractions, but the neighborhood was very quiet at night.  The room was very clean and nice and cozy.  The breakfast might have been the highlight- it was a wonderful way to start our day every morning (also nice to have a variety of options so you could do a lighter or heavier breakfast for whatever you preferred for that day).  Staff was always incredibly kind as well.  Thank you for an amazing stay in Dublin!",5,2023,10,01
230,Quality put pricey,Great place to stay arrived early and asked if I could have breakfast as I would be leaving early the following day he just said no and laughed at me which I thought was a little out of order. Paid almost the same amount of money for a 3 night stay in Berlin last month for the price of one night here so criminally over priced but it was lovely ,5,2023,09,29
230,Delightful Stay,"Having stayed at many different kinds, sizes and styles of hotels around the world, I have to applaud the experience at Trinity Townhouse. The staff, without exception, were welcoming and friendly and the accommodation was spacious and comfortable. It was a little strange having a washbasin separate from the bathroom, but this was the only thing I would change. The breakfasts were of high quality and we would certainly look to stay here again when we return to Dublin.",5,2023,09,28
230,Wonderful place to begin our Girls Trip.,"What a fantastic start to our girls trip when we checked in here!  The rooms are spacious, super comfortable beds/pillows, plenty of outlets and our room was perfectly laid out for 2 friends to share the room and bathroom.

Breakfast was delicious, wonderful variety.  The staff is attentive, helped with reservations as well as transportation.  They even provided plenty of umbrellas.  Would for sure return on my next trip to Dublin.",5,2023,09,22
230,"Location, Location","This hotel is situated in the centre of Dublin. Walking distance to all tourist sights, quaint pubs, restaurants and beautiful parks. Our room was modern, comfortable and clean. the breakfast was very good and staff friendly.",4,2023,09,13
230,My Stay at TTH,"Hotel is extremely well located, very charming building and spacy and superbly decorated  romm. Bed very confortable. Bathroom tiny but confortable, bathroom eating system very efficience maybe a bit too much for this very warm weather period; Overall I highly recommend TTH .",5,2023,09,11
230,Excellent in all aspects,"Excellent room, outstanding service, superb brekfast. It is and old house, so there is no elevator! But staff is more than willing to help with luggage. Pure flavour of classic Dublin. We will definitely be back.",5,2023,09,05
230,Perfect 1 night stay,"Staff are so friendly, we stayed in the cosy room and it was perfect for us. Bed and pillows are really comfortable. Breakfast was amazing. Location amazing. Loved every minute of our stay, we will be back. ",5,2023,09,01
230,Nice stay,Nice hotel. We had a small room (but knew this when we booked) in which everything was perfect. Our room was located on the 3rd floor and there was no lift. The location is great and the breakfast delicious (could be until 10am instead of 9.30am). ,5,2023,08,22
230,Superb,Superb accommodation and very convenient location. The staff were wonderful and service was very friendly and punctual. Loved the breakfast with lots of options and great coffee. The room was spacious and en-suite very modern. Highly recommend,5,2023,08,19
230,A very pleasant stay,"Simply a great stay in Dublin. Rooms have been excellent, and friendlyness and helpfulness of staff cannot be better. Also breakfast was served from heart and was very delicious. When we visit Dublin again, our choice will be Trinity Townhouse again",5,2023,08,19
230,A WONDERFUL WEEK-END,"Great experience at the Trinity Townhouse.
Everything was quiet and perfect
We loved the room, the location, the cleanliness and service.
Staff gave us good advices to visit the town.
The italian restaurant in the street is also a great pleasure.
",5,2023,08,16
230,Nicest staff would definitely stay again,Stayed for 1 night with my sister the staff were so nice and went above and beyond to make our stay special. The room was lovely and spacious and clean. Location wise it's really close to Grafton street and the luas line so easy to get around the city. Would definitely book again and recommend this hotel I've stayed in a good few hotels in Dublin and by far the nicest staff I've ever encountered. The only downside is there is no elevator but the staff that greeted us at reception offered to help with our bags,5,2023,08,14
230,Early August 2day stay,"Friendly helpful staff, lovely atmosphere, excellent breakfast menu, loved the room, incl fridge and bathroom, which was nice and roomy with with easy to use shower. Dimmer switches for lights were a Godsend and air conditioning. Convenient to good restaurants and to shops but very quite street - no nighttime interruptions. If I was to find a fault it would be some background noise, presumably from kitchens/water heating systems in the hotel or from nearby premises, which we could hear in the distance but was not that bothersome. It did not stop us from sleeping! We have been a few times and will be back again. ",5,2023,08,10
230,Amazing place. Best staff,"The Trinity Townhouse Hotel is probably the best place to stay in Dublin. Right beside Trinity College where you can see The Book of Kells exhibition and the library Long Room (featured in the TV Show Foundation as the Trantor reading room).
Fantastic neighbourhood with a lot of pubs and lively streets and a lot more relaxed than the Temple Bar zone which is just a very short walk away anyway.
Many thanks to the staff at the Trinity Townhouse Hotel who were always helpful and made our stay very pleasant.",5,2023,07,29
230,lovely place,"Great location, impressive breakfast, lovely room. Close to Trinity college, Library ,Archeology museum. Not far from Grafton Street,St. Stephens Green.  Helpful and friendly staff, good wifi connection. We'd stay there again.",5,2023,07,25
230,"Beautiful hotel, great breakfast but lots of stairs",Lovely place to stay and the details and extras were lovely. great location and breakfast. from a practical perspective we were on top floor and there are a lot of stairs to climb even for a fit person its a challenge. The rooms are as described cosy with not a lot of space for movement. no chair but also no space to have one. The room was hot and whilst there is air-conditioning it can be noisy but there was no top sheet only a duvet so sleep was disturbed. also the seagulls are noisy which I know is outwith your control. Staff were very friendly.,4,2023,07,17
230,Amazing hotel!,"Partner and I went to Trinity Townhouse Hotel for a night for his birthday and I can't describe how amazing everything was. We were welcomed with big smiles at the reception and explained everything. Room was very clean and super spacious. Shower is amazing!! Breakfast was beyond delicious, there was no noise throughout the night although we were located in city centre. Staff was so lovely and helpful. I definitely recommend this place, we will be back! Thank you for an amazing day!",5,2023,07,17
230,Perfectly situated,"Excellent location and very comfortable room (although noise can be clearly heard from the room above. The hotel, appears to be plagued by a faulty hot water system. A decent breakfast but don't expect a second cup of coffee.",4,2023,07,09
