Location Name,Title,Text,Rating,Year,Month,Day
225,Magnificent Merchant House.,"Like the previous reviewer we stayed in the Oscar Wilde suite and it was amazing. 
Every little detail is thought of to make it a comfortable and luxury stay for you. 
Lovely hot warm shower, fresh towels, tea & coffee facilities, hair dryer etc. 
mini bar available if you want it. 
We did stay mid-week but temple bar was still busy, but we did not hear any noise after we returned from evening out. 
Although there is not a reception us such I think they did more for us than a 24 hour manned reception ! 
They stored our bags as we arrived before 2 and recommended a lovely cafe for a bite to eat. Midday checkout was handy and again stored our bags. 
The breakfast included is provided by a place called the stage door and again was amazing. 
Wouldn't hesitate in recommending.",5,2012,12,06
225,What an amazing suite!,"We stayed at The Merchant House, Temple Bar Dublin for a few days recently and were truly impressed by this accomodation! There are 4 suites, all named after famous writers, we stayed in the Oscar Wilde suite and as soon as we were let in we were gobsmacked. This is truly 5 star with every little detail thought about, from underfloor heating in the bathroom to sound proof glazing on the windows (you are in a very busy part of Dublin)! Our welcome was very frinedly and informative, breakfast was at the Stage Door just around the corner and is a must to set you up for the day! The suites are on Temple Bar doorstep, perfect on cold nights when you don't want to walk too far.
Overall, perfect accomodation for a great time in Dublin!",5,2012,11,05
225,OK serviced Apartment,"I think its important to emphasise the fact that this is a serviced apartment without cooking or washing facilities. So if you want a serviced apartment look elsewhere and if you want a hotel with facilities (including reception) you also better look again. The room/ apartment was nice and spacious however its important to emphasise a couple of things that some potential guests may see as a deal breaker. The shower pressure is rubbish. Its more of a trickle than anything else so if you like your showers and intend on washing your hair stay out of Temple Bar. Being in Temple Bar it will be incredibly loud until around 3am or so. If you like sleeping at night then please stay out of Temple Bar. The Merchant House has installed double glazing and even provide you with a pair of ear plugs but this simply reduces the noise to sound like a marching band rather than a U2 concert. If you dont like climbing stairs then stay away! There were 58 steps to the top, which doesnt sound like much but try that with two suitcases or after an exhusting day out. All in all the ""luxury suites"" as they are refered to are clean and comfy but just too noisy for me to give it anything more than 4 out of 5.",4,2012,10,31
225,Excellent location beautiful room,We stayed in James Joyce suite beautifully decorated room location brilliant every area of central Dublin close by. We had no problems with noise our stay was on mon/tues   We didn't feel as relaxed as we would have in a hotel there was a list of do' and don'ts which I can perfectly understand as they have lavished money and care into the renovation  no bath which we knew before we went was a downside and electric shower ran hot and cold could have done with more towels and shampoo and shower gel barely enough to cover our stay  but that aside a beautiful place and would recommend ,5,2012,10,10
225,In the centre of Temple Bar,"We've stayed at the Merchant House before (in the WB Yeats suite) but this time we had booked the Bram Stoker room as it was on the first floor and at the back (avoiding the street noise but typical there was a three day concert behind the building whilst we were there but we suspect everyone else in the building were subject to the same torture of Ireland's ""finest"" bands). 

First thing is the location - the Merchant House is truly in the centre of Temple Bar. It's noisy and smelly at times but the people are great. Easily accessible by the superb bus service - no wonder taxis tout for business all the time. We were greeted by a lovely lady and shown the room. The Stoker room is smaller but we felt we didn't need a larger room. The windows in the roof are magic - opened by remote control. The bed is supremely comfortable with tea making facilities but the kettle has seen better days - replace it with a new one! There is plenty of storage space so we could store our clothes. The mini fridge was useful for storing milk and other items that required chilling. 

The bathroom is lovely although I'm sure a bath could be installed. The toiletries and towels were replaced on a daily basis. The shower doors didn't close properly meaning that water leaked onto the glorious heated floor (shame that this couldn't be set for longer periods as it was a touch nippy).

We loved the Stage Door Cafe - vouchers are valid from 8am to 8pm for any meal so you can have an evening meal there instead of breakfast. The food and service is excellent. They even pulled out the stops in preparing sandwiches for us on our return journey home as we couldn't use the voucher for the weekend.

All in all, we loved the Merchant House. Make a note - new kettle, fix the shower doors and possibly stick a bath in as well and it would be perfect.",5,2012,10,07
225,Lovely James Joyce Suite...but noisy very noisy!,"First, the good points...
The James Joyce Suite is really spacious, clean and has quality furnishings etc.
The Housekeeper John appeared like Mr Benn from the next door Sex Shop (!) and gave us a lovely welcome. He really was very pleasant and helpful.
It's bang in the middle of the action; Temple Bar central! Just around the corner from the fantastic Saturday gourmet food Market and all the lively bars. We LOVED Dublin!
The Stage Door Cafe was great; nice and quirky, friendly, two minutes walk and a good fry up every morning at the time which suited us.
And then....
It's not cheap, 145e a night and I'd rather they just call it bed and breakfast; what's free about the breakfast?
The shower room was disappointing. It was a weak electric shower and the underfloor heating was ineffective. The towels were a bit past their best and the toiletries seemed a bit on the mean side.
I would have liked net curtains or some kind of privacy since when you opened the curtains everyone in the Riverhouse Hotel and artist studios could see right in.
But...the main thing is THE NOISE! It wasn't so bad on the Wednesday and Thursday nights, although you do get a lot of street NOISE at kicking out time and I could hear the guests upstairs moving about, running up the stairs etc. But FRIDAY! IT WAS MAD! LOUD MAD NOISE! REALLY NICE CHATTY PEOPLE and MUSIC and glass bottles SMASHING and people SHOUTING! MAD! I was tempted to take the duvet into the shower room and sleep there at the back. The windows do have sound proofing but still it was LOUD! The Mezz Bar/Club is right opposite and although the atmosphere was in no way intimidating or violent it was just not what you want at 4am. Check out google streetview and make your own decision!
I would go back if I got a room at the back and it was a bit cheaper and I was deaf. Shame, since like I say, it really was a very very nice suite and we did have a brilliant time and Leonard Cohen was great!",4,2012,09,17
225,Good B&B if you dont mind late night noise,"Spent one night at this B&B. Expensive at 145euro. Lovely comfortable bed, room quite small the Bran suite but had everything needed, safe, hairdryer etc. Met on arrival by a lovely gentleman who showed us to our room.  Excellent breakfast in cafe round the conrer, great coffee.But the noise couldnt be ignored.  At 1 am we could'nt hear the T.V. in the bedroom. with the music outside. We know it would be noisy in Temple Bar but didnt know it would be this loud. Avoid unless your a total party animal.",3,2012,09,16
225,"Perfect, wish we could have stayed for longer !!","Just back from a 2 night stay in the merchant house , we stayed in the Oscar Wilde suite in the top floor. The suite was huge and had everything we needed plus more, exceptionally clean and extremely comfortable . Location was perfect for us right in the middle of temple bar so although very lively at night we had no problems with noise at all. Breakfast is served in a cafe round the corner and again have no complaints , was a great start to the day. We plan on making another trip to Dublin soon and wouldn't want to stay anywhere else!! ",5,2012,08,30
225,Nice but noisy and a little scary,This is a nice large guest house in the heart of the Temple Bar area but would recommend only for those who are looking to seriously party as otherwise it can get really noisy at night because of the pub next door. Jokes aside the house was really spooky and one of my friends felt really uneasy sleeping on the top floor. Would recommend only for large groups looking for a lie in after a night of debauchery!!!,3,2012,08,28
225,Central and Clean,"My husband and I spent 3 days in Dublin and found this an excellent location for walking the city as it is so central.  Breakfast was provided by way of a voucher at a nearby cafe which was efficient and the food was excellent.  We were met on arrival but after that did not see or talk to anyone else, and this was a little strange and cold. However our rooms were cleaned thoroughly every day and were very comfortable with some nice little touches added like chocolates and biscuits renewed each day.",4,2012,08,09
225,absolutely perfect!,"Me and friend just got back yesterday from staying here in the James Joyce suite and it was perfect, no faults at all. Location great too! We almost didn't go out the first night as didn't want to leave the room! I almost don't want to rate it to high as want it to be our little secret! when staying in Dublin i don't think i'll ever look elsewhere to stay, if rooms not available for dates i want...i'd change dates haha!",5,2012,07,30
225,Hidden treasure!,"Stayed in the Bram Stoker room and whilst there may be no views, more importantly it is very quiet (not an easy feat in Temple Bar) so had a great night sleep. The room itself was beautiful, good size, very clean and plenty of light from the remote controlled sky light. Breakfast was included at a charming little cafe around the corner. 

All in all, Merchant house is a little treasure in a very popular location – good for nightlife in the temple bar, attending the Olympia Theatre or shopping in Grafton St. I would definitely go back.",5,2012,07,23
225,New love for Yeats,"We had a wonderful stay in the Yeats suite! It was spacious, super-clean and very comfortable.  The bathroom was huge and very modern - and also very, very clean! (I like clean!) The sound-proof windows really were sound-proof!  We didn't hear a thing.  It was a fabulous location - close to many attractions.  The breakfast was really a surprise ~ coupons for a wonderful little bistro just around the corner.  Mike and John and the housekeeping staff were very friendly and attentive.  I would definitely recommend The Merchant House.",5,2012,07,19
225,Attention to Detail-Superb!,"We stayed in the Oscar Wilde Suite which is the top floor (several flights of stairs).  It looks exactly like the photos.  Everything is exceptional quality and the attention to detail is unparalleled!  Everything you could want is there and labeled.  We only stayed 2 nights, but I wished we could have stayed longer.  Temple Bar is extremely loud--louder then anywhere I have ever stayed (louder then NY).  I like to sleep with the windows open, but I couldn't for the noise, but what amazed me was how quite it was when I closed the windows.  The breakfast restaurant was really surprisingly excellent as well.  The staff was very friendly, they even carried our luggage up all the flights of stairs.  The only thing that was strange is the bathroom door is glass, with only part of it frosted.  I'm not sure about the other suites.  I would highly recommend the Merchant House.",5,2012,07,04
225,The beautiful Oscar Wilde suite,"We stayed in the Oscar Wilde suite at the very top of the Merchant House in Temple Bar on Friday 22nd June.
If you can't make the four flights of stairs (no lifts - so difficult with luggage) then there are other suites on lower floors. 
If you can, then you are in for a treat - its a tastefully decorated/furnished apartment and well worth paying that little bit extra for - I believe it was the largest of the 3 or 4 suites available.

There was no noise at all from the bars/pubs around and it was well situated for the nightlife.
It was  really like having the key to a lavish apartment right in the heart of Dublin but be aware - there are no cooking facilites/kitchen, just tea/coffee making and a small fridge for the cold stuff.
Wife and I loved it and would definitely stay again - especially for that special occasion.

Stevo, Belfast",4,2012,07,02
225,Sanctuary in Temple Bar,"What an elegant and beautifully appointed guesthouse in the middle of the rowdy and noisy Temple Bar.  It was a great location, and no amenity was spared!  We loved the sound proof windows.  Both the Oscar Wilde and James Joyce suites were lovely.  We stayed here on our last night in Ireland, and this hotel provided the perfect end to an incredible trip!",5,2012,07,01
225,Best start to our honeymoon,"We stayed here for the 1st night of our honeymoon.  We arrived early in the morning and were allowed to leave our luggage and walk around Dublin for a few hours until our room was ready.  We stayed in the Oscar Wilde Suite on the top floor, it was the best room they have.  The room was very spacious and beautifully decorated.  We loved the location, right in the middle of Temple Bar!  The B&B offers several al a carte items, wifi, dvd's, and privacy/security.  The breakfast was around the corner and the Irish breakfast was great.  We stayed 2 nights and had different breakfast selections each day.  The gentlemen that work there were great, they really took care of us.  

The only slight negative for us was the low water pressure, which seems to be a European thing.  

We would definately stay again and suggest you stay here.",5,2012,06,24
225,Charming elegant property in Temple Bar,"The suites are lovely and well furnished. Sound insulating windows curb noise effectively, so you can stay in the middle of Party Central (Temple Bar) and sleep peacefully. Location is terrific. You can't beat it for a stay in Dublin.",5,2012,06,18
225,Excellent,"Stayed 2 nights on business
Perfect location
Very quiet
Excellent facilities
V good breakfast
Will return",5,2012,06,08
225,"Great hotel, lovely room, would return!","We stayed at the merchant house for 2 nights at the end of April.

We stayed in the Bram Stoker suite and I was happy surprised at the size of the room, I don't think any pictures really show quite the size of it. I thought we would barely have room to walk either side of the bed but we did. 

We were met by a very nice young lady who showed us to our room, on the first floor but set back from the main staircase. With 3 little steps leading up to it. We barely ever heard anyone walking up the main stairs. And we never heard anything from inside the room at all and for this reason - we would DEFINITELY stay here again! 

It was fully equipped with everything you would expect - umbrella, hairdryer, soap, shower gel, shampoo, safe, and hangers. The bed and pillows were comfy too. Modern and clean. The only thing which was a little meh was the shower pressure but hey, it's not a problem. The minibar is well equipped but prices are as you would expect to pay in Dublin.

It was right in the heart of Temple bar which was brill, and the breakfast served 2 mins around the corner was also very very good! and a great way to start the day. We had to wait a little while for a seat on the Saturday morning as it's quite small but it's very quaint. 

They are up on the security and so you have to go through 3 doors to get in, a few keys to 
carry but I'd rather that than worry. 

We would definitely return in the future, why go someone else when this is everything you need and more. I was pleasantly surprised. Not because I expected it to be bad but because it was better than I thought it could ever be. 

Go and have fun!",5,2012,06,02
225,Very good...,"I really enjoyed my stay at The Merchant House, even though we arrived ahead                            of schedule the staff were helpful and stored our bags for us and when we returned to ""check in"" our bags had already been taken up to our room...
The rooms themselves are beautifully decorated and are extremely comfortable, wifi connection was excellent and there was even a universal adaptor in the room, which was a nice touch... 
There was some noise from the club across the road but as we were staying in the heart of Temple Bar to enjoy the bars and live music scene this was to be expected and it never interfered with our enjoyment of the room...
Breakfast at the cafe provided was excellent with a good range of options and a decent coffee, while not in the actual abode itself it was so close it usually takes me longer to get from the room to the resteraunt in more traditional hotels so I didn't see this a major drama and actually liked the fact that breakfast was served in a cafe that locals frequented...
The only improvement I could offer would be to move the wardrobe and fridge from the entry room into the main bedroom and add soem seating into this room....
If your looking for Holiday Inn style hotel accommodation then stay in one, however if you are looking for a comfortable bed and quirky place to relax and unwind in the heart of Temple Bar then I don't see how you can go far wrong here,,,",4,2012,05,08
225,Nice refuge,"We enjoyed our stay at The Merchant House.  We were traveling with our 16 y.o. son and stayed in the WB Yeats suite in April.  Someone met us when we arrived around 10:45am but we were not able to get into out room yet.  Since there is no lobby or public bathroom (really just a short narrow hallway right off the street), it was a bit awkward getting things from our bags so that we would be comfortable sight seeing for the afternoon.  We also had to specify a time that we would be returning so that someone could show us up to our room after it was ready.  We were going on a walking tour and gave a 30 minute window when we would be back but still ended up hurrying because we were going to be late.
The room was lovely, very spacious and nicely decorated.  The large bed was very comfortable with nice linens, and my son said that the pull out was ""OK"".  Some people have complained about the noise but we didn't have any problem.  Granted, we were there mid week.  There is a  floor fan in the room that helps with noise and also an ipod dock so you can play your own ""sleep music"".  The bathroom door really needs to be replaced.  It looks great but that isn't the purpose of a bathroom door.  Most people want a bit more privacy than these doors allow.  We took an extra blanket and draped it over the door, which worked fairly well.  Otherwise the bathroom was pretty nice.  No outlet so you have to dry your hair in the other room which is a bit awkward, but frankly, not unlike other place we stayed in Ireland.  The electric kettle is nice for tea and coffee.  The coffee is instant but is exactly the same that we had every other place we stayed.  There is also a little fridge that is stocked, but you can squeeze a few personal things in.
There is no telephone in the room so if you need to reach the management for anything (and you don't have a cell phone), then you have to go down to the entry door and push an intercom button for help.  We had to request help in this way because the in room wifi wasn't really working for us.  We were going to have to schedule yet another time to meet someone the next day who was going to work on it for us but after I asked for an adjustment in my room rate because one of my criteria in choosing a place to stay is free in room wifi, someone was actually able to fix the problem that evening by rebooting the router.
We had to leave our son in the room one day because he wasn't feeling well and the housekeeping staff was very accommodating.  They didn't try to clean the room, and she gave me plenty of things to restock the room myself: coffee, complimentary bottled water, towels.
The breakfast at The Stage Door was pretty good, although, I think they have only white bread for the toast.  You can ask for salad instead of the toast, though.  They serve breakfast all day so you don't have to hurry in the morning.  You could actually come back and have your breakfast for lunch.  They will also make a really good breakfast sandwich (grilled egg, ham, and cheese) to take with you if you don't have time to sit down and eat.
Overall, we very much enjoyed our stay at the Merchant House. It was in a great location in Temple Bar and close to other major attractions or on a bus route.  It felt like a nice refuge from the hustle and bustle of Dublin.  We would stay there again and we would recommend it to friends.",4,2012,05,06
225,A mistake,We stayed in the Bram Stoker suite. No view as no windows  only roof windows which we had to keep shut because of the thumping from nearby night clubs.    Noise stopped about 3am and we opened skylights but the seagulls had arrived by then.     Did not like the rules and regulations. E.g. If we soiled bed or floor €100 fine.    Escort guests of premises etc.     No reception. This was not an hotel.  Although we had booked and paid for two nights we left after one. One of the worst experiences i have had.  Breakfast in the cafe was good.,1,2012,05,05
225,Disappointed.,"I was very disappointed in the merchant house. I had booked it online and it was in the hotels section, listed as a boutique hotel. This is very misleading as it is a guesthouse. You are essentially renting a room in a house. There is no reception and no facilities. 
The location is in the heart of temple bar. It was very noisy at night and difficult to sleep. 
Our breakfast was in a cafe down the road, the stage door, but they did not understand the terms gluten free or coeliac so I didn't have anything to eat.
 
There were long black hairs on the lockers which put me off and the carpet is that hard wearing stuff they put in schools, really rough on your feet.

Somebody has gone mad with a label maker and labelled literally everything in the room!
 
Overall I felt it had been miss sold and didn't live up to my expectations. ",3,2012,04,24
225,One Night in Dublin,"We had just gotten married, and were staying in Dublin for one night before we flew out of the country.  We decided to treat ourselves with a boutique hotel in the heart of everything, and this hotel met all expectations. 

We were staying in the Oscar Wilde Suite.  If you're in there, be ready to walk up 4 flights of stairs. This is truly an old 18th century Irish house, which means there are no lifts/elevators to help you out with your luggage.  

The Suite was beautiful and very intimate. So intimate that the door to the bathroom was a partially sand blasted glass, which means you can see your roomie (in this case my new husband) at his most intimate.  I figured I'm living the rest of my life with this man, so might as well get used to these things, but if I was travelling with someone else, it would've been a different story.  

The location is great.  You can walk to tons of bars and restaurants, and their sound proof windows held up so slept through the night.",4,2012,04,24
225,Quiet and elegant in Temple Bar,"We were extremely happy with The Merchant House. We stayed in the Bram Stoker room which is in the back. Consequently, though there are no views, there is no noise either. Yet when you walk out the door you find yourself in the heart of theTemple Bar area. The Castle is just up the hill, Christchurch Cathedral is a 5 minute walk, the Quay is just down the hill, Trinity College and the Book of Kells were maybe a 10 minute walk. This property is located on a side street off Temple Bar, still in the ""zone"", on cobblestones, but without the ruckus.

The room itself  was elegant. It had two skylights and two frosted windows onto an inner rooftop, so it had plenty of light though no view. This turned out to be a great thing as it was super quiet, I don't know how you could find a quieter room in the Temple Bar area.

The bed was Queen sized and very comfortable, as were the comforter and pillows.

We were a little taken aback at first as we had planned to crash for a bit in the lobby after our overnight flight but there was no lobby. However they did store our bags and have our room ready when promised so in retrospect, given that they are a B&B/Inn and not a hotel this is something to plan for but not hold against them.

Everything was meticulously clean, and decorated with good taste. We had a bit of trouble getting the temp consistent in the shower but there was no shortage of hot water and the flow was good.
Breakfast was included and provided by a fantastic little place around the corner. Very charming, excellent food (quality and volume) and super friendly service.

The room is termed a 'suite' though it is really just a room, but well-appointed and a fair size for a city room.

Very easy to get an a cab to airport. Just walk half a block to the main street and cabs fly by every 10 seconds.

I would definitely go back. I would be interested in some of the larger rooms in the front too. Although they look out over the street they are on a higher floor and I'm betting they are quiet too, as the actual road this is on, though right off Temple Bar, is not itself busy.",5,2012,04,22
