Location Name,Title,Text,Rating,Year,Month,Day
225,Perfect stay,Beautiful room in the centre of Temple bar. The decor of our room was tastefully decorated me with lovely added features like complimentary water and coffee. Staff were very helpful and I can not praise them enough. Discounted parking was a great added benefit. Highly recommend,5,2024,10,17
225,Very disappointed ,Lovely room and bathroom but we were awake very early because of the light coming in the deluxe windows!! This is totally unacceptable seeing as the room cost 240euros for one night! What was even worse was that there were blinds on the windows but the windows could not be reached to pull them down. It really ruined our stay and we wouldn't recommend this place,3,2024,10,06
225,Avoid this place,"Horrible, horrible service.  Booked a room, received two confirmation emails, and then when we arrived we discovered-through the help of the business next door-that people haven’t been getting an email for payment two weeks in advance.  No communication from whoever the con artist is that owns this place.  No email for payment, no communication that our room was given to someone else.  Avoid this place.",1,2024,09,01
225,Give it a very wide berth.,"I booked a room at this hotel, two weeks in advance of my trip. They debited my credit card for the full amount and then,two days before my checkin date, cancelled my reservation, telling me they had overbooked. This caused huge issues for me, given a close friend had separately booked a room  in the Merchant House. I was forced, on two days notice, to find another hotel.

I would avoid this place, they clearly have no respect for customers, particularly those who pay in advance for services they subsequently decide, on two days notice, not to provide , disgraceful.",1,2024,01,31
225,Terrible service,"Myself and my Wife were scheduled to stay at the merchant house on Saturday the 27th of January. 

Payment was taken on the 9th of January for €200 (the deal through booking. Com was for €185)(no mention of a reimbursement in any of the messages from booking.com)

My booking was cancelled less than 24 hours prior to my stay. 

I was sent on codes for entry etc and 6 hours later told to ignore these emails and that my booking was cancelled. 

Very disappointed that a phone call wasn't made and email sent to explain the situation (booking.com notifed me). Definitely not a 5 star hotel. I called three times and no answer. 

Fair play lads your in the service industry but offer awful service (happy in your work?)",1,2024,01,26
225,Unhelpful,"Due to the riots in Dublin we did not want to travel to Dublin tomorrow .  I totally understand that we could not get a refund but would have thought they would have been willing to give us another date due to the situation.   I was advised by booking.com to email them to request a change of date - they did not respond to my emails.  Poor, unhelpful customer service  - did not answer telephone -   only contacted me through WhatsApp once I had left a message their response  'situation out of our control'.",1,2023,11,24
225,Outstanding ,"Great location, clean, beautiful and spacious rooms. Walking distance to everything. If I come back, definitely staying here again. Only thing missing is a/c in the rooms so we could keep the windows closed during the night.",5,2023,09,12
225,Great location and very quiet,"My husband and I recently stayed at the Merchant House.  Our room (the W.B. Yeats room) was spacious and clean.  The location in the Temple Bar area was central to everything, yet the room was super quiet.  We were able to leave our luggage in the building entryway until check-in on the day we arrived which was very convenient.  Overall, it was a great place to stay!
",5,2023,07,16
225,Perfect hotel in Belfast!,"The hotel was beautiful and the location was great. We walked to all the sights we wanted to visit. Plenty of restaurants out the door! The staff went above and beyond. Ryan, the assistant manager went above and beyond at the last minute. We were leaving for the airport and our rental car had a flat :-( 
He hired us a taxi and made sure the tire got fixed and delivered the car to the airport for us. We had a flight to catch so we had to leave. Thank you Ryan! 
Request an Art Deco room to be sure you are in the quiet section. 
The only thing I would like to see changed is the hotel to  change foreign currency for the tourists.",5,2023,07,02
225,Stay at The Merchant House,"The Merchant House was a fascinating find in Dublin!  The location cannot be beaten in terms of proximity to the Temple Bar area and other attractions.  The street is VERY quirky but we never felt unsafe and the neighbors and neighborhood were colorful!  We were not met by a member of the staff but were provided instructions for access.  Please note that the initial lock into the front door is a bit temperamental but we eventually got the hang of it.  If you are short, it can be a bit hard to reach.  We had no problems with noise at night as long as we shut the windows as instructed - it was very quiet.  The first night we left the windows open and learned our lesson!  They provided a tower fan, which was very nice to keep the air moving.  The pillows are very hard, but helpfully there was a drawer marked ""softer pillow"" and we did supplement with that one.  We were in the James Joyce suite, and the size was very nice with plenty of seating provided with a chair and small loveseat.  We particularly appreciated the bench at the foot of the bed which was helpful for putting on shoes, etc.  In our room, the hair dryer was in the vestibule and was attached to the wall (our friends were in another room and their hair dryer was movable), but there were mirrors in the door of the cabinet next to the hair dryer so you could see what you were doing.  They do not serve breakfast and used to have an agreement with a nearby restaurant Panem but that apparently has lapsed.  We did eat at Panem twice (it is quite close) and the breakfasts were delicious.  There is no lobby in this guest house and you will need to navigate the stairs with your luggage.",4,2023,06,24
225,Quirky & Fabulous Gem of a place! ,"If you like quirky, don’t mind being between a sex shop & Thai massage place then this is the place for you! Fabulous location to explore Dublin, a bit noisy at night when the Temple Bar lights up but great sound proofing at the windows if required. The decor, the ‘loft’ feel and comfort are fab - comfy bed, great living space & lovely bathroom.  Mini bar at reasonable cost, complimentary tea & coffee, toiletries, iron, trouser press, Wi-Fi & immaculately clean the Oscar Wilde Suite is worth the 4 flights of stairs! (They are manageable even after a few pints but if you have mobility problems there is no lift) - Airy, bright space, safe and secure entrance & charming manager ‘Frank’ makes this place a gem of a find.  The sex shop & massage place are no bother at all, discreet and we didn’t have any issues. Frank works next door in the shop if you need him & it’s an eyes on saucers experience walking in there …. but he os polite & very helpful if there is a problem.  The breakfast is epic! A short walk over a bridge at end of street to the wonderful Panem Cafe for a fabulous 3 course breakfast.  All in all the Merchants House is a perfect place to make your base when exploring Dublin. ",5,2023,05,12
225,Lovely quirky accommodation with some downsides,"Lovely accommodation, we stayed in the James Joyce suite which was beautifully furnished, very clean. Had everything you needed hair dryer , ironing board , coffee/tea , mini bar etc. The member of staff who met us was really nice and professional, the door system is very secure and easy to use . 
Downside is despite very good triple glazing it’s just very very noisy because of its location whatever was happening next door didn’t end until half 4 which was such a shame it’s a trade off really it was a great location and a quirky accommodation. Only thing for those travelling who might be a bit shy the bathroom door and shower tiles are glass 😳",3,2023,03,25
225,DO NOT STAY HERE,"I have been working in hotel industry for 20 years and have never experienced anything so bad. 
They advertise as a Five Star hotel and suites, here is our experience:
Day of arrival, we get a phone call telling us that we cannot do check in when we want, that we should have left Cork earlier. 
We arrived to do check in at 6pm 

The rooms are full with clutter and plastic flowers, there is no space to put any of your belongings.

They give you two old rotten towels, one of them so bad that the edge is totally in pieces, and we asked for extra towels, we are told that “only one towel per guest is authorized”

Next: 
TV does not work in one of the rooms 
If you want a hot shower be ready for a trip to 1950 they have this old devise that either scorches you or freezes you.

You have to wait 20 minutes between showers because the water won’t flush and it’s disgusting 

The cherry on top of the cake:
We had 3 rooms two of them had an early flight, so they left at 9am, our flight is later so we stayed in the room until 12 (This is the check out time they have written in their book at the room) 
At 12:01 an old gentleman storms into our room without knocking and I cuote literally” Get out!! You need to be out of the room, I have other guests, Get out!! This happens yelling 
I grabbed the book and showed him the check out time is at 12 an he replies yelling 12:02 is past noon 
Grab your sh*&8 and get out, he grabed the keys of the room and stormed out as he continued yelling going downstairs.

We are appalled at this point, we were ready to leave anyways, but I have never ever ever been in a place like this in my life. 

Save your money, enjoy a nice stay a the Temple Bar Hotel or any other, BUT DO NOT STAY HERE

THIS IS NOT A FIVE STAR HOTEL

It is a 3 star or lower Airbnb",1,2022,09,14
225,"Beautiful, boutique suites!","We had a lovely 3 night stay in the James Joyce Suite. Very spacious suite with great facilities, huge bathroom and windows. Even though you're in the heart of vibrant Temple Bar area of Dublin, there's minimal noise disturbance due to the extra internal glazing. The suite felt very private, secure and peaceful.
Room was spotlessly clean and serviced daily. Attention to detail was evident throughout the apartment. Loved the little extras such as the coffee machine, DVD player and earplugs for light sleepers (these were not required but a nice touch!) Shower was amazing even though it states the water pressure is low in this area.
You're greeted by one of the team on arrival and everything is explained in detail. Can't remember the name of our host now, but he was fantastic and told us not to hesitate to call if we needed anything further.
We would definitely recommend these Suites if you're looking to be in a central location of Dublin City.
Overall, had a brilliant stay here and will be back soon!

Bev & Doug",5,2022,08,19
225,"Great Rooms, Very Clean","Very nicely appointed rooms, super clean, and upgraded bathrooms.  This small boutique hotel is in an older/historical building that only adds to its charm. Be aware there are no lifts. We booked three rooms on three floors and they were all very nice.  Parking, as in pretty much any part of Dublin, is not easy and there is literally no place to pull over to drop off luggage without threat of the dreaded tire boot!  Also be aware that this is a very busy, noisy, traffic-laden part of the City.  If its peace and quite you are looking for, this isn't your kinda place but if you want to be in the thick of the Temple Bar area, its a good choice.",4,2022,06,30
225,Good location,Host Frank was very friendly and explained all details to us. Room was a good size and so clean.  It's an excellent location to stay.  At the bottom of Eustace Street is Temple Bar's busy area and at the top of the Street is Dame Street.  There is a Spar shop at the top of Eustace Street that prepares fresh sandwiches.  We got the express bus from the airport which was three stops.  Be prepared one side of the Merchant House is a Thai Massage shop and the other side is a shop that sells sex toys but we didn't see anyone visiting these places and we felt very safe day/evening.,5,2022,06,23
225,"Charming and unique, but a little off","The building is 300 years old so it has ""charm"" that we enjoyed. However, the main reason I booked it was for the king sized bed. It might have been a queen sized bed or a full. NOT king. The street below is noisy- as is to be expected for the fun neighborhood it is located in. The doubled windows worked fine for keeping out the noise, however when it is warm you may want to keep the windows open since there is no a/c. (There is an underwhelming fan.) One other strange quirk was the glass walled bathroom. Yep, you can see through from the bedroom. For privacy we coordinated our positioning in the room at key time.",3,2022,05,24
225,"Gorgeous suites, unfriendly staff.","Booked 3 rooms for myself and friends for our wedding. I required an unusual check in where I needed the other guests room keys to be left in my own suite, in order to help the running of the days events. This was outside of their policy which I totally understand and am very grateful it was accomodated. However it was not easily achieved. I was firmly assured how they were going out of their way for my special check-in and how this was a 5 star facility, so maybe treat your guests as if it is 5 star?

I needed to explain the plan/situation countless times prior our check in date which I may as well not have because we ended up needing to explain everything again on check-in. Very strict on check-in time, ringing to confirm once again while I was on route- no need. Communication was over the top for me prior my stay. Example, received an email one day saying ""telephone me I left a voice mail an hour ago"". Kinda in work, cant pick up at your demand my apologies.

And then for check in itself, well that was an experience. Greeted, or not greeted, by the most inhospitable person I have ever come across in the hospitality sector. The whole check in process was extremely lengthy and unnecessary, and we were spoken to as if we were children and that we needed to ""pay attention"". Personally, I don't feel the need to be shown every little corner of the room or being explained to what ear plugs are for. (By the way, advertised as soundproofed, but provide ear plugs.) Anyway, we just wanted to check in and chill, keep to the important stuff like fire escapes maybe. But now thinking about it, I dont think that was even covered! Took a good 35 mins of rude, abrubt chatter before check finally ended. I thoroughly enjoyed the room itself, beautifully decorated and maintained, perfect location. Its an amazing building. Just a pity the staff aren't very pleasant, it was our very first impression and unfortunately a lasting one. 

Would have been a nice place to go back to for anniversaries but after that experience I can't say I'd go back. Unless the staff obtain hospitality training, manners or just some simple kind social skills.",3,2022,03,23
225,Mr and mrs,We were  so looking forward to our night away in a beautiful looking hotel. However having been charged 50 euros to move booking from Dec 2020 to Dec 2021 they now want to charge another 50 euros as we are unable to travel again due to covid. Asked for a voucher for next year as advertised on the website but that too is 50 euros.,1,2021,11,12
225,"Great room , great location","This charming hotel is situated in the middle of the town centre and walking distance from lovely restaurants pubs and shopping.
The rooms are charming and spacious, for breakfast you walk to a nearby coffee shop and that was delicious",4,2021,09,21
225,Very Charming,"We very much enjoyed our stay here.  It is one of the more unique B & B's I have stayed at.

It is right in Temple bar which makes it nice to be able to Pub Hop and go back to your room, plus it is close to many attractions.

We stayed in The Oscar Wilde Suite, top floor, it is not handicap accessible so if stairs are an issue unfortunately this is not the place for you.   Room comes with a mini bar and some wine options.  We did not opt for the breakfast so I can not tell you about that.  Shower was a bit small so the only thing that would have made the room perfect is a spot for a soaker tub.

We were very happy with our stay here.",4,2021,08,31
225,Super accommodation,"If you are happy left on your own, this is fantastic. Well met on arrival, thorough tour of room and amenities. Large suites, well designed. Great location if you want to be central, all your epicurean desires are within easy walking distance.",4,2020,08,13
225,Terrible Customer Service,"I can't actually review the location or accommodation as sadly out of our control my 40th Birthday Surprise holiday was cancelled due to COVID.  My husband contacted all 5 hotels he had booked us into (mini tour planned) and every hotel understood it was not our choice to cancel and offered either a full or partial refund with SMALL fee. 

Having already paid nearly £200 for one night at the Merchant House he contacted Merchant House who then sent a e-mail saying we could change dates for a FURTHER 50 euros or have a voucher to re-book if we didn't know the date yet for a FURTHER 52 euros and said they were being generous ! 

My husband e-mailed several times asking them to surely reconsider in light of the current Pandemic only to be sent the same e-mail time and time again saying no, basically take it or leave it. 

If we do take the voucher (solely to avoid losing everything) I will attend the holiday (when we are allowed) knowing they made a bad situation so much worse and will never recommend them. Funny enough my friend is planning her 40th and wanted our feedback as she was going to book a week there ...... She won't be now !",1,2020,07,30
225,Pleasant Stay,"We stayed on The Oscar Wilde Suite on the top floor and we loved it! The spacious room, very comfortable and beautifully decorated. 
Located right in the heart of Dublin, close to everything. Despite it's  located at the Temple Bar district but it's quite in the room. Such a great stay. ",4,2020,04,30
225,Excellent stay again!,"This was our 3rd stay at Merchant House and the excellent service continues! We stayed in the W B Yeats Suite and did not have any problem negotiating the doors or the stairs. We were greeted very warmly and we were set for the stay.
The shower is very typical of an Irish accommodation and had the added luxury of heated floors. The room was bright and comfortable and we enjoyed the stay!",5,2020,03,12
225,Lovely place - brekky was offsite though. ,"Superb accommodation. Room is a wonderful and 
spacious Art Deco delight. 

Main room in the suite dominated by 2 striking Art Deco paintings which are great. Photos don’t do this place justice - lovely artistic and fresh touches in every place you look. 

We found the pillows a little high (but to be fair then in the morning we realised there were spare (smaller - ie normal) pillows in the closet). Shower was a little weak, which was out of kilter with the nicely appointed room, and the very-high ceilings - although lovely - meant it was a little cold in the shower when the shower was otherwise hot. 

Room is effectively a suite of lobby, bathroom and lounge/bedroom. Place was meticulously and spotlessly clean with nice touches everywhere and really nice linen and furniture. Everything looks new and fresh. Owner had clearly put a lot of thought in. I’d give the place and location even more than 5 stars if possible - but dropped a star over breakfast. 

Breakfast was a disappointment because it was not on site - it’s not far though, in a cafe just across the Liffey river. Annoying when the breakfast is €16 each, but the breakfast you get is €9.50 at that same cafe... I’d always rather have breakfast on site - but searching for a location offsite is awful. 

Location is bang in the middle of Temple Bar, and a plus point is the owner has nicely soundproofed the place - was lovely and calm inside despite the noise outside. One downside is that these suites are located with a Thai Massage parkour on one side, and a sex shop on the other side, so you feel a little seedy fumbling for your keys outside!

On the whole a good place, and recommended. We stayed in the James Joyce suite - very nice. I’ve attached photos of 2 breathtaking paintings in the main room. Really stunning. Thanks!",4,2020,02,16
225,Most unprofessional hoteliers we have ever dealt with,We have travelled to over 65 countries and 100s of hotels. This hotel was informed that an error was made on a booking within 5 hours of booking. The hotel sent us one of the most hateful messages I have ever received from a hotel. I have a disability and informed them of this. Instead of understanding and accommodating they charged my card 1000 dollars sent us more rude messages and forced me to cancel my card. I told them this was horrible business and to avoid this and they did it anyways. Dishonest. Unprofessional avoid. Don't buy their self serving response. It will be a lie.,1,2019,12,11
225,3 days in Dublin,"Rented the oscar wilder suite for my partner and me, and the bram stoker for my adult son.  The wilder suite was large but on top floor, having to climb 4 double flights of stairs.  View of the street below.  The stoker room Was small, dark no view.  A mistake I'm sorry to say.  Breakfast while included meant taking your voucher and walking a half mile to a cafe.  Very low water pressure in The showers.  Not what would i call 5 star at all.  Be aware",2,2019,12,06
225,"Great location, but...","Overall, I don't disagree with those that state; ""water pressure"" issues to some degree...and great ""location"". I just would NOT rate this anywhere near ""5-stars"". It's a solid 3. WHY? Incredibly steep staircases. ALL rooms will require a steep and somewhat awkward climb with luggage. 3 interior doors for ingress/egress, including an equally awkward to lock, outside security door. None of these features are mentioned. If you have ANY type of mobility issues, do not choose this property. In my view, it's pricey for what you get, but being in ""Temple"" area is a great feature, and what you're mostly paying for. ",3,2019,12,06
225,Location Location Location!,"Great spot right in the heart of Temple Bar. The room was spectacular! The service was excellent, we couldnt have had a better experience. The next time we plan a trip for Dublin, this we definitely be top of the list to stay! Strongly suggest!",5,2019,11,07
225,Awesome Stay,Location is perfect! Easy to get around and there is so much within a stones throw to do! The staff (Denise) greeted us at the door and explained how everything works before handing the keys off and bidding good day. The suite was tastefully decorated to then period of the room. The bathrooms were extremely large and even though some complained about the water pressure in the showers I thought it was perfectly acceptable. The best part was the bed. I believe it was a feather mattress and was one of the most comfortable bed I’ve ever slept in. Would definitely stay again and highly recommend to anyone looking for a great stay in Dublin. Thanks to everyone at the Merchant House (ie Denise)!!!,5,2019,09,27
225,FANTASTIC LOCATION,"We stayed there for 4 nights actually in Sept 2018.  Great location near the Temple Bar and the river.  The only minor issue I had is that getting a comfortable water temperature in the shower required an MIT Doctorate degree in Engineering.  Otherwise, the room was fantastic...well appointed, comfortable and clean.  We would certainly stay there again.",5,2019,09,12
225,A beautiful room in Temple Bar,"We stayed in the Oscar Wilde suite and were very pleased with the room. It had the unique charm that we were hoping for. It was walking distance from everywhere we wanted to visit. The breakfast vouchers we received were for a place called Panem, just across the river. The breakfasts were tasty.

Two things to be aware of. Our suite was the top-most, being 5 flights up without an elevator. The staff were very helpful with our bags, but you need to be able to walk stairs just to get to the room. (Other suites aren’t as high up, so check when choosing.)

The other is that Merchant House is in a very active
neighborhood. Even with the soundproofing, if you want to open the windows for fresh air, there’s significant street noise. It didn’t bother us, but if you need complete quiet, it might.

In general, our stay here was a wonderful part of our visit to Dublin. ",5,2019,08,31
225,Lovely hotel but the stairs are ridiculous,"A charming hotel right in the middle of Temple Bar, large comfortable rooms etc. But there's no lift so the stairs are tiny and many, so be warned before you book in. We stayed in the Oscar Wilde room which is at the very top, so about 8 flights of stairs, which is not great on two middle aged people with knee issues! Suggest you only stay there if you can get the Bram Stoker room, which is the lowest one!",3,2019,07,02
225,Beautiful and unique suites in a busy nightlife part of town,"Generous size rooms with quirky but tasteful decor.  

Very comfortable bed.

Triple glazing means you don't hear any noise from the nearby bars and clubs

Premises not normally manned - a housekeeper meets you at the door

Located in the Temple Bar area of Dublin - wall to wall bars, restaurants and adult shops.  Housekeeper emerged from the fetish shop next to the door to the suites !! 
Door security intense - sliding steel mesh door, then solid front door, then pass code on inner door.",5,2019,06,24
