Location Name,Title,Text,Rating,Year,Month,Day
21,"The good, the bad and the ugly!","I recently stayed at the Sofia hotel during the ESMO conference in Barcelona.  I will start will the good points of the hotel.  Beautiful rooms, comfy beds and amazing pillows.  The housekeeping staff and front desk were awesome!  Super efficient willing to help with whatever i needed.  My room was cleaned every evening bed turned down nicely.  The very bad side of my experience is I never stayed at a  start hotel that served such terrible food and bad service in food and beverage spots.  You get seated outside to order a glass of wine and no one ever comes over to take your order.  It's strange they see you but never come over.  

The bartender was the most unfriendly, poor drink maker not sure he understood certain drinks it is clear he has no real training.  Went to the bar with a colleague and we sat and sat and sat as he wiped down the empty bar just ignoring us.  There was a female with his look to be a manager she too ignored us sitting there.  I finally had to say ""are you open""?  Then the very unfriendly bar keep came over.  He was awful never checked back to see if we wanted a second so we ask for check and left.  The night prior my entire team was at the bar for last call, a waitress pushed by my friends with her tray of empty glasses and dropped them and they broke all over the floor.  Not only did she keep on walking and never apologize she never picked it up.  So we all stood around pushing the broken glass under the bar stool so no one would step on it.  Again who does this at a 5 star hotel.  I will never ever stay there again!  Too bad they had nice front desk staff the door men were great too but if you can get decent food or a drink no point staying there.    My advice, hire a new chef and new wait staff.",2,2019,10,07
21,Very nice hotel with slow service and food is not great,"I stayed at Sofia for 5 nights on business. I am for sure not a picky person at all but the food was really not good. I ordered something off their in-room dining menu on the first night and was coughing it was so dry (and that's a first). The bartenders were outright mean to the patrons, ignoring them as well as just plain rudeness. The hotel was super clean, the front desk and cleaners were so kind. The experience overall was great I just HIGHLY recommend not eating or having a relaxing beverage there. Walk right across the street and sit outside, they are very kind and quick over there.",5,2019,10,07
21,so relaxing ,"my husband and i stayed for 3 nights at hotel sofia in barcelona, and we LOVED it. the rooms were so comfortable and modern. the gym was awesome (my favorite spinning bikes) there is a beautiful pool area, and the lobby was fantastic. off the lobby is a cafe with indoor/outdoor seating ( and full bar). there was an indoor cocktail lounge which made our cocktails precisely as we liked them (not easy in spain). the restaurant is also very nice although we didn’t eat there, just drank. the hotel is located next to the football stadium, and not far at all from touristic buses. nice walk or taxi ride to other sights.  oh, and i have to mention the staff- EXCELLENT- they were so helpful with everything from hailing a cab to answering our sightseeing questions. there was also a spa, but we didn’t have time to use it- maybe next time",5,2019,10,07
21,Great staff and wonderful accomodations,"Just returned from a stay at Hotel Sofia for a one week business trip.  The hotel was lovely and the staff aims to please.  A particular shout out to George, the bellman!  He was outstanding and looked out for me during my week at the Sofia.  The beds were so comfortable and along with the pillow menu, helped to provide me with a decent night's seep. I highly recommend the Hotel Sofia.",5,2019,10,02
21,A week in the sun with friends,"Princess SOFIA Hotel, Barcelona, Spain

15 September ~ 22 September 

My husbands employers had a week long conference based in the SOFIA hotel. Some of the employees took their wives along for a holiday, including me. 

Neither of us had been to Barcelona before therefore knew nothing of the transport or where to go during the day whilst our husbands were busy. So, we, en masse sought out Christian Brasero, the hotels’ City Host and Concierge.

His knowledge of Barcelona and the limitless information he has about the sights and how to get there effortlessly made our touring so much easier.

He gave us information on the Gaudi cathedral, La Sagrada Família, and the ticket prices. Sadly, they were sold out on the days we wished to go. 

He booked a restaurant for the group of 20, explained to the owner of allergies. Then did a follow up the next day to make sure everything went smoothly.

Christian went above and beyond what was expected of him. He is a valuable asset to the Sofia hotel.
",4,2019,10,02
21,Corporate conference ,"Stayed at the SOFIA as part of a company corporate event for four nights.
Pros:
Good location, not too far from airport and shops, restaurants and tram/ metro line in walking distance 
Hotel is very sleek, modern and stylish 
Conference facilities are excellent although all subterranean. After four days on -2 I felt hugely light deprived and caged in 
Food in the hotel was incredible 
Strong WiFi 
Brilliant gym/ pool 
Very reactive front desk. I had a problem with a power adaptor and within minutes of calling the front desk someone was here to help me 
Negatives: although on a high floor and what I thought was double glazing, I could still hear traffic noise
On the first day my room had not been made up by 17:00 which was a little annoying, esp as I left the room and deactivated the do not disturb sign at 07:30 am 

All in all a very solid hotel which was perfectly suited to our concerning needs! ",4,2019,10,01
21,"Home away from Home-Very comfortable, modern decor, best concierge service ever","Very comfortable and modern decor. They have made the best use of technology to make the stay comfortable. High tech gadgets available to use in the room- everything is electronic/ automatic- including night light turn on when moving as it has sensors, so you don't disturb your partner with the light. Breakfast is included and one of the best with lots of choices.
I had to use the concierge service for printing some documents and scanning them- Christian Brasero was so helpful and curteous in promptly printing them for me and then waiting to scan them back to me. I may not have been able to do it so promptly at home.Thank you Christian for making my work easy and helping me! I appreiciate your help.
This hotel is so close to local restaurants, starbucks, metro station and the mall which also has a supermarket. We used the metro pass to move around the city and did not feel the need to rent a car or take a taxi!!!",5,2019,09,29
21,Nice place to stay,Lovely hotel with great service. Has a business/executive feel to it. Delicious food and very clean and the staff are very helpful with any request. It’s not exactly in the main centre but has good metro lines and access to the main areas.,4,2019,09,28
21,Hotel Sofia,"Excellent service in a very modern, upscale hotel.  Restaurants, shopping, all within walking distance.  Public transportation is also readily available for those who want to travel throughout the city. ",5,2019,09,26
21,"Excellent Hotel, very well appointed and rooms lovely.","Stayed here last week at a work event and was very impressed as whole hotel very slick and well maintained.  Not cheap, but as I always say, you pay for what you get. Close to center of town, so taxi's not expensive for trips to Las Ramblas and Marina bars and restaurants. Outdoor pool is beautiful, as had drinks reception round it, but didn't get a chance to swim in it as had limited time, same for Spa.
Would definitely recommend and stay again.",5,2019,09,25
21,Delightfully Comfortable,"Great professional and friendly staff.  Good security and technology (loved the key card for elevator access) for comfort.  Enjoyed our stay.  Felt that the breakfast was expensive, but it was complete and convenient. While the room is expensive, it is worth it and certainly better than the competition at this service level.",5,2019,09,24
21,Spectacular and Sophisticated Hotel!!!,"I don't think I have ever written a TripAdvisor review, yet always count on TripAdvisor for international travel. I feel compelled to write one here. 

Hotel Sofia Barcelona was spectacular. We were originally booked at NOBU Barcelona and received an email few days before arrival stating NOBU was delaying their grand opening and wouldn't be able to accommodate us. NOBU suggested Hotel Sofia, and I have to say I am so grateful this happened. 

From the moment we pulled up to the hotel, to the lobby, the pool, the coffee, breakfast, spa, gardens, and finally, the best part-the gorgeous rooms-we were incredibly impressed. Barcelona is amazing, but I have to say staying at Hotel Sofia may have been the best part of the trip. So much so that one day we spent the entire morning and afternoon relaxing at the hotel spa and my dad said this was his favorite part of the trip. I cannot stop telling people how much I loved this hotel. 

Definitely will go back again and again.

The small details do not go unnoticed at this hotel-from the pillow menu to the sugar packets to the notebooks-this may have been the best hotel I've ever stayed in.",5,2019,09,22
21,"Superior hotel with first-rate staff, great security features, close proximity to metro","What a fantastic hotel, so glad we stayed here.  As soon as we arrived we were greeted by the doorman and our luggage was delivered to our room - before we even got there.  Matteo (sorry if I've misspelled)  at the front desk was pleasant and helpful, thanks to him, we knew the T10 metro ticket was just what we needed.  We stayed in an Infinity room on the 10th floor, lovely view and the room has all sorts of state of the art features, automatic window shades, ambient lighting, motion-based night lights, good temperature control. The center of the room is a little dark as it's mainly the perimeter that is lighted. The bathroom has a motion-based night light and the shower offers a rain-head and hand held options.  In terms of security, getting to your room involved scanning the room key at the elevator, you are then provided with destination options, such as 10th floor, assigned an elevator, 'B', and taken directly to your floor.  The only thing I could not figure our was how to use the plug the sink in the bathroom - no matter what I did the sink would drain - but had I been more available someone would have been happy to help me.  The hotel is in a nice location, only about a 5 minute walk to Marie Cristina metro - and that's all you need really.   I hope to come back to this hotel soon!!  Well done Hyatt Sofia!!",5,2019,09,19
21,Beautiful hotel with great warmth and service,"Great luxury hotel with modern and sizable rooms.  Very comfortable, and convenient too. There are many cafes, amenities around, and a short walk to subways and shopping, right next to Camp Nou.
Had a lovely stay, and the concierge service was superb!",5,2019,09,18
21,Fantastic hotel,"The staff are warm and friendly and very helpful. The room was beautiful and very restful. We loved the power blind and blackout shade and the layout was really neat. The shower is fabulous, I don’t normally like a rain shower but that one was divine! ",5,2019,09,18
21,Beautiful hotel,This hotel is beautiful and newly renovated. The staff were extremely friendly and helpful. The only reason for not being an excellent review is the location. The area is very nice but not close to most restaurants and shopping which are mostly downtown. It wasn't hard to get a cab but for the price of the room would have rather not had to pay for a cab to and from downtown. ,4,2019,09,17
21,Great service at an architecturally interesting property,The staff at this hotel are amazingly helpful. I experienced an unexpected acute back problem.  Staff went out of their way to make arrangements for our subsequent travel and followed up to see that everything had worked. The concierge a Christian was exceptionally helpful.  I have travelled extensively and had never had such exceptional assistance and service,5,2019,09,17
21,"Comfortable, sophisticated hotel","Slightly out of the way from convention area and downtown, but the neighborhood seems safe and hotel is a short distance from the metro stops.  Room was top notch-- comfortable, quiet, beautifully designed, great lighting, excellent climate control.  very clean.",5,2019,09,12
21,Wonderful experience at Hotel SOFIA Barcelona,"The staff at this hotel went out of their way to welcome us and make sure we had a pleasant stay.  The friendliness of everyone seemed genuine and warm. The hotel itself was modern and clean, with elegant streamlined decor.",5,2019,09,12
21,"Great service, modern technology, nice accommodations, would return and recommend ","We arrived at 0900, hours before check in, after an overnight international flight. Extremely sleep deprived, we arrived with the plan of dropping our luggage off, changing, and exploring the city until our room was ready. 
Though the room we booked was not ready, they were generous enough to upgrade us so we had a room immediately. They didn’t have to do that, so it was grateful appreciated!
This is a hotel that embraces technology. Want to use the elevator? ..swipe your card, the room you are staying on appears for your selection. Not sure where the light switch is in the middle of the night? ...sensors detect when you’re out do end and floor lights in the bathroom turn on. Want to open and close the blinds? ...there’s a button for that too!
Nice selection of equipment in the gym. Pool long enough for laps, though very narrow, so laps could be an issue if it’s crowded. 

Only down side is that the location was not ideal for us, so look at a map closely before booking. ",5,2019,09,08
21,Excellent high tech hotel ,"Attended a conference at the hotel and I must say that as a location it might not be ideal for a touristic visit, however everything is a short and affordable taxi ride away! 

The hotel is extremely modern with a few high tech elements to it! Love how the elevator has no buttons and how the rooms are managed via touch screens! Hotel is spotless and the rooms are spacious! There is also a very nice cafe/restaurant at the lobby with a lovely outdoor space! 

Finally the staff are very pleasant and welcoming. 

I truly enjoyed my stay at this hotel ",5,2019,09,06
21,Comfortable luxury,"This hotel was wonderful, from the moment we walked in the door it was above and beyond our expectations. The bed/pillows were VERY comfortable! Convenient light controls near the bed and throughout the room (including a light in the bathroom working with a sensor which was nice for going in the middle of the night). All the staff were extremely helpful and kind. It’s very close to a metro station which made it easy to explore Barcelona and also easy to get to the airport early in the morning for our flight. It was a perfectly luxurious ending to our time in Spain. ",5,2019,09,05
21,Great hotel with great service ,"We stayed in the hotel for 5 nights for the trip to Barcelona and glad we chose this hotel. 

-  Room

The room is modern, clean, nicely designed and spacious.  I have stayed in multiple hotels but this is one of the best ones.  

-  Service

The service is top class, everyone was helpful and friendly.

-  Location

The hotel is not very near to attractions, but the bus stop in front of hotel is very convenient to get to city centre within 20-30 mins.  Just hop on and take a seat.  There is also a big shopping mall nearby with a supermarket, in case you need to do some last minute shopping.  If you are planning to catch a FCB Football game, this is the perfect location...walking distance. ",5,2019,09,03
21,"From Beginning To End, A Perfect Hotel","It's hard to know where to start with the Sofia. I arrived weary from a long flight and an average stay at another Hyatt hotel in Barcelona. I needed something better and decided to switch hotels. The minute my taxi pulled up to the Sofia, I knew I was home. The bellmen greeted me warmly and upon walking up to the front desk I was welcomed with a smile and was told that indeed there was room at the inn. Due to my membership with Hyatt, I was upgraded to a Junior Suite on the 16th floor with a sweeping view of Barcelona all of the way to the Carribbean. I couldn't have been happier. 

The room was perfect, from the fixtures and furniture, comfortable bed, rain shower...you name it, the Sofia has thought of it. And if you forget anything, they will quickly bring it to your room. The location -- as has been mentioned before -- is perfect for football fans; just a quick 5 minute walk to the Camp Nou as well as walking distance to a shopping mall that included restaurants and a grocery store. A longer walk takes you to the center of Barcelona and taxis are readily available with a taxi stand directly in front of the hotel.

The restaurants are impeccable with an outstanding breakfast and the Impar restaurant being nearly perfect on every level. There is a somallier on staff with a great command of the wine list, which I made good use of. Unfortunately, because August is vacation month and very slow, the Sofia BeSo and Zuu were closed, but I look forward to a return to discovering what I missed out on. Even the grill by the pool served a top-notch lunch.

But what really sets the Hotel Sofia apart are the people. From Alfredo at the front desk to Christian and Mathieu at the concierge desk to Saleh and the rest of the bell and doormen and so many other employees whose names escape me at the moment. I remember you. I appreciate your smiles and hospitality and for everything you did to make my stay absolutely perfect. The staff at the Sofia are the best!

There's no reason to keep looking. The Hotel Sofia is quite possibly the perfect hotel and easily my favorite hotel in Europe.",5,2019,09,03
21,Luxury,"All perfect
Super service - nice room - stunning hotel in a nice area out of turist zone buy still plenty of shopping and food oprtunities.
Good price/quality especially if you order in advance.
Will be back",5,2019,09,01
21,Barcelona Visit 2019,"Wonderful first class property with food and service to match, from in hotel prepared foods to suggested restaurants and points of interests to visit-- my new go to spot when visiting Barcelona! Prepared for warm weather days, luxurious well air conditioned rooms, with great views from the higher floors! Breakfast was amongst the best meals i had when visiting the region -- consider for personal travel and for business!",5,2019,09,01
21,Nice Place,"Good Hotel, Went during renovations so was quite loud after 12 but thats my fault for staying in too alte, there was only one small outside pool, which was quite disappointing as wanted a nice indoor pool to use.",4,2019,08,31
21,Best Hotel I’ve stayed in for a WHILE ,"Really couldn’t beat this hotel. From start to finish I felt like I was treated like royalty. The aesthetic of the ‘universe’ as they call it is beautiful and so tranquil. Bottles of water and chocolate were delivered to our room every evening which was just incredible and such a surprise. 

One free spa admission each for our stay. The spa is beautiful and made us so relaxed.

The staff couldn’t do enough for you. Albert especially was just amazing. Anything we needed he arranged and was such a lovely face to see every day in the hotel lobby! 
Christian was also a great concierge and provided us with all the information on Barcelona we needed! 

Our room was also upgraded and we were allowed to extend check out. (Check In early was also provided for us!) 

I couldn’t recommend it enough. The location is slightly out of the centre but I actually preferred this as it was easy enough to get into the centre but you had the more relaxed side of the city to come home to every night!

Wish I could give more than 5 stars! 

",5,2019,08,30
21,Excellent Modern Hotel,Very modern hotel with a nice quite location.  Short walk to the Metro to access central Barcelona.  The staff was very helpful in fixing a couple of issues with the room.  It seemed to be a very safe hotel with security taken seriously by them.  My first stay at this property.  I would look forward to another stay here on returning to Barcelona.,5,2019,08,29
21,Friendly & Quiet & Clean,Visited with my family ( 3 kids ) in August 2019. Good location. Very nice lobby area. Excellent coffee at PhiloSofia Coffee Place while books are watching you... very friendly staff.. 700 m walking distance to Camo Nou if yoi plan to watch Barcelona FC Game.. we loved it.. TV sound system was not perfect and rooms could have got bit more lighting in the evenings..,5,2019,08,29
21,"Chic, luxurious, awesome BCN hotel.","The design on this modern hotel is fantastic, from the lobby, to the elevator and rooms everything screams attention to detail. I loved my stay at Sofia. The hotel is located steps from the Camp Nou. You have a subway station that takes you directly to City center and a Hop on - Hop Off Gray Line stop steps from the hotel door. I stayed at a Jr Suite and the room was spacious, the bed dreamy and the bathroom spectacular. The staff is very friendly and always helpful. The gym is very well equipped and the pool while small it is great for a nice splash after a long day of walking.",5,2019,08,29
21,BLOWN AWAY!,"This hotel exceeded expectations in every way!!  They truly surprised and delighted.  Would love to come back!!  Gorgeous hotel, high end amenities, and phenomenal customer service.  No detail was overlooked.  ",5,2019,08,28
21,We will come again,"Everything was great! We had a wonderful stay in Barcelona! The bed was very comfortable, the room was very clean and we had everything we needed. The location is perfect, not in the crowded city center, but close to metro and bus station.",5,2019,08,28
21,Excellent,"I really liked the hotel, all service personal are very pleasant. The first day we arrived we got macarons as gift from the hotel. The room was so clean, they cleaned the room more than one time at the day. We come every evening at the room and been surprised with free bottle of water and choclate pieces. Nothing could be better. It takes 10 minutes from the hotel to Catalunya with the Metro, the hotel is worth the time.  Its 7 minutes walk from camp nou.",5,2019,08,28
21,"Great new Hyatt brand hotel in Barcelona, great design !",Nice hotel and loved the design of this hotel. Rooms were beautiful and large. The location is not right in the center of the city but I can still walk to many nice restaurants in the area. It's about a 10 minute taxi ride into the city center.,5,2019,08,28
21,Best hotel I ever stayed at. ,"So please by our stay at Hotel Sofia. Amazing design in the room, very comfortable bed, great room service, friendly staff, tasty food (best burger we ever had), nice swimming pool... A great experience all around. Thank you.",5,2019,08,27
21,Great service at a modern hotel,"The hotel was completely refurbished and taken under Hyatt ownership a couple of years ago, and the rooms are now very sleek and modern with a great selection of amenities.  The service from the hotel staff is exemplary, and we particularly enjoyed spending some time around the outdoor pool, which is a beautiful area in which to relax and enjoy a drink from the pool bar.

The hotel has a number of restaurants - we enjoyed in-room dining, for which the food was to a very high standard.  

We highly recommend this hotel and hope to stay here again on future visits to Barcelona - particularly when attending a match at the Camp Nou as the hotel is just a short walk away.",5,2019,08,27
21,Fantastic Hotel,"Best hotel we have stayed in, staff were friendly and helpful. The hotel was beautifully decorated and the rooms were immaculate, comfortable and modern. It was a pleasure hotel Sofia!! We will be back. ",5,2019,08,26
21,Really made to feel special!,"Had an excellent 10 day stay at the SOFIA Barcelona for our honeymoon. Service by Christian on the concierge desk was second to none and we were really made to feel special. I would stay here again as the hotel has excellent public transport links and removes the need for a private car, yet is out of all the hustle and bustle of Las Rambla or Catalunya Square.",5,2019,08,25
21,Modern and high end hotel with great services,"Wonderful hotel in barcelona. Rooms are spacious, modern and very clean. You receive all the things that you need to make your stay very comfortable. Pool is nice and location is not far from the center",5,2019,08,25
21,Sofia hotel - must stay,"I stayed at Sofia hotel with my husband! Best trip we've ever had. The rooms are amazing and the staff is very friendly. We had the best time, we could rest after long hours of walking. Highly recommended!",5,2019,08,24
