Location Name,Title,Text,Rating,Year,Month,Day
01,Wonderfully located well appointed bernini,"Fabulously located hotel - 7 minutes from Spanish Steps, 10 min from Trevi fountain, 15 minutes from pantheon, 30 minute stroll of colloseo.  Very luxuriant and well appointed hotel.  Decor is a very baroque and you expect Louis XVI to jump out at any point!!  Comes with bathrobes, marble bathrooms, well equipped gym and the spa area looks nice (jacuzzi wasn't working during our 5 night stay).  

The food is extortionate here, however and there are lots of great restaurants half the price within walking distance.  

ask for a room on the quiet side (i.e. not on the side facing the piazza, as the traffic is loud there, rooms are right next to the lift and smaller than on the side).  

Rome tips:  when going to the colliseum - go with the tour groups that one can find there - you miss the queue, get the highlights and then can book a tour to the vatican - which also misses the queues - the standard of the tours are very good.  Call in advance (or get reception) to book tickets for the Galleria Borghese - in my opinion better than the Capitoline museum.  Fabulous art and sculptures.  Food - Gusto and a roof top restuarant by the Spanish Steps were both wonderful.  Once again, book in advance as both are popular!
",5,2007,07,23
01,"A first rate, luxurious experience!","My husband and I stayed for a weekend at the Bernini Bristol and it was a joy from beginning to end.  Fabulous location (five minutes walk from the Trevi Fountain, 15 from the colloseum) and sumptous decor within.  The staff could not do enough for us.  Our room had a great view and was large and comfortable.  The breakfast was delicious and plentiful.  It made our stay in this great city magical.
",5,2007,04,05
01,Great Hotel beautiful views,"We did a Mediterranean cruise out of Rome and stayed at the Bernini  Bristol for a couple of nights before the cruise.  From our suite we had a lovely view of Rome. Our rooms were very clean and the staff very friendly.  The location is excellent.  We will certainly stay there on our next trip to Rome/
",5,2006,11,14
01,5-star price with 3-star service,"If 5-star means indifferent staff, then this is 5-star.  The service highlight were the doormen.  If they were all like them, we would have some service.  I felt like the front desk staff was a bit snooty.

The hotel is old and ornate, but seems to need some renovaion around the edges.  It was also clean.  So, I would say it was nice enough.  But, it would never hit my list of favorites.  And for the price, I am unlikely to return.
",3,2006,11,06
01,Very Happy with this hotel,"Even though we only stayed one night, we were so happy with this hotel.  Our room was so comfortable and the staff were so nice.  The location was great - we were able to walk everywhere.  I am so happy that we stayed here even after reading previous reviews.  We were even able to get into our room by 10:30 AM which after flying all night was a big benefit.

I would stay here again in a minute.
",5,2006,09,26
01,Great Hotel! 5-star,"We had already booked Bernini Bristol prior to reading the Trip Advisor reviews for it which were quite negative.  As a result, we had fairly low expectations.  We were so pleasantly surprised to see that it was a gorgeous hotel.  The staff were very professional and our room was huge and very nice - looking out towards a fountain.

The only negative comments I have are, 1. the hotel room service is extremely expensive so we ducked across the road to Pepy's Snack Bar for takeaway (too tired to eat out after big day seeing the sights of Rome) and 2. we both had massages which were quite expensive but did not go for the full hour.

Other than that - great hotel.
",5,2006,09,05
01,"Great Location, Rooms Vary, Ask to see room first.. but great stay!!","My wife and I just got back from a 5 night stay at the Bernini Bristol and it is a good property in a great location but just do a few things to make sure you have the same wonderful stay we had.

First.. I have been selling high end international travel for the past 12 years and have learned few things along the way.

Hotel rooms in Europe greatly vary in size and decor.  You should always leave your bags in the lobby and ask the bellman to show you the room first.  He is working for your tip and wants to make you happy to get the bigger tip.. if you give him the tip and he leaves and then you want to change your room.. You are now a pain in the rear.  If I like the room great.. if I dont I go down to the front desk and ask for a better room, and do so until I get a room that is acceptable.   Most reputable hotels will do this or not charge you to move to another hotel.. If I have a real problem I walk down the street and try to find a similar hotel and ask to see a room there .. sometimes that works out great and I get an amazing room in a differnt hotel for the same or less.

The original room I was shown was room 701 which was on the newly renovated ( I think they are done with most of the rooms and hallways) but the room was small and I could reach out my door and touch the elevator door which was 1 foot away.  I was not about to hear the elevator ding all night long so I made them change me to room 525 which was great and probably double the size of the first room.

I will upload the layout of the hotel from their hallway ""fire escape"" plan so that you can see the floor plan of hotel.. good to see what are the larger rooms.  If you have trouble or need help just email me --- and my advice is always free. I just hope you have some great vacations!

",4,2006,08,30
01,Disappointing for the price,"We stayed only for one night, so this is a snapshot. 
The reception area is somewhat shabby with scuffed coffee tables, dated Italianate furnishings and dingy lighting. We seemed to be invisible to the Russian receptionist for about 5 minutes whilst she discussed something with a colleague. The rooms were a reasonable size and the beds very comfortable. Noise in our low floor front-facing room was minimal with the windows shut and a/c on. We had dinner at the rooftop L'Olimpo restaurant, the service is very good and the view is what you go there for but it's extremely expensive and the food style is somewhat dated. We had dressed for a special occasion and were surprised to see Americans allowed in in jeans, trainers and short-sleeved shirts. Breakfast was bad and in no way 5 star. Tinned pears, foul coffee, cold fried eggs and bacon that could take your eye out if you attempted to stab it. There was a forlorn lady hoovering in the hallway who was clearly visible and audible throughout this sad meal. If it hadnt been included in the price I would have argued the cost. Yes this is a centrally located hotel, but it is overpriced and several areas need a refurb. 
 I would not go back again. 
Rome however I would love to see again and for longer. 
From a UK travel agent.
",2,2006,07,04
01,"overpriced, but great location","I had read previous reviews and was concerned.  Yes, the rooms are small.  We had 3 adults packed into 1 room, it was too small.  But, the location made up for any inconvenience.  Everything stops out front.  The hotel is in Bernini Square, which happens to be a very central location to the Spanish Steps, Trevi Fountain, and just about everything else can be reached by bus, metro or taxi.  We had a problem with leaking water handle when you flushed the toilet, they sent a repairman up the next morning and he fixed it.  The television only gets a couple of american stations. The spa is quite good, except their English is very poor.  The breakfasts are quite good also.  They offer ""american breakfast buffet"" which has a lot of really good items. The concierge speaks good English and is quite helpful.  He helped us arrange a tour on a double decker bus where you get on and off to see the sites all day!

Stayed here 5/27/2006 - 5/28/2006.
",3,2006,05,31
01,Not recommended,"Stayed at the Bernini for 3 nights and would not recommend or rate this hotel as a *****L .  Easy walking distance to major attractions, however it is situated on a busy roundabout with heavy vehicular traffic.  Biggest complaint is the restrictions on use by residents of the rooftop bar at night.  My partner and I decided to have a night cap at 10:30 p.m. and were not allowed to sit at any of the 10 vacant tables to the front of the rooftop overlooking St. Peters.  These tables were reserved for diner guests - however there were only 2 diners left on the rooftop at this time (having drinks) and every other table was vacant and cleared.  We were rudely seated at the very back of the terrace.  I paid €352 per night precisely for the use of the terrace.  Also the drinks came from the ground floor bar area and took over 30 minutes to arrive.
",2,2006,05,31
01,Outstanding Hotel,"My husband and I went to Rome for our one year anniversary and stayed at the Hotel Bernini Bristol.  It was fabulous!  This is a five star hotel!  Our room and bathroom were spacious.  The bathroom was very large with two sinks, a large tub and shower.  The decor was very charming!

The hotel restaurant is a must.  The roof top garden was elegant and had marvelous views of Rome.  The food was also excellent.

The hotel staff was friendly and helpful.  The location is fantastic!  It is close to the Spanish Steps and Trevi Fountain.  There is a subway stop very close to the enterance of the hotel and that was a great way to travel in Rome.    

The wireless high speed Internet was a huge plus.  

I would recommend this hotel to any one travelling to Rome and I would stay there again on my next visit.

I cannot say enough good things about the Hotel Bernini Bristol !
",5,2006,05,30
01,Don't Stay at the Bernini--the Rooms Are Teeny!,"We had seen the good reviews on Trip Advisor and so decided to book a room for our four day visit to Rome. I looked on Expedia and found a room for $350 a night. I assumed that at this price it would be a bit special. Sadly, our room was absolutely tiny, on the second floor and smelled of cigarette smoke. Worse, it had a double bed with a terrible, saggy mattress. Otherwise the hotel was clean and the location and staff were fine. It was not a disaster, just not worth $350 a night. (Breakfast was not included but there are many good places in the neighborhood). We go to  Europe several times a year so we are no stranger to small hotel rooms and I know that space is at a premium in Rome. But a few days later we got a junior suite on the 7th floor of the fabulous Lutetia Hotel in Paris (breakfast included) for only 405 euros a night--practically the same price as the teeny Bernini. We love the Bernini in Genoa but I would avoid the one in Rome and go to the Minerva  instead.
",3,2006,05,04
01,Excellent Experience at Bernini Bristol,"We just returned from a lovely trip to Italy, which ended with two days at the Bernini Bristol in Rome After mixed reviews here, I was a little anxious, but our stay was perfect.  The new windows completely obliterate the noise from the plaza. We had a beautifully remodeled room on the fifth floor overlooking the Bernini Triton Fountain.  Our package included breakfast and tickets to the Galleria Borghese (dont miss it). The staff, including the concierge, were professional and gracious.  We would return in a minute. I celebrated my 65th birthday with an outrageously overpriced but worth every penny dinner in the roof terrace restaurant and had a beautiful view of the sunset and of the lights coming on all over Rome, including St. Peter's.
",5,2006,04,18
01,Great Hotel,"Loved my stay at Bernini Bristol. The room was large and clean. Great location- 10 minutes to Spanish steps and Borghese Gallery and Park, 15 minutes to Trevi and Pantheon, 25-30 minutes to Piazza Navona. Metro stop right by, which gives you easy access to different areas of the city. Would stay here again.
",5,2006,04,14
01,Great location comes at a cost!,"The hotel's location is great - 5 min walk to the Spanish Steps or the Trevi Fountain! The underground is just in front of the door. Ask for rooms on the upper floors and to the side street to avoid being disturbed by too much traffic. The room decor is decent and has a contemporary feel - something rare in Italian hotel interiors. However, not a ""Design Hotel"" at all...we had a rather unpleasant surprise when checking out: we were charged breakfast and minibar although we never touched any of both! The restaurant manager confirmed that we had signed a bill which was not true. The receptionist, however, took these charges off the bill because she ""trusted"" us - what a grace! Better to keep off the breakfast anyway since they charge 30 Euros - plenty of bars in the area to get a typical Italian coffe and cornetto....All in all a nice experience, despite the ending. But the rooms come at a price...better check the internet for discount rates.
",4,2006,03,07
01,Decent hotel,"Very nice hotel; rooms are very spacious and the location is very handy.  Do not pay too much; the rooms are often discounted.
",4,2006,02,28
01,Do not pay too much for this hotel!,"We just back from Rome, Feb 12th to the 16th, 2006. This is our first time here and we chose to stay with Bernini Bristol. We book a jr. suite but we were upgraded to a full suite b/c they were renovating the floor that holds all the jr. suites (1st floor).
Some suites were renovated and others were not. But even with the renovation, I personally thought it still looked a little shabby not quite five star hotel as they claimed it to be. 
First our room was located on the second floor(a renovated one) which was really the third floor and we had to be moved because we faced Piazza Barberini. Now let me say this room looked a lot better then the room we moved to the next day. It was so noisy even with soundproof windows. They moved us to the 7th floor right side on the hotel(facing the piazza) and it was definitely a lot less noise. Now this room was not one of the renovated ones, the molding around the doorways was cracking and splitting apart, the sink fixtures were old, we had terrace(what a magnificent view!)the railing was rusting and cracked upwards, the glass on the terrace extremely dirty, the hooks that held the drapery back came coming out of the tapestry walls. The new soundproofed windows they did not finished with molding around it left it expose and drafty. The bathroom, toilet seat upper part half broken so we couldn't put the top part down, there was a towel holder that keeps towels warm, leaking hot water and stining the old marble floor. Tub has half glass door that swings and does not keep any water inside. The caulking job looks like a child did it. And when we took our showers, it goes from hot to cold NEVER remaining a constant temperature. The door handle of our bathroom was falling apart. The only new stuff we saw in this suit was the ceilings and halogen fixtures in the ceiling. Maybe it was just this room? But what made this room bearable is the view!

Breakfast: DO NOT GET this unless it is included! IT really sucks. It was included so we went to breakfast. A buffet setup but what they offer was very limited. It was more like a continental breakfast. They did have scrambled eggs but it was very mushy. Oh by the way it costs 30 Euros pp. And the service stinks, the waiters hang around talking to each other instead of taking care of customers.

Dinner: The restaurant which we ate there on the last night was really really good but OMG it was really EXPENSIVE! The restaurant is on the rooftop and it has a 360 degree view of the city. You can see ST. Peter's Basilica's dome, the Pantheon, etc.
Service was much better here and they have live music. Since it is winter here the outdoor area was closed but we could see it and it seem really nice. The nicest area in the whole hotel.

If you get a great I mean a out of this world price for this hotel then I would suggest staying here b/c it is centrally located. We walked everywhere! But if you had to pay full price or you just received a little discount I would suggest you stay in the area closer to The Villa Borghese as the hotels there, Westin Excelsior, Hotel Eden or true 5 star hotels!

But the overall experience was a four star
",3,2006,02,19
01,Great location!,"This hotel was in walking distance to Piazza Navonna and the Trevi Fountain.  Good near-by restaurants as well.
",4,2006,01,04
01,Great place for our Christmas holidays!,"Our stay couldn't have been better than that! It is true that it was the first time we were in Rome, but our stay at the Hotel Bernini Bristol meant a lot for the success of our honeymoon trip to Italy. The service was good and the room were small but neat!(in Italy they are truly very small compared to the States! but it seems it is normal for them!).  We also stayed at the Palazzo Sant'Angelo in Venice (part of the SINA Hotels group) and it was great to find the same high level standards of service! We are looking forward to coming back to Italy!
",5,2006,01,02
01,PRE AND POST CRUISE STAY,"We arrived the day before our  cruise.This Hotel is
 A ***** STAR....Our room was on the second floor
 over looking the Plaza windows opened to enlighten
 the feel( also had a window that opened onto a side
 street in the bathroom)and there where scales in
 the bath..We were scared to use them after the cruise LOL. Bar on the roof is great for sunsets.
 Very close to Spanish steps and the fountain.
They offer us( in english) a limo to the port
but it was 250 euros, so we took the train 6 euros
each.. and it was a blast.we will be back....
",5,2005,11,09
01,What a Relief!,"My wife and I were lucky to have found this website, and the reviews of this hotel that were posted at the time, only a day before our departure for Rome.  I say this because, after reading the reviews, and in particular the one dated September 18, we were sorely tempted to cancel our reservation and try our luck elsewhere.  However there was no time to do this and, this is why we feel lucky, as otherwise we would have missed a nice experience in this pleasant, and very conveniently located, hotel.

We stayed at the Bernini Bristol between September 30 and Oct. 4, in room 714 (on the left side of the hotel, which is, indeed, quieter). Our room was very nicely appointed and absolutely clean (after *much* looking, I found a *small* spot on one chair, and that was it!). After reading the reviews, we sort of expected to the hotel staff to be a bunch of very disagreeable people but, to our joy and relief, they were, without exception, absolutely charming, gracious and helpful and, yes, as soon as they saw us, each and every time they would offer a ""buon giorno"" or ""buona sera"" together with a smile.  My wife really took advantage of the concierge services for all sorts of advice, directions, reservations and miscellaneous help, which they invariably provided very graciously (and I only tipped them at the end of our stay, so it cannot be said that we bought their kindness).

This hotel's location is just GREAT!  We were able to walk to and from most places we went to visit.  This is definitely a plus.

One criticism and some caveats:
- The white wood panels in the elevators  (by the way, they worked flawlessly during our stay) were slightly grimy.  Hopefully, the hotel's management will read this and have them cleaned.
- The voltage is 220v throughout, INCLUDING the outlet in the bathroom (at least in our room), no matter what they say.  I almost fried my electric razor, but I was kind of expecting this and reacted quickly. So, bring your transformers/adapters (also for the round plugs that they use there)
- As most European hotels, they provide no American-style washcloths, so, if you're used to them for shaving and/or showering, bring your own.
- Limited TV offerings in English (not terribly important, as you are not there to watch TV anyway!)
- Utter lack of wall hooks to hang things from (like your pajamas, or even the nice terry cloth robes that they provide)
- The safe, indeed, takes eight digits instead of 4, and no instructions were provided.  Things to the reviewer of September 25, I was able to figure this one out pretty quickly, though.
- I was going to say ""limited closet space"" until we went to Venice, afterwards, and found the true meaning of the term.

We plan to return to Roma in the relatively near future, with our kids this time, and we would be very willing to stay at the Bernini Bristol again.
",4,2005,11,08
01,Excellent Hotel      Best have ever stayed in,"Myself and my friend chose to stay at this hotel upon recommendation from family members.
Having read some of the reviews from this site   I was very disappointed and dubious about staying there. 
Arrived quite late in evening, greeted by an extremely nice gentleman at the desk who had excellent english and was very informative.
He arranged a table at the nearby Tullio restaurant and we enjoyed a wonderful dinner among lovely people.
I was astonished to find that the hotel was completely different from some of these reviews. In our opinion this most certainly is of 5 star rating if not more. We stayed in a junior suite ,which,if rather expensive, was worth every cent for the luxury.
The location is excellent and I would reccomend this Hotel to anyone wishing to experience Rome.
Having travelled the world and stayed at some of the most luxurious Hotels , I can safely say the Bernini Bristol is in the top five.
",5,2005,10,29
01,Not overly impressed,"I was really looking forward to staying in this hotel because from their website it looked amazing and I wanted to start our trip with some luxuary. I was dissapointed however when we arrived after such a long flight (18 hours from Sydney) to find that this hotel has passed its days of grandure. The rooms were very small and tired with the decorating looking like it had not been refreshed for a long time. We also were dissapointed to find our ""double bed"" was infact two singles pushed together making for four very uncomfortable nights sleep and not what you would expect from a five star hotel. The staff were generally helpful however they were not overly friendly. The breakfast was not well stocked and if you arrived later than 8.30am several of the items were gone all together. The location however is great and in easy walking distance to the Trevi Fountain and the Spanish Steps. I would not however reccommend the hotel to anyone.
",3,2005,10,23
01,Terrible. Worst Hotel I ever stayed at.,"First of all I was checked into a room which had a connecting door to another room, smelled very badly and the toilet was broken. A man came up to fix the toilet, he did not fix it. So they moved me and my husband to another room. The room had stain carpets all over. It was very small. The bathroom wall had mold all over, I had to be extra careful not to get near the mold while showering. While I was blow drying my hair I smelled urine. I realized the floor behind the toilet was embedded with urination.  Then the shower broke. I called to complain. Some man came up and tried to fix it and and painted the wall to cover the mold. But it was still there and he couldnt fix the shower. I was in the room for 4 hours while he was doing this because my husband needed to shower. 
I was told by one of the hotel staff members that I would have to shower down the hall in a different room.
I was furious at this point. I felt like I was in a cheap motel not a 5 star hotel which I payed alot of money for.
So I demanded another room. He did not want to give it to me, after argueing for an hour he finally agreed. He took me to the new room and the lock was jammed, he tried opening it for 15 minutes, he could not get in so he finally got a key for a different room which was much better, no urination, stains, mold, or broken toilets and showers.

The worst hotel I have ever stayed at in my life!!!!!!!!!
",1,2005,10,16
01,Perfect location and great hotel!,"We were kind of scared about staying here after reading some of the other reviews, but upon arrival, we quickly found out that all of our concerns were unnecessary!  The hotel is in a great location - walking distance to all sights, close to supermarket, lots of restaurants, close to train station!  Our room was perfect - we didn't hear any noise at all, we had our own balcony that was surrounded by bushes, our room was very clean and large, and the breakfast was super good.  It was also really easy to work with the hotel to book our stay and to work with the concierge over email to book tours in advance.  All around - great hotel for a visit to Rome.
",4,2005,10,14
01,Great Stay,"We stayed in this hotel in mid September and it was a lovely stay. The room was clean and well kept with all the usual essentials provided – including those wrapped up slippers! The staff were polite and more than willing to help. We had a candle lit dinner on the top floor of this hotel with wonderful views of Rome and St Peter's – it was unforgettable. The food was also very good served with care and a sense of pride we could not fault. Getting there was easy with the Metro very close by. The only slight problem was the Spa which was working although the sauna and steam room were fine.  I would also recommend the La Corte Dei Leoni which is a good restaurant just around the corner from this hotel. It provided good food and more than met my expectations. 

I would happily recommend this hotel to friends and family. Next time we go to Rome, I would be happy to stay there again. It truly was a magical trip.
",4,2005,10,04
