Location Name,Title,Text,Rating,Year,Month,Day
01,Nice to be back,"It has been many years since we have stayed at the Bernini and we were so glad to return.
There have been some renovations since and a wonderful restaurant and bar on the roof with magnificent views of Rome.
We had exceptional service from all the staff especially Chiara and would highly recommend the Bernini to anyone looking for a nice comfortable stay in Rome.
Look forward to seeing everyone again real soon.",5,2018,08,17
01,Great location,"We stayed at this hotel as part of a tour group.  We were treated very well by the friendly and helpful staff.

The hotel looks a bit ordinary from the outside but has a much more luxurious feel inside with lots of marble.  The main lounge area on the ground floor is very, very nice.

Our room was also very nice.  Comfortable bed, good sized bathroom and the room was also a good size.  Plenty of room for suitcases etc.

The buffet breakfast was very nice.  Lots of choice and all fresh and tasty.  

The location of the hotel is a bit offputting on first view because of all of the traffic but there are traffic lights to help overcome this.  The square in front of the hotel is a bit boring but the fountain is nice.

Make sure you take the time to go up to the top floor where the restaurant is for some lovely views over the city.  Stunning at night.

The hotel is within walking distance of the Trevi Fountain, Spanish Steps etc.  Also lots of restaurants within walking distance.",5,2018,08,16
01,Excellent hotel,"We had a great experience here our first time in Rome a few years back, and felt compelled to come here again. Indeed, we were greeted with the same helpfulness, professionalism, and top quality accommodations that we experienced last time. The concierge staff couldn’t be more helpful, recommending great dining places and even lending us umbrellas in the midst of a torrential downpour. While the WiFi isn’t ultra fast and the pillows have room for improvement, this was balanced out by a comfortable bed, elegant bathroom, and friendly cleaning staff. Add to that its central location, and you’ve got yourself a great package. I can say without hesitation that I would recommend this place to anyone visiting Rome.",5,2018,08,15
01,Good hotel with fantastic views of Bernini Square!,"We stayed here for one night and booked a double room....the receptionist was kind enough to upgrade us to a Deluxe room which was on the 5th floor with a balcony directly facing the Bernini fountain.  This was quite magical...having a stunning city view.

The room was quite nice, nice firm double bed with a walk in wardrobe.  The bathroom was big although the shower was in the bath...and not a standalone shower.  The air-conditioning did not work which was very disappointing as it was crazily hot outside....we complained a couple of times and a handyman was sent up who said he couldn't do anything, except giving us a fan!  For a 5 star hotel to not have air con during August is absolutely crazy!

We tried the spa downstairs and it was average (the jacuzzi had dirty water and the steam room smelt of mould)....it wasn't cleaned much!!!  Also, if you wanted a towel...you'll have to pay €5 each...best remember to take one from your room!

It also has a roof top bar (American bar) which was quite nice, although air con up there was disappointing.  Overall it's an average 4.5* hotel which is trying to be a 5*.",4,2018,08,14
01,Very special experience,"Wonderful staff, especially delightful  Chiara, ensured that our stay was utterly memorable. A fantastic central location with well appointed accommodation. Our weekend break felt a lot longer because we enjoyed our stay so much.
Our guide, booked by the hotel, Federica Bruni, was warm, patient and knowledgeable.",5,2018,08,12
01,Sina Bernini Bristol Good Choice but Needs TLC,"4 rooms, 4 nights at the Sina Bernini Bristol hotel.  Nice location, good size rooms and bathrooms.  We stayed at a sister property in Florence and expected the same if not a better property.  However, this hotel has some work cut out for it to boost my rating.  Our location on the 7th floor was wonderful.  That is until they had to take one of the lifts/elevators out of commission leaving only one working in the main bank of elevators... this made for a LONG wait and the stairs were not an option with 2 senior citizens. Check-in was smooth as half the rooms were ready well before check-in and the following 2 available within the hour.  The issues began with the 3rd room (714) which had a leaking in the ceiling due to the A/C.  The leak caused a hole in the ceiling panel which looked like it needed immediate fixing.  The technician, which I was informed would be there in 20 minutes didn't show up for several hours.  Issue fixed was what I was told...however, the ceiling was still dripping onto the hardwood floor when checked and no patchwork done on the ceiling hole (size of a quarter or 2Euro coin)... Thus, room was taken out of inventory and we had to move rooms.  Turns out the room across the hall was also taken out of commission as the ceiling was being serviced (assuming the same issue) and something large was being replaced.   The re-assigned room (710) does not get a good WiFi signal so you either have to reconnect or stand by the hall door.  The side of the hotel has scaffolding (which we were informed of the construction) which only partially obstructed the view once you approached the window.  The only pitfall was the construction lift (elevator) meant that the workers could see right into the room and watch you if you were sitting at the desk or on the edge of the bed.  If you opt to stay here in the next month or so... just avoid any room ending in 10.  
The hotel does have a lovely lobby and lounge area.  Plenty of seating if you need to wait   for any reason or just want a place to read and relax.  The rooftop restaurant/bistro/bar has some amazing views and should not be missed.  The food is very good for a hotel.  The only disappointment when it came to food was the breakfast.  It was very sub-par for this caliber of a hotel.  The make-your-own waffle station was the only truly edible item.  Scrambled eggs were very runny (and I like mine wet) and the omelets were overcooked and then left to further dry out in the chaffing dish. Reminded me of a mini-frisbee. Fruit was good.  Bacon and Sausage left a lot to be desired.  Pastries ...pass.   Coffee was weak.  They did have a nice assortment of juices and even offer a gluten free selection.  For an included breakfast it did have a lot to offer, but quality-wise it just did not meet the standard that this hotel is known for.
The staff were all very accommodating and friendly.   They went out of there way to make sure all needs were met.  The staff would be one of the reasons to return after the construction and little idiosyncracies are ironed out.  The issues stated should not be deal breakers, just issues that can and hopefully will be fixed.  
The location is wonderful as you are in walking distance to so many of the sites - Trevi Fountain, Spanish Steps, high-end shopping, side alley shops, Piazza Navona, etc..  The #85 bus will take you right to the Colisseum and from there a short walk to a number of other sites and neighborhoods (like Trastevere).
This is an older hotel, I believe it is a former palace from back in 1874 so there are going to be some issues, but again, nothing that cannot be fixed.  If you can get a discounted rate this property is worth a stay.
I",3,2018,08,07
01,Disappointed ,"We stayed here as part of a cruise package. We have been to Rome before and we were disappointed with this hotel.

 We didn’t  particularly like the location, the area seems a bit run down and the square is a busy traffic island unlike the location of other hotels that we have stayed in. 

The room quality was poor eg the tap was loose  and the door frame was hanging off   Also beware if you are allergic to  scent , there was an overpowering smell of “ air freshener “

The breakfast was not 5* quality. 

The redeeming feature is the amazing view from the roof top bar and restaurant. Even this 
had its problems. The staff were busying about doing nothing and it took ages to get served.

There is a scaffold up and building work on the side of the hotel. It depends where you room is whether you will be affected. 

All in all we enjoyed our time in Rome but definitely would not stay here again. ",3,2018,08,05
01,Terrible,"Aircon didn’t work properly & room was unbearably hot. Had scaffolding & building works right outside our window (which we weren’t informed about), or offered a discount for. Paid full premium rate for our room. Absolute rip off!!!",1,2018,08,01
01,Nightmare!,"It's not a hotel, it's a construction site!!!!!!!!!!!!!!!!!!!!!
Two days at this hotel and two days in a row from 8 am in the morning unbearable noise!
Vacation Nightmare.
Wake up to Congo noise, hammers, drills and just no one cares.",1,2018,08,01
01,Excellent service and location,"The hotel is in a convenient location, nice sized suites and comfortable. The facilities are adated and decor in some suites too gaudy for our taste. 
But - most of this hotel meets the bare basic expectations of any hotel charging the big $$$$ 

What sets it apart for us is the great service. Right from the time we were welcomed by the bellman to the front desk the smiles were genuine and conversations friendly. Our room had trouble with the AC making the scorching heat unbearable. The front desk apologized and made arrangements for an alternate and better suite for us. In addition they left us a nice apology note on our desk for the inconvenience. Wow! 

The staff cannot help the challenges with the facilities but they certainly do their best and that makes a difference. 

Breakfast was not too great and surprisingly we never got to even see the check. We were brushed off with a “we will bill to your room”. Curious to see how much we did end up paying. 😊😊

",4,2018,07,30
01,"Fantastic, Fantastic, Fantastic!","On our arrival, we were greeted by a very welcoming doorman, followed by a lovely welcome from Chiara at the reception area. We chatted and mentioned that this visit to Rome was for our 20th Wedding Anniversary. Chiara chatted with enthusiasm, and we had a laugh with her. She advised us that we had requested a deluxe room with a balcony, and this was the room that we were given...........the room exceeded our expectations. A lovely balcony overlooking the City, lovely bedroom and bathroom, everything that we wished to have. To put the icing on the cake, we received a bottle of bubbles on ice, with a lovely signed card from the General Manager, giving  their Congratulations on our Anniversary. All the staff throughout our stay were polite, helpful, and courteous. The hotel is situated in a perfect position,as you can walk to all of what Rome has to offer.... Would we return to Sina Bernini Bristol Hotel?.....most definitely.",5,2018,07,28
01,When in ROMA,"The hotel is elegant and chic  but it is the staff that makes the Bernini 5 star.

From the Doorman to the Reception desk  the staff radiates warmth concern and kindness with every interaction .

Nothing was too difficult for the concierge from procuring private transportation to arranging dinners at the last moment  . 

The hotel amenities are better than the Ritz with the included breakfast being way, way .way over the top, in both selection and attentiveness to fresh selections.

 Morning Meal service  was leisurely  and unobtrusive   Typical selection   included prime  Italian meats variety  of fresh cheeses ,juices and pastry You  must  ASK your server to whip up   a fresh Sicilian OrangeJuice.. YUM YUM YUMMIE.

The roof top bar   is HEAVENLY as you can touch the clouds and 3/4 of ROMA is in your eyes vantage .

Location is everything and Bernini is in th eheart of shopping sight seeing and cultural districts ..

We highly recomend the big red bus  or the pink bus  to sight see both run late and allow you multiple day & night trips for 15/20 Euro,
Best of all 25 feet from the Bernini is the bus stop for all on and off bus lines ..  great way to get ones bearings  and plot the days activities ...    SUPERB STAFF , FOOD  DRINK AND ACCOMIDATIONS   ..Did I MENTION the basement spa area ??  YOU must indulge it to believe it and it is included with ones room ..",5,2018,07,24
01,Rome,Great hotel!!! In the center of history.  Easy to get to.  The staff was excellent.  Very knowledgeable of the area.  Breakfast buffet was very good and roof top restaurant and bar had great views.  Rooms were small and bathroom shower had low pressure.  AC was minimal not like US.,4,2018,07,23
01,AC was a problem ,"I stayed here with my son during the first week of July. The location was pretty good, and the hotel was clean and somewhat elegant. 

However, the AC in our room was definitely unacceptable. We had stayed at 2 other hotels in Italy prior to arriving here, and had no AC issues at the other hotels. Our hotel room was warm, and setting the thermostat lower had no impact. We called and asked to have the AC looked at. They said they would do so, but that took multiple hours. After returning from dinner, we were told that our window had been open and that was the problem for the warm temperature. When I went to the room, it was not any cooler. I was told that the hotel was completely sold out and there were no other rooms available. We were offered a fan for our room. The gentleman who brought us the fan said that we could not controls the AC temp from our room. At this point it was close to midnight. The fan ended up making the room tolerable for the night. But this is not what I expected from a five star hotel. 

The next morning, I was offered to switch to a junior suite which was in fact much cooler. I noticed that the junior suite had four vents for AC versus the one vent that was in our original room. The bathroom in the junior suite was not as nice, and the shower was very small. But I decided I’d rather have better AC than a better shower. 

The staff on the second day was very apologetic. We were sent wine and a fruit plate from the hotel. They followed up with us in the afternoon to make sure we were comfortable. 

I see from other reviews that the AC is an ongoing issue. I would recommend not staying here during the summer months for this reason. The hotel is nice enough otherwise. ",3,2018,07,21
01,Chiara. Thank you for all your attention and information every one was helpful in whatever my family needed   ,"  Chiara thank you for all attention you all gave us while my family stayed  with you especially to chiara at the desk  we hope to come back soon  breakfast was excellent service excellent from the floor manager  down  thank you again a presto from the Severino family from Orange County ",5,2018,07,18
01,Beautiful Hotel,I just returned from a 10 day trip to Italy and had the pleasure of staying at the SIna Bernini Bristol. It was a truly lovely hotel. The rooms are nice and spacious. The hotel is very clean.  My only complaint was that one afternoon the maid who cleaned our room did not do a very good job; our floor was not swept and the towels were not replaced and no new ones added. The restaurant staff for the breakfast are FANTASTIC and the food was amazing. So many options to choose from and they make an amazing cappuccino!! Overall its in a decent location and very clean nice hotel.,5,2018,07,18
01,Wonderful Stay,"Stayed 5 nights at this quaint hotel located in the center of many historical and beautiful places to see. The concierge staff was very helpful.  The room was clean, comfortable and quiet even though it was only on the second floor. Walking distance to the Spanish steps, the Pantheon,  the Verdi Fountain and much more. ",5,2018,07,17
01,Great location and average hotel,"Our room the first night was horrible!  No a/c (hotel had a/c). I was told that no other rooms were available.  I would have left, but I prepaid my room.  It was allegedly a deluxe room (scary that was deluxe).  The hotel upgraded us the next 3 nights to a junior suite.  That was an improvement, but that bathroom had a TINY shower.  I’m pretty sure it was smaller that some cruise shower stalls I have been in.  There was a tub in the bathroom, but no shower head in there.  Not sure why they did that since my “deluxe” room the previous night had the shower in the tub.  The room was “old world” which was fine.  The bed was a normal height (unlike the bed in my “deluxe” room), but the sheets weren’t too nice.  Like other reviewers, I’m not sure what makes this hotel 5 stars.",2,2018,07,13
01,"Outdated, poor service and overpriced: not a 5-star experience!","Starting with positives: the location is excellent, very central and with good transport links.

Check-in: very impersonal; the receptionist was doing my check-in while multitasking and talking to other people. I had to ask for the information regarding breakfast, check out, etc rather than the hotel telling me ‘the basics’. First impressions count, and this was a very poor start.

The room: I paid for a Superior room. The size was ok, but it was outdated, it look tired and with facilities (e.g. old tv) that would expect in a 1-star hotel, but not in 5-star one. The bed was not very comfortable with very hard pillows.
Attention to detail is non existent ( for the price I paid I would have expected at least a complimentary bottle of water, which is standard in any 5-star hotel) . There were no toiletries in the bathroom and I had to ask twice to reception (and had to wait a considerable time) before someone brought them to my room. 
To top it up, the room was literally next to major scaffolding and very noisy building work. The very loud noise from the building work started at 7am. Nobody told me anything at reception that I would be woken up by heavy banging on the walls, even as a courtesy. 

I travel to Rome  for work on a regular basis and needless to say I won’t ever come back to this hotel 

",1,2018,07,10
01,Great stay and worth the price,"We were recommended this place by our amazing travel agent and loved it! The staff are wonderful and the location is really nice. You are close to all the great sites- closest to Trevi fountain and the Pantheon. The Spanish steps are close too with all the wonderful designer shops in that location. 

We stayed in a junior suite which was pricey but nice. Our daughter had a bed and it gave us some privacy. 

The breakfast was included and really wonderful! Great place even though pricey",5,2018,07,09
01,Never Ever Stay Here.....0 star hotel,"This was absolutely the worst experience I’ve ever had at any hotel.  Let’s start with the room.  Stained sheets, stained furniture, lumpy bed that felt like hay/straw was used to make it, the most uncomfortable pillows I’ve ever had, floor molding falling off the walls, slippery shower floor to the point where you couldn’t move without falling (my wife fell down during her first shower. She’s an extremely active 30 year old.)

Now onto breakfast.  Dirty, smelly plates, eggs that were very grey and smelled/tasted like rotten fish, meats tasted very foul (imagine licking the floor of a barn), low low grade motel style waffle machine, and to top it off on our last morning we found a long blonde hair BAKED into our pastry.  You could literally hold onto the hair and swing the pastry around like a yo-yo.  DISGUSTING.  You pride yourself on claiming that you have a Michelin star chef.  I would be ashamed if I was a chef and my name was associated to this dump.

Amenities.  The spa is false advertisement. They claim they have a jacuzzi and a Turkish bath. Nope.  Just a four person jacuzzi.  We went down to use the facilities and found 2 young children running around and using the jacuzzi as a play pool.  The lady working the spa told us to use quiet voices while we were using the spa, as there were screaming children running around.  Then we were told towels are 5 euros each, or go back to your room and grab a towel for free. Are you kidding me?!?!?!  That’s not a 5 star hotel experience!!

Management: don’t even bother complaining to them.  Upper management doesn’t care at all. We were told that he wanted to speak with us the next day after we had calmed down, and that if every guest had the mentality that we have, they would be out of business.  Extremely condescending.  Oh and by the way we ran into 3 other groups that were upset about their experience and were either in the process of complaining to the front desk, or venting to us about it saying they had similar experiences.  

0 star hotel.  I don’t even think you can call this a hotel.  How on earth does this place call themselves a 5 star hotel?  Save your time, energy, and money. Go anywhere else.  Tourist trap at the highest degree.  I will never even think of staying at any of the Sina hotel locations around the world.  Can’t speak about any of their other locations, but this one desperately needs to be shut down....or be bought out by a hotel brand that actually knows how to run a proper 5 star hotel experience.",1,2018,07,09
01,"Dirty Hotel, Inedible Breakfast","We stayed here for 3 nights. From the moment we arrived, the experience was negative. Dirty rooms, gross food, stained sheets and furniture, rude staff who asked us not to leave a review, and a long blonde hair baked into a croissant. We reported our experience and while the staff was apologetic, they flat out said “we will talk to you after you’ve calmed down. If every guest was like you, we’d be out of business.” Unbelievably rude and condescending. Our concerns were not outrageous nor were they uncalled for. If we pay for a “five star” hotel then I’d expect our sheets to be clean and for there to be no hair in our food. The towel hooks were falling off and pulling the padded wallpaper away from the walls. The spa was dirty and filled with kids. There were no Turkish baths, so don’t be fooled by that. 

You’d be better off at a Motel 6. ",1,2018,07,09
01,Great hotel with stunning views from cocktail bar & restaurant,"Sina Bernini Bristol is a great hotel in a convenient location, close to cafes, restaurants, shopping & bus stops
Our room was comfortable, quiet & of average size for a couple travelling with luggage for a cruise
Staff were helpful & polite, speaking English if required.. Breakfast was good with plenty of choice, served in a lovey room on 1st floor with views
Cocktail bar on rooftop has great views. Restaurant looked good but pricey - did not eat there",5,2018,07,04
01,Our 25th wedding anniversary stay in Rome,"Although the Sina Bernini Bristol apprears to be a beautiful hotel, in fact the rooms are uncomfortable and air conditioning unacceptable. After sending 2 maintenance men to our room who told us there was nothing wrong with the AC unit, they finally agreed to change our room after 2 nights of our 4 night stay. When they showed us the room which was a few doors down on the same floor, it appeared to be actually smaller and did not seem to be any cooler so we declined. I would not recommend this hotel. I am sure there are better hotels in Rome. The best part of this hotel is the roof top restaurant's view. The food is just ok and overpriced. Ironically we stayed in a Sina hotel in Florence that was amazing and top notch. Hard to believe they are from the same collection!",2,2018,07,04
01,Rooftop restaurant is overrated and overpriced,"This review is for the Rooftop restaurant.  Our group of 4 had dinner here.  The view of Rome is fantastic. The food was good but way overpriced.  The wine service was nothing short of bizarre.  It was obvious that the people there knew very little about wine and wine service yet charge exorbitant prices for the wine. They did not open any of the wines at the table which is an absolute no no - this is NEVER done anywhere.  Then, they poured wine to taste the bottle of Brunello we were buying from another bottle that they were pouring glasses from - just bizarre and totally incompetent. The food service was fine but nothing to get too excited about.  There seemed to be too many employees running around, a number of them doing nothing really and it honestly looked like the Keystone Kops.  All in all, the restaurant is too overpriced and not that great - I would not recommend anyone going here. Find another restaurant for fine dining.",3,2018,07,02
01,AMAZING hotel & GREAT staff,"Everyone at the Sina Bernini Bristol Hotel in Rome is amazing and accommodating…starting with the owner.  I was staying at a nearby hotel and was very unhappy with how small the room was. I happen to be having dinner and drinks on the rooftop of the Sina Bernini Bristol Hotel, where the view was spectacular and the food was excellent, when I met the owner.  I told him about my unhappiness with my current hotel room and he told me his hotel had rooms available at the same price.  I took a look at the rooms and they happen to be much bigger and more beautiful.  I made the decision to switch hotels.  A couple of days after I checked into the Sina Bernine Bristol, I became sick.  I spoke with the concierge and they had a doctor who spoke English in my room within 15 minutes. The owner and staff went out of their way to accommodate me every time I needed them.   In addition, to me this is a real authentic “Rome” hotel. It has all the charm and style of old Italy yet with all the modern conveniences.  I have nothing but raving reviews on this hotel and their staff.  I’d like to add that I travel a great deal and tend to be very demanding.  This hotel was so impressive, it’s the first time I felt compelled to write a review.",5,2018,06,29
